[I 2025-08-04 20:46:54,857] Trial 489 finished with value: 2.73561763205488 and parameters: {'channels_list': [16, 32, 64], 'kernel_size': 3, 'padding': 1, 'pool_kernel': 2, 'dropout_rate': 0, 'fc_hidden_dim': 256, 'lr': 0.0009677898440364783, 'weight_decay': 1.0140484909656376e-06, 'optimizer': 'rmsprop', 'activation': <class 'torch.nn.modules.activation.LeakyReLU'>, 'batchnorm': True, 'epochs': 35, 'batch_size': 32, 'flip_prob': 0.0}. Best is trial 269 with value: 2.690232738856096.
[I 2025-08-04 20:47:54,880] Trial 490 finished with value: 2.71634755721282 and parameters: {'channels_list': [16, 32, 64], 'kernel_size': 3, 'padding': 1, 'pool_kernel': 2, 'dropout_rate': 0, 'fc_hidden_dim': 256, 'lr': 0.0010364288780141623, 'weight_decay': 1.1818396723886661e-06, 'optimizer': 'rmsprop', 'activation': <class 'torch.nn.modules.activation.LeakyReLU'>, 'batchnorm': True, 'epochs': 35, 'batch_size': 32, 'flip_prob': 0.0}. Best is trial 269 with value: 2.690232738856096.
[I 2025-08-04 20:48:45,953] Trial 491 finished with value: 2.746474576600354 and parameters: {'channels_list': [16, 32, 64], 'kernel_size': 3, 'padding': 1, 'pool_kernel': 2, 'dropout_rate': 0, 'fc_hidden_dim': 256, 'lr': 0.0008811645112902238, 'weight_decay': 1.4539895753541027e-06, 'optimizer': 'adam', 'activation': <class 'torch.nn.modules.activation.LeakyReLU'>, 'batchnorm': True, 'epochs': 35, 'batch_size': 32, 'flip_prob': 0.0}. Best is trial 269 with value: 2.690232738856096.
[I 2025-08-04 20:49:06,315] Trial 492 finished with value: 2.834025281473581 and parameters: {'channels_list': [16, 32, 64], 'kernel_size': 3, 'padding': 1, 'pool_kernel': 2, 'dropout_rate': 0, 'fc_hidden_dim': 256, 'lr': 0.0017484575416027634, 'weight_decay': 1.4783848060004365e-06, 'optimizer': 'rmsprop', 'activation': <class 'torch.nn.modules.activation.LeakyReLU'>, 'batchnorm': True, 'epochs': 35, 'batch_size': 32, 'flip_prob': 0.0}. Best is trial 269 with value: 2.690232738856096.
[I 2025-08-04 20:50:00,896] Trial 493 finished with value: 2.748992432328559 and parameters: {'channels_list': [16, 32, 64], 'kernel_size': 3, 'padding': 1, 'pool_kernel': 2, 'dropout_rate': 0, 'fc_hidden_dim': 64, 'lr': 0.0011190630070122727, 'weight_decay': 1.334473469923723e-06, 'optimizer': 'rmsprop', 'activation': <class 'torch.nn.modules.activation.LeakyReLU'>, 'batchnorm': True, 'epochs': 35, 'batch_size': 32, 'flip_prob': 0.0}. Best is trial 269 with value: 2.690232738856096.
[I 2025-08-04 20:50:55,988] Trial 494 finished with value: 2.693523563263068 and parameters: {'channels_list': [16, 32, 64], 'kernel_size': 3, 'padding': 1, 'pool_kernel': 2, 'dropout_rate': 0, 'fc_hidden_dim': 256, 'lr': 0.0015729643764225809, 'weight_decay': 1.1862993286123376e-06, 'optimizer': 'rmsprop', 'activation': <class 'torch.nn.modules.activation.LeakyReLU'>, 'batchnorm': True, 'epochs': 35, 'batch_size': 32, 'flip_prob': 0.0}. Best is trial 269 with value: 2.690232738856096.
[I 2025-08-04 20:51:53,500] Trial 495 finished with value: 2.7145960613959375 and parameters: {'channels_list': [16, 32, 64], 'kernel_size': 3, 'padding': 1, 'pool_kernel': 2, 'dropout_rate': 0, 'fc_hidden_dim': 256, 'lr': 0.0015253070291733851, 'weight_decay': 1.2007153683398921e-06, 'optimizer': 'rmsprop', 'activation': <class 'torch.nn.modules.activation.LeakyReLU'>, 'batchnorm': True, 'epochs': 35, 'batch_size': 32, 'flip_prob': 0.0}. Best is trial 269 with value: 2.690232738856096.
[I 2025-08-04 20:52:51,200] Trial 496 finished with value: 2.733972426404136 and parameters: {'channels_list': [16, 32, 64], 'kernel_size': 5, 'padding': 1, 'pool_kernel': 2, 'dropout_rate': 0, 'fc_hidden_dim': 256, 'lr': 0.001596914802182551, 'weight_decay': 1.1648050652506151e-06, 'optimizer': 'rmsprop', 'activation': <class 'torch.nn.modules.activation.LeakyReLU'>, 'batchnorm': True, 'epochs': 35, 'batch_size': 32, 'flip_prob': 0.0}. Best is trial 269 with value: 2.690232738856096.
[I 2025-08-04 20:53:13,348] Trial 497 finished with value: 2.7630206249016185 and parameters: {'channels_list': [32, 64, 128], 'kernel_size': 3, 'padding': 1, 'pool_kernel': 2, 'dropout_rate': 0, 'fc_hidden_dim': 128, 'lr': 0.0018144158203727662, 'weight_decay': 1.0189025482159447e-06, 'optimizer': 'rmsprop', 'activation': <class 'torch.nn.modules.activation.LeakyReLU'>, 'batchnorm': True, 'epochs': 35, 'batch_size': 128, 'flip_prob': 0.0}. Best is trial 269 with value: 2.690232738856096.
[I 2025-08-04 20:53:13,383] Trial 498 pruned. 
