[I 2025-08-04 16:57:19,898] Trial 198 finished with value: 2.726433174342672 and parameters: {'channels_list': [16, 32, 64], 'kernel_size': 3, 'padding': 1, 'pool_kernel': 2, 'dropout_rate': 0, 'fc_hidden_dim': 256, 'lr': 0.002142929729446455, 'weight_decay': 0.008565904350267021, 'optimizer': 'sgd', 'activation': <class 'torch.nn.modules.activation.ReLU'>, 'batchnorm': True, 'epochs': 35, 'batch_size': 32, 'flip_prob': 0.0}. Best is trial 187 with value: 2.7078559371041733.
[I 2025-08-04 16:57:19,919] Trial 199 pruned. 
[I 2025-08-04 16:57:41,958] Trial 200 finished with value: 2.8885071170632024 and parameters: {'channels_list': [16, 32, 64], 'kernel_size': 3, 'padding': 1, 'pool_kernel': 2, 'dropout_rate': 0, 'fc_hidden_dim': 256, 'lr': 0.0014345115319405039, 'weight_decay': 0.0098946313618988, 'optimizer': 'sgd', 'activation': <class 'torch.nn.modules.activation.ReLU'>, 'batchnorm': True, 'epochs': 35, 'batch_size': 32, 'flip_prob': 0.0}. Best is trial 187 with value: 2.7078559371041733.
[I 2025-08-04 16:58:09,281] Trial 201 finished with value: 2.8051743050104747 and parameters: {'channels_list': [16, 32, 64], 'kernel_size': 3, 'padding': 1, 'pool_kernel': 2, 'dropout_rate': 0, 'fc_hidden_dim': 256, 'lr': 0.0018843044431671675, 'weight_decay': 0.007307194368262638, 'optimizer': 'sgd', 'activation': <class 'torch.nn.modules.activation.ReLU'>, 'batchnorm': True, 'epochs': 35, 'batch_size': 32, 'flip_prob': 0.0}. Best is trial 187 with value: 2.7078559371041733.
[I 2025-08-04 16:59:37,434] Trial 202 finished with value: 2.736832667547486 and parameters: {'channels_list': [16, 32, 64], 'kernel_size': 3, 'padding': 1, 'pool_kernel': 2, 'dropout_rate': 0, 'fc_hidden_dim': 256, 'lr': 0.0019831265827807386, 'weight_decay': 0.008418077621108631, 'optimizer': 'sgd', 'activation': <class 'torch.nn.modules.activation.ReLU'>, 'batchnorm': True, 'epochs': 35, 'batch_size': 32, 'flip_prob': 0.0}. Best is trial 187 with value: 2.7078559371041733.
[I 2025-08-04 17:00:10,019] Trial 203 finished with value: 2.8414390620909207 and parameters: {'channels_list': [16, 32, 64], 'kernel_size': 3, 'padding': 1, 'pool_kernel': 2, 'dropout_rate': 0, 'fc_hidden_dim': 256, 'lr': 0.002326158123281991, 'weight_decay': 0.008668065317755897, 'optimizer': 'sgd', 'activation': <class 'torch.nn.modules.activation.ReLU'>, 'batchnorm': True, 'epochs': 35, 'batch_size': 32, 'flip_prob': 0.0}. Best is trial 187 with value: 2.7078559371041733.
[I 2025-08-04 17:00:58,716] Trial 204 finished with value: 2.760421069884904 and parameters: {'channels_list': [16, 32, 64], 'kernel_size': 3, 'padding': 1, 'pool_kernel': 2, 'dropout_rate': 0, 'fc_hidden_dim': 256, 'lr': 0.00205716554745554, 'weight_decay': 0.008474613806830717, 'optimizer': 'sgd', 'activation': <class 'torch.nn.modules.activation.ReLU'>, 'batchnorm': True, 'epochs': 35, 'batch_size': 32, 'flip_prob': 0.0}. Best is trial 187 with value: 2.7078559371041733.
[I 2025-08-04 17:02:08,628] Trial 205 finished with value: 2.729567513333586 and parameters: {'channels_list': [16, 32, 64], 'kernel_size': 3, 'padding': 1, 'pool_kernel': 2, 'dropout_rate': 0, 'fc_hidden_dim': 256, 'lr': 0.0016912383408712497, 'weight_decay': 0.00991723261312441, 'optimizer': 'sgd', 'activation': <class 'torch.nn.modules.activation.ReLU'>, 'batchnorm': True, 'epochs': 35, 'batch_size': 32, 'flip_prob': 0.0}. Best is trial 187 with value: 2.7078559371041733.
[I 2025-08-04 17:03:13,236] Trial 206 finished with value: 2.7205857918259606 and parameters: {'channels_list': [16, 32, 64], 'kernel_size': 3, 'padding': 1, 'pool_kernel': 2, 'dropout_rate': 0, 'fc_hidden_dim': 256, 'lr': 0.0016307069181552745, 'weight_decay': 0.009894912625767222, 'optimizer': 'sgd', 'activation': <class 'torch.nn.modules.activation.ReLU'>, 'batchnorm': True, 'epochs': 35, 'batch_size': 32, 'flip_prob': 0.0}. Best is trial 187 with value: 2.7078559371041733.
[I 2025-08-04 17:04:01,832] Trial 207 finished with value: 2.7316691293359807 and parameters: {'channels_list': [16, 32, 64], 'kernel_size': 3, 'padding': 1, 'pool_kernel': 2, 'dropout_rate': 0, 'fc_hidden_dim': 256, 'lr': 0.0016292361648924968, 'weight_decay': 0.006972829926260974, 'optimizer': 'sgd', 'activation': <class 'torch.nn.modules.activation.ReLU'>, 'batchnorm': True, 'epochs': 35, 'batch_size': 32, 'flip_prob': 0.0}. Best is trial 187 with value: 2.7078559371041733.
[I 2025-08-04 17:04:42,482] Trial 208 finished with value: 2.767927782785763 and parameters: {'channels_list': [16, 32, 64], 'kernel_size': 3, 'padding': 1, 'pool_kernel': 2, 'dropout_rate': 0, 'fc_hidden_dim': 256, 'lr': 0.001521257847191208, 'weight_decay': 0.009970854962317748, 'optimizer': 'sgd', 'activation': <class 'torch.nn.modules.activation.ReLU'>, 'batchnorm': True, 'epochs': 35, 'batch_size': 32, 'flip_prob': 0.0}. Best is trial 187 with value: 2.7078559371041733.
[I 2025-08-04 17:05:36,477] Trial 209 finished with value: 2.716680113685433 and parameters: {'channels_list': [16, 32, 64], 'kernel_size': 3, 'padding': 1, 'pool_kernel': 2, 'dropout_rate': 0, 'fc_hidden_dim': 256, 'lr': 0.001661804323938863, 'weight_decay': 0.006826955238025175, 'optimizer': 'sgd', 'activation': <class 'torch.nn.modules.activation.ReLU'>, 'batchnorm': True, 'epochs': 35, 'batch_size': 32, 'flip_prob': 0.0}. Best is trial 187 with value: 2.7078559371041733.
[I 2025-08-04 17:06:27,968] Trial 210 finished with value: 2.7161646470804985 and parameters: {'channels_list': [16, 32, 64], 'kernel_size': 3, 'padding': 1, 'pool_kernel': 2, 'dropout_rate': 0, 'fc_hidden_dim': 256, 'lr': 0.0015637066744400652, 'weight_decay': 0.006913688754207361, 'optimizer': 'sgd', 'activation': <class 'torch.nn.modules.activation.ReLU'>, 'batchnorm': True, 'epochs': 35, 'batch_size': 32, 'flip_prob': 0.0}. Best is trial 187 with value: 2.7078559371041733.
[I 2025-08-04 17:07:24,600] Trial 211 finished with value: 2.74060110574177 and parameters: {'channels_list': [16, 32, 64], 'kernel_size': 3, 'padding': 1, 'pool_kernel': 2, 'dropout_rate': 0, 'fc_hidden_dim': 256, 'lr': 0.0015679929658008805, 'weight_decay': 0.006976540265223754, 'optimizer': 'sgd', 'activation': <class 'torch.nn.modules.activation.ReLU'>, 'batchnorm': True, 'epochs': 35, 'batch_size': 32, 'flip_prob': 0.0}. Best is trial 187 with value: 2.7078559371041733.
[I 2025-08-04 17:08:15,845] Trial 212 finished with value: 2.7775743159511554 and parameters: {'channels_list': [16, 32, 64], 'kernel_size': 3, 'padding': 1, 'pool_kernel': 2, 'dropout_rate': 0, 'fc_hidden_dim': 256, 'lr': 0.0016894542938652069, 'weight_decay': 0.007400942963399845, 'optimizer': 'sgd', 'activation': <class 'torch.nn.modules.activation.ReLU'>, 'batchnorm': True, 'epochs': 35, 'batch_size': 32, 'flip_prob': 0.0}. Best is trial 187 with value: 2.7078559371041733.
[I 2025-08-04 17:09:20,437] Trial 213 finished with value: 2.747662609765268 and parameters: {'channels_list': [16, 32, 64], 'kernel_size': 3, 'padding': 1, 'pool_kernel': 2, 'dropout_rate': 0, 'fc_hidden_dim': 256, 'lr': 0.0013408824622079725, 'weight_decay': 0.005260589594262816, 'optimizer': 'sgd', 'activation': <class 'torch.nn.modules.activation.ReLU'>, 'batchnorm': True, 'epochs': 35, 'batch_size': 32, 'flip_prob': 0.0}. Best is trial 187 with value: 2.7078559371041733.
[I 2025-08-04 17:10:22,242] Trial 214 finished with value: 2.734438358083709 and parameters: {'channels_list': [16, 32, 64], 'kernel_size': 3, 'padding': 1, 'pool_kernel': 2, 'dropout_rate': 0, 'fc_hidden_dim': 256, 'lr': 0.0016571687198142205, 'weight_decay': 0.00657302428293576, 'optimizer': 'sgd', 'activation': <class 'torch.nn.modules.activation.ReLU'>, 'batchnorm': True, 'epochs': 35, 'batch_size': 32, 'flip_prob': 0.0}. Best is trial 187 with value: 2.7078559371041733.
[I 2025-08-04 17:11:41,457] Trial 215 finished with value: 2.7267827411900094 and parameters: {'channels_list': [16, 32, 64], 'kernel_size': 3, 'padding': 1, 'pool_kernel': 2, 'dropout_rate': 0, 'fc_hidden_dim': 256, 'lr': 0.001642193414311616, 'weight_decay': 0.0065410410294055085, 'optimizer': 'sgd', 'activation': <class 'torch.nn.modules.activation.ReLU'>, 'batchnorm': True, 'epochs': 35, 'batch_size': 32, 'flip_prob': 0.0}. Best is trial 187 with value: 2.7078559371041733.
[I 2025-08-04 17:12:44,227] Trial 216 finished with value: 2.7198945082858907 and parameters: {'channels_list': [16, 32, 64], 'kernel_size': 3, 'padding': 1, 'pool_kernel': 2, 'dropout_rate': 0, 'fc_hidden_dim': 256, 'lr': 0.0018266648114524007, 'weight_decay': 0.009860627457379749, 'optimizer': 'sgd', 'activation': <class 'torch.nn.modules.activation.ReLU'>, 'batchnorm': True, 'epochs': 35, 'batch_size': 32, 'flip_prob': 0.0}. Best is trial 187 with value: 2.7078559371041733.
[I 2025-08-04 17:13:30,950] Trial 217 finished with value: 2.751208938476691 and parameters: {'channels_list': [16, 32, 64], 'kernel_size': 3, 'padding': 1, 'pool_kernel': 2, 'dropout_rate': 0, 'fc_hidden_dim': 256, 'lr': 0.0017777685662602476, 'weight_decay': 0.008406750908583656, 'optimizer': 'sgd', 'activation': <class 'torch.nn.modules.activation.ReLU'>, 'batchnorm': True, 'epochs': 35, 'batch_size': 32, 'flip_prob': 0.0}. Best is trial 187 with value: 2.7078559371041733.
[I 2025-08-04 17:14:26,055] Trial 218 finished with value: 2.7546156050931705 and parameters: {'channels_list': [16, 32, 64], 'kernel_size': 3, 'padding': 1, 'pool_kernel': 2, 'dropout_rate': 0, 'fc_hidden_dim': 256, 'lr': 0.001376352118930448, 'weight_decay': 0.00859301647600327, 'optimizer': 'sgd', 'activation': <class 'torch.nn.modules.activation.LeakyReLU'>, 'batchnorm': True, 'epochs': 35, 'batch_size': 32, 'flip_prob': 0.0}. Best is trial 187 with value: 2.7078559371041733.
[I 2025-08-04 17:15:39,889] Trial 219 finished with value: 2.7383755401477883 and parameters: {'channels_list': [16, 32, 64], 'kernel_size': 3, 'padding': 1, 'pool_kernel': 2, 'dropout_rate': 0, 'fc_hidden_dim': 256, 'lr': 0.0015905286213641794, 'weight_decay': 0.009555021122535041, 'optimizer': 'sgd', 'activation': <class 'torch.nn.modules.activation.ReLU'>, 'batchnorm': True, 'epochs': 35, 'batch_size': 32, 'flip_prob': 0.0}. Best is trial 187 with value: 2.7078559371041733.
[I 2025-08-04 17:16:23,733] Trial 220 finished with value: 2.7387118961325023 and parameters: {'channels_list': [16, 32, 64], 'kernel_size': 3, 'padding': 1, 'pool_kernel': 2, 'dropout_rate': 0, 'fc_hidden_dim': 256, 'lr': 0.0023772918372793775, 'weight_decay': 0.0072513818492998365, 'optimizer': 'sgd', 'activation': <class 'torch.nn.modules.activation.ReLU'>, 'batchnorm': True, 'epochs': 35, 'batch_size': 32, 'flip_prob': 0.0}. Best is trial 187 with value: 2.7078559371041733.
[I 2025-08-04 17:17:26,568] Trial 221 finished with value: 2.729682350101172 and parameters: {'channels_list': [16, 32, 64], 'kernel_size': 3, 'padding': 1, 'pool_kernel': 2, 'dropout_rate': 0, 'fc_hidden_dim': 256, 'lr': 0.0017939671018826187, 'weight_decay': 0.009932658640547102, 'optimizer': 'sgd', 'activation': <class 'torch.nn.modules.activation.ReLU'>, 'batchnorm': True, 'epochs': 35, 'batch_size': 32, 'flip_prob': 0.0}. Best is trial 187 with value: 2.7078559371041733.
[I 2025-08-04 17:18:02,425] Trial 222 finished with value: 2.736507164813641 and parameters: {'channels_list': [16, 32, 64], 'kernel_size': 3, 'padding': 1, 'pool_kernel': 2, 'dropout_rate': 0, 'fc_hidden_dim': 256, 'lr': 0.0017775611514497134, 'weight_decay': 0.009964988549462638, 'optimizer': 'sgd', 'activation': <class 'torch.nn.modules.activation.ReLU'>, 'batchnorm': True, 'epochs': 35, 'batch_size': 32, 'flip_prob': 0.0}. Best is trial 187 with value: 2.7078559371041733.
[I 2025-08-04 17:18:49,035] Trial 223 finished with value: 2.749306213266168 and parameters: {'channels_list': [16, 32, 64], 'kernel_size': 3, 'padding': 1, 'pool_kernel': 2, 'dropout_rate': 0, 'fc_hidden_dim': 256, 'lr': 0.001995226696826258, 'weight_decay': 0.0074389428221100055, 'optimizer': 'sgd', 'activation': <class 'torch.nn.modules.activation.ReLU'>, 'batchnorm': True, 'epochs': 35, 'batch_size': 32, 'flip_prob': 0.0}. Best is trial 187 with value: 2.7078559371041733.
[I 2025-08-04 17:19:40,969] Trial 224 finished with value: 2.7533680384926975 and parameters: {'channels_list': [16, 32, 64], 'kernel_size': 3, 'padding': 1, 'pool_kernel': 2, 'dropout_rate': 0, 'fc_hidden_dim': 256, 'lr': 0.0014665138105504117, 'weight_decay': 0.00796286335201262, 'optimizer': 'sgd', 'activation': <class 'torch.nn.modules.activation.ReLU'>, 'batchnorm': True, 'epochs': 35, 'batch_size': 32, 'flip_prob': 0.0}. Best is trial 187 with value: 2.7078559371041733.
[I 2025-08-04 17:20:24,939] Trial 225 finished with value: 2.744140863533618 and parameters: {'channels_list': [16, 32, 64], 'kernel_size': 3, 'padding': 1, 'pool_kernel': 2, 'dropout_rate': 0, 'fc_hidden_dim': 256, 'lr': 0.001626432905058814, 'weight_decay': 0.006516812753342194, 'optimizer': 'sgd', 'activation': <class 'torch.nn.modules.activation.ReLU'>, 'batchnorm': True, 'epochs': 35, 'batch_size': 32, 'flip_prob': 0.0}. Best is trial 187 with value: 2.7078559371041733.
[I 2025-08-04 17:21:10,287] Trial 226 finished with value: 2.8511932026203923 and parameters: {'channels_list': [16, 32, 64], 'kernel_size': 3, 'padding': 1, 'pool_kernel': 2, 'dropout_rate': 0, 'fc_hidden_dim': 256, 'lr': 0.0018012965279305035, 'weight_decay': 0.009839627694313256, 'optimizer': 'rmsprop', 'activation': <class 'torch.nn.modules.activation.ReLU'>, 'batchnorm': True, 'epochs': 35, 'batch_size': 32, 'flip_prob': 0.0}. Best is trial 187 with value: 2.7078559371041733.
[I 2025-08-04 17:21:57,028] Trial 227 finished with value: 2.771786623208169 and parameters: {'channels_list': [16, 32, 64], 'kernel_size': 3, 'padding': 1, 'pool_kernel': 2, 'dropout_rate': 0, 'fc_hidden_dim': 256, 'lr': 0.002206037209607242, 'weight_decay': 0.009911624315763243, 'optimizer': 'sgd', 'activation': <class 'torch.nn.modules.activation.ReLU'>, 'batchnorm': True, 'epochs': 35, 'batch_size': 32, 'flip_prob': 0.0}. Best is trial 187 with value: 2.7078559371041733.
[I 2025-08-04 17:22:46,828] Trial 228 finished with value: 2.7698770522496092 and parameters: {'channels_list': [16, 32, 64], 'kernel_size': 3, 'padding': 1, 'pool_kernel': 2, 'dropout_rate': 0, 'fc_hidden_dim': 256, 'lr': 0.0019278404232464712, 'weight_decay': 0.005389488253215054, 'optimizer': 'sgd', 'activation': <class 'torch.nn.modules.activation.ReLU'>, 'batchnorm': True, 'epochs': 35, 'batch_size': 32, 'flip_prob': 0.0}. Best is trial 187 with value: 2.7078559371041733.
[I 2025-08-04 17:23:14,783] Trial 229 finished with value: 2.8793099053087223 and parameters: {'channels_list': [16, 32, 64], 'kernel_size': 3, 'padding': 1, 'pool_kernel': 2, 'dropout_rate': 0, 'fc_hidden_dim': 256, 'lr': 0.0013746406457360244, 'weight_decay': 0.007920123256026977, 'optimizer': 'sgd', 'activation': <class 'torch.nn.modules.activation.ReLU'>, 'batchnorm': True, 'epochs': 35, 'batch_size': 32, 'flip_prob': 0.0}. Best is trial 187 with value: 2.7078559371041733.
[I 2025-08-04 17:24:31,318] Trial 230 finished with value: 2.7455890025678387 and parameters: {'channels_list': [16, 32, 64], 'kernel_size': 3, 'padding': 1, 'pool_kernel': 2, 'dropout_rate': 0, 'fc_hidden_dim': 256, 'lr': 0.0015697775758107743, 'weight_decay': 0.006515155307292766, 'optimizer': 'sgd', 'activation': <class 'torch.nn.modules.activation.ReLU'>, 'batchnorm': True, 'epochs': 35, 'batch_size': 32, 'flip_prob': 0.0}. Best is trial 187 with value: 2.7078559371041733.
[I 2025-08-04 17:24:56,219] Trial 231 finished with value: 2.8131859315175056 and parameters: {'channels_list': [16, 32, 64], 'kernel_size': 3, 'padding': 1, 'pool_kernel': 2, 'dropout_rate': 0, 'fc_hidden_dim': 256, 'lr': 0.0017527071848945945, 'weight_decay': 0.005727690895542303, 'optimizer': 'sgd', 'activation': <class 'torch.nn.modules.activation.ReLU'>, 'batchnorm': True, 'epochs': 35, 'batch_size': 32, 'flip_prob': 0.0}. Best is trial 187 with value: 2.7078559371041733.
[I 2025-08-04 17:25:40,170] Trial 232 finished with value: 2.765971530447248 and parameters: {'channels_list': [16, 32, 64], 'kernel_size': 3, 'padding': 1, 'pool_kernel': 2, 'dropout_rate': 0, 'fc_hidden_dim': 256, 'lr': 0.0020842371239576194, 'weight_decay': 0.008076346819315863, 'optimizer': 'sgd', 'activation': <class 'torch.nn.modules.activation.ReLU'>, 'batchnorm': True, 'epochs': 35, 'batch_size': 32, 'flip_prob': 0.0}. Best is trial 187 with value: 2.7078559371041733.
[I 2025-08-04 17:26:29,378] Trial 233 finished with value: 2.753981823972971 and parameters: {'channels_list': [16, 32, 64], 'kernel_size': 3, 'padding': 1, 'pool_kernel': 2, 'dropout_rate': 0, 'fc_hidden_dim': 256, 'lr': 0.0015372061123751014, 'weight_decay': 0.004669387775931716, 'optimizer': 'sgd', 'activation': <class 'torch.nn.modules.activation.ReLU'>, 'batchnorm': True, 'epochs': 35, 'batch_size': 32, 'flip_prob': 0.0}. Best is trial 187 with value: 2.7078559371041733.
[I 2025-08-04 17:27:23,783] Trial 234 finished with value: 2.722873574258047 and parameters: {'channels_list': [16, 32, 64], 'kernel_size': 3, 'padding': 1, 'pool_kernel': 2, 'dropout_rate': 0, 'fc_hidden_dim': 256, 'lr': 0.0012849768161557796, 'weight_decay': 0.006587371107968816, 'optimizer': 'sgd', 'activation': <class 'torch.nn.modules.activation.ReLU'>, 'batchnorm': True, 'epochs': 35, 'batch_size': 32, 'flip_prob': 0.0}. Best is trial 187 with value: 2.7078559371041733.
[I 2025-08-04 17:28:07,574] Trial 235 finished with value: 2.800168559059447 and parameters: {'channels_list': [16, 32, 64], 'kernel_size': 3, 'padding': 1, 'pool_kernel': 2, 'dropout_rate': 0, 'fc_hidden_dim': 256, 'lr': 0.0012541421267201224, 'weight_decay': 0.007068227078949807, 'optimizer': 'sgd', 'activation': <class 'torch.nn.modules.activation.ReLU'>, 'batchnorm': True, 'epochs': 35, 'batch_size': 32, 'flip_prob': 0.0}. Best is trial 187 with value: 2.7078559371041733.
[I 2025-08-04 17:29:15,470] Trial 236 finished with value: 2.7576348298421385 and parameters: {'channels_list': [16, 32, 64], 'kernel_size': 3, 'padding': 1, 'pool_kernel': 2, 'dropout_rate': 0, 'fc_hidden_dim': 256, 'lr': 0.001449670480240033, 'weight_decay': 0.008803496325815958, 'optimizer': 'sgd', 'activation': <class 'torch.nn.modules.activation.ReLU'>, 'batchnorm': True, 'epochs': 35, 'batch_size': 32, 'flip_prob': 0.0}. Best is trial 187 with value: 2.7078559371041733.
[I 2025-08-04 17:29:40,136] Trial 237 finished with value: 2.7719859701301566 and parameters: {'channels_list': [16, 32, 64], 'kernel_size': 3, 'padding': 1, 'pool_kernel': 2, 'dropout_rate': 0, 'fc_hidden_dim': 256, 'lr': 0.0016908044490102998, 'weight_decay': 0.006966794957057679, 'optimizer': 'sgd', 'activation': <class 'torch.nn.modules.activation.ReLU'>, 'batchnorm': True, 'epochs': 35, 'batch_size': 32, 'flip_prob': 0.0}. Best is trial 187 with value: 2.7078559371041733.
[I 2025-08-04 17:30:53,657] Trial 238 finished with value: 2.806646243223091 and parameters: {'channels_list': [16, 32, 64], 'kernel_size': 3, 'padding': 0, 'pool_kernel': 2, 'dropout_rate': 0, 'fc_hidden_dim': 256, 'lr': 0.0012869886983400698, 'weight_decay': 0.008364137398456815, 'optimizer': 'sgd', 'activation': <class 'torch.nn.modules.activation.ReLU'>, 'batchnorm': True, 'epochs': 35, 'batch_size': 32, 'flip_prob': 0.0}. Best is trial 187 with value: 2.7078559371041733.
[I 2025-08-04 17:31:55,345] Trial 239 finished with value: 2.742666299898173 and parameters: {'channels_list': [16, 32, 64], 'kernel_size': 3, 'padding': 1, 'pool_kernel': 2, 'dropout_rate': 0, 'fc_hidden_dim': 64, 'lr': 0.001902135977590861, 'weight_decay': 0.0061698608098620985, 'optimizer': 'sgd', 'activation': <class 'torch.nn.modules.activation.ReLU'>, 'batchnorm': True, 'epochs': 35, 'batch_size': 32, 'flip_prob': 0.0}. Best is trial 187 with value: 2.7078559371041733.
[I 2025-08-04 17:32:50,315] Trial 240 finished with value: 2.7228317934296244 and parameters: {'channels_list': [16, 32, 64], 'kernel_size': 3, 'padding': 1, 'pool_kernel': 2, 'dropout_rate': 0, 'fc_hidden_dim': 256, 'lr': 0.0016680060574945726, 'weight_decay': 0.004418067685184015, 'optimizer': 'sgd', 'activation': <class 'torch.nn.modules.activation.ReLU'>, 'batchnorm': True, 'epochs': 35, 'batch_size': 32, 'flip_prob': 0.0}. Best is trial 187 with value: 2.7078559371041733.
[I 2025-08-04 17:33:39,309] Trial 241 finished with value: 2.7854121209916505 and parameters: {'channels_list': [16, 32, 64], 'kernel_size': 3, 'padding': 1, 'pool_kernel': 2, 'dropout_rate': 0, 'fc_hidden_dim': 256, 'lr': 0.0016617327198365677, 'weight_decay': 0.0045854048298756105, 'optimizer': 'sgd', 'activation': <class 'torch.nn.modules.activation.ReLU'>, 'batchnorm': True, 'epochs': 35, 'batch_size': 32, 'flip_prob': 0.0}. Best is trial 187 with value: 2.7078559371041733.
[I 2025-08-04 17:34:52,317] Trial 242 finished with value: 2.725024790643064 and parameters: {'channels_list': [16, 32, 64], 'kernel_size': 3, 'padding': 1, 'pool_kernel': 2, 'dropout_rate': 0, 'fc_hidden_dim': 256, 'lr': 0.001516358483836838, 'weight_decay': 0.009883006025933217, 'optimizer': 'sgd', 'activation': <class 'torch.nn.modules.activation.ReLU'>, 'batchnorm': True, 'epochs': 35, 'batch_size': 32, 'flip_prob': 0.0}. Best is trial 187 with value: 2.7078559371041733.
[I 2025-08-04 17:36:06,444] Trial 243 finished with value: 2.7394253562241615 and parameters: {'channels_list': [16, 32, 64], 'kernel_size': 3, 'padding': 1, 'pool_kernel': 2, 'dropout_rate': 0, 'fc_hidden_dim': 256, 'lr': 0.0014957317712482503, 'weight_decay': 0.007840718059745065, 'optimizer': 'sgd', 'activation': <class 'torch.nn.modules.activation.ReLU'>, 'batchnorm': True, 'epochs': 35, 'batch_size': 32, 'flip_prob': 0.0}. Best is trial 187 with value: 2.7078559371041733.
