[I 2025-08-05 10:18:21,303] Trial 96 finished with value: 2.6939485582712908 and parameters: {'channels_list': [32, 64], 'kernel_size': 3, 'padding': 1, 'pool_kernel': 2, 'dropout_rate': 0, 'fc_hidden_dim': 64, 'lr': 0.0008169958826470292, 'weight_decay': 0.009979231767764255, 'optimizer': 'sgd', 'activation': <class 'torch.nn.modules.activation.ReLU'>, 'batchnorm': True, 'epochs': 50, 'batch_size': 32, 'flip_prob': 0.0, 'lstm_hidden_dim': 128, 'lstm_layers': 1}. Best is trial 74 with value: 2.6790329756581452.
[I 2025-08-05 10:18:49,385] Trial 97 finished with value: 2.8551162548893467 and parameters: {'channels_list': [32, 64], 'kernel_size': 7, 'padding': 1, 'pool_kernel': 2, 'dropout_rate': 0, 'fc_hidden_dim': 64, 'lr': 0.0005590148295021612, 'weight_decay': 0.009591600472398789, 'optimizer': 'rmsprop', 'activation': <class 'torch.nn.modules.activation.LeakyReLU'>, 'batchnorm': True, 'epochs': 50, 'batch_size': 64, 'flip_prob': 0.0, 'lstm_hidden_dim': 128, 'lstm_layers': 1}. Best is trial 74 with value: 2.6790329756581452.
[I 2025-08-05 10:19:18,182] Trial 98 finished with value: 2.7890421207621245 and parameters: {'channels_list': [32, 64], 'kernel_size': 3, 'padding': 1, 'pool_kernel': 2, 'dropout_rate': 0, 'fc_hidden_dim': 64, 'lr': 0.0007978055665934535, 'weight_decay': 0.008077593364234777, 'optimizer': 'sgd', 'activation': <class 'torch.nn.modules.activation.ReLU'>, 'batchnorm': True, 'epochs': 50, 'batch_size': 32, 'flip_prob': 0.0, 'lstm_hidden_dim': 128, 'lstm_layers': 1}. Best is trial 74 with value: 2.6790329756581452.
[I 2025-08-05 10:19:46,969] Trial 99 finished with value: 2.787752245303661 and parameters: {'channels_list': [32, 64], 'kernel_size': 3, 'padding': 1, 'pool_kernel': 2, 'dropout_rate': 0, 'fc_hidden_dim': 64, 'lr': 0.0004902418320282704, 'weight_decay': 0.0020093711396168713, 'optimizer': 'sgd', 'activation': <class 'torch.nn.modules.activation.ReLU'>, 'batchnorm': True, 'epochs': 50, 'batch_size': 32, 'flip_prob': 0.0, 'lstm_hidden_dim': 128, 'lstm_layers': 1}. Best is trial 74 with value: 2.6790329756581452.
[I 2025-08-05 10:21:05,751] Trial 100 finished with value: 2.7549893694993814 and parameters: {'channels_list': [32, 64], 'kernel_size': 5, 'padding': 1, 'pool_kernel': 2, 'dropout_rate': 0, 'fc_hidden_dim': 64, 'lr': 0.00041972497039879, 'weight_decay': 0.004441246603558971, 'optimizer': 'sgd', 'activation': <class 'torch.nn.modules.activation.ReLU'>, 'batchnorm': True, 'epochs': 50, 'batch_size': 32, 'flip_prob': 0.0, 'lstm_hidden_dim': 128, 'lstm_layers': 1}. Best is trial 74 with value: 2.6790329756581452.
[I 2025-08-05 10:22:15,526] Trial 101 finished with value: 2.6980880316836697 and parameters: {'channels_list': [32, 64], 'kernel_size': 3, 'padding': 1, 'pool_kernel': 2, 'dropout_rate': 0, 'fc_hidden_dim': 64, 'lr': 0.0009535087265054864, 'weight_decay': 0.005991867353684099, 'optimizer': 'sgd', 'activation': <class 'torch.nn.modules.activation.ReLU'>, 'batchnorm': True, 'epochs': 50, 'batch_size': 32, 'flip_prob': 0.0, 'lstm_hidden_dim': 128, 'lstm_layers': 1}. Best is trial 74 with value: 2.6790329756581452.
[I 2025-08-05 10:22:50,703] Trial 102 finished with value: 2.7777561687589123 and parameters: {'channels_list': [32, 64], 'kernel_size': 3, 'padding': 1, 'pool_kernel': 2, 'dropout_rate': 0, 'fc_hidden_dim': 64, 'lr': 0.000880182963053391, 'weight_decay': 0.006092598358576764, 'optimizer': 'sgd', 'activation': <class 'torch.nn.modules.activation.ReLU'>, 'batchnorm': True, 'epochs': 50, 'batch_size': 32, 'flip_prob': 0.0, 'lstm_hidden_dim': 128, 'lstm_layers': 1}. Best is trial 74 with value: 2.6790329756581452.
[I 2025-08-05 10:23:41,693] Trial 103 finished with value: 2.733267107861177 and parameters: {'channels_list': [32, 64], 'kernel_size': 3, 'padding': 1, 'pool_kernel': 2, 'dropout_rate': 0, 'fc_hidden_dim': 64, 'lr': 0.0009612627267112178, 'weight_decay': 0.004869850731314653, 'optimizer': 'sgd', 'activation': <class 'torch.nn.modules.activation.ReLU'>, 'batchnorm': True, 'epochs': 50, 'batch_size': 32, 'flip_prob': 0.0, 'lstm_hidden_dim': 128, 'lstm_layers': 1}. Best is trial 74 with value: 2.6790329756581452.
[I 2025-08-05 10:24:48,595] Trial 104 finished with value: 2.73586078017986 and parameters: {'channels_list': [32, 64], 'kernel_size': 3, 'padding': 1, 'pool_kernel': 2, 'dropout_rate': 0, 'fc_hidden_dim': 64, 'lr': 0.0012011796718117119, 'weight_decay': 0.002837007103591204, 'optimizer': 'sgd', 'activation': <class 'torch.nn.modules.activation.ReLU'>, 'batchnorm': True, 'epochs': 50, 'batch_size': 32, 'flip_prob': 0.0, 'lstm_hidden_dim': 128, 'lstm_layers': 1}. Best is trial 74 with value: 2.6790329756581452.
[I 2025-08-05 10:25:41,535] Trial 105 finished with value: 2.725825534827459 and parameters: {'channels_list': [32, 64], 'kernel_size': 3, 'padding': 1, 'pool_kernel': 2, 'dropout_rate': 0, 'fc_hidden_dim': 64, 'lr': 0.0007171630920371024, 'weight_decay': 0.008629338910007054, 'optimizer': 'sgd', 'activation': <class 'torch.nn.modules.activation.ReLU'>, 'batchnorm': True, 'epochs': 50, 'batch_size': 32, 'flip_prob': 0.0, 'lstm_hidden_dim': 128, 'lstm_layers': 1}. Best is trial 74 with value: 2.6790329756581452.
[I 2025-08-05 10:26:42,192] Trial 106 finished with value: 2.7137731565353524 and parameters: {'channels_list': [32, 64], 'kernel_size': 3, 'padding': 1, 'pool_kernel': 2, 'dropout_rate': 0, 'fc_hidden_dim': 128, 'lr': 0.0013835144424655093, 'weight_decay': 0.003677084996322947, 'optimizer': 'sgd', 'activation': <class 'torch.nn.modules.activation.ReLU'>, 'batchnorm': True, 'epochs': 50, 'batch_size': 32, 'flip_prob': 0.0, 'lstm_hidden_dim': 128, 'lstm_layers': 1}. Best is trial 74 with value: 2.6790329756581452.
[I 2025-08-05 10:27:36,238] Trial 107 finished with value: 2.75549585868136 and parameters: {'channels_list': [32, 64], 'kernel_size': 3, 'padding': 1, 'pool_kernel': 3, 'dropout_rate': 0, 'fc_hidden_dim': 64, 'lr': 0.0007720404876179054, 'weight_decay': 0.00027224606700421226, 'optimizer': 'sgd', 'activation': <class 'torch.nn.modules.activation.ReLU'>, 'batchnorm': True, 'epochs': 50, 'batch_size': 32, 'flip_prob': 0.0, 'lstm_hidden_dim': 128, 'lstm_layers': 1}. Best is trial 74 with value: 2.6790329756581452.
[I 2025-08-05 10:28:26,864] Trial 108 finished with value: 2.791840656761381 and parameters: {'channels_list': [32, 64], 'kernel_size': 3, 'padding': 0, 'pool_kernel': 2, 'dropout_rate': 0, 'fc_hidden_dim': 64, 'lr': 0.0006320252569761371, 'weight_decay': 0.006564060144876684, 'optimizer': 'sgd', 'activation': <class 'torch.nn.modules.activation.ReLU'>, 'batchnorm': True, 'epochs': 50, 'batch_size': 32, 'flip_prob': 0.0, 'lstm_hidden_dim': 32, 'lstm_layers': 1}. Best is trial 74 with value: 2.6790329756581452.
[I 2025-08-05 10:29:31,533] Trial 109 finished with value: 2.732425214873292 and parameters: {'channels_list': [32, 64, 128], 'kernel_size': 3, 'padding': 1, 'pool_kernel': 2, 'dropout_rate': 0, 'fc_hidden_dim': 64, 'lr': 0.0005497467424215506, 'weight_decay': 0.0014718136692667414, 'optimizer': 'rmsprop', 'activation': <class 'torch.nn.modules.activation.ReLU'>, 'batchnorm': True, 'epochs': 50, 'batch_size': 32, 'flip_prob': 0.0, 'lstm_hidden_dim': 128, 'lstm_layers': 1}. Best is trial 74 with value: 2.6790329756581452.
[I 2025-08-05 10:30:35,290] Trial 110 finished with value: 2.682216683112813 and parameters: {'channels_list': [32, 64], 'kernel_size': 3, 'padding': 1, 'pool_kernel': 2, 'dropout_rate': 0, 'fc_hidden_dim': 64, 'lr': 0.0011888791523662098, 'weight_decay': 0.005402967273480621, 'optimizer': 'sgd', 'activation': <class 'torch.nn.modules.activation.ReLU'>, 'batchnorm': True, 'epochs': 50, 'batch_size': 32, 'flip_prob': 0.0, 'lstm_hidden_dim': 128, 'lstm_layers': 1}. Best is trial 74 with value: 2.6790329756581452.
[I 2025-08-05 10:32:04,366] Trial 111 finished with value: 2.7064677326469284 and parameters: {'channels_list': [32, 64], 'kernel_size': 3, 'padding': 1, 'pool_kernel': 2, 'dropout_rate': 0, 'fc_hidden_dim': 64, 'lr': 0.0009902498114647462, 'weight_decay': 0.005668814694318283, 'optimizer': 'sgd', 'activation': <class 'torch.nn.modules.activation.ReLU'>, 'batchnorm': True, 'epochs': 50, 'batch_size': 32, 'flip_prob': 0.0, 'lstm_hidden_dim': 128, 'lstm_layers': 1}. Best is trial 74 with value: 2.6790329756581452.
[I 2025-08-05 10:33:27,023] Trial 112 finished with value: 2.6877708459792005 and parameters: {'channels_list': [32, 64], 'kernel_size': 3, 'padding': 1, 'pool_kernel': 2, 'dropout_rate': 0, 'fc_hidden_dim': 64, 'lr': 0.0011406215711356014, 'weight_decay': 0.009942749449243959, 'optimizer': 'sgd', 'activation': <class 'torch.nn.modules.activation.ReLU'>, 'batchnorm': True, 'epochs': 50, 'batch_size': 32, 'flip_prob': 0.0, 'lstm_hidden_dim': 128, 'lstm_layers': 1}. Best is trial 74 with value: 2.6790329756581452.
[I 2025-08-05 10:34:52,749] Trial 113 finished with value: 2.714890479868945 and parameters: {'channels_list': [32, 64], 'kernel_size': 3, 'padding': 1, 'pool_kernel': 2, 'dropout_rate': 0, 'fc_hidden_dim': 64, 'lr': 0.001148020097906543, 'weight_decay': 0.008213295753294856, 'optimizer': 'sgd', 'activation': <class 'torch.nn.modules.activation.ReLU'>, 'batchnorm': True, 'epochs': 50, 'batch_size': 32, 'flip_prob': 0.0, 'lstm_hidden_dim': 128, 'lstm_layers': 1}. Best is trial 74 with value: 2.6790329756581452.
[I 2025-08-05 10:35:28,060] Trial 114 finished with value: 2.7901130495082915 and parameters: {'channels_list': [32, 64], 'kernel_size': 3, 'padding': 1, 'pool_kernel': 2, 'dropout_rate': 0, 'fc_hidden_dim': 64, 'lr': 0.0008240442861795875, 'weight_decay': 0.00996035493333985, 'optimizer': 'sgd', 'activation': <class 'torch.nn.modules.activation.ReLU'>, 'batchnorm': True, 'epochs': 50, 'batch_size': 32, 'flip_prob': 0.0, 'lstm_hidden_dim': 128, 'lstm_layers': 1}. Best is trial 74 with value: 2.6790329756581452.
[I 2025-08-05 10:36:47,419] Trial 115 finished with value: 2.717053275286648 and parameters: {'channels_list': [32, 64], 'kernel_size': 3, 'padding': 1, 'pool_kernel': 2, 'dropout_rate': 0, 'fc_hidden_dim': 64, 'lr': 0.0008769037282160707, 'weight_decay': 0.004523840665635496, 'optimizer': 'sgd', 'activation': <class 'torch.nn.modules.activation.ReLU'>, 'batchnorm': True, 'epochs': 50, 'batch_size': 32, 'flip_prob': 0.0, 'lstm_hidden_dim': 128, 'lstm_layers': 1}. Best is trial 74 with value: 2.6790329756581452.
[I 2025-08-05 10:37:05,030] Trial 116 finished with value: 2.809054584526182 and parameters: {'channels_list': [32, 64], 'kernel_size': 3, 'padding': 1, 'pool_kernel': 2, 'dropout_rate': 0, 'fc_hidden_dim': 64, 'lr': 0.0012413436726474794, 'weight_decay': 0.006986499441663846, 'optimizer': 'sgd', 'activation': <class 'torch.nn.modules.activation.ReLU'>, 'batchnorm': True, 'epochs': 50, 'batch_size': 64, 'flip_prob': 0.0, 'lstm_hidden_dim': 128, 'lstm_layers': 1}. Best is trial 74 with value: 2.6790329756581452.
[I 2025-08-05 10:37:46,710] Trial 117 finished with value: 2.7665593067325642 and parameters: {'channels_list': [32, 64], 'kernel_size': 3, 'padding': 1, 'pool_kernel': 2, 'dropout_rate': 0, 'fc_hidden_dim': 64, 'lr': 0.0006947762321319189, 'weight_decay': 0.005494248584453945, 'optimizer': 'sgd', 'activation': <class 'torch.nn.modules.activation.LeakyReLU'>, 'batchnorm': True, 'epochs': 50, 'batch_size': 32, 'flip_prob': 0.0, 'lstm_hidden_dim': 128, 'lstm_layers': 1}. Best is trial 74 with value: 2.6790329756581452.
[I 2025-08-05 10:38:37,762] Trial 118 finished with value: 2.772970255206376 and parameters: {'channels_list': [32, 64], 'kernel_size': 7, 'padding': 1, 'pool_kernel': 2, 'dropout_rate': 0, 'fc_hidden_dim': 64, 'lr': 0.001979631748294632, 'weight_decay': 0.003658459602544785, 'optimizer': 'sgd', 'activation': <class 'torch.nn.modules.activation.ReLU'>, 'batchnorm': True, 'epochs': 50, 'batch_size': 32, 'flip_prob': 0.0, 'lstm_hidden_dim': 128, 'lstm_layers': 1}. Best is trial 74 with value: 2.6790329756581452.
[I 2025-08-05 10:39:41,425] Trial 119 finished with value: 2.738403178411744 and parameters: {'channels_list': [32, 64], 'kernel_size': 3, 'padding': 1, 'pool_kernel': 2, 'dropout_rate': 0, 'fc_hidden_dim': 64, 'lr': 0.0010150679889701073, 'weight_decay': 0.009948006563564905, 'optimizer': 'sgd', 'activation': <class 'torch.nn.modules.activation.ReLU'>, 'batchnorm': True, 'epochs': 50, 'batch_size': 32, 'flip_prob': 0.0, 'lstm_hidden_dim': 128, 'lstm_layers': 1}. Best is trial 74 with value: 2.6790329756581452.
[I 2025-08-05 10:41:16,764] Trial 120 finished with value: 2.714310376060311 and parameters: {'channels_list': [32, 64], 'kernel_size': 3, 'padding': 1, 'pool_kernel': 2, 'dropout_rate': 0, 'fc_hidden_dim': 64, 'lr': 0.0003103673755790471, 'weight_decay': 0.00691666703149772, 'optimizer': 'sgd', 'activation': <class 'torch.nn.modules.activation.ReLU'>, 'batchnorm': True, 'epochs': 50, 'batch_size': 32, 'flip_prob': 0.0, 'lstm_hidden_dim': 128, 'lstm_layers': 1}. Best is trial 74 with value: 2.6790329756581452.
[I 2025-08-05 10:41:52,011] Trial 121 finished with value: 2.763486437055544 and parameters: {'channels_list': [32, 64], 'kernel_size': 3, 'padding': 1, 'pool_kernel': 2, 'dropout_rate': 0, 'fc_hidden_dim': 64, 'lr': 0.0013666300680047739, 'weight_decay': 0.004918328711942803, 'optimizer': 'sgd', 'activation': <class 'torch.nn.modules.activation.ReLU'>, 'batchnorm': True, 'epochs': 50, 'batch_size': 32, 'flip_prob': 0.0, 'lstm_hidden_dim': 128, 'lstm_layers': 1}. Best is trial 74 with value: 2.6790329756581452.
[I 2025-08-05 10:43:49,352] Trial 122 finished with value: 2.707552039292523 and parameters: {'channels_list': [32, 64], 'kernel_size': 3, 'padding': 1, 'pool_kernel': 2, 'dropout_rate': 0, 'fc_hidden_dim': 64, 'lr': 0.0016122858744161777, 'weight_decay': 0.007880860751534435, 'optimizer': 'sgd', 'activation': <class 'torch.nn.modules.activation.ReLU'>, 'batchnorm': True, 'epochs': 50, 'batch_size': 32, 'flip_prob': 0.0, 'lstm_hidden_dim': 128, 'lstm_layers': 1}. Best is trial 74 with value: 2.6790329756581452.
[I 2025-08-05 10:45:00,944] Trial 123 finished with value: 2.7146178590086603 and parameters: {'channels_list': [32, 64], 'kernel_size': 3, 'padding': 1, 'pool_kernel': 2, 'dropout_rate': 0, 'fc_hidden_dim': 64, 'lr': 0.0011485005855998483, 'weight_decay': 0.005852080030245677, 'optimizer': 'sgd', 'activation': <class 'torch.nn.modules.activation.ReLU'>, 'batchnorm': True, 'epochs': 50, 'batch_size': 32, 'flip_prob': 0.0, 'lstm_hidden_dim': 128, 'lstm_layers': 1}. Best is trial 74 with value: 2.6790329756581452.
[I 2025-08-05 10:45:27,411] Trial 124 finished with value: 2.8645089587198953 and parameters: {'channels_list': [32, 64], 'kernel_size': 3, 'padding': 1, 'pool_kernel': 2, 'dropout_rate': 0, 'fc_hidden_dim': 64, 'lr': 0.001503256698249299, 'weight_decay': 0.002514551852296887, 'optimizer': 'sgd', 'activation': <class 'torch.nn.modules.activation.ReLU'>, 'batchnorm': True, 'epochs': 50, 'batch_size': 32, 'flip_prob': 0.0, 'lstm_hidden_dim': 128, 'lstm_layers': 1}. Best is trial 74 with value: 2.6790329756581452.
[I 2025-08-05 10:46:25,244] Trial 125 finished with value: 2.7047576303217467 and parameters: {'channels_list': [32, 64], 'kernel_size': 3, 'padding': 1, 'pool_kernel': 2, 'dropout_rate': 0, 'fc_hidden_dim': 64, 'lr': 0.000952054956925659, 'weight_decay': 0.004274732678149626, 'optimizer': 'sgd', 'activation': <class 'torch.nn.modules.activation.ReLU'>, 'batchnorm': True, 'epochs': 50, 'batch_size': 32, 'flip_prob': 0.0, 'lstm_hidden_dim': 128, 'lstm_layers': 1}. Best is trial 74 with value: 2.6790329756581452.
[I 2025-08-05 10:47:14,453] Trial 126 finished with value: 2.7288113775241793 and parameters: {'channels_list': [32, 64], 'kernel_size': 3, 'padding': 1, 'pool_kernel': 2, 'dropout_rate': 0, 'fc_hidden_dim': 128, 'lr': 0.0009226205023071391, 'weight_decay': 0.004349777575258717, 'optimizer': 'sgd', 'activation': <class 'torch.nn.modules.activation.ReLU'>, 'batchnorm': True, 'epochs': 50, 'batch_size': 32, 'flip_prob': 0.0, 'lstm_hidden_dim': 128, 'lstm_layers': 1}. Best is trial 74 with value: 2.6790329756581452.
[I 2025-08-05 10:48:15,351] Trial 127 finished with value: 2.7927420677695833 and parameters: {'channels_list': [32, 64], 'kernel_size': 5, 'padding': 1, 'pool_kernel': 3, 'dropout_rate': 0, 'fc_hidden_dim': 64, 'lr': 0.0006089422655520149, 'weight_decay': 0.0033653265463548087, 'optimizer': 'sgd', 'activation': <class 'torch.nn.modules.activation.ReLU'>, 'batchnorm': True, 'epochs': 50, 'batch_size': 32, 'flip_prob': 0.0, 'lstm_hidden_dim': 128, 'lstm_layers': 1}. Best is trial 74 with value: 2.6790329756581452.
[I 2025-08-05 10:49:41,029] Trial 128 finished with value: 2.7493204307211037 and parameters: {'channels_list': [32, 64], 'kernel_size': 3, 'padding': 0, 'pool_kernel': 2, 'dropout_rate': 0, 'fc_hidden_dim': 64, 'lr': 0.0007754517658589942, 'weight_decay': 0.008004823711839295, 'optimizer': 'sgd', 'activation': <class 'torch.nn.modules.activation.ReLU'>, 'batchnorm': True, 'epochs': 50, 'batch_size': 32, 'flip_prob': 0.0, 'lstm_hidden_dim': 128, 'lstm_layers': 1}. Best is trial 74 with value: 2.6790329756581452.
[I 2025-08-05 10:50:55,157] Trial 129 finished with value: 2.6957556911486913 and parameters: {'channels_list': [32, 64], 'kernel_size': 3, 'padding': 1, 'pool_kernel': 2, 'dropout_rate': 0, 'fc_hidden_dim': 64, 'lr': 0.0010323102514076083, 'weight_decay': 0.006134365789233438, 'optimizer': 'sgd', 'activation': <class 'torch.nn.modules.activation.ReLU'>, 'batchnorm': True, 'epochs': 50, 'batch_size': 32, 'flip_prob': 0.0, 'lstm_hidden_dim': 128, 'lstm_layers': 1}. Best is trial 74 with value: 2.6790329756581452.
[I 2025-08-05 10:52:02,976] Trial 130 finished with value: 2.7352537225900426 and parameters: {'channels_list': [32, 64], 'kernel_size': 3, 'padding': 1, 'pool_kernel': 2, 'dropout_rate': 0, 'fc_hidden_dim': 64, 'lr': 0.00010309184804332756, 'weight_decay': 0.006305585437277289, 'optimizer': 'rmsprop', 'activation': <class 'torch.nn.modules.activation.ReLU'>, 'batchnorm': True, 'epochs': 50, 'batch_size': 32, 'flip_prob': 0.0, 'lstm_hidden_dim': 32, 'lstm_layers': 1}. Best is trial 74 with value: 2.6790329756581452.
[I 2025-08-05 10:52:47,156] Trial 131 finished with value: 2.744904317211616 and parameters: {'channels_list': [32, 64], 'kernel_size': 3, 'padding': 1, 'pool_kernel': 2, 'dropout_rate': 0, 'fc_hidden_dim': 64, 'lr': 0.001045082883251481, 'weight_decay': 0.00492263543102253, 'optimizer': 'sgd', 'activation': <class 'torch.nn.modules.activation.ReLU'>, 'batchnorm': True, 'epochs': 50, 'batch_size': 32, 'flip_prob': 0.0, 'lstm_hidden_dim': 128, 'lstm_layers': 1}. Best is trial 74 with value: 2.6790329756581452.
[I 2025-08-05 10:54:04,835] Trial 132 finished with value: 2.7023475975409346 and parameters: {'channels_list': [32, 64], 'kernel_size': 3, 'padding': 1, 'pool_kernel': 2, 'dropout_rate': 0, 'fc_hidden_dim': 64, 'lr': 0.0008715452475188148, 'weight_decay': 0.009987936798418837, 'optimizer': 'sgd', 'activation': <class 'torch.nn.modules.activation.ReLU'>, 'batchnorm': True, 'epochs': 50, 'batch_size': 32, 'flip_prob': 0.0, 'lstm_hidden_dim': 128, 'lstm_layers': 1}. Best is trial 74 with value: 2.6790329756581452.
[I 2025-08-05 10:55:05,294] Trial 133 finished with value: 2.699088380477684 and parameters: {'channels_list': [32, 64], 'kernel_size': 3, 'padding': 1, 'pool_kernel': 2, 'dropout_rate': 0, 'fc_hidden_dim': 64, 'lr': 0.0008575932595264936, 'weight_decay': 0.009839880064858733, 'optimizer': 'sgd', 'activation': <class 'torch.nn.modules.activation.ReLU'>, 'batchnorm': True, 'epochs': 50, 'batch_size': 32, 'flip_prob': 0.0, 'lstm_hidden_dim': 128, 'lstm_layers': 1}. Best is trial 74 with value: 2.6790329756581452.
[I 2025-08-05 10:55:34,041] Trial 134 finished with value: 2.7760601441161334 and parameters: {'channels_list': [32, 64], 'kernel_size': 3, 'padding': 1, 'pool_kernel': 2, 'dropout_rate': 0, 'fc_hidden_dim': 64, 'lr': 0.0008298071708688015, 'weight_decay': 0.008518407717379007, 'optimizer': 'sgd', 'activation': <class 'torch.nn.modules.activation.ReLU'>, 'batchnorm': True, 'epochs': 50, 'batch_size': 32, 'flip_prob': 0.0, 'lstm_hidden_dim': 128, 'lstm_layers': 1}. Best is trial 74 with value: 2.6790329756581452.
[I 2025-08-05 10:57:21,318] Trial 135 finished with value: 2.7113856248314905 and parameters: {'channels_list': [32, 64], 'kernel_size': 3, 'padding': 1, 'pool_kernel': 2, 'dropout_rate': 0, 'fc_hidden_dim': 64, 'lr': 0.0006870570421247152, 'weight_decay': 0.007000240575090078, 'optimizer': 'sgd', 'activation': <class 'torch.nn.modules.activation.ReLU'>, 'batchnorm': True, 'epochs': 50, 'batch_size': 32, 'flip_prob': 0.0, 'lstm_hidden_dim': 128, 'lstm_layers': 1}. Best is trial 74 with value: 2.6790329756581452.
[I 2025-08-05 10:58:10,554] Trial 136 finished with value: 2.73769237169742 and parameters: {'channels_list': [32, 64, 128], 'kernel_size': 3, 'padding': 1, 'pool_kernel': 2, 'dropout_rate': 0, 'fc_hidden_dim': 64, 'lr': 0.0011195606295001169, 'weight_decay': 0.00928005664305667, 'optimizer': 'sgd', 'activation': <class 'torch.nn.modules.activation.ReLU'>, 'batchnorm': True, 'epochs': 50, 'batch_size': 32, 'flip_prob': 0.0, 'lstm_hidden_dim': 128, 'lstm_layers': 1}. Best is trial 74 with value: 2.6790329756581452.
[I 2025-08-05 10:58:47,036] Trial 137 finished with value: 2.7261649062176234 and parameters: {'channels_list': [32, 64], 'kernel_size': 3, 'padding': 1, 'pool_kernel': 2, 'dropout_rate': 0, 'fc_hidden_dim': 64, 'lr': 0.0008738123816539705, 'weight_decay': 0.0058471310408270095, 'optimizer': 'sgd', 'activation': <class 'torch.nn.modules.activation.LeakyReLU'>, 'batchnorm': True, 'epochs': 50, 'batch_size': 64, 'flip_prob': 0.0, 'lstm_hidden_dim': 128, 'lstm_layers': 1}. Best is trial 74 with value: 2.6790329756581452.
