[I 2025-08-04 14:52:42,186] A new study created in memory with name: no-name-1dbd4808-60fc-4ebd-a744-23f05eee2576
/uufs/chpc.utah.edu/common/home/u1325975/software/pkg/miniforge3/lib/python3.12/site-packages/optuna/distributions.py:518: UserWarning: Choices for a categorical distribution should be a tuple of None, bool, int, float and str for persistent storage but contains [32, 64] which is of type list.
  warnings.warn(message)
/uufs/chpc.utah.edu/common/home/u1325975/software/pkg/miniforge3/lib/python3.12/site-packages/optuna/distributions.py:518: UserWarning: Choices for a categorical distribution should be a tuple of None, bool, int, float and str for persistent storage but contains [16, 32, 64] which is of type list.
  warnings.warn(message)
/uufs/chpc.utah.edu/common/home/u1325975/software/pkg/miniforge3/lib/python3.12/site-packages/optuna/distributions.py:518: UserWarning: Choices for a categorical distribution should be a tuple of None, bool, int, float and str for persistent storage but contains [32, 64, 128] which is of type list.
  warnings.warn(message)
/uufs/chpc.utah.edu/common/home/u1325975/software/pkg/miniforge3/lib/python3.12/site-packages/optuna/distributions.py:518: UserWarning: Choices for a categorical distribution should be a tuple of None, bool, int, float and str for persistent storage but contains [16, 32, 64, 128] which is of type list.
  warnings.warn(message)
/uufs/chpc.utah.edu/common/home/u1325975/software/pkg/miniforge3/lib/python3.12/site-packages/optuna/distributions.py:518: UserWarning: Choices for a categorical distribution should be a tuple of None, bool, int, float and str for persistent storage but contains <class 'torch.nn.modules.activation.ReLU'> which is of type type.
  warnings.warn(message)
/uufs/chpc.utah.edu/common/home/u1325975/software/pkg/miniforge3/lib/python3.12/site-packages/optuna/distributions.py:518: UserWarning: Choices for a categorical distribution should be a tuple of None, bool, int, float and str for persistent storage but contains <class 'torch.nn.modules.activation.LeakyReLU'> which is of type type.
  warnings.warn(message)
[I 2025-08-04 14:52:42,289] Trial 0 pruned. 
[I 2025-08-04 14:52:42,344] Trial 1 pruned. 
[I 2025-08-04 14:53:03,098] Trial 2 finished with value: 2.762898464686045 and parameters: {'channels_list': [32, 64, 128], 'kernel_size': 3, 'padding': 1, 'pool_kernel': 2, 'dropout_rate': 0, 'fc_hidden_dim': 256, 'lr': 0.0042305518967186454, 'weight_decay': 0.001772947777174821, 'optimizer': 'sgd', 'activation': <class 'torch.nn.modules.activation.ReLU'>, 'batchnorm': True, 'epochs': 35, 'batch_size': 128, 'flip_prob': 0.0}. Best is trial 2 with value: 2.762898464686045.
[I 2025-08-04 14:53:03,105] Trial 3 pruned. 
[I 2025-08-04 14:53:27,653] Trial 4 finished with value: 2.9335865085749058 and parameters: {'channels_list': [32, 64], 'kernel_size': 3, 'padding': 0, 'pool_kernel': 3, 'dropout_rate': 0, 'fc_hidden_dim': 64, 'lr': 0.001433602788015722, 'weight_decay': 0.0004683444722586642, 'optimizer': 'sgd', 'activation': <class 'torch.nn.modules.activation.ReLU'>, 'batchnorm': True, 'epochs': 35, 'batch_size': 64, 'flip_prob': 0.0}. Best is trial 2 with value: 2.762898464686045.
[I 2025-08-04 14:53:27,659] Trial 5 pruned. 
[I 2025-08-04 14:54:24,019] Trial 6 finished with value: 2.7837871146000768 and parameters: {'channels_list': [32, 64], 'kernel_size': 5, 'padding': 1, 'pool_kernel': 3, 'dropout_rate': 0, 'fc_hidden_dim': 128, 'lr': 0.004197684644017015, 'weight_decay': 1.622734518218477e-05, 'optimizer': 'rmsprop', 'activation': <class 'torch.nn.modules.activation.ReLU'>, 'batchnorm': True, 'epochs': 35, 'batch_size': 32, 'flip_prob': 0.0}. Best is trial 2 with value: 2.762898464686045.
[I 2025-08-04 14:54:24,025] Trial 7 pruned. 
[I 2025-08-04 14:54:24,031] Trial 8 pruned. 
[I 2025-08-04 14:54:24,036] Trial 9 pruned. 
[I 2025-08-04 14:55:06,893] Trial 10 finished with value: 2.7352241696149506 and parameters: {'channels_list': [32, 64, 128], 'kernel_size': 3, 'padding': 1, 'pool_kernel': 2, 'dropout_rate': 0, 'fc_hidden_dim': 256, 'lr': 0.008328591467668553, 'weight_decay': 0.008276329227938103, 'optimizer': 'sgd', 'activation': <class 'torch.nn.modules.activation.ReLU'>, 'batchnorm': True, 'epochs': 35, 'batch_size': 128, 'flip_prob': 0.0}. Best is trial 10 with value: 2.7352241696149506.
[I 2025-08-04 14:55:30,432] Trial 11 finished with value: 2.7703277171449003 and parameters: {'channels_list': [32, 64, 128], 'kernel_size': 3, 'padding': 1, 'pool_kernel': 2, 'dropout_rate': 0, 'fc_hidden_dim': 256, 'lr': 0.00873921976770489, 'weight_decay': 0.005793415976042005, 'optimizer': 'sgd', 'activation': <class 'torch.nn.modules.activation.ReLU'>, 'batchnorm': True, 'epochs': 35, 'batch_size': 128, 'flip_prob': 0.0}. Best is trial 10 with value: 2.7352241696149506.
[I 2025-08-04 14:55:45,474] Trial 12 finished with value: 2.9398742707417007 and parameters: {'channels_list': [32, 64, 128], 'kernel_size': 3, 'padding': 1, 'pool_kernel': 2, 'dropout_rate': 0, 'fc_hidden_dim': 256, 'lr': 0.00016801622167420915, 'weight_decay': 0.0004691939318506589, 'optimizer': 'sgd', 'activation': <class 'torch.nn.modules.activation.ReLU'>, 'batchnorm': True, 'epochs': 35, 'batch_size': 128, 'flip_prob': 0.0}. Best is trial 10 with value: 2.7352241696149506.
[I 2025-08-04 14:55:56,875] Trial 13 finished with value: 2.8819601758397817 and parameters: {'channels_list': [32, 64, 128], 'kernel_size': 3, 'padding': 1, 'pool_kernel': 2, 'dropout_rate': 0, 'fc_hidden_dim': 256, 'lr': 0.008779401550333051, 'weight_decay': 0.009092418324988322, 'optimizer': 'sgd', 'activation': <class 'torch.nn.modules.activation.ReLU'>, 'batchnorm': True, 'epochs': 35, 'batch_size': 128, 'flip_prob': 0.0}. Best is trial 10 with value: 2.7352241696149506.
[I 2025-08-04 14:56:20,857] Trial 14 finished with value: 2.7571990277712537 and parameters: {'channels_list': [32, 64, 128], 'kernel_size': 3, 'padding': 1, 'pool_kernel': 2, 'dropout_rate': 0, 'fc_hidden_dim': 256, 'lr': 0.002518674401017969, 'weight_decay': 0.0007367947815716113, 'optimizer': 'sgd', 'activation': <class 'torch.nn.modules.activation.ReLU'>, 'batchnorm': True, 'epochs': 35, 'batch_size': 128, 'flip_prob': 0.0}. Best is trial 10 with value: 2.7352241696149506.
[I 2025-08-04 14:56:41,403] Trial 15 finished with value: 2.8155563800268784 and parameters: {'channels_list': [32, 64, 128], 'kernel_size': 3, 'padding': 1, 'pool_kernel': 2, 'dropout_rate': 0, 'fc_hidden_dim': 256, 'lr': 0.002461552471170352, 'weight_decay': 0.0002750896204586545, 'optimizer': 'sgd', 'activation': <class 'torch.nn.modules.activation.ReLU'>, 'batchnorm': True, 'epochs': 35, 'batch_size': 128, 'flip_prob': 0.0}. Best is trial 10 with value: 2.7352241696149506.
[I 2025-08-04 14:57:01,229] Trial 16 finished with value: 2.7798480671191244 and parameters: {'channels_list': [32, 64, 128], 'kernel_size': 3, 'padding': 1, 'pool_kernel': 2, 'dropout_rate': 0, 'fc_hidden_dim': 256, 'lr': 0.00966442381220334, 'weight_decay': 0.0011018389531405105, 'optimizer': 'sgd', 'activation': <class 'torch.nn.modules.activation.ReLU'>, 'batchnorm': True, 'epochs': 35, 'batch_size': 128, 'flip_prob': 0.0}. Best is trial 10 with value: 2.7352241696149506.
[I 2025-08-04 14:57:30,012] Trial 17 finished with value: 2.759782428189267 and parameters: {'channels_list': [32, 64, 128], 'kernel_size': 3, 'padding': 1, 'pool_kernel': 2, 'dropout_rate': 0, 'fc_hidden_dim': 256, 'lr': 0.002525767291896675, 'weight_decay': 0.00012535904388114925, 'optimizer': 'sgd', 'activation': <class 'torch.nn.modules.activation.ReLU'>, 'batchnorm': True, 'epochs': 35, 'batch_size': 128, 'flip_prob': 0.0}. Best is trial 10 with value: 2.7352241696149506.
[I 2025-08-04 14:57:55,175] Trial 18 finished with value: 2.830741946976205 and parameters: {'channels_list': [16, 32, 64, 128], 'kernel_size': 3, 'padding': 1, 'pool_kernel': 2, 'dropout_rate': 0, 'fc_hidden_dim': 256, 'lr': 0.005993736849331158, 'weight_decay': 0.005016533119475556, 'optimizer': 'adam', 'activation': <class 'torch.nn.modules.activation.LeakyReLU'>, 'batchnorm': True, 'epochs': 35, 'batch_size': 128, 'flip_prob': 0.0}. Best is trial 10 with value: 2.7352241696149506.
[I 2025-08-04 14:58:21,385] Trial 19 finished with value: 2.7833540870427225 and parameters: {'channels_list': [32, 64, 128], 'kernel_size': 5, 'padding': 1, 'pool_kernel': 2, 'dropout_rate': 0, 'fc_hidden_dim': 128, 'lr': 0.000665712897126029, 'weight_decay': 0.0007483601418475838, 'optimizer': 'rmsprop', 'activation': <class 'torch.nn.modules.activation.ReLU'>, 'batchnorm': True, 'epochs': 35, 'batch_size': 64, 'flip_prob': 0.0}. Best is trial 10 with value: 2.7352241696149506.
[I 2025-08-04 14:58:43,685] Trial 20 finished with value: 2.773461371768082 and parameters: {'channels_list': [32, 64, 128], 'kernel_size': 3, 'padding': 1, 'pool_kernel': 2, 'dropout_rate': 0, 'fc_hidden_dim': 256, 'lr': 0.002411552465897063, 'weight_decay': 0.00021709787903723506, 'optimizer': 'sgd', 'activation': <class 'torch.nn.modules.activation.ReLU'>, 'batchnorm': True, 'epochs': 35, 'batch_size': 128, 'flip_prob': 0.0}. Best is trial 10 with value: 2.7352241696149506.
[I 2025-08-04 14:59:06,359] Trial 21 finished with value: 2.8211147772532463 and parameters: {'channels_list': [32, 64, 128], 'kernel_size': 3, 'padding': 1, 'pool_kernel': 2, 'dropout_rate': 0, 'fc_hidden_dim': 256, 'lr': 0.0025365155900192804, 'weight_decay': 8.195861575036129e-05, 'optimizer': 'sgd', 'activation': <class 'torch.nn.modules.activation.ReLU'>, 'batchnorm': True, 'epochs': 35, 'batch_size': 128, 'flip_prob': 0.0}. Best is trial 10 with value: 2.7352241696149506.
[I 2025-08-04 14:59:20,044] Trial 22 finished with value: 2.8470138638960005 and parameters: {'channels_list': [32, 64, 128], 'kernel_size': 3, 'padding': 1, 'pool_kernel': 2, 'dropout_rate': 0, 'fc_hidden_dim': 256, 'lr': 0.0010879802518075597, 'weight_decay': 0.00013676950987957865, 'optimizer': 'sgd', 'activation': <class 'torch.nn.modules.activation.ReLU'>, 'batchnorm': True, 'epochs': 35, 'batch_size': 128, 'flip_prob': 0.0}. Best is trial 10 with value: 2.7352241696149506.
[I 2025-08-04 14:59:43,550] Trial 23 finished with value: 2.768442457748984 and parameters: {'channels_list': [32, 64, 128], 'kernel_size': 3, 'padding': 1, 'pool_kernel': 2, 'dropout_rate': 0, 'fc_hidden_dim': 256, 'lr': 0.003129435695453633, 'weight_decay': 2.47869623036146e-05, 'optimizer': 'sgd', 'activation': <class 'torch.nn.modules.activation.ReLU'>, 'batchnorm': True, 'epochs': 35, 'batch_size': 128, 'flip_prob': 0.0}. Best is trial 10 with value: 2.7352241696149506.
[I 2025-08-04 15:00:13,116] Trial 24 finished with value: 2.784127642536048 and parameters: {'channels_list': [32, 64, 128], 'kernel_size': 3, 'padding': 1, 'pool_kernel': 2, 'dropout_rate': 0, 'fc_hidden_dim': 256, 'lr': 0.006267782788412009, 'weight_decay': 6.505684312169885e-05, 'optimizer': 'sgd', 'activation': <class 'torch.nn.modules.activation.ReLU'>, 'batchnorm': True, 'epochs': 35, 'batch_size': 128, 'flip_prob': 0.0}. Best is trial 10 with value: 2.7352241696149506.
[I 2025-08-04 15:00:32,232] Trial 25 finished with value: 2.8053722091118014 and parameters: {'channels_list': [32, 64, 128], 'kernel_size': 3, 'padding': 1, 'pool_kernel': 2, 'dropout_rate': 0, 'fc_hidden_dim': 256, 'lr': 0.0019896896389613446, 'weight_decay': 0.0028265433537871657, 'optimizer': 'sgd', 'activation': <class 'torch.nn.modules.activation.ReLU'>, 'batchnorm': True, 'epochs': 35, 'batch_size': 128, 'flip_prob': 0.0}. Best is trial 10 with value: 2.7352241696149506.
[I 2025-08-04 15:00:32,245] Trial 26 pruned. 
[I 2025-08-04 15:00:42,868] Trial 27 finished with value: 3.2296204701551336 and parameters: {'channels_list': [32, 64], 'kernel_size': 3, 'padding': 1, 'pool_kernel': 2, 'dropout_rate': 0, 'fc_hidden_dim': 256, 'lr': 0.0010076459400208695, 'weight_decay': 0.0009604588537965269, 'optimizer': 'sgd', 'activation': <class 'torch.nn.modules.activation.ReLU'>, 'batchnorm': True, 'epochs': 35, 'batch_size': 128, 'flip_prob': 0.0}. Best is trial 10 with value: 2.7352241696149506.
[I 2025-08-04 15:00:42,884] Trial 28 pruned. 
[I 2025-08-04 15:00:42,914] Trial 29 pruned. 
[I 2025-08-04 15:01:09,208] Trial 30 finished with value: 2.7823352286841527 and parameters: {'channels_list': [32, 64, 128], 'kernel_size': 5, 'padding': 1, 'pool_kernel': 2, 'dropout_rate': 0, 'fc_hidden_dim': 128, 'lr': 0.007198213448662682, 'weight_decay': 0.00011903372268810666, 'optimizer': 'adam', 'activation': <class 'torch.nn.modules.activation.ReLU'>, 'batchnorm': True, 'epochs': 35, 'batch_size': 128, 'flip_prob': 0.0}. Best is trial 10 with value: 2.7352241696149506.
[I 2025-08-04 15:01:23,473] Trial 31 finished with value: 2.7955065164692585 and parameters: {'channels_list': [32, 64, 128], 'kernel_size': 3, 'padding': 1, 'pool_kernel': 2, 'dropout_rate': 0, 'fc_hidden_dim': 256, 'lr': 0.00419401284087269, 'weight_decay': 0.0019544605141003186, 'optimizer': 'sgd', 'activation': <class 'torch.nn.modules.activation.ReLU'>, 'batchnorm': True, 'epochs': 35, 'batch_size': 128, 'flip_prob': 0.0}. Best is trial 10 with value: 2.7352241696149506.
[I 2025-08-04 15:01:51,911] Trial 32 finished with value: 2.743182517478492 and parameters: {'channels_list': [32, 64, 128], 'kernel_size': 3, 'padding': 1, 'pool_kernel': 2, 'dropout_rate': 0, 'fc_hidden_dim': 256, 'lr': 0.0036092007353149672, 'weight_decay': 0.008432381840632951, 'optimizer': 'sgd', 'activation': <class 'torch.nn.modules.activation.ReLU'>, 'batchnorm': True, 'epochs': 35, 'batch_size': 128, 'flip_prob': 0.0}. Best is trial 10 with value: 2.7352241696149506.
[I 2025-08-04 15:02:07,575] Trial 33 finished with value: 2.791947066913324 and parameters: {'channels_list': [32, 64, 128], 'kernel_size': 3, 'padding': 1, 'pool_kernel': 2, 'dropout_rate': 0, 'fc_hidden_dim': 256, 'lr': 0.0033507180937837225, 'weight_decay': 0.008344022628120241, 'optimizer': 'sgd', 'activation': <class 'torch.nn.modules.activation.ReLU'>, 'batchnorm': True, 'epochs': 35, 'batch_size': 128, 'flip_prob': 0.0}. Best is trial 10 with value: 2.7352241696149506.
[I 2025-08-04 15:02:21,264] Trial 34 finished with value: 2.8760558738639475 and parameters: {'channels_list': [32, 64, 128], 'kernel_size': 3, 'padding': 0, 'pool_kernel': 2, 'dropout_rate': 0, 'fc_hidden_dim': 256, 'lr': 0.005139585701364914, 'weight_decay': 0.003517958019929365, 'optimizer': 'sgd', 'activation': <class 'torch.nn.modules.activation.ReLU'>, 'batchnorm': True, 'epochs': 35, 'batch_size': 128, 'flip_prob': 0.0}. Best is trial 10 with value: 2.7352241696149506.
[I 2025-08-04 15:02:46,142] Trial 35 finished with value: 2.7561379921594487 and parameters: {'channels_list': [16, 32, 64, 128], 'kernel_size': 3, 'padding': 1, 'pool_kernel': 2, 'dropout_rate': 0, 'fc_hidden_dim': 256, 'lr': 0.0020437835557361216, 'weight_decay': 0.0004920784388193091, 'optimizer': 'sgd', 'activation': <class 'torch.nn.modules.activation.ReLU'>, 'batchnorm': True, 'epochs': 35, 'batch_size': 128, 'flip_prob': 0.0}. Best is trial 10 with value: 2.7352241696149506.
[I 2025-08-04 15:03:49,877] Trial 36 finished with value: 2.787623039344539 and parameters: {'channels_list': [16, 32, 64, 128], 'kernel_size': 3, 'padding': 1, 'pool_kernel': 2, 'dropout_rate': 0, 'fc_hidden_dim': 64, 'lr': 0.0017084048075038975, 'weight_decay': 0.0012614958561672537, 'optimizer': 'sgd', 'activation': <class 'torch.nn.modules.activation.ReLU'>, 'batchnorm': True, 'epochs': 35, 'batch_size': 32, 'flip_prob': 0.0}. Best is trial 10 with value: 2.7352241696149506.
[I 2025-08-04 15:03:49,893] Trial 37 pruned. 
[I 2025-08-04 15:03:49,917] Trial 38 pruned. 
[I 2025-08-04 15:03:49,939] Trial 39 pruned. 
[I 2025-08-04 15:04:47,770] Trial 40 finished with value: 2.7809614007234287 and parameters: {'channels_list': [32, 64], 'kernel_size': 3, 'padding': 1, 'pool_kernel': 3, 'dropout_rate': 0, 'fc_hidden_dim': 64, 'lr': 0.004301668479066713, 'weight_decay': 0.0006338624303590061, 'optimizer': 'adam', 'activation': <class 'torch.nn.modules.activation.LeakyReLU'>, 'batchnorm': True, 'epochs': 35, 'batch_size': 32, 'flip_prob': 0.0}. Best is trial 10 with value: 2.7352241696149506.
[I 2025-08-04 15:05:08,297] Trial 41 finished with value: 2.742725376743459 and parameters: {'channels_list': [16, 32, 64], 'kernel_size': 3, 'padding': 1, 'pool_kernel': 2, 'dropout_rate': 0, 'fc_hidden_dim': 256, 'lr': 0.0028962227537952783, 'weight_decay': 0.009927515113309894, 'optimizer': 'sgd', 'activation': <class 'torch.nn.modules.activation.ReLU'>, 'batchnorm': True, 'epochs': 35, 'batch_size': 128, 'flip_prob': 0.0}. Best is trial 10 with value: 2.7352241696149506.
[I 2025-08-04 15:05:27,779] Trial 42 finished with value: 2.7938474459009663 and parameters: {'channels_list': [16, 32, 64], 'kernel_size': 3, 'padding': 1, 'pool_kernel': 2, 'dropout_rate': 0, 'fc_hidden_dim': 256, 'lr': 0.0021683126935089134, 'weight_decay': 0.009965915858937097, 'optimizer': 'sgd', 'activation': <class 'torch.nn.modules.activation.ReLU'>, 'batchnorm': True, 'epochs': 35, 'batch_size': 128, 'flip_prob': 0.0}. Best is trial 10 with value: 2.7352241696149506.
[I 2025-08-04 15:05:46,138] Trial 43 finished with value: 2.76724584836005 and parameters: {'channels_list': [16, 32, 64], 'kernel_size': 3, 'padding': 1, 'pool_kernel': 2, 'dropout_rate': 0, 'fc_hidden_dim': 256, 'lr': 0.0029750665031053466, 'weight_decay': 0.005706711653871381, 'optimizer': 'sgd', 'activation': <class 'torch.nn.modules.activation.ReLU'>, 'batchnorm': True, 'epochs': 35, 'batch_size': 128, 'flip_prob': 0.0}. Best is trial 10 with value: 2.7352241696149506.
[I 2025-08-04 15:05:46,154] Trial 44 pruned. 
[I 2025-08-04 15:06:20,031] Trial 45 finished with value: 2.7516397463541984 and parameters: {'channels_list': [16, 32, 64], 'kernel_size': 3, 'padding': 1, 'pool_kernel': 2, 'dropout_rate': 0, 'fc_hidden_dim': 256, 'lr': 0.0007537832752164749, 'weight_decay': 0.0013824147680590439, 'optimizer': 'sgd', 'activation': <class 'torch.nn.modules.activation.ReLU'>, 'batchnorm': True, 'epochs': 35, 'batch_size': 64, 'flip_prob': 0.0}. Best is trial 10 with value: 2.7352241696149506.
[I 2025-08-04 15:06:20,046] Trial 46 pruned. 
[I 2025-08-04 15:07:06,681] Trial 47 finished with value: 2.711872135169256 and parameters: {'channels_list': [16, 32, 64], 'kernel_size': 3, 'padding': 1, 'pool_kernel': 2, 'dropout_rate': 0, 'fc_hidden_dim': 256, 'lr': 0.0007555532134517655, 'weight_decay': 0.0036263521640727014, 'optimizer': 'rmsprop', 'activation': <class 'torch.nn.modules.activation.ReLU'>, 'batchnorm': True, 'epochs': 35, 'batch_size': 64, 'flip_prob': 0.0}. Best is trial 47 with value: 2.711872135169256.
[I 2025-08-04 15:07:47,507] Trial 48 finished with value: 2.7977044295344338 and parameters: {'channels_list': [16, 32, 64], 'kernel_size': 3, 'padding': 1, 'pool_kernel': 2, 'dropout_rate': 0, 'fc_hidden_dim': 64, 'lr': 0.0004842861968118399, 'weight_decay': 0.006568897688719091, 'optimizer': 'rmsprop', 'activation': <class 'torch.nn.modules.activation.LeakyReLU'>, 'batchnorm': True, 'epochs': 35, 'batch_size': 64, 'flip_prob': 0.0}. Best is trial 47 with value: 2.711872135169256.
[I 2025-08-04 15:07:47,523] Trial 49 pruned. 
[I 2025-08-04 15:08:39,907] Trial 50 finished with value: 2.814596409561838 and parameters: {'channels_list': [16, 32, 64], 'kernel_size': 3, 'padding': 0, 'pool_kernel': 2, 'dropout_rate': 0, 'fc_hidden_dim': 256, 'lr': 0.0007356740104787345, 'weight_decay': 0.0068997249067940785, 'optimizer': 'rmsprop', 'activation': <class 'torch.nn.modules.activation.ReLU'>, 'batchnorm': True, 'epochs': 35, 'batch_size': 64, 'flip_prob': 0.0}. Best is trial 47 with value: 2.711872135169256.
[I 2025-08-04 15:09:01,290] Trial 51 finished with value: 2.8881932532399066 and parameters: {'channels_list': [16, 32, 64], 'kernel_size': 3, 'padding': 1, 'pool_kernel': 2, 'dropout_rate': 0, 'fc_hidden_dim': 256, 'lr': 0.0009287909989539255, 'weight_decay': 0.0040719404252919445, 'optimizer': 'rmsprop', 'activation': <class 'torch.nn.modules.activation.ReLU'>, 'batchnorm': True, 'epochs': 35, 'batch_size': 64, 'flip_prob': 0.0}. Best is trial 47 with value: 2.711872135169256.
[I 2025-08-04 15:09:36,512] Trial 52 finished with value: 2.7713777121071073 and parameters: {'channels_list': [16, 32, 64], 'kernel_size': 3, 'padding': 1, 'pool_kernel': 2, 'dropout_rate': 0, 'fc_hidden_dim': 256, 'lr': 0.000571577133184006, 'weight_decay': 0.0014464251467907186, 'optimizer': 'sgd', 'activation': <class 'torch.nn.modules.activation.ReLU'>, 'batchnorm': True, 'epochs': 35, 'batch_size': 64, 'flip_prob': 0.0}. Best is trial 47 with value: 2.711872135169256.
[I 2025-08-04 15:09:50,781] Trial 53 finished with value: 2.898560727893659 and parameters: {'channels_list': [16, 32, 64], 'kernel_size': 3, 'padding': 1, 'pool_kernel': 2, 'dropout_rate': 0, 'fc_hidden_dim': 256, 'lr': 0.0003227231078830963, 'weight_decay': 0.00304655151976784, 'optimizer': 'rmsprop', 'activation': <class 'torch.nn.modules.activation.ReLU'>, 'batchnorm': True, 'epochs': 35, 'batch_size': 64, 'flip_prob': 0.0}. Best is trial 47 with value: 2.711872135169256.
[I 2025-08-04 15:10:23,471] Trial 54 finished with value: 2.7562912278353666 and parameters: {'channels_list': [16, 32, 64], 'kernel_size': 3, 'padding': 1, 'pool_kernel': 2, 'dropout_rate': 0, 'fc_hidden_dim': 256, 'lr': 0.0011566670633257432, 'weight_decay': 0.009964214529280514, 'optimizer': 'sgd', 'activation': <class 'torch.nn.modules.activation.ReLU'>, 'batchnorm': True, 'epochs': 35, 'batch_size': 64, 'flip_prob': 0.0}. Best is trial 47 with value: 2.711872135169256.
