[I 2025-06-30 22:54:09,667] Trial 115 finished with value: 16.028940624175956 and parameters: {'kernel_size': 3, 'channel_list': [16, 32, 64, 128], 'padding': 1, 'pool_kernel': 2, 'dropout_rate': 0.1, 'fc_hidden_dim': 64, 'lr': 0.0028051236816597027, 'weight_decay': 4.411331553078307e-06, 'optimizer': 'adam', 'activation': <class 'torch.nn.modules.activation.LeakyReLU'>, 'batchnorm': True, 'epochs': 20, 'batch_size': 64, 'flip_prob': 0.0}. Best is trial 86 with value: 15.539556323098529.
[I 2025-06-30 22:54:59,433] Trial 116 finished with value: 15.881884848927314 and parameters: {'kernel_size': 3, 'channel_list': [16, 32, 64, 128], 'padding': 1, 'pool_kernel': 2, 'dropout_rate': 0.1, 'fc_hidden_dim': 64, 'lr': 0.0026943995286912935, 'weight_decay': 2.4463707043064362e-06, 'optimizer': 'adam', 'activation': <class 'torch.nn.modules.activation.LeakyReLU'>, 'batchnorm': True, 'epochs': 20, 'batch_size': 64, 'flip_prob': 0.0}. Best is trial 86 with value: 15.539556323098529.
[I 2025-06-30 22:55:40,189] Trial 117 finished with value: 16.114962422875028 and parameters: {'kernel_size': 3, 'channel_list': [16, 32, 64], 'padding': 1, 'pool_kernel': 2, 'dropout_rate': 0.1, 'fc_hidden_dim': 64, 'lr': 0.0017960145593530004, 'weight_decay': 8.996834228842423e-06, 'optimizer': 'adam', 'activation': <class 'torch.nn.modules.activation.LeakyReLU'>, 'batchnorm': True, 'epochs': 20, 'batch_size': 64, 'flip_prob': 0.0}. Best is trial 86 with value: 15.539556323098529.
[I 2025-06-30 22:56:43,630] Trial 118 finished with value: 16.046670612847738 and parameters: {'kernel_size': 3, 'channel_list': [32, 64, 128], 'padding': 1, 'pool_kernel': 2, 'dropout_rate': 0.1, 'fc_hidden_dim': 64, 'lr': 0.0022087812292387876, 'weight_decay': 1.564615162964608e-05, 'optimizer': 'adam', 'activation': <class 'torch.nn.modules.activation.LeakyReLU'>, 'batchnorm': True, 'epochs': 20, 'batch_size': 64, 'flip_prob': 0.0}. Best is trial 86 with value: 15.539556323098529.
[I 2025-06-30 22:56:43,650] Trial 119 pruned. 
[I 2025-06-30 22:56:43,671] Trial 120 pruned. 
[I 2025-06-30 22:57:31,887] Trial 121 finished with value: 15.493945159799877 and parameters: {'kernel_size': 3, 'channel_list': [16, 32, 64, 128], 'padding': 1, 'pool_kernel': 2, 'dropout_rate': 0.1, 'fc_hidden_dim': 64, 'lr': 0.002991075183277198, 'weight_decay': 1.8660900908876813e-06, 'optimizer': 'adam', 'activation': <class 'torch.nn.modules.activation.LeakyReLU'>, 'batchnorm': True, 'epochs': 20, 'batch_size': 64, 'flip_prob': 0.0}. Best is trial 121 with value: 15.493945159799877.
[I 2025-06-30 22:58:21,461] Trial 122 finished with value: 15.87317242985576 and parameters: {'kernel_size': 3, 'channel_list': [16, 32, 64, 128], 'padding': 1, 'pool_kernel': 2, 'dropout_rate': 0.1, 'fc_hidden_dim': 64, 'lr': 0.0029146987506043307, 'weight_decay': 1.9689323119477853e-06, 'optimizer': 'adam', 'activation': <class 'torch.nn.modules.activation.LeakyReLU'>, 'batchnorm': True, 'epochs': 20, 'batch_size': 64, 'flip_prob': 0.0}. Best is trial 121 with value: 15.493945159799877.
[I 2025-06-30 22:59:10,905] Trial 123 finished with value: 16.025032551314325 and parameters: {'kernel_size': 3, 'channel_list': [16, 32, 64, 128], 'padding': 1, 'pool_kernel': 2, 'dropout_rate': 0.1, 'fc_hidden_dim': 64, 'lr': 0.0030582917739227196, 'weight_decay': 1.3507887338779087e-06, 'optimizer': 'adam', 'activation': <class 'torch.nn.modules.activation.LeakyReLU'>, 'batchnorm': True, 'epochs': 20, 'batch_size': 64, 'flip_prob': 0.0}. Best is trial 121 with value: 15.493945159799877.
[I 2025-06-30 23:00:00,070] Trial 124 finished with value: 15.873415013862303 and parameters: {'kernel_size': 3, 'channel_list': [16, 32, 64, 128], 'padding': 1, 'pool_kernel': 2, 'dropout_rate': 0.1, 'fc_hidden_dim': 64, 'lr': 0.0023339517298107816, 'weight_decay': 3.2508309794870474e-06, 'optimizer': 'adam', 'activation': <class 'torch.nn.modules.activation.LeakyReLU'>, 'batchnorm': True, 'epochs': 20, 'batch_size': 64, 'flip_prob': 0.0}. Best is trial 121 with value: 15.493945159799877.
[I 2025-06-30 23:00:48,775] Trial 125 finished with value: 15.805822115857914 and parameters: {'kernel_size': 3, 'channel_list': [16, 32, 64, 128], 'padding': 1, 'pool_kernel': 2, 'dropout_rate': 0.1, 'fc_hidden_dim': 64, 'lr': 0.0031913220435543137, 'weight_decay': 8.194913523721086e-05, 'optimizer': 'adam', 'activation': <class 'torch.nn.modules.activation.LeakyReLU'>, 'batchnorm': True, 'epochs': 20, 'batch_size': 64, 'flip_prob': 0.0}. Best is trial 121 with value: 15.493945159799877.
[I 2025-06-30 23:00:48,794] Trial 126 pruned. 
[I 2025-06-30 23:01:45,181] Trial 127 finished with value: 15.796618158578015 and parameters: {'kernel_size': 3, 'channel_list': [16, 32, 64, 128], 'padding': 1, 'pool_kernel': 2, 'dropout_rate': 0.1, 'fc_hidden_dim': 256, 'lr': 0.0045853366030882085, 'weight_decay': 1.638646167248621e-06, 'optimizer': 'adam', 'activation': <class 'torch.nn.modules.activation.LeakyReLU'>, 'batchnorm': True, 'epochs': 15, 'batch_size': 32, 'flip_prob': 0.0}. Best is trial 121 with value: 15.493945159799877.
[I 2025-06-30 23:02:34,610] Trial 128 finished with value: 16.287088734607128 and parameters: {'kernel_size': 3, 'channel_list': [16, 32, 64, 128], 'padding': 1, 'pool_kernel': 2, 'dropout_rate': 0.1, 'fc_hidden_dim': 64, 'lr': 0.0008658733301694534, 'weight_decay': 2.2629893733342672e-06, 'optimizer': 'adam', 'activation': <class 'torch.nn.modules.activation.ReLU'>, 'batchnorm': True, 'epochs': 20, 'batch_size': 64, 'flip_prob': 0.0}. Best is trial 121 with value: 15.493945159799877.
[I 2025-06-30 23:03:05,195] Trial 129 finished with value: 15.945731927149044 and parameters: {'kernel_size': 3, 'channel_list': [16, 32, 64, 128], 'padding': 1, 'pool_kernel': 2, 'dropout_rate': 0.1, 'fc_hidden_dim': 64, 'lr': 0.0016072003826978908, 'weight_decay': 4.947047500209764e-06, 'optimizer': 'adam', 'activation': <class 'torch.nn.modules.activation.LeakyReLU'>, 'batchnorm': True, 'epochs': 12, 'batch_size': 64, 'flip_prob': 0.0}. Best is trial 121 with value: 15.493945159799877.
[I 2025-06-30 23:03:51,128] Trial 130 finished with value: 16.486674006369505 and parameters: {'kernel_size': 3, 'channel_list': [16, 32, 64, 128], 'padding': 1, 'pool_kernel': 2, 'dropout_rate': 0.1, 'fc_hidden_dim': 64, 'lr': 0.0038400945854076655, 'weight_decay': 0.003761942059506557, 'optimizer': 'sgd', 'activation': <class 'torch.nn.modules.activation.LeakyReLU'>, 'batchnorm': True, 'epochs': 20, 'batch_size': 64, 'flip_prob': 0.0}. Best is trial 121 with value: 15.493945159799877.
[I 2025-06-30 23:05:04,065] Trial 131 finished with value: 15.77054924916582 and parameters: {'kernel_size': 3, 'channel_list': [16, 32, 64, 128], 'padding': 1, 'pool_kernel': 2, 'dropout_rate': 0.5, 'fc_hidden_dim': 128, 'lr': 0.007637887810409662, 'weight_decay': 1.8870266528874623e-06, 'optimizer': 'adam', 'activation': <class 'torch.nn.modules.activation.LeakyReLU'>, 'batchnorm': True, 'epochs': 30, 'batch_size': 64, 'flip_prob': 0.0}. Best is trial 121 with value: 15.493945159799877.
[I 2025-06-30 23:05:52,971] Trial 132 finished with value: 15.937781443039395 and parameters: {'kernel_size': 3, 'channel_list': [16, 32, 64, 128], 'padding': 1, 'pool_kernel': 2, 'dropout_rate': 0.1, 'fc_hidden_dim': 128, 'lr': 0.0025430031371641393, 'weight_decay': 2.785682813411008e-06, 'optimizer': 'adam', 'activation': <class 'torch.nn.modules.activation.LeakyReLU'>, 'batchnorm': True, 'epochs': 20, 'batch_size': 64, 'flip_prob': 0.0}. Best is trial 121 with value: 15.493945159799877.
[I 2025-06-30 23:06:54,069] Trial 133 finished with value: 15.860469458344015 and parameters: {'kernel_size': 3, 'channel_list': [16, 32, 64, 128], 'padding': 1, 'pool_kernel': 2, 'dropout_rate': 0, 'fc_hidden_dim': 128, 'lr': 0.0062279127958481065, 'weight_decay': 3.7791952646593626e-06, 'optimizer': 'adam', 'activation': <class 'torch.nn.modules.activation.LeakyReLU'>, 'batchnorm': True, 'epochs': 25, 'batch_size': 64, 'flip_prob': 0.0}. Best is trial 121 with value: 15.493945159799877.
[I 2025-06-30 23:07:06,703] Trial 134 finished with value: 17.42297001234181 and parameters: {'kernel_size': 3, 'channel_list': [16, 32, 64, 128], 'padding': 1, 'pool_kernel': 2, 'dropout_rate': 0.1, 'fc_hidden_dim': 128, 'lr': 0.00893222396042708, 'weight_decay': 1.5608581330035948e-06, 'optimizer': 'adam', 'activation': <class 'torch.nn.modules.activation.LeakyReLU'>, 'batchnorm': True, 'epochs': 5, 'batch_size': 64, 'flip_prob': 0.0}. Best is trial 121 with value: 15.493945159799877.
[I 2025-06-30 23:08:23,726] Trial 135 finished with value: 16.344645142594207 and parameters: {'kernel_size': 3, 'channel_list': [16, 32, 64, 128], 'padding': 1, 'pool_kernel': 2, 'dropout_rate': 0.1, 'fc_hidden_dim': 128, 'lr': 0.005237963115004439, 'weight_decay': 2.3728212784162983e-06, 'optimizer': 'adam', 'activation': <class 'torch.nn.modules.activation.LeakyReLU'>, 'batchnorm': True, 'epochs': 30, 'batch_size': 64, 'flip_prob': 0.5}. Best is trial 121 with value: 15.493945159799877.
[I 2025-06-30 23:08:48,703] Trial 136 finished with value: 16.04984498281189 and parameters: {'kernel_size': 3, 'channel_list': [16, 32, 64, 128], 'padding': 1, 'pool_kernel': 2, 'dropout_rate': 0.1, 'fc_hidden_dim': 128, 'lr': 0.004246227025893607, 'weight_decay': 1.019710212993858e-06, 'optimizer': 'adam', 'activation': <class 'torch.nn.modules.activation.ReLU'>, 'batchnorm': True, 'epochs': 10, 'batch_size': 64, 'flip_prob': 0.0}. Best is trial 121 with value: 15.493945159799877.
[I 2025-06-30 23:08:48,726] Trial 137 pruned. 
[I 2025-06-30 23:09:50,036] Trial 138 finished with value: 16.422443638365422 and parameters: {'kernel_size': 3, 'channel_list': [16, 32, 64, 128], 'padding': 1, 'pool_kernel': 2, 'dropout_rate': 0.1, 'fc_hidden_dim': 128, 'lr': 0.005870830022895897, 'weight_decay': 3.0798702955855427e-06, 'optimizer': 'adam', 'activation': <class 'torch.nn.modules.activation.ReLU'>, 'batchnorm': False, 'epochs': 30, 'batch_size': 64, 'flip_prob': 0.0}. Best is trial 121 with value: 15.493945159799877.
[I 2025-06-30 23:10:29,199] Trial 139 finished with value: 16.641061607315947 and parameters: {'kernel_size': 3, 'channel_list': [16, 32, 64], 'padding': 0, 'pool_kernel': 2, 'dropout_rate': 0.5, 'fc_hidden_dim': 256, 'lr': 0.00820628299211745, 'weight_decay': 0.00014973594201884936, 'optimizer': 'adam', 'activation': <class 'torch.nn.modules.activation.LeakyReLU'>, 'batchnorm': True, 'epochs': 20, 'batch_size': 64, 'flip_prob': 0.25}. Best is trial 121 with value: 15.493945159799877.
[I 2025-06-30 23:11:59,246] Trial 140 finished with value: 15.90653199485487 and parameters: {'kernel_size': 3, 'channel_list': [32, 64, 128], 'padding': 1, 'pool_kernel': 2, 'dropout_rate': 0.1, 'fc_hidden_dim': 128, 'lr': 0.0033702230377489193, 'weight_decay': 5.219289322827102e-06, 'optimizer': 'adam', 'activation': <class 'torch.nn.modules.activation.LeakyReLU'>, 'batchnorm': True, 'epochs': 30, 'batch_size': 64, 'flip_prob': 0.0}. Best is trial 121 with value: 15.493945159799877.
[I 2025-06-30 23:12:48,548] Trial 141 finished with value: 16.05263654341609 and parameters: {'kernel_size': 3, 'channel_list': [16, 32, 64, 128], 'padding': 1, 'pool_kernel': 2, 'dropout_rate': 0.1, 'fc_hidden_dim': 64, 'lr': 0.0028042864666919217, 'weight_decay': 3.28869398742526e-06, 'optimizer': 'adam', 'activation': <class 'torch.nn.modules.activation.LeakyReLU'>, 'batchnorm': True, 'epochs': 20, 'batch_size': 64, 'flip_prob': 0.0}. Best is trial 121 with value: 15.493945159799877.
[I 2025-06-30 23:13:38,421] Trial 142 finished with value: 15.705954031369078 and parameters: {'kernel_size': 3, 'channel_list': [16, 32, 64, 128], 'padding': 1, 'pool_kernel': 2, 'dropout_rate': 0.1, 'fc_hidden_dim': 64, 'lr': 0.00405352744454616, 'weight_decay': 3.865074265711736e-06, 'optimizer': 'adam', 'activation': <class 'torch.nn.modules.activation.LeakyReLU'>, 'batchnorm': True, 'epochs': 20, 'batch_size': 64, 'flip_prob': 0.0}. Best is trial 121 with value: 15.493945159799877.
[I 2025-06-30 23:14:26,380] Trial 143 finished with value: 15.908071232372034 and parameters: {'kernel_size': 3, 'channel_list': [16, 32, 64, 128], 'padding': 1, 'pool_kernel': 2, 'dropout_rate': 0.1, 'fc_hidden_dim': 64, 'lr': 0.004928694565584613, 'weight_decay': 7.882427151229638e-06, 'optimizer': 'adam', 'activation': <class 'torch.nn.modules.activation.LeakyReLU'>, 'batchnorm': True, 'epochs': 20, 'batch_size': 64, 'flip_prob': 0.0}. Best is trial 121 with value: 15.493945159799877.
[I 2025-06-30 23:15:14,826] Trial 144 finished with value: 15.74364011308733 and parameters: {'kernel_size': 3, 'channel_list': [16, 32, 64, 128], 'padding': 1, 'pool_kernel': 2, 'dropout_rate': 0.1, 'fc_hidden_dim': 64, 'lr': 0.0037651547399370077, 'weight_decay': 0.00010581540669980265, 'optimizer': 'adam', 'activation': <class 'torch.nn.modules.activation.LeakyReLU'>, 'batchnorm': True, 'epochs': 20, 'batch_size': 64, 'flip_prob': 0.0}. Best is trial 121 with value: 15.493945159799877.
[I 2025-06-30 23:16:03,523] Trial 145 finished with value: 15.814669768379265 and parameters: {'kernel_size': 3, 'channel_list': [16, 32, 64, 128], 'padding': 1, 'pool_kernel': 2, 'dropout_rate': 0.1, 'fc_hidden_dim': 64, 'lr': 0.004456652421893953, 'weight_decay': 1.7260851194949997e-06, 'optimizer': 'adam', 'activation': <class 'torch.nn.modules.activation.LeakyReLU'>, 'batchnorm': True, 'epochs': 20, 'batch_size': 64, 'flip_prob': 0.0}. Best is trial 121 with value: 15.493945159799877.
[I 2025-06-30 23:16:03,544] Trial 146 pruned. 
[I 2025-06-30 23:16:03,568] Trial 147 pruned. 
[I 2025-06-30 23:16:52,182] Trial 148 finished with value: 15.673532310752707 and parameters: {'kernel_size': 3, 'channel_list': [16, 32, 64, 128], 'padding': 1, 'pool_kernel': 2, 'dropout_rate': 0.1, 'fc_hidden_dim': 128, 'lr': 0.0030936539807555528, 'weight_decay': 2.5841632742513152e-06, 'optimizer': 'adam', 'activation': <class 'torch.nn.modules.activation.LeakyReLU'>, 'batchnorm': True, 'epochs': 20, 'batch_size': 64, 'flip_prob': 0.0}. Best is trial 121 with value: 15.493945159799877.
[I 2025-06-30 23:17:53,077] Trial 149 finished with value: 29.241728800891778 and parameters: {'kernel_size': 3, 'channel_list': [16, 32, 64, 128], 'padding': 1, 'pool_kernel': 2, 'dropout_rate': 0.1, 'fc_hidden_dim': 128, 'lr': 0.0019614141067128446, 'weight_decay': 2.677994158360291e-06, 'optimizer': 'adam', 'activation': <class 'torch.nn.modules.activation.ReLU'>, 'batchnorm': True, 'epochs': 15, 'batch_size': 32, 'flip_prob': 1}. Best is trial 121 with value: 15.493945159799877.
[I 2025-06-30 23:19:14,234] Trial 150 finished with value: 16.470524930688985 and parameters: {'kernel_size': 3, 'channel_list': [16, 32, 64, 128], 'padding': 1, 'pool_kernel': 2, 'dropout_rate': 0.1, 'fc_hidden_dim': 128, 'lr': 0.003060256988259732, 'weight_decay': 1.298342274580657e-06, 'optimizer': 'adam', 'activation': <class 'torch.nn.modules.activation.LeakyReLU'>, 'batchnorm': True, 'epochs': 30, 'batch_size': 64, 'flip_prob': 0.75}. Best is trial 121 with value: 15.493945159799877.
[I 2025-06-30 23:20:04,856] Trial 151 finished with value: 15.839675320328821 and parameters: {'kernel_size': 3, 'channel_list': [16, 32, 64, 128], 'padding': 1, 'pool_kernel': 2, 'dropout_rate': 0.1, 'fc_hidden_dim': 128, 'lr': 0.0032975298948770843, 'weight_decay': 3.6880261242229247e-06, 'optimizer': 'adam', 'activation': <class 'torch.nn.modules.activation.LeakyReLU'>, 'batchnorm': True, 'epochs': 20, 'batch_size': 64, 'flip_prob': 0.0}. Best is trial 121 with value: 15.493945159799877.
[I 2025-06-30 23:20:54,383] Trial 152 finished with value: 15.735727173941475 and parameters: {'kernel_size': 3, 'channel_list': [16, 32, 64, 128], 'padding': 1, 'pool_kernel': 2, 'dropout_rate': 0.1, 'fc_hidden_dim': 128, 'lr': 0.002283545365820527, 'weight_decay': 4.23952691472491e-06, 'optimizer': 'adam', 'activation': <class 'torch.nn.modules.activation.LeakyReLU'>, 'batchnorm': True, 'epochs': 20, 'batch_size': 64, 'flip_prob': 0.0}. Best is trial 121 with value: 15.493945159799877.
[I 2025-06-30 23:21:43,489] Trial 153 finished with value: 16.07980157784209 and parameters: {'kernel_size': 3, 'channel_list': [16, 32, 64, 128], 'padding': 1, 'pool_kernel': 2, 'dropout_rate': 0.1, 'fc_hidden_dim': 128, 'lr': 0.0029219999479817155, 'weight_decay': 2.3671851870504545e-06, 'optimizer': 'adam', 'activation': <class 'torch.nn.modules.activation.LeakyReLU'>, 'batchnorm': True, 'epochs': 20, 'batch_size': 64, 'flip_prob': 0.0}. Best is trial 121 with value: 15.493945159799877.
[I 2025-06-30 23:22:32,184] Trial 154 finished with value: 15.848060926840796 and parameters: {'kernel_size': 3, 'channel_list': [16, 32, 64, 128], 'padding': 1, 'pool_kernel': 2, 'dropout_rate': 0.1, 'fc_hidden_dim': 128, 'lr': 0.003772456647661527, 'weight_decay': 6.906990133965495e-06, 'optimizer': 'adam', 'activation': <class 'torch.nn.modules.activation.LeakyReLU'>, 'batchnorm': True, 'epochs': 20, 'batch_size': 64, 'flip_prob': 0.0}. Best is trial 121 with value: 15.493945159799877.
[I 2025-06-30 23:23:21,827] Trial 155 finished with value: 15.979219384269802 and parameters: {'kernel_size': 3, 'channel_list': [16, 32, 64, 128], 'padding': 1, 'pool_kernel': 2, 'dropout_rate': 0.1, 'fc_hidden_dim': 64, 'lr': 0.0075788971590496235, 'weight_decay': 5.063832886976742e-06, 'optimizer': 'adam', 'activation': <class 'torch.nn.modules.activation.LeakyReLU'>, 'batchnorm': True, 'epochs': 20, 'batch_size': 64, 'flip_prob': 0.0}. Best is trial 121 with value: 15.493945159799877.
[I 2025-06-30 23:24:12,026] Trial 156 finished with value: 15.882590826058863 and parameters: {'kernel_size': 3, 'channel_list': [16, 32, 64, 128], 'padding': 1, 'pool_kernel': 2, 'dropout_rate': 0.5, 'fc_hidden_dim': 128, 'lr': 0.005650868846518885, 'weight_decay': 2.9351455240952874e-06, 'optimizer': 'adam', 'activation': <class 'torch.nn.modules.activation.LeakyReLU'>, 'batchnorm': True, 'epochs': 20, 'batch_size': 64, 'flip_prob': 0.0}. Best is trial 121 with value: 15.493945159799877.
[I 2025-06-30 23:24:40,334] Trial 157 finished with value: 16.328957285511606 and parameters: {'kernel_size': 3, 'channel_list': [16, 32, 64, 128], 'padding': 1, 'pool_kernel': 2, 'dropout_rate': 0.1, 'fc_hidden_dim': 128, 'lr': 0.0034909456095569514, 'weight_decay': 1.765361498616334e-06, 'optimizer': 'sgd', 'activation': <class 'torch.nn.modules.activation.ReLU'>, 'batchnorm': True, 'epochs': 12, 'batch_size': 64, 'flip_prob': 0.0}. Best is trial 121 with value: 15.493945159799877.
[I 2025-06-30 23:25:29,767] Trial 158 finished with value: 16.113201109557885 and parameters: {'kernel_size': 3, 'channel_list': [16, 32, 64, 128], 'padding': 1, 'pool_kernel': 2, 'dropout_rate': 0.1, 'fc_hidden_dim': 64, 'lr': 0.00940666325491025, 'weight_decay': 3.7114739741088444e-06, 'optimizer': 'adam', 'activation': <class 'torch.nn.modules.activation.LeakyReLU'>, 'batchnorm': True, 'epochs': 20, 'batch_size': 64, 'flip_prob': 0.0}. Best is trial 121 with value: 15.493945159799877.
[I 2025-06-30 23:26:45,340] Trial 159 finished with value: 15.52129960629082 and parameters: {'kernel_size': 3, 'channel_list': [16, 32, 64, 128], 'padding': 1, 'pool_kernel': 2, 'dropout_rate': 0, 'fc_hidden_dim': 128, 'lr': 0.004150230984782345, 'weight_decay': 2.107222499996181e-06, 'optimizer': 'adam', 'activation': <class 'torch.nn.modules.activation.LeakyReLU'>, 'batchnorm': True, 'epochs': 30, 'batch_size': 64, 'flip_prob': 0.0}. Best is trial 121 with value: 15.493945159799877.
[I 2025-06-30 23:26:45,363] Trial 160 pruned. 
[I 2025-06-30 23:27:59,338] Trial 161 finished with value: 15.987687600987844 and parameters: {'kernel_size': 3, 'channel_list': [16, 32, 64, 128], 'padding': 1, 'pool_kernel': 2, 'dropout_rate': 0, 'fc_hidden_dim': 128, 'lr': 0.0041075773210143204, 'weight_decay': 2.045533327298634e-06, 'optimizer': 'adam', 'activation': <class 'torch.nn.modules.activation.LeakyReLU'>, 'batchnorm': True, 'epochs': 30, 'batch_size': 64, 'flip_prob': 0.0}. Best is trial 121 with value: 15.493945159799877.
[I 2025-06-30 23:29:13,572] Trial 162 finished with value: 16.072634592209038 and parameters: {'kernel_size': 3, 'channel_list': [16, 32, 64, 128], 'padding': 1, 'pool_kernel': 2, 'dropout_rate': 0, 'fc_hidden_dim': 128, 'lr': 0.004976931244206119, 'weight_decay': 2.883690873317325e-06, 'optimizer': 'adam', 'activation': <class 'torch.nn.modules.activation.LeakyReLU'>, 'batchnorm': True, 'epochs': 30, 'batch_size': 64, 'flip_prob': 0.0}. Best is trial 121 with value: 15.493945159799877.
[I 2025-06-30 23:30:26,727] Trial 163 finished with value: 15.812187449220506 and parameters: {'kernel_size': 3, 'channel_list': [16, 32, 64, 128], 'padding': 1, 'pool_kernel': 2, 'dropout_rate': 0, 'fc_hidden_dim': 128, 'lr': 0.0031797414845818823, 'weight_decay': 2.4488611063866004e-06, 'optimizer': 'adam', 'activation': <class 'torch.nn.modules.activation.LeakyReLU'>, 'batchnorm': True, 'epochs': 30, 'batch_size': 64, 'flip_prob': 0.0}. Best is trial 121 with value: 15.493945159799877.
[I 2025-06-30 23:31:40,018] Trial 164 finished with value: 15.884405911144146 and parameters: {'kernel_size': 3, 'channel_list': [16, 32, 64, 128], 'padding': 1, 'pool_kernel': 2, 'dropout_rate': 0, 'fc_hidden_dim': 128, 'lr': 0.004494932597800417, 'weight_decay': 4.241485212473793e-06, 'optimizer': 'adam', 'activation': <class 'torch.nn.modules.activation.LeakyReLU'>, 'batchnorm': True, 'epochs': 30, 'batch_size': 64, 'flip_prob': 0.0}. Best is trial 121 with value: 15.493945159799877.
