[I 2025-08-05 04:01:27,819] Trial 148 finished with value: 2.74311336723254 and parameters: {'patch_size': 6, 'emb_dim': 256, 'depth': 2, 'n_heads': 2, 'mlp_dim': 512, 'dropout_rate': 0, 'lr': 0.0025721392291158077, 'weight_decay': 0.001327744227227041, 'optimizer': 'sgd', 'activation': <class 'torch.nn.modules.activation.ReLU'>, 'epochs': 100, 'batch_size': 32, 'flip_prob': 0.0}. Best is trial 102 with value: 2.7074620693814193.
[I 2025-08-05 04:02:51,133] Trial 149 finished with value: 2.7383390514065473 and parameters: {'patch_size': 6, 'emb_dim': 256, 'depth': 2, 'n_heads': 2, 'mlp_dim': 128, 'dropout_rate': 0, 'lr': 0.006022631975943547, 'weight_decay': 0.0002540591426615044, 'optimizer': 'sgd', 'activation': <class 'torch.nn.modules.activation.ReLU'>, 'epochs': 100, 'batch_size': 64, 'flip_prob': 0.0}. Best is trial 102 with value: 2.7074620693814193.
[I 2025-08-05 04:05:08,572] Trial 150 finished with value: 2.766737832148774 and parameters: {'patch_size': 6, 'emb_dim': 256, 'depth': 2, 'n_heads': 2, 'mlp_dim': 128, 'dropout_rate': 0, 'lr': 0.001998048162245725, 'weight_decay': 0.0005297128659220398, 'optimizer': 'sgd', 'activation': <class 'torch.nn.modules.activation.ReLU'>, 'epochs': 100, 'batch_size': 32, 'flip_prob': 0.0}. Best is trial 102 with value: 2.7074620693814193.
[I 2025-08-05 04:07:29,518] Trial 151 finished with value: 2.7638346446006232 and parameters: {'patch_size': 6, 'emb_dim': 256, 'depth': 2, 'n_heads': 2, 'mlp_dim': 128, 'dropout_rate': 0, 'lr': 0.002904195131053988, 'weight_decay': 0.0006660000824057096, 'optimizer': 'sgd', 'activation': <class 'torch.nn.modules.activation.ReLU'>, 'epochs': 100, 'batch_size': 32, 'flip_prob': 0.0}. Best is trial 102 with value: 2.7074620693814193.
[I 2025-08-05 04:09:02,039] Trial 152 finished with value: 2.7703015429263234 and parameters: {'patch_size': 6, 'emb_dim': 256, 'depth': 2, 'n_heads': 2, 'mlp_dim': 128, 'dropout_rate': 0, 'lr': 0.0027368008002744354, 'weight_decay': 0.0006329510093229041, 'optimizer': 'sgd', 'activation': <class 'torch.nn.modules.activation.ReLU'>, 'epochs': 100, 'batch_size': 32, 'flip_prob': 0.0}. Best is trial 102 with value: 2.7074620693814193.
[I 2025-08-05 04:11:54,089] Trial 153 finished with value: 2.7310452762069977 and parameters: {'patch_size': 6, 'emb_dim': 256, 'depth': 2, 'n_heads': 2, 'mlp_dim': 128, 'dropout_rate': 0, 'lr': 0.002404843228180607, 'weight_decay': 0.00105156894952632, 'optimizer': 'sgd', 'activation': <class 'torch.nn.modules.activation.ReLU'>, 'epochs': 100, 'batch_size': 32, 'flip_prob': 0.0}. Best is trial 102 with value: 2.7074620693814193.
[I 2025-08-05 04:13:44,236] Trial 154 finished with value: 2.7733774398578235 and parameters: {'patch_size': 6, 'emb_dim': 256, 'depth': 2, 'n_heads': 2, 'mlp_dim': 128, 'dropout_rate': 0, 'lr': 0.0018269557424743397, 'weight_decay': 0.0015733706060008853, 'optimizer': 'sgd', 'activation': <class 'torch.nn.modules.activation.ReLU'>, 'epochs': 100, 'batch_size': 32, 'flip_prob': 0.0}. Best is trial 102 with value: 2.7074620693814193.
[I 2025-08-05 04:16:13,885] Trial 155 finished with value: 2.7357122265386637 and parameters: {'patch_size': 6, 'emb_dim': 256, 'depth': 2, 'n_heads': 4, 'mlp_dim': 128, 'dropout_rate': 0, 'lr': 0.0023285790725737113, 'weight_decay': 0.0010550639633631008, 'optimizer': 'sgd', 'activation': <class 'torch.nn.modules.activation.ReLU'>, 'epochs': 100, 'batch_size': 32, 'flip_prob': 0.0}. Best is trial 102 with value: 2.7074620693814193.
[I 2025-08-05 04:18:19,908] Trial 156 finished with value: 2.7620081701957417 and parameters: {'patch_size': 6, 'emb_dim': 256, 'depth': 2, 'n_heads': 2, 'mlp_dim': 128, 'dropout_rate': 0, 'lr': 0.003225787424785939, 'weight_decay': 0.0007937260591817307, 'optimizer': 'sgd', 'activation': <class 'torch.nn.modules.activation.ReLU'>, 'epochs': 100, 'batch_size': 32, 'flip_prob': 0.25}. Best is trial 102 with value: 2.7074620693814193.
[I 2025-08-05 04:20:27,592] Trial 157 finished with value: 2.759639333499499 and parameters: {'patch_size': 6, 'emb_dim': 256, 'depth': 2, 'n_heads': 2, 'mlp_dim': 128, 'dropout_rate': 0, 'lr': 0.002091821946837816, 'weight_decay': 0.0011633139119748852, 'optimizer': 'sgd', 'activation': <class 'torch.nn.modules.activation.ReLU'>, 'epochs': 100, 'batch_size': 32, 'flip_prob': 0.0}. Best is trial 102 with value: 2.7074620693814193.
[I 2025-08-05 04:21:42,534] Trial 158 finished with value: 2.7699978489639965 and parameters: {'patch_size': 6, 'emb_dim': 256, 'depth': 2, 'n_heads': 2, 'mlp_dim': 128, 'dropout_rate': 0, 'lr': 0.002433523312762953, 'weight_decay': 0.00219398517097604, 'optimizer': 'sgd', 'activation': <class 'torch.nn.modules.activation.ReLU'>, 'epochs': 100, 'batch_size': 128, 'flip_prob': 0.0}. Best is trial 102 with value: 2.7074620693814193.
[I 2025-08-05 04:24:56,690] Trial 159 finished with value: 2.7772208916119987 and parameters: {'patch_size': 6, 'emb_dim': 256, 'depth': 2, 'n_heads': 2, 'mlp_dim': 128, 'dropout_rate': 0, 'lr': 0.0014566555790783136, 'weight_decay': 0.002973574622790463, 'optimizer': 'sgd', 'activation': <class 'torch.nn.modules.activation.ReLU'>, 'epochs': 100, 'batch_size': 32, 'flip_prob': 0.0}. Best is trial 102 with value: 2.7074620693814193.
[I 2025-08-05 04:26:41,968] Trial 160 finished with value: 2.7890884558743245 and parameters: {'patch_size': 6, 'emb_dim': 256, 'depth': 2, 'n_heads': 2, 'mlp_dim': 128, 'dropout_rate': 0, 'lr': 0.001958619202709179, 'weight_decay': 0.0004497674897671522, 'optimizer': 'sgd', 'activation': <class 'torch.nn.modules.activation.ReLU'>, 'epochs': 100, 'batch_size': 32, 'flip_prob': 0.5}. Best is trial 102 with value: 2.7074620693814193.
[I 2025-08-05 04:29:03,448] Trial 161 finished with value: 2.766661781281125 and parameters: {'patch_size': 6, 'emb_dim': 256, 'depth': 2, 'n_heads': 4, 'mlp_dim': 128, 'dropout_rate': 0, 'lr': 0.002303568580281529, 'weight_decay': 0.0009857494414168618, 'optimizer': 'sgd', 'activation': <class 'torch.nn.modules.activation.ReLU'>, 'epochs': 100, 'batch_size': 32, 'flip_prob': 0.0}. Best is trial 102 with value: 2.7074620693814193.
[I 2025-08-05 04:31:07,480] Trial 162 finished with value: 2.75199427639187 and parameters: {'patch_size': 6, 'emb_dim': 256, 'depth': 2, 'n_heads': 4, 'mlp_dim': 128, 'dropout_rate': 0, 'lr': 0.002511360108171679, 'weight_decay': 0.0012285197064723745, 'optimizer': 'sgd', 'activation': <class 'torch.nn.modules.activation.ReLU'>, 'epochs': 100, 'batch_size': 32, 'flip_prob': 0.0}. Best is trial 102 with value: 2.7074620693814193.
[I 2025-08-05 04:33:28,953] Trial 163 finished with value: 2.7425713299266965 and parameters: {'patch_size': 6, 'emb_dim': 256, 'depth': 2, 'n_heads': 4, 'mlp_dim': 128, 'dropout_rate': 0, 'lr': 0.0022320712218614177, 'weight_decay': 0.0008521155901848956, 'optimizer': 'sgd', 'activation': <class 'torch.nn.modules.activation.ReLU'>, 'epochs': 100, 'batch_size': 32, 'flip_prob': 0.0}. Best is trial 102 with value: 2.7074620693814193.
[I 2025-08-05 04:38:24,603] Trial 164 finished with value: 2.749840677776728 and parameters: {'patch_size': 6, 'emb_dim': 256, 'depth': 4, 'n_heads': 4, 'mlp_dim': 128, 'dropout_rate': 0, 'lr': 0.002737883840111118, 'weight_decay': 0.0005254536166361381, 'optimizer': 'sgd', 'activation': <class 'torch.nn.modules.activation.ReLU'>, 'epochs': 100, 'batch_size': 32, 'flip_prob': 0.0}. Best is trial 102 with value: 2.7074620693814193.
[I 2025-08-05 04:40:55,014] Trial 165 finished with value: 2.748313297264826 and parameters: {'patch_size': 6, 'emb_dim': 256, 'depth': 2, 'n_heads': 4, 'mlp_dim': 128, 'dropout_rate': 0, 'lr': 0.0017552730424394943, 'weight_decay': 0.0010063082830926839, 'optimizer': 'sgd', 'activation': <class 'torch.nn.modules.activation.ReLU'>, 'epochs': 100, 'batch_size': 32, 'flip_prob': 0.0}. Best is trial 102 with value: 2.7074620693814193.
[I 2025-08-05 04:44:53,053] Trial 166 finished with value: 2.7672897766237523 and parameters: {'patch_size': 6, 'emb_dim': 256, 'depth': 2, 'n_heads': 2, 'mlp_dim': 128, 'dropout_rate': 0, 'lr': 0.0020886103571993615, 'weight_decay': 0.0016613386325754638, 'optimizer': 'sgd', 'activation': <class 'torch.nn.modules.activation.GELU'>, 'epochs': 100, 'batch_size': 32, 'flip_prob': 0.0}. Best is trial 102 with value: 2.7074620693814193.
[I 2025-08-05 04:47:00,098] Trial 167 finished with value: 2.791337680989209 and parameters: {'patch_size': 6, 'emb_dim': 128, 'depth': 2, 'n_heads': 4, 'mlp_dim': 128, 'dropout_rate': 0, 'lr': 0.002417436499431781, 'weight_decay': 0.000770272509276367, 'optimizer': 'adamw', 'activation': <class 'torch.nn.modules.activation.ReLU'>, 'epochs': 100, 'batch_size': 32, 'flip_prob': 0.0}. Best is trial 102 with value: 2.7074620693814193.
[I 2025-08-05 04:49:17,717] Trial 168 finished with value: 2.7189428670558766 and parameters: {'patch_size': 4, 'emb_dim': 256, 'depth': 2, 'n_heads': 2, 'mlp_dim': 128, 'dropout_rate': 0, 'lr': 0.0031589444973153364, 'weight_decay': 0.00039768193904088914, 'optimizer': 'sgd', 'activation': <class 'torch.nn.modules.activation.ReLU'>, 'epochs': 100, 'batch_size': 32, 'flip_prob': 0.0}. Best is trial 102 with value: 2.7074620693814193.
[I 2025-08-05 04:51:12,961] Trial 169 finished with value: 2.740227089514922 and parameters: {'patch_size': 4, 'emb_dim': 256, 'depth': 2, 'n_heads': 2, 'mlp_dim': 128, 'dropout_rate': 0, 'lr': 0.003434786682016439, 'weight_decay': 0.0001967873896750179, 'optimizer': 'sgd', 'activation': <class 'torch.nn.modules.activation.ReLU'>, 'epochs': 100, 'batch_size': 32, 'flip_prob': 0.0}. Best is trial 102 with value: 2.7074620693814193.
[I 2025-08-05 04:53:29,732] Trial 170 finished with value: 2.7524152398540833 and parameters: {'patch_size': 4, 'emb_dim': 256, 'depth': 2, 'n_heads': 2, 'mlp_dim': 128, 'dropout_rate': 0, 'lr': 0.0039730386658467474, 'weight_decay': 0.0004021205476159038, 'optimizer': 'sgd', 'activation': <class 'torch.nn.modules.activation.ReLU'>, 'epochs': 100, 'batch_size': 32, 'flip_prob': 0.0}. Best is trial 102 with value: 2.7074620693814193.
[I 2025-08-05 04:55:11,627] Trial 171 finished with value: 2.772071510689969 and parameters: {'patch_size': 4, 'emb_dim': 256, 'depth': 2, 'n_heads': 2, 'mlp_dim': 128, 'dropout_rate': 0, 'lr': 0.0030549730332908214, 'weight_decay': 0.0003447586249856322, 'optimizer': 'sgd', 'activation': <class 'torch.nn.modules.activation.ReLU'>, 'epochs': 100, 'batch_size': 32, 'flip_prob': 0.0}. Best is trial 102 with value: 2.7074620693814193.
[I 2025-08-05 04:57:33,283] Trial 172 finished with value: 2.7422125899748577 and parameters: {'patch_size': 4, 'emb_dim': 256, 'depth': 2, 'n_heads': 2, 'mlp_dim': 128, 'dropout_rate': 0, 'lr': 0.0026388266419066805, 'weight_decay': 0.0005818516942371788, 'optimizer': 'sgd', 'activation': <class 'torch.nn.modules.activation.ReLU'>, 'epochs': 100, 'batch_size': 32, 'flip_prob': 0.0}. Best is trial 102 with value: 2.7074620693814193.
[I 2025-08-05 05:00:08,120] Trial 173 finished with value: 2.74550873689686 and parameters: {'patch_size': 4, 'emb_dim': 256, 'depth': 2, 'n_heads': 2, 'mlp_dim': 128, 'dropout_rate': 0, 'lr': 0.0018998729344628048, 'weight_decay': 0.00028469501169846296, 'optimizer': 'sgd', 'activation': <class 'torch.nn.modules.activation.ReLU'>, 'epochs': 100, 'batch_size': 32, 'flip_prob': 0.0}. Best is trial 102 with value: 2.7074620693814193.
[I 2025-08-05 05:01:41,050] Trial 174 finished with value: 2.771374566189774 and parameters: {'patch_size': 6, 'emb_dim': 256, 'depth': 2, 'n_heads': 2, 'mlp_dim': 128, 'dropout_rate': 0, 'lr': 0.0016133470717153752, 'weight_decay': 0.00047297583450372653, 'optimizer': 'sgd', 'activation': <class 'torch.nn.modules.activation.ReLU'>, 'epochs': 100, 'batch_size': 32, 'flip_prob': 0.0}. Best is trial 102 with value: 2.7074620693814193.
[I 2025-08-05 05:03:49,231] Trial 175 finished with value: 2.744903791482831 and parameters: {'patch_size': 6, 'emb_dim': 256, 'depth': 2, 'n_heads': 2, 'mlp_dim': 128, 'dropout_rate': 0, 'lr': 0.0022522022921825043, 'weight_decay': 0.0013824752735333845, 'optimizer': 'sgd', 'activation': <class 'torch.nn.modules.activation.ReLU'>, 'epochs': 100, 'batch_size': 32, 'flip_prob': 0.0}. Best is trial 102 with value: 2.7074620693814193.
[I 2025-08-05 05:05:53,137] Trial 176 finished with value: 2.7425449644555804 and parameters: {'patch_size': 6, 'emb_dim': 256, 'depth': 2, 'n_heads': 2, 'mlp_dim': 512, 'dropout_rate': 0, 'lr': 0.003078612375162862, 'weight_decay': 0.0006979126641928039, 'optimizer': 'sgd', 'activation': <class 'torch.nn.modules.activation.ReLU'>, 'epochs': 100, 'batch_size': 32, 'flip_prob': 0.0}. Best is trial 102 with value: 2.7074620693814193.
[I 2025-08-05 05:07:57,875] Trial 177 finished with value: 2.7645015987469863 and parameters: {'patch_size': 6, 'emb_dim': 64, 'depth': 2, 'n_heads': 2, 'mlp_dim': 128, 'dropout_rate': 0, 'lr': 0.002105990984891299, 'weight_decay': 0.0010276377353536483, 'optimizer': 'rmsprop', 'activation': <class 'torch.nn.modules.activation.ReLU'>, 'epochs': 100, 'batch_size': 32, 'flip_prob': 0.0}. Best is trial 102 with value: 2.7074620693814193.
[I 2025-08-05 05:09:26,407] Trial 178 finished with value: 2.747403561335565 and parameters: {'patch_size': 6, 'emb_dim': 256, 'depth': 2, 'n_heads': 2, 'mlp_dim': 128, 'dropout_rate': 0, 'lr': 0.00356418989378477, 'weight_decay': 0.000394807519647456, 'optimizer': 'sgd', 'activation': <class 'torch.nn.modules.activation.ReLU'>, 'epochs': 100, 'batch_size': 32, 'flip_prob': 0.0}. Best is trial 102 with value: 2.7074620693814193.
[I 2025-08-05 05:13:09,760] Trial 179 finished with value: 2.741772870074135 and parameters: {'patch_size': 4, 'emb_dim': 128, 'depth': 2, 'n_heads': 4, 'mlp_dim': 128, 'dropout_rate': 0, 'lr': 0.002491620128180609, 'weight_decay': 0.0011536706292829052, 'optimizer': 'sgd', 'activation': <class 'torch.nn.modules.activation.ReLU'>, 'epochs': 100, 'batch_size': 32, 'flip_prob': 0.0}. Best is trial 102 with value: 2.7074620693814193.
[I 2025-08-05 05:14:46,380] Trial 180 finished with value: 2.7575357009763453 and parameters: {'patch_size': 6, 'emb_dim': 256, 'depth': 2, 'n_heads': 2, 'mlp_dim': 128, 'dropout_rate': 0, 'lr': 0.0018382790928027765, 'weight_decay': 0.0005567872135557497, 'optimizer': 'sgd', 'activation': <class 'torch.nn.modules.activation.ReLU'>, 'epochs': 100, 'batch_size': 64, 'flip_prob': 0.0}. Best is trial 102 with value: 2.7074620693814193.
[I 2025-08-05 05:16:58,516] Trial 181 finished with value: 2.732587095624144 and parameters: {'patch_size': 6, 'emb_dim': 256, 'depth': 2, 'n_heads': 2, 'mlp_dim': 128, 'dropout_rate': 0, 'lr': 0.0029006395473142282, 'weight_decay': 0.0008545555602112151, 'optimizer': 'sgd', 'activation': <class 'torch.nn.modules.activation.ReLU'>, 'epochs': 100, 'batch_size': 32, 'flip_prob': 0.0}. Best is trial 102 with value: 2.7074620693814193.
[I 2025-08-05 05:19:15,122] Trial 182 finished with value: 2.7523434004536296 and parameters: {'patch_size': 6, 'emb_dim': 256, 'depth': 2, 'n_heads': 2, 'mlp_dim': 128, 'dropout_rate': 0, 'lr': 0.0027979985210303472, 'weight_decay': 0.0009106152644980948, 'optimizer': 'sgd', 'activation': <class 'torch.nn.modules.activation.ReLU'>, 'epochs': 100, 'batch_size': 32, 'flip_prob': 0.0}. Best is trial 102 with value: 2.7074620693814193.
[I 2025-08-05 05:22:29,006] Trial 183 finished with value: 2.7645596463372537 and parameters: {'patch_size': 6, 'emb_dim': 256, 'depth': 2, 'n_heads': 2, 'mlp_dim': 128, 'dropout_rate': 0, 'lr': 0.002341823939423013, 'weight_decay': 0.0019031651647197344, 'optimizer': 'sgd', 'activation': <class 'torch.nn.modules.activation.ReLU'>, 'epochs': 100, 'batch_size': 32, 'flip_prob': 0.0}. Best is trial 102 with value: 2.7074620693814193.
[I 2025-08-05 05:24:36,776] Trial 184 finished with value: 2.745797594608818 and parameters: {'patch_size': 6, 'emb_dim': 256, 'depth': 2, 'n_heads': 2, 'mlp_dim': 128, 'dropout_rate': 0, 'lr': 0.003289616984921432, 'weight_decay': 0.0007439351209350838, 'optimizer': 'sgd', 'activation': <class 'torch.nn.modules.activation.ReLU'>, 'epochs': 100, 'batch_size': 32, 'flip_prob': 0.0}. Best is trial 102 with value: 2.7074620693814193.
[I 2025-08-05 05:27:06,500] Trial 185 finished with value: 2.7574893966946297 and parameters: {'patch_size': 6, 'emb_dim': 256, 'depth': 2, 'n_heads': 2, 'mlp_dim': 128, 'dropout_rate': 0, 'lr': 0.0029212108428191444, 'weight_decay': 0.0014443375439457573, 'optimizer': 'sgd', 'activation': <class 'torch.nn.modules.activation.ReLU'>, 'epochs': 100, 'batch_size': 32, 'flip_prob': 0.0}. Best is trial 102 with value: 2.7074620693814193.
[I 2025-08-05 05:29:01,099] Trial 186 finished with value: 2.748011854963222 and parameters: {'patch_size': 6, 'emb_dim': 256, 'depth': 2, 'n_heads': 2, 'mlp_dim': 128, 'dropout_rate': 0, 'lr': 0.001981628630666257, 'weight_decay': 0.000473645865866287, 'optimizer': 'sgd', 'activation': <class 'torch.nn.modules.activation.ReLU'>, 'epochs': 100, 'batch_size': 32, 'flip_prob': 0.0}. Best is trial 102 with value: 2.7074620693814193.
[I 2025-08-05 05:31:29,528] Trial 187 finished with value: 2.755224339090584 and parameters: {'patch_size': 6, 'emb_dim': 256, 'depth': 2, 'n_heads': 2, 'mlp_dim': 128, 'dropout_rate': 0, 'lr': 0.002618941258954184, 'weight_decay': 0.0003110666709300746, 'optimizer': 'sgd', 'activation': <class 'torch.nn.modules.activation.ReLU'>, 'epochs': 100, 'batch_size': 32, 'flip_prob': 0.25}. Best is trial 102 with value: 2.7074620693814193.
[I 2025-08-05 05:34:27,562] Trial 188 finished with value: 2.729955431923216 and parameters: {'patch_size': 6, 'emb_dim': 256, 'depth': 2, 'n_heads': 2, 'mlp_dim': 128, 'dropout_rate': 0, 'lr': 0.0021431628691098987, 'weight_decay': 0.0008785690842319003, 'optimizer': 'sgd', 'activation': <class 'torch.nn.modules.activation.ReLU'>, 'epochs': 100, 'batch_size': 32, 'flip_prob': 0.0}. Best is trial 102 with value: 2.7074620693814193.
[I 2025-08-05 05:35:26,597] Trial 189 finished with value: 2.797533775209949 and parameters: {'patch_size': 6, 'emb_dim': 128, 'depth': 2, 'n_heads': 2, 'mlp_dim': 128, 'dropout_rate': 0, 'lr': 0.002143624766097752, 'weight_decay': 0.0006122990596712231, 'optimizer': 'sgd', 'activation': <class 'torch.nn.modules.activation.ReLU'>, 'epochs': 100, 'batch_size': 128, 'flip_prob': 0.0}. Best is trial 102 with value: 2.7074620693814193.
[I 2025-08-05 05:38:18,393] Trial 190 finished with value: 2.7402589016282803 and parameters: {'patch_size': 6, 'emb_dim': 256, 'depth': 2, 'n_heads': 2, 'mlp_dim': 128, 'dropout_rate': 0, 'lr': 0.0017683634900492215, 'weight_decay': 0.0007428508593075304, 'optimizer': 'sgd', 'activation': <class 'torch.nn.modules.activation.GELU'>, 'epochs': 100, 'batch_size': 32, 'flip_prob': 0.0}. Best is trial 102 with value: 2.7074620693814193.
[I 2025-08-05 05:40:57,535] Trial 191 finished with value: 2.7536449476663107 and parameters: {'patch_size': 6, 'emb_dim': 256, 'depth': 2, 'n_heads': 2, 'mlp_dim': 128, 'dropout_rate': 0, 'lr': 0.0023195986612083754, 'weight_decay': 0.0009203653439408435, 'optimizer': 'sgd', 'activation': <class 'torch.nn.modules.activation.ReLU'>, 'epochs': 100, 'batch_size': 32, 'flip_prob': 0.0}. Best is trial 102 with value: 2.7074620693814193.
[I 2025-08-05 05:43:58,813] Trial 192 finished with value: 2.7415839310865784 and parameters: {'patch_size': 6, 'emb_dim': 256, 'depth': 2, 'n_heads': 2, 'mlp_dim': 128, 'dropout_rate': 0, 'lr': 0.0024972225307376542, 'weight_decay': 0.0011490482558283986, 'optimizer': 'sgd', 'activation': <class 'torch.nn.modules.activation.ReLU'>, 'epochs': 100, 'batch_size': 32, 'flip_prob': 0.0}. Best is trial 102 with value: 2.7074620693814193.
[I 2025-08-05 05:48:42,606] Trial 193 finished with value: 2.7611745230970395 and parameters: {'patch_size': 6, 'emb_dim': 256, 'depth': 5, 'n_heads': 2, 'mlp_dim': 128, 'dropout_rate': 0, 'lr': 0.0019898980087064435, 'weight_decay': 0.0008507726761580468, 'optimizer': 'sgd', 'activation': <class 'torch.nn.modules.activation.ReLU'>, 'epochs': 100, 'batch_size': 32, 'flip_prob': 0.0}. Best is trial 102 with value: 2.7074620693814193.
[I 2025-08-05 05:51:30,853] Trial 194 finished with value: 2.755674150223036 and parameters: {'patch_size': 6, 'emb_dim': 256, 'depth': 2, 'n_heads': 2, 'mlp_dim': 128, 'dropout_rate': 0, 'lr': 0.0022181843679775393, 'weight_decay': 0.0012673089337051225, 'optimizer': 'sgd', 'activation': <class 'torch.nn.modules.activation.ReLU'>, 'epochs': 100, 'batch_size': 32, 'flip_prob': 0.0}. Best is trial 102 with value: 2.7074620693814193.
[I 2025-08-05 05:53:39,478] Trial 195 finished with value: 2.738074711579897 and parameters: {'patch_size': 6, 'emb_dim': 256, 'depth': 2, 'n_heads': 2, 'mlp_dim': 128, 'dropout_rate': 0, 'lr': 0.002739624749191022, 'weight_decay': 0.0004010395663392927, 'optimizer': 'sgd', 'activation': <class 'torch.nn.modules.activation.ReLU'>, 'epochs': 100, 'batch_size': 32, 'flip_prob': 0.0}. Best is trial 102 with value: 2.7074620693814193.
[I 2025-08-05 05:56:28,979] Trial 196 finished with value: 2.7451640766981282 and parameters: {'patch_size': 6, 'emb_dim': 256, 'depth': 2, 'n_heads': 2, 'mlp_dim': 128, 'dropout_rate': 0, 'lr': 0.0029658758803547025, 'weight_decay': 0.0006391939338760294, 'optimizer': 'sgd', 'activation': <class 'torch.nn.modules.activation.ReLU'>, 'epochs': 100, 'batch_size': 32, 'flip_prob': 0.5}. Best is trial 102 with value: 2.7074620693814193.
[I 2025-08-05 05:57:37,764] Trial 197 finished with value: 2.9141537033030436 and parameters: {'patch_size': 6, 'emb_dim': 256, 'depth': 2, 'n_heads': 4, 'mlp_dim': 128, 'dropout_rate': 0, 'lr': 0.003676845562413074, 'weight_decay': 0.0005099156991016503, 'optimizer': 'adamw', 'activation': <class 'torch.nn.modules.activation.ReLU'>, 'epochs': 100, 'batch_size': 32, 'flip_prob': 0.0}. Best is trial 102 with value: 2.7074620693814193.
