[I 2025-07-01 03:48:14,149] Trial 499 finished with value: 16.236179679466563 and parameters: {'kernel_size': 3, 'channel_list': [16, 32, 64, 128], 'padding': 1, 'pool_kernel': 2, 'dropout_rate': 0.1, 'fc_hidden_dim': 64, 'lr': 0.0024284147688251, 'weight_decay': 2.63484733553273e-06, 'optimizer': 'adam', 'activation': <class 'torch.nn.modules.activation.LeakyReLU'>, 'batchnorm': True, 'epochs': 20, 'batch_size': 128, 'flip_prob': 0.0}. Best is trial 121 with value: 15.493945159799877.

Epoch loss: 16.615007
train phase, Epoch 13/20, Loss: 15.486780
val phase, Epoch 13/20, Loss: 17.135650
Val Best Loss: 16.105377
Epoch loss: 17.135650
train phase, Epoch 14/20, Loss: 15.272303
val phase, Epoch 14/20, Loss: 16.955420
Val Best Loss: 16.105377
Epoch loss: 16.955420
train phase, Epoch 15/20, Loss: 15.010661
val phase, Epoch 15/20, Loss: 16.628335
Val Best Loss: 16.105377
Epoch loss: 16.628335
train phase, Epoch 16/20, Loss: 14.601101
val phase, Epoch 16/20, Loss: 16.827282
Val Best Loss: 16.105377
Epoch loss: 16.827282
train phase, Epoch 17/20, Loss: 14.430626
val phase, Epoch 17/20, Loss: 17.668946
Val Best Loss: 16.105377
Epoch loss: 17.668946
train phase, Epoch 18/20, Loss: 14.217399
val phase, Epoch 18/20, Loss: 16.993868
Val Best Loss: 16.105377
Epoch loss: 16.993868
train phase, Epoch 19/20, Loss: 13.747460
val phase, Epoch 19/20, Loss: 16.926746
Val Best Loss: 16.105377
Epoch loss: 16.926746
train phase, Epoch 20/20, Loss: 13.554380
val phase, Epoch 20/20, Loss: 16.585080
Val Best Loss: 16.105377
Epoch loss: 16.585080
train phase, Epoch 1/20, Loss: 19.748272
val phase, Epoch 1/20, Loss: 17.304916
Val Best Loss: 17.304916
Epoch loss: 17.304916
train phase, Epoch 2/20, Loss: 17.797072
val phase, Epoch 2/20, Loss: 16.945622
Val Best Loss: 16.945622
Epoch loss: 16.945622
train phase, Epoch 3/20, Loss: 17.554446
val phase, Epoch 3/20, Loss: 17.219299
Val Best Loss: 16.945622
Epoch loss: 17.219299
train phase, Epoch 4/20, Loss: 17.198258
val phase, Epoch 4/20, Loss: 16.166539
Val Best Loss: 16.166539
Epoch loss: 16.166539
train phase, Epoch 5/20, Loss: 16.766755
val phase, Epoch 5/20, Loss: 21.644997
Val Best Loss: 16.166539
Epoch loss: 21.644997
train phase, Epoch 6/20, Loss: 16.561409
val phase, Epoch 6/20, Loss: 17.406624
Val Best Loss: 16.166539
Epoch loss: 17.406624
train phase, Epoch 7/20, Loss: 16.711166
val phase, Epoch 7/20, Loss: 16.494226
Val Best Loss: 16.166539
Epoch loss: 16.494226
train phase, Epoch 8/20, Loss: 16.515334
val phase, Epoch 8/20, Loss: 15.988640
Val Best Loss: 15.988640
Epoch loss: 15.988640
train phase, Epoch 9/20, Loss: 16.382193
val phase, Epoch 9/20, Loss: 16.045646
Val Best Loss: 15.988640
Epoch loss: 16.045646
train phase, Epoch 10/20, Loss: 16.064067
val phase, Epoch 10/20, Loss: 16.091692
Val Best Loss: 15.988640
Epoch loss: 16.091692
train phase, Epoch 11/20, Loss: 15.836338
val phase, Epoch 11/20, Loss: 17.617370
Val Best Loss: 15.988640
Epoch loss: 17.617370
train phase, Epoch 12/20, Loss: 15.773876
val phase, Epoch 12/20, Loss: 16.234137
Val Best Loss: 15.988640
Epoch loss: 16.234137
train phase, Epoch 13/20, Loss: 15.588402
val phase, Epoch 13/20, Loss: 16.153415
Val Best Loss: 15.988640
Epoch loss: 16.153415
train phase, Epoch 14/20, Loss: 15.590878
val phase, Epoch 14/20, Loss: 16.090304
Val Best Loss: 15.988640
Epoch loss: 16.090304
train phase, Epoch 15/20, Loss: 15.194944
val phase, Epoch 15/20, Loss: 16.513073
Val Best Loss: 15.988640
Epoch loss: 16.513073
train phase, Epoch 16/20, Loss: 14.928793
val phase, Epoch 16/20, Loss: 16.316498
Val Best Loss: 15.988640
Epoch loss: 16.316498
train phase, Epoch 17/20, Loss: 14.837854
val phase, Epoch 17/20, Loss: 18.829342
Val Best Loss: 15.988640
Epoch loss: 18.829342
train phase, Epoch 18/20, Loss: 14.519777
val phase, Epoch 18/20, Loss: 17.233318
Val Best Loss: 15.988640
Epoch loss: 17.233318
train phase, Epoch 19/20, Loss: 14.688322
val phase, Epoch 19/20, Loss: 15.822673
Val Best Loss: 15.822673
Epoch loss: 15.822673
train phase, Epoch 20/20, Loss: 13.912757
val phase, Epoch 20/20, Loss: 15.984701
Val Best Loss: 15.822673
Epoch loss: 15.984701
train phase, Epoch 1/5, Loss: 19.726359
val phase, Epoch 1/5, Loss: 22.513507
Val Best Loss: 22.513507
Epoch loss: 22.513507
train phase, Epoch 2/5, Loss: 17.837403
val phase, Epoch 2/5, Loss: 17.995720
Val Best Loss: 17.995720
Epoch loss: 17.995720
train phase, Epoch 3/5, Loss: 17.298515
val phase, Epoch 3/5, Loss: 16.231091
Val Best Loss: 16.231091
Epoch loss: 16.231091
train phase, Epoch 4/5, Loss: 17.042856
val phase, Epoch 4/5, Loss: 16.243974
Val Best Loss: 16.231091
Epoch loss: 16.243974
train phase, Epoch 5/5, Loss: 16.771457
val phase, Epoch 5/5, Loss: 16.105897
Val Best Loss: 16.105897
Epoch loss: 16.105897
train phase, Epoch 1/20, Loss: 19.529140
val phase, Epoch 1/20, Loss: 17.512464
Val Best Loss: 17.512464
Epoch loss: 17.512464
train phase, Epoch 2/20, Loss: 17.972088
val phase, Epoch 2/20, Loss: 17.815005
Val Best Loss: 17.512464
Epoch loss: 17.815005
train phase, Epoch 3/20, Loss: 17.443487
val phase, Epoch 3/20, Loss: 16.513282
Val Best Loss: 16.513282
Epoch loss: 16.513282
train phase, Epoch 4/20, Loss: 17.258979
val phase, Epoch 4/20, Loss: 16.246717
Val Best Loss: 16.246717
Epoch loss: 16.246717
train phase, Epoch 5/20, Loss: 16.777977
val phase, Epoch 5/20, Loss: 17.303626
Val Best Loss: 16.246717
Epoch loss: 17.303626
train phase, Epoch 6/20, Loss: 16.642763
val phase, Epoch 6/20, Loss: 16.331666
Val Best Loss: 16.246717
Epoch loss: 16.331666
train phase, Epoch 7/20, Loss: 16.520967
val phase, Epoch 7/20, Loss: 17.881616
Val Best Loss: 16.246717
Epoch loss: 17.881616
train phase, Epoch 8/20, Loss: 16.738655
val phase, Epoch 8/20, Loss: 15.860595
Val Best Loss: 15.860595
Epoch loss: 15.860595
train phase, Epoch 9/20, Loss: 16.117578
val phase, Epoch 9/20, Loss: 16.027003
Val Best Loss: 15.860595
Epoch loss: 16.027003
train phase, Epoch 10/20, Loss: 16.251268
val phase, Epoch 10/20, Loss: 15.836982
Val Best Loss: 15.836982
Epoch loss: 15.836982
train phase, Epoch 11/20, Loss: 16.100263
val phase, Epoch 11/20, Loss: 16.611217
Val Best Loss: 15.836982
Epoch loss: 16.611217
train phase, Epoch 12/20, Loss: 15.793330
val phase, Epoch 12/20, Loss: 16.191583
Val Best Loss: 15.836982
Epoch loss: 16.191583
train phase, Epoch 13/20, Loss: 15.462748
val phase, Epoch 13/20, Loss: 18.081719
Val Best Loss: 15.836982
Epoch loss: 18.081719
train phase, Epoch 14/20, Loss: 15.607033
val phase, Epoch 14/20, Loss: 15.908560
Val Best Loss: 15.836982
Epoch loss: 15.908560
train phase, Epoch 15/20, Loss: 15.308338
val phase, Epoch 15/20, Loss: 16.024912
Val Best Loss: 15.836982
Epoch loss: 16.024912
train phase, Epoch 16/20, Loss: 15.088700
val phase, Epoch 16/20, Loss: 16.670741
Val Best Loss: 15.836982
Epoch loss: 16.670741
train phase, Epoch 17/20, Loss: 15.041152
val phase, Epoch 17/20, Loss: 15.903262
Val Best Loss: 15.836982
Epoch loss: 15.903262
train phase, Epoch 18/20, Loss: 14.685220
val phase, Epoch 18/20, Loss: 17.424145
Val Best Loss: 15.836982
Epoch loss: 17.424145
train phase, Epoch 19/20, Loss: 14.533338
val phase, Epoch 19/20, Loss: 16.200354
Val Best Loss: 15.836982
Epoch loss: 16.200354
train phase, Epoch 20/20, Loss: 14.076679
val phase, Epoch 20/20, Loss: 16.110026
Val Best Loss: 15.836982
Epoch loss: 16.110026
train phase, Epoch 1/20, Loss: 23.743011
val phase, Epoch 1/20, Loss: 17.123761
Val Best Loss: 17.123761
Epoch loss: 17.123761
train phase, Epoch 2/20, Loss: 18.082504
val phase, Epoch 2/20, Loss: 19.505149
Val Best Loss: 17.123761
Epoch loss: 19.505149
train phase, Epoch 3/20, Loss: 18.167659
val phase, Epoch 3/20, Loss: 16.714873
Val Best Loss: 16.714873
Epoch loss: 16.714873
train phase, Epoch 4/20, Loss: 17.192737
val phase, Epoch 4/20, Loss: 16.718525
Val Best Loss: 16.714873
Epoch loss: 16.718525
train phase, Epoch 5/20, Loss: 17.015260
val phase, Epoch 5/20, Loss: 16.370828
Val Best Loss: 16.370828
Epoch loss: 16.370828
train phase, Epoch 6/20, Loss: 16.706836
val phase, Epoch 6/20, Loss: 16.106986
Val Best Loss: 16.106986
Epoch loss: 16.106986
train phase, Epoch 7/20, Loss: 16.320296
val phase, Epoch 7/20, Loss: 16.887610
Val Best Loss: 16.106986
Epoch loss: 16.887610
train phase, Epoch 8/20, Loss: 16.189612
val phase, Epoch 8/20, Loss: 16.823769
Val Best Loss: 16.106986
Epoch loss: 16.823769
train phase, Epoch 9/20, Loss: 16.136580
val phase, Epoch 9/20, Loss: 16.102444
Val Best Loss: 16.102444
Epoch loss: 16.102444
train phase, Epoch 10/20, Loss: 16.032322
val phase, Epoch 10/20, Loss: 15.950800
Val Best Loss: 15.950800
Epoch loss: 15.950800
train phase, Epoch 11/20, Loss: 15.781076
val phase, Epoch 11/20, Loss: 16.760973
Val Best Loss: 15.950800
Epoch loss: 16.760973
train phase, Epoch 12/20, Loss: 15.568119
val phase, Epoch 12/20, Loss: 16.046807
Val Best Loss: 15.950800
Epoch loss: 16.046807
train phase, Epoch 13/20, Loss: 15.277151
val phase, Epoch 13/20, Loss: 17.008735
Val Best Loss: 15.950800
Epoch loss: 17.008735
train phase, Epoch 14/20, Loss: 15.577083
val phase, Epoch 14/20, Loss: 17.962911
Val Best Loss: 15.950800
Epoch loss: 17.962911
train phase, Epoch 15/20, Loss: 14.964955
val phase, Epoch 15/20, Loss: 16.084206
Val Best Loss: 15.950800
Epoch loss: 16.084206
train phase, Epoch 16/20, Loss: 15.049075
val phase, Epoch 16/20, Loss: 16.594979
Val Best Loss: 15.950800
Epoch loss: 16.594979
train phase, Epoch 17/20, Loss: 14.465896
val phase, Epoch 17/20, Loss: 16.930783
Val Best Loss: 15.950800
Epoch loss: 16.930783
train phase, Epoch 18/20, Loss: 14.439480
val phase, Epoch 18/20, Loss: 16.365543
Val Best Loss: 15.950800
Epoch loss: 16.365543
train phase, Epoch 19/20, Loss: 14.223475
val phase, Epoch 19/20, Loss: 16.088644
Val Best Loss: 15.950800
Epoch loss: 16.088644
train phase, Epoch 20/20, Loss: 14.195337
val phase, Epoch 20/20, Loss: 18.597467
Val Best Loss: 15.950800
Epoch loss: 18.597467
train phase, Epoch 1/20, Loss: 21.604276
val phase, Epoch 1/20, Loss: 17.579939
Val Best Loss: 17.579939
Epoch loss: 17.579939
train phase, Epoch 2/20, Loss: 17.980510
val phase, Epoch 2/20, Loss: 17.551882
Val Best Loss: 17.551882
Epoch loss: 17.551882
train phase, Epoch 3/20, Loss: 17.558579
val phase, Epoch 3/20, Loss: 17.433668
Val Best Loss: 17.433668
Epoch loss: 17.433668
train phase, Epoch 4/20, Loss: 17.489878
val phase, Epoch 4/20, Loss: 16.886656
Val Best Loss: 16.886656
Epoch loss: 16.886656
train phase, Epoch 5/20, Loss: 17.358098
val phase, Epoch 5/20, Loss: 16.400803
Val Best Loss: 16.400803
Epoch loss: 16.400803
train phase, Epoch 6/20, Loss: 17.061663
val phase, Epoch 6/20, Loss: 17.793609
Val Best Loss: 16.400803
Epoch loss: 17.793609
train phase, Epoch 7/20, Loss: 16.924599
val phase, Epoch 7/20, Loss: 17.774704
Val Best Loss: 16.400803
Epoch loss: 17.774704
train phase, Epoch 8/20, Loss: 16.498438
val phase, Epoch 8/20, Loss: 16.765361
Val Best Loss: 16.400803
Epoch loss: 16.765361
train phase, Epoch 9/20, Loss: 16.819654
val phase, Epoch 9/20, Loss: 16.165101
Val Best Loss: 16.165101
Epoch loss: 16.165101
train phase, Epoch 10/20, Loss: 16.654909
val phase, Epoch 10/20, Loss: 16.814443
Val Best Loss: 16.165101
Epoch loss: 16.814443
train phase, Epoch 11/20, Loss: 16.394042
val phase, Epoch 11/20, Loss: 15.861462
Val Best Loss: 15.861462
Epoch loss: 15.861462
train phase, Epoch 12/20, Loss: 16.351821
val phase, Epoch 12/20, Loss: 16.134711
Val Best Loss: 15.861462
Epoch loss: 16.134711
train phase, Epoch 13/20, Loss: 15.898044
val phase, Epoch 13/20, Loss: 16.544260
Val Best Loss: 15.861462
Epoch loss: 16.544260
train phase, Epoch 14/20, Loss: 15.775490
val phase, Epoch 14/20, Loss: 15.858931
Val Best Loss: 15.858931
Epoch loss: 15.858931
train phase, Epoch 15/20, Loss: 15.857394
val phase, Epoch 15/20, Loss: 16.311132
Val Best Loss: 15.858931
Epoch loss: 16.311132
train phase, Epoch 16/20, Loss: 15.766998
val phase, Epoch 16/20, Loss: 16.434120
Val Best Loss: 15.858931
Epoch loss: 16.434120
train phase, Epoch 17/20, Loss: 15.273574
val phase, Epoch 17/20, Loss: 16.711529
Val Best Loss: 15.858931
Epoch loss: 16.711529
train phase, Epoch 18/20, Loss: 15.550624
val phase, Epoch 18/20, Loss: 15.890439
Val Best Loss: 15.858931
Epoch loss: 15.890439
train phase, Epoch 19/20, Loss: 14.976008
val phase, Epoch 19/20, Loss: 16.877065
Val Best Loss: 15.858931
Epoch loss: 16.877065
train phase, Epoch 20/20, Loss: 14.974115
val phase, Epoch 20/20, Loss: 16.707763
Val Best Loss: 15.858931
Epoch loss: 16.707763
[Trial 471] Skipped due to model construction error: Calculated padded input size per channel: (6 x 3). Kernel size: (5 x 5). Kernel size can't be greater than actual input size
train phase, Epoch 1/20, Loss: 20.133527
val phase, Epoch 1/20, Loss: 17.455572
Val Best Loss: 17.455572
Epoch loss: 17.455572
train phase, Epoch 2/20, Loss: 17.981206
val phase, Epoch 2/20, Loss: 17.275559
Val Best Loss: 17.275559
Epoch loss: 17.275559
train phase, Epoch 3/20, Loss: 17.135144
val phase, Epoch 3/20, Loss: 16.617556
Val Best Loss: 16.617556
Epoch loss: 16.617556
train phase, Epoch 4/20, Loss: 16.846048
val phase, Epoch 4/20, Loss: 17.347853
Val Best Loss: 16.617556
Epoch loss: 17.347853
train phase, Epoch 5/20, Loss: 16.545653
val phase, Epoch 5/20, Loss: 15.969711
Val Best Loss: 15.969711
Epoch loss: 15.969711
train phase, Epoch 6/20, Loss: 16.383379
val phase, Epoch 6/20, Loss: 17.255475
Val Best Loss: 15.969711
Epoch loss: 17.255475
train phase, Epoch 7/20, Loss: 16.222034
val phase, Epoch 7/20, Loss: 16.469789
Val Best Loss: 15.969711
Epoch loss: 16.469789
train phase, Epoch 8/20, Loss: 16.000001
val phase, Epoch 8/20, Loss: 15.878926
Val Best Loss: 15.878926
Epoch loss: 15.878926
train phase, Epoch 9/20, Loss: 16.043832
val phase, Epoch 9/20, Loss: 15.969410
Val Best Loss: 15.878926
Epoch loss: 15.969410
train phase, Epoch 10/20, Loss: 15.839210
val phase, Epoch 10/20, Loss: 16.943761
Val Best Loss: 15.878926
Epoch loss: 16.943761
train phase, Epoch 11/20, Loss: 15.639091
val phase, Epoch 11/20, Loss: 15.916728
Val Best Loss: 15.878926
Epoch loss: 15.916728
train phase, Epoch 12/20, Loss: 15.441014
val phase, Epoch 12/20, Loss: 17.391592
Val Best Loss: 15.878926
Epoch loss: 17.391592
train phase, Epoch 13/20, Loss: 15.057025
val phase, Epoch 13/20, Loss: 16.674379
Val Best Loss: 15.878926
Epoch loss: 16.674379
train phase, Epoch 14/20, Loss: 14.941363
val phase, Epoch 14/20, Loss: 16.012388
Val Best Loss: 15.878926
Epoch loss: 16.012388
train phase, Epoch 15/20, Loss: 14.637991
val phase, Epoch 15/20, Loss: 16.395778
Val Best Loss: 15.878926
Epoch loss: 16.395778
train phase, Epoch 16/20, Loss: 14.551153
val phase, Epoch 16/20, Loss: 15.987117
Val Best Loss: 15.878926
Epoch loss: 15.987117
train phase, Epoch 17/20, Loss: 14.225228
val phase, Epoch 17/20, Loss: 16.206500
Val Best Loss: 15.878926
Epoch loss: 16.206500
train phase, Epoch 18/20, Loss: 13.681381
val phase, Epoch 18/20, Loss: 16.420058
Val Best Loss: 15.878926
Epoch loss: 16.420058
train phase, Epoch 19/20, Loss: 13.537070
val phase, Epoch 19/20, Loss: 16.657529
Val Best Loss: 15.878926
Epoch loss: 16.657529
train phase, Epoch 20/20, Loss: 13.202320
val phase, Epoch 20/20, Loss: 16.361470
Val Best Loss: 15.878926
Epoch loss: 16.361470
train phase, Epoch 1/20, Loss: 19.946927
val phase, Epoch 1/20, Loss: 17.554392
Val Best Loss: 17.554392
Epoch loss: 17.554392
train phase, Epoch 2/20, Loss: 18.354070
val phase, Epoch 2/20, Loss: 16.983272
Val Best Loss: 16.983272
Epoch loss: 16.983272
train phase, Epoch 3/20, Loss: 17.456570
val phase, Epoch 3/20, Loss: 16.491419
Val Best Loss: 16.491419
Epoch loss: 16.491419
train phase, Epoch 4/20, Loss: 17.100238
val phase, Epoch 4/20, Loss: 16.753214
Val Best Loss: 16.491419
Epoch loss: 16.753214
train phase, Epoch 5/20, Loss: 17.179202
val phase, Epoch 5/20, Loss: 16.935008
Val Best Loss: 16.491419
Epoch loss: 16.935008
train phase, Epoch 6/20, Loss: 16.760412
val phase, Epoch 6/20, Loss: 18.023659
Val Best Loss: 16.491419
Epoch loss: 18.023659
train phase, Epoch 7/20, Loss: 16.735287
val phase, Epoch 7/20, Loss: 16.590239
Val Best Loss: 16.491419
Epoch loss: 16.590239
train phase, Epoch 8/20, Loss: 16.362655
val phase, Epoch 8/20, Loss: 17.084677
Val Best Loss: 16.491419
Epoch loss: 17.084677
train phase, Epoch 9/20, Loss: 16.121210
val phase, Epoch 9/20, Loss: 16.291307
Val Best Loss: 16.291307
Epoch loss: 16.291307
train phase, Epoch 10/20, Loss: 16.004457
val phase, Epoch 10/20, Loss: 16.952494
Val Best Loss: 16.291307
Epoch loss: 16.952494
train phase, Epoch 11/20, Loss: 16.008947
val phase, Epoch 11/20, Loss: 15.821814
Val Best Loss: 15.821814
Epoch loss: 15.821814
train phase, Epoch 12/20, Loss: 15.617984
val phase, Epoch 12/20, Loss: 16.229931
Val Best Loss: 15.821814
Epoch loss: 16.229931
train phase, Epoch 13/20, Loss: 15.898046
val phase, Epoch 13/20, Loss: 17.025157
Val Best Loss: 15.821814
Epoch loss: 17.025157
train phase, Epoch 14/20, Loss: 15.390847
val phase, Epoch 14/20, Loss: 17.960206
Val Best Loss: 15.821814
Epoch loss: 17.960206
train phase, Epoch 15/20, Loss: 15.263331
val phase, Epoch 15/20, Loss: 16.257980
Val Best Loss: 15.821814
Epoch loss: 16.257980
train phase, Epoch 16/20, Loss: 15.170067
val phase, Epoch 16/20, Loss: 16.480600
Val Best Loss: 15.821814
Epoch loss: 16.480600
train phase, Epoch 17/20, Loss: 15.010883
val phase, Epoch 17/20, Loss: 16.561524
Val Best Loss: 15.821814
Epoch loss: 16.561524
train phase, Epoch 18/20, Loss: 14.971863
val phase, Epoch 18/20, Loss: 16.389199
Val Best Loss: 15.821814
Epoch loss: 16.389199
train phase, Epoch 19/20, Loss: 14.668767
val phase, Epoch 19/20, Loss: 16.445879
Val Best Loss: 15.821814
Epoch loss: 16.445879
train phase, Epoch 20/20, Loss: 14.361141
val phase, Epoch 20/20, Loss: 16.283657
Val Best Loss: 15.821814
Epoch loss: 16.283657
train phase, Epoch 1/20, Loss: 19.783110
val phase, Epoch 1/20, Loss: 19.063372
Val Best Loss: 19.063372
Epoch loss: 19.063372
train phase, Epoch 2/20, Loss: 18.219910
val phase, Epoch 2/20, Loss: 17.593708
Val Best Loss: 17.593708
Epoch loss: 17.593708
train phase, Epoch 3/20, Loss: 17.816881
val phase, Epoch 3/20, Loss: 18.884228
Val Best Loss: 17.593708
Epoch loss: 18.884228
train phase, Epoch 4/20, Loss: 17.658858
val phase, Epoch 4/20, Loss: 16.921446
Val Best Loss: 16.921446
Epoch loss: 16.921446
train phase, Epoch 5/20, Loss: 17.413250
val phase, Epoch 5/20, Loss: 16.670096
Val Best Loss: 16.670096
Epoch loss: 16.670096
train phase, Epoch 6/20, Loss: 16.786510
val phase, Epoch 6/20, Loss: 16.545522
Val Best Loss: 16.545522
Epoch loss: 16.545522
train phase, Epoch 7/20, Loss: 16.661926
val phase, Epoch 7/20, Loss: 16.584642
Val Best Loss: 16.545522
Epoch loss: 16.584642
train phase, Epoch 8/20, Loss: 16.586072
val phase, Epoch 8/20, Loss: 18.912803
Val Best Loss: 16.545522
Epoch loss: 18.912803
train phase, Epoch 9/20, Loss: 16.289922
val phase, Epoch 9/20, Loss: 18.136427
Val Best Loss: 16.545522
Epoch loss: 18.136427
train phase, Epoch 10/20, Loss: 16.113405
val phase, Epoch 10/20, Loss: 16.243867
Val Best Loss: 16.243867
Epoch loss: 16.243867
train phase, Epoch 11/20, Loss: 15.943682
val phase, Epoch 11/20, Loss: 16.727399
Val Best Loss: 16.243867
Epoch loss: 16.727399
train phase, Epoch 12/20, Loss: 16.189454
val phase, Epoch 12/20, Loss: 16.731844
Val Best Loss: 16.243867
Epoch loss: 16.731844
train phase, Epoch 13/20, Loss: 15.933861
val phase, Epoch 13/20, Loss: 15.828718
Val Best Loss: 15.828718
Epoch loss: 15.828718
train phase, Epoch 14/20, Loss: 15.874377
val phase, Epoch 14/20, Loss: 16.989653
Val Best Loss: 15.828718
Epoch loss: 16.989653
train phase, Epoch 15/20, Loss: 15.655101
val phase, Epoch 15/20, Loss: 16.309844
Val Best Loss: 15.828718
Epoch loss: 16.309844
train phase, Epoch 16/20, Loss: 15.535890
val phase, Epoch 16/20, Loss: 16.508989
Val Best Loss: 15.828718
Epoch loss: 16.508989
train phase, Epoch 17/20, Loss: 15.123064
val phase, Epoch 17/20, Loss: 16.150772
Val Best Loss: 15.828718
Epoch loss: 16.150772
train phase, Epoch 18/20, Loss: 15.139609
val phase, Epoch 18/20, Loss: 16.400624
Val Best Loss: 15.828718
Epoch loss: 16.400624
train phase, Epoch 19/20, Loss: 14.914526
val phase, Epoch 19/20, Loss: 15.958084
Val Best Loss: 15.828718
Epoch loss: 15.958084
train phase, Epoch 20/20, Loss: 14.849608
val phase, Epoch 20/20, Loss: 16.440252
Val Best Loss: 15.828718
Epoch loss: 16.440252
train phase, Epoch 1/30, Loss: 29.374215
val phase, Epoch 1/30, Loss: 19.627641
Val Best Loss: 19.627641
Epoch loss: 19.627641
train phase, Epoch 2/30, Loss: 19.067069
val phase, Epoch 2/30, Loss: 18.482011
Val Best Loss: 18.482011
Epoch loss: 18.482011
train phase, Epoch 3/30, Loss: 18.344583
val phase, Epoch 3/30, Loss: 19.661749
Val Best Loss: 18.482011
Epoch loss: 19.661749
train phase, Epoch 4/30, Loss: 18.166914
val phase, Epoch 4/30, Loss: 17.522366
Val Best Loss: 17.522366
Epoch loss: 17.522366
train phase, Epoch 5/30, Loss: 17.820290
val phase, Epoch 5/30, Loss: 21.885712
Val Best Loss: 17.522366
Epoch loss: 21.885712
train phase, Epoch 6/30, Loss: 17.559046
val phase, Epoch 6/30, Loss: 17.440543
Val Best Loss: 17.440543
Epoch loss: 17.440543
train phase, Epoch 7/30, Loss: 17.265941
val phase, Epoch 7/30, Loss: 26.362084
Val Best Loss: 17.440543
Epoch loss: 26.362084
train phase, Epoch 8/30, Loss: 17.393800
val phase, Epoch 8/30, Loss: 19.000699
Val Best Loss: 17.440543
Epoch loss: 19.000699
train phase, Epoch 9/30, Loss: 16.798122
val phase, Epoch 9/30, Loss: 17.496762
Val Best Loss: 17.440543
Epoch loss: 17.496762
train phase, Epoch 10/30, Loss: 16.524980
val phase, Epoch 10/30, Loss: 16.934662
Val Best Loss: 16.934662
Epoch loss: 16.934662
train phase, Epoch 11/30, Loss: 16.382233
val phase, Epoch 11/30, Loss: 16.854915
Val Best Loss: 16.854915
Epoch loss: 16.854915
train phase, Epoch 12/30, Loss: 16.529294
val phase, Epoch 12/30, Loss: 21.862040
Val Best Loss: 16.854915
Epoch loss: 21.862040
train phase, Epoch 13/30, Loss: 16.184272
val phase, Epoch 13/30, Loss: 17.616599
Val Best Loss: 16.854915
Epoch loss: 17.616599
train phase, Epoch 14/30, Loss: 16.132081
val phase, Epoch