[I 2025-08-05 09:07:25,648] A new study created in memory with name: no-name-a08223ad-36fe-4882-80fb-830dbad76a92
/uufs/chpc.utah.edu/common/home/u1325975/software/pkg/miniforge3/lib/python3.12/site-packages/optuna/distributions.py:518: UserWarning: Choices for a categorical distribution should be a tuple of None, bool, int, float and str for persistent storage but contains <class 'torch.nn.modules.activation.GELU'> which is of type type.
  warnings.warn(message)
/uufs/chpc.utah.edu/common/home/u1325975/software/pkg/miniforge3/lib/python3.12/site-packages/optuna/distributions.py:518: UserWarning: Choices for a categorical distribution should be a tuple of None, bool, int, float and str for persistent storage but contains <class 'torch.nn.modules.activation.ReLU'> which is of type type.
  warnings.warn(message)
[I 2025-08-05 09:13:51,099] Trial 0 finished with value: 2.764337477264128 and parameters: {'patch_size': 6, 'emb_dim': 64, 'depth': 4, 'n_heads': 2, 'mlp_dim': 256, 'dropout_rate': 0, 'lr': 0.0005200369147477385, 'weight_decay': 0.00012683875829313582, 'optimizer': 'sgd', 'activation': <class 'torch.nn.modules.activation.ReLU'>, 'epochs': 100, 'batch_size': 32, 'flip_prob': 0.0}. Best is trial 0 with value: 2.764337477264128.
[I 2025-08-05 09:14:24,737] Trial 1 finished with value: 2.8440523485798024 and parameters: {'patch_size': 6, 'emb_dim': 128, 'depth': 3, 'n_heads': 2, 'mlp_dim': 512, 'dropout_rate': 0, 'lr': 0.002522985857992509, 'weight_decay': 1.3886369980520132e-06, 'optimizer': 'adam', 'activation': <class 'torch.nn.modules.activation.ReLU'>, 'epochs': 100, 'batch_size': 128, 'flip_prob': 0.5}. Best is trial 0 with value: 2.764337477264128.
[I 2025-08-05 09:15:51,464] Trial 2 finished with value: 2.8790626846838054 and parameters: {'patch_size': 4, 'emb_dim': 128, 'depth': 6, 'n_heads': 2, 'mlp_dim': 256, 'dropout_rate': 0, 'lr': 0.0004903440235216865, 'weight_decay': 0.008647855099232002, 'optimizer': 'adam', 'activation': <class 'torch.nn.modules.activation.GELU'>, 'epochs': 100, 'batch_size': 128, 'flip_prob': 0.0}. Best is trial 0 with value: 2.764337477264128.
[I 2025-08-05 09:17:06,082] Trial 3 finished with value: 2.7878909517111046 and parameters: {'patch_size': 4, 'emb_dim': 128, 'depth': 2, 'n_heads': 2, 'mlp_dim': 256, 'dropout_rate': 0, 'lr': 0.0001408090311555503, 'weight_decay': 2.9207925643133782e-06, 'optimizer': 'rmsprop', 'activation': <class 'torch.nn.modules.activation.GELU'>, 'epochs': 100, 'batch_size': 64, 'flip_prob': 0.25}. Best is trial 0 with value: 2.764337477264128.
[I 2025-08-05 09:18:22,094] Trial 4 finished with value: 2.7718908074106325 and parameters: {'patch_size': 6, 'emb_dim': 128, 'depth': 5, 'n_heads': 4, 'mlp_dim': 256, 'dropout_rate': 0, 'lr': 0.0035630431881825356, 'weight_decay': 2.748160989821982e-06, 'optimizer': 'adamw', 'activation': <class 'torch.nn.modules.activation.ReLU'>, 'epochs': 100, 'batch_size': 128, 'flip_prob': 0.0}. Best is trial 0 with value: 2.764337477264128.
[I 2025-08-05 09:19:57,388] Trial 5 finished with value: 2.8918654056452437 and parameters: {'patch_size': 4, 'emb_dim': 256, 'depth': 6, 'n_heads': 8, 'mlp_dim': 512, 'dropout_rate': 0, 'lr': 0.006855256876621597, 'weight_decay': 0.0062944168213819, 'optimizer': 'adamw', 'activation': <class 'torch.nn.modules.activation.GELU'>, 'epochs': 100, 'batch_size': 64, 'flip_prob': 0.0}. Best is trial 0 with value: 2.764337477264128.
[I 2025-08-05 09:21:29,824] Trial 6 finished with value: 2.8811852621370693 and parameters: {'patch_size': 6, 'emb_dim': 256, 'depth': 3, 'n_heads': 2, 'mlp_dim': 256, 'dropout_rate': 0, 'lr': 0.006875067286159428, 'weight_decay': 1.9759986767232007e-05, 'optimizer': 'adam', 'activation': <class 'torch.nn.modules.activation.ReLU'>, 'epochs': 100, 'batch_size': 128, 'flip_prob': 0.5}. Best is trial 0 with value: 2.764337477264128.
[I 2025-08-05 09:26:00,603] Trial 7 finished with value: 2.8173309153037995 and parameters: {'patch_size': 6, 'emb_dim': 64, 'depth': 5, 'n_heads': 8, 'mlp_dim': 512, 'dropout_rate': 0, 'lr': 0.006472146894073537, 'weight_decay': 0.002429709618490961, 'optimizer': 'rmsprop', 'activation': <class 'torch.nn.modules.activation.ReLU'>, 'epochs': 100, 'batch_size': 64, 'flip_prob': 0.25}. Best is trial 0 with value: 2.764337477264128.
[I 2025-08-05 09:27:32,809] Trial 8 finished with value: 2.9027406662019515 and parameters: {'patch_size': 6, 'emb_dim': 64, 'depth': 3, 'n_heads': 2, 'mlp_dim': 512, 'dropout_rate': 0, 'lr': 0.0072670446782246, 'weight_decay': 0.00011586497609845906, 'optimizer': 'rmsprop', 'activation': <class 'torch.nn.modules.activation.ReLU'>, 'epochs': 100, 'batch_size': 32, 'flip_prob': 0.5}. Best is trial 0 with value: 2.764337477264128.
[I 2025-08-05 09:29:01,363] Trial 9 finished with value: 2.792926083025225 and parameters: {'patch_size': 6, 'emb_dim': 256, 'depth': 2, 'n_heads': 4, 'mlp_dim': 256, 'dropout_rate': 0, 'lr': 0.0022569741298262055, 'weight_decay': 2.320836561628192e-06, 'optimizer': 'adamw', 'activation': <class 'torch.nn.modules.activation.GELU'>, 'epochs': 100, 'batch_size': 128, 'flip_prob': 0.5}. Best is trial 0 with value: 2.764337477264128.
[I 2025-08-05 09:35:05,320] Trial 10 finished with value: 2.800621385942466 and parameters: {'patch_size': 4, 'emb_dim': 64, 'depth': 4, 'n_heads': 4, 'mlp_dim': 128, 'dropout_rate': 0, 'lr': 0.0005235982248270649, 'weight_decay': 0.00032905988651179294, 'optimizer': 'sgd', 'activation': <class 'torch.nn.modules.activation.ReLU'>, 'epochs': 100, 'batch_size': 32, 'flip_prob': 0.0}. Best is trial 0 with value: 2.764337477264128.
[I 2025-08-05 09:38:18,389] Trial 11 finished with value: 2.7752966196890765 and parameters: {'patch_size': 6, 'emb_dim': 128, 'depth': 5, 'n_heads': 4, 'mlp_dim': 256, 'dropout_rate': 0, 'lr': 0.0012329875063291852, 'weight_decay': 2.01188168015158e-05, 'optimizer': 'sgd', 'activation': <class 'torch.nn.modules.activation.ReLU'>, 'epochs': 100, 'batch_size': 32, 'flip_prob': 0.0}. Best is trial 0 with value: 2.764337477264128.
[I 2025-08-05 09:41:17,412] Trial 12 finished with value: 2.7837646709276482 and parameters: {'patch_size': 6, 'emb_dim': 64, 'depth': 5, 'n_heads': 4, 'mlp_dim': 128, 'dropout_rate': 0, 'lr': 0.00021400365636055222, 'weight_decay': 0.0005471970390252328, 'optimizer': 'adamw', 'activation': <class 'torch.nn.modules.activation.ReLU'>, 'epochs': 100, 'batch_size': 32, 'flip_prob': 0.0}. Best is trial 0 with value: 2.764337477264128.
[I 2025-08-05 09:44:18,911] Trial 13 finished with value: 2.802904731890836 and parameters: {'patch_size': 6, 'emb_dim': 64, 'depth': 4, 'n_heads': 4, 'mlp_dim': 256, 'dropout_rate': 0, 'lr': 0.0005930911969933388, 'weight_decay': 1.4752650320608584e-05, 'optimizer': 'sgd', 'activation': <class 'torch.nn.modules.activation.ReLU'>, 'epochs': 100, 'batch_size': 128, 'flip_prob': 0.0}. Best is trial 0 with value: 2.764337477264128.
[I 2025-08-05 09:48:13,204] Trial 14 finished with value: 2.7674000160829295 and parameters: {'patch_size': 6, 'emb_dim': 128, 'depth': 5, 'n_heads': 8, 'mlp_dim': 256, 'dropout_rate': 0, 'lr': 0.002181386242131863, 'weight_decay': 7.12140686861656e-05, 'optimizer': 'sgd', 'activation': <class 'torch.nn.modules.activation.ReLU'>, 'epochs': 100, 'batch_size': 32, 'flip_prob': 0.0}. Best is trial 0 with value: 2.764337477264128.
[I 2025-08-05 09:53:19,488] Trial 15 finished with value: 2.7497206197285395 and parameters: {'patch_size': 6, 'emb_dim': 128, 'depth': 4, 'n_heads': 8, 'mlp_dim': 256, 'dropout_rate': 0, 'lr': 0.0011641430359867714, 'weight_decay': 7.685733838153624e-05, 'optimizer': 'sgd', 'activation': <class 'torch.nn.modules.activation.ReLU'>, 'epochs': 100, 'batch_size': 32, 'flip_prob': 0.0}. Best is trial 15 with value: 2.7497206197285395.
[I 2025-08-05 09:56:03,361] Trial 16 finished with value: 2.820701438008804 and parameters: {'patch_size': 6, 'emb_dim': 64, 'depth': 4, 'n_heads': 8, 'mlp_dim': 128, 'dropout_rate': 0, 'lr': 0.0011953645929631618, 'weight_decay': 0.0006365599049144934, 'optimizer': 'sgd', 'activation': <class 'torch.nn.modules.activation.ReLU'>, 'epochs': 100, 'batch_size': 32, 'flip_prob': 0.25}. Best is trial 15 with value: 2.7497206197285395.
[I 2025-08-05 10:02:43,958] Trial 17 finished with value: 2.7765310301855477 and parameters: {'patch_size': 6, 'emb_dim': 128, 'depth': 3, 'n_heads': 8, 'mlp_dim': 256, 'dropout_rate': 0, 'lr': 0.000260792689182298, 'weight_decay': 8.965777916567026e-05, 'optimizer': 'sgd', 'activation': <class 'torch.nn.modules.activation.ReLU'>, 'epochs': 100, 'batch_size': 32, 'flip_prob': 0.0}. Best is trial 15 with value: 2.7497206197285395.
[I 2025-08-05 10:07:08,801] Trial 18 finished with value: 2.812911717365389 and parameters: {'patch_size': 4, 'emb_dim': 64, 'depth': 4, 'n_heads': 8, 'mlp_dim': 256, 'dropout_rate': 0, 'lr': 0.0007794987476367364, 'weight_decay': 0.0001752207771324241, 'optimizer': 'sgd', 'activation': <class 'torch.nn.modules.activation.GELU'>, 'epochs': 100, 'batch_size': 32, 'flip_prob': 0.0}. Best is trial 15 with value: 2.7497206197285395.
[I 2025-08-05 10:12:31,995] Trial 19 finished with value: 2.8044474672494664 and parameters: {'patch_size': 6, 'emb_dim': 256, 'depth': 3, 'n_heads': 2, 'mlp_dim': 128, 'dropout_rate': 0, 'lr': 0.00031027215763812917, 'weight_decay': 3.696870083361044e-05, 'optimizer': 'sgd', 'activation': <class 'torch.nn.modules.activation.ReLU'>, 'epochs': 100, 'batch_size': 32, 'flip_prob': 0.25}. Best is trial 15 with value: 2.7497206197285395.
[I 2025-08-05 10:17:19,442] Trial 20 finished with value: 2.787628809246712 and parameters: {'patch_size': 6, 'emb_dim': 64, 'depth': 4, 'n_heads': 8, 'mlp_dim': 256, 'dropout_rate': 0, 'lr': 0.0014273192478173541, 'weight_decay': 0.0012087452775673437, 'optimizer': 'sgd', 'activation': <class 'torch.nn.modules.activation.ReLU'>, 'epochs': 100, 'batch_size': 32, 'flip_prob': 0.0}. Best is trial 15 with value: 2.7497206197285395.
[I 2025-08-05 10:21:23,150] Trial 21 finished with value: 2.775947919886995 and parameters: {'patch_size': 6, 'emb_dim': 128, 'depth': 5, 'n_heads': 8, 'mlp_dim': 256, 'dropout_rate': 0, 'lr': 0.0022209107214002594, 'weight_decay': 4.727712071260705e-05, 'optimizer': 'sgd', 'activation': <class 'torch.nn.modules.activation.ReLU'>, 'epochs': 100, 'batch_size': 32, 'flip_prob': 0.0}. Best is trial 15 with value: 2.7497206197285395.
[I 2025-08-05 10:28:28,213] Trial 22 finished with value: 2.730086537178233 and parameters: {'patch_size': 6, 'emb_dim': 128, 'depth': 6, 'n_heads': 8, 'mlp_dim': 256, 'dropout_rate': 0, 'lr': 0.00082006918676122, 'weight_decay': 6.227904706091465e-06, 'optimizer': 'sgd', 'activation': <class 'torch.nn.modules.activation.ReLU'>, 'epochs': 100, 'batch_size': 32, 'flip_prob': 0.0}. Best is trial 22 with value: 2.730086537178233.
[I 2025-08-05 10:36:04,061] Trial 23 finished with value: 2.74992026080556 and parameters: {'patch_size': 6, 'emb_dim': 128, 'depth': 6, 'n_heads': 8, 'mlp_dim': 256, 'dropout_rate': 0, 'lr': 0.0008323057352717191, 'weight_decay': 8.414595499803853e-06, 'optimizer': 'sgd', 'activation': <class 'torch.nn.modules.activation.ReLU'>, 'epochs': 100, 'batch_size': 32, 'flip_prob': 0.0}. Best is trial 22 with value: 2.730086537178233.
[I 2025-08-05 10:43:49,621] Trial 24 finished with value: 2.752990690157698 and parameters: {'patch_size': 6, 'emb_dim': 128, 'depth': 6, 'n_heads': 8, 'mlp_dim': 256, 'dropout_rate': 0, 'lr': 0.0008910506239956269, 'weight_decay': 9.73056305009424e-06, 'optimizer': 'sgd', 'activation': <class 'torch.nn.modules.activation.ReLU'>, 'epochs': 100, 'batch_size': 32, 'flip_prob': 0.0}. Best is trial 22 with value: 2.730086537178233.
[I 2025-08-05 10:48:35,484] Trial 25 finished with value: 2.7942817971559717 and parameters: {'patch_size': 6, 'emb_dim': 128, 'depth': 6, 'n_heads': 8, 'mlp_dim': 256, 'dropout_rate': 0, 'lr': 0.0003785576858784356, 'weight_decay': 7.479804824567027e-06, 'optimizer': 'sgd', 'activation': <class 'torch.nn.modules.activation.ReLU'>, 'epochs': 100, 'batch_size': 64, 'flip_prob': 0.0}. Best is trial 22 with value: 2.730086537178233.
[I 2025-08-05 10:54:12,932] Trial 26 finished with value: 2.801371015254206 and parameters: {'patch_size': 4, 'emb_dim': 128, 'depth': 6, 'n_heads': 8, 'mlp_dim': 256, 'dropout_rate': 0, 'lr': 0.0007504089338530833, 'weight_decay': 5.129181577984973e-06, 'optimizer': 'sgd', 'activation': <class 'torch.nn.modules.activation.GELU'>, 'epochs': 100, 'batch_size': 32, 'flip_prob': 0.0}. Best is trial 22 with value: 2.730086537178233.
[I 2025-08-05 10:57:33,418] Trial 27 finished with value: 2.772942531238275 and parameters: {'patch_size': 6, 'emb_dim': 128, 'depth': 6, 'n_heads': 8, 'mlp_dim': 256, 'dropout_rate': 0, 'lr': 0.0015860610735240613, 'weight_decay': 4.919965644926415e-06, 'optimizer': 'adam', 'activation': <class 'torch.nn.modules.activation.ReLU'>, 'epochs': 100, 'batch_size': 32, 'flip_prob': 0.0}. Best is trial 22 with value: 2.730086537178233.
[I 2025-08-05 11:01:22,336] Trial 28 finished with value: 2.841808625498497 and parameters: {'patch_size': 6, 'emb_dim': 128, 'depth': 5, 'n_heads': 8, 'mlp_dim': 512, 'dropout_rate': 0, 'lr': 0.0039591401466789996, 'weight_decay': 1.047224183969483e-06, 'optimizer': 'rmsprop', 'activation': <class 'torch.nn.modules.activation.ReLU'>, 'epochs': 100, 'batch_size': 32, 'flip_prob': 0.25}. Best is trial 22 with value: 2.730086537178233.
[I 2025-08-05 11:04:38,338] Trial 29 finished with value: 3.110271017571554 and parameters: {'patch_size': 6, 'emb_dim': 128, 'depth': 6, 'n_heads': 8, 'mlp_dim': 128, 'dropout_rate': 0, 'lr': 0.00010021141490061576, 'weight_decay': 3.3696335531792336e-05, 'optimizer': 'sgd', 'activation': <class 'torch.nn.modules.activation.ReLU'>, 'epochs': 100, 'batch_size': 32, 'flip_prob': 0.5}. Best is trial 22 with value: 2.730086537178233.
[I 2025-08-05 11:07:42,108] Trial 30 finished with value: 2.765503559871807 and parameters: {'patch_size': 6, 'emb_dim': 128, 'depth': 5, 'n_heads': 8, 'mlp_dim': 256, 'dropout_rate': 0, 'lr': 0.00097194681239502, 'weight_decay': 0.00021289061035739402, 'optimizer': 'sgd', 'activation': <class 'torch.nn.modules.activation.ReLU'>, 'epochs': 100, 'batch_size': 64, 'flip_prob': 0.0}. Best is trial 22 with value: 2.730086537178233.
[I 2025-08-05 11:16:54,733] Trial 31 finished with value: 2.7417165059663704 and parameters: {'patch_size': 6, 'emb_dim': 128, 'depth': 6, 'n_heads': 8, 'mlp_dim': 256, 'dropout_rate': 0, 'lr': 0.0008855417636460333, 'weight_decay': 1.0233342570470602e-05, 'optimizer': 'sgd', 'activation': <class 'torch.nn.modules.activation.ReLU'>, 'epochs': 100, 'batch_size': 32, 'flip_prob': 0.0}. Best is trial 22 with value: 2.730086537178233.
[I 2025-08-05 11:28:13,669] Trial 32 finished with value: 2.725476768997524 and parameters: {'patch_size': 6, 'emb_dim': 128, 'depth': 6, 'n_heads': 8, 'mlp_dim': 256, 'dropout_rate': 0, 'lr': 0.0007015507692359801, 'weight_decay': 1.2284819292146817e-05, 'optimizer': 'sgd', 'activation': <class 'torch.nn.modules.activation.ReLU'>, 'epochs': 100, 'batch_size': 32, 'flip_prob': 0.0}. Best is trial 32 with value: 2.725476768997524.
[I 2025-08-05 11:32:25,182] Trial 33 finished with value: 2.755574314211764 and parameters: {'patch_size': 6, 'emb_dim': 128, 'depth': 6, 'n_heads': 8, 'mlp_dim': 256, 'dropout_rate': 0, 'lr': 0.0016656479030959248, 'weight_decay': 1.2520119324257666e-05, 'optimizer': 'sgd', 'activation': <class 'torch.nn.modules.activation.ReLU'>, 'epochs': 100, 'batch_size': 32, 'flip_prob': 0.0}. Best is trial 32 with value: 2.725476768997524.
[I 2025-08-05 11:35:46,209] Trial 34 finished with value: 2.8022732351024704 and parameters: {'patch_size': 6, 'emb_dim': 128, 'depth': 6, 'n_heads': 8, 'mlp_dim': 256, 'dropout_rate': 0, 'lr': 0.0004490373817834251, 'weight_decay': 1.8124868651424395e-06, 'optimizer': 'adam', 'activation': <class 'torch.nn.modules.activation.ReLU'>, 'epochs': 100, 'batch_size': 32, 'flip_prob': 0.0}. Best is trial 32 with value: 2.725476768997524.
[I 2025-08-05 11:41:45,819] Trial 35 finished with value: 2.793951969871475 and parameters: {'patch_size': 4, 'emb_dim': 128, 'depth': 5, 'n_heads': 8, 'mlp_dim': 256, 'dropout_rate': 0, 'lr': 0.0005722068816002874, 'weight_decay': 4.699716921920838e-06, 'optimizer': 'sgd', 'activation': <class 'torch.nn.modules.activation.GELU'>, 'epochs': 100, 'batch_size': 32, 'flip_prob': 0.0}. Best is trial 32 with value: 2.725476768997524.
[I 2025-08-05 11:49:40,045] Trial 36 finished with value: 2.7394120963548723 and parameters: {'patch_size': 6, 'emb_dim': 128, 'depth': 6, 'n_heads': 8, 'mlp_dim': 256, 'dropout_rate': 0, 'lr': 0.0006493715318182927, 'weight_decay': 2.1661976379989945e-05, 'optimizer': 'sgd', 'activation': <class 'torch.nn.modules.activation.ReLU'>, 'epochs': 100, 'batch_size': 32, 'flip_prob': 0.0}. Best is trial 32 with value: 2.725476768997524.
U'>, 'batchnorm': True, 'epochs': 50, 'batch_size': 128, 'flip_prob': 0.0, 'lstm_hidden_dim': 64, 'lstm_layers': 2}. Best is trial 15 with value: 2.7184562955172993.
[I 2025-08-05 09:22:52,815] Trial 43 finished with value: 3.028624698480162 and parameters: {'channels_list': [32, 64, 128], 'kernel_size': 3, 'padding': 1, 'pool_kernel': 2, 'dropout_rate': 0, 'fc_hidden_dim': 256, 'lr': 0.00044888195001621184, 'weight_decay': 0.0002563637557212964, 'optimizer': 'adam', 'activation': <class 'torch.nn.modules.activation.ReLU'>, 'batchnorm': True, 'epochs': 50, 'batch_size': 128, 'flip_prob': 0.0, 'lstm_hidden_dim': 64, 'lstm_layers': 2}. Best is trial 15 with value: 2.7184562955172993.
[I 2025-08-05 09:23:35,643] Trial 44 finished with value: 2.7450186862301336 and parameters: {'channels_list': [16, 32, 64], 'kernel_size': 3, 'padding': 1, 'pool_kernel': 2, 'dropout_rate': 0, 'fc_hidden_dim': 256, 'lr': 0.0006269612919546974, 'weight_decay': 0.0025273937449920556, 'optimizer': 'sgd', 'activation': <class 'torch.nn.modules.activation.ReLU'>, 'batchnorm': True, 'epochs': 50, 'batch_size': 128, 'flip_prob': 0.0, 'lstm_hidden_dim': 64, 'lstm_layers': 2}. Best is trial 15 with value: 2.7184562955172993.
[I 2025-08-05 09:23:51,319] Trial 45 finished with value: 3.0742092332161235 and parameters: {'channels_list': [16, 32, 64, 128], 'kernel_size': 3, 'padding': 1, 'pool_kernel': 2, 'dropout_rate': 0, 'fc_hidden_dim': 256, 'lr': 0.0006216753065326604, 'weight_decay': 0.0008846399187879232, 'optimizer': 'sgd', 'activation': <class 'torch.nn.modules.activation.ReLU'>, 'batchnorm': True, 'epochs': 50, 'batch_size': 128, 'flip_prob': 0.0, 'lstm_hidden_dim': 32, 'lstm_layers': 2}. Best is trial 15 with value: 2.7184562955172993.
[I 2025-08-05 09:23:51,336] Trial 46 pruned. 
[I 2025-08-05 09:23:51,360] Trial 47 pruned. 
[I 2025-08-05 09:25:12,641] Trial 48 finished with value: 2.6973911761087157 and parameters: {'channels_list': [32, 64], 'kernel_size': 3, 'padding': 1, 'pool_kernel': 2, 'dropout_rate': 0, 'fc_hidden_dim': 256, 'lr': 0.0012142611417289332, 'weight_decay': 0.00397325913795211, 'optimizer': 'sgd', 'activation': <class 'torch.nn.modules.activation.ReLU'>, 'batchnorm': True, 'epochs': 50, 'batch_size': 32, 'flip_prob': 0.0, 'lstm_hidden_dim': 128, 'lstm_layers': 2}. Best is trial 48 with value: 2.6973911761087157.
[I 2025-08-05 09:26:16,946] Trial 49 finished with value: 2.761884461035918 and parameters: {'channels_list': [32, 64], 'kernel_size': 7, 'padding': 1, 'pool_kernel': 2, 'dropout_rate': 0, 'fc_hidden_dim': 256, 'lr': 0.0005707463841511463, 'weight_decay': 0.0025109214757939556, 'optimizer': 'sgd', 'activation': <class 'torch.nn.modules.activation.LeakyReLU'>, 'batchnorm': True, 'epochs': 50, 'batch_size': 32, 'flip_prob': 0.0, 'lstm_hidden_dim': 128, 'lstm_layers': 2}. Best is trial 48 with value: 2.6973911761087157.
[I 2025-08-05 09:27:06,220] Trial 50 finished with value: 2.733055581747407 and parameters: {'channels_list': [32, 64], 'kernel_size': 3, 'padding': 1, 'pool_kernel': 2, 'dropout_rate': 0, 'fc_hidden_dim': 64, 'lr': 0.0012006753044143139, 'weight_decay': 0.00605633072119288, 'optimizer': 'sgd', 'activation': <class 'torch.nn.modules.activation.ReLU'>, 'batchnorm': True, 'epochs': 50, 'batch_size': 32, 'flip_prob': 0.0, 'lstm_hidden_dim': 128, 'lstm_layers': 2}. Best is trial 48 with value: 2.6973911761087157.
[I 2025-08-05 09:28:15,528] Trial 51 finished with value: 2.7239272104385246 and parameters: {'channels_list': [32, 64], 'kernel_size': 3, 'padding': 1, 'pool_kernel': 2, 'dropout_rate': 0, 'fc_hidden_dim': 64, 'lr': 0.0012501843821486186, 'weight_decay': 0.0054169345039321816, 'optimizer': 'sgd', 'activation': <class 'torch.nn.modules.activation.ReLU'>, 'batchnorm': True, 'epochs': 50, 'batch_size': 32, 'flip_prob': 0.0, 'lstm_hidden_dim': 128, 'lstm_layers': 2}. Best is trial 48 with value: 2.6973911761087157.
[I 2025-08-05 09:29:38,666] Trial 52 finished with value: 2.7110839264528024 and parameters: {'channels_list': [32, 64], 'kernel_size': 3, 'padding': 1, 'pool_kernel': 2, 'dropout_rate': 0, 'fc_hidden_dim': 64, 'lr': 0.001080724326550648, 'weight_decay': 0.005149574565756489, 'optimizer': 'sgd', 'activation': <class 'torch.nn.modules.activation.ReLU'>, 'batchnorm': True, 'epochs': 50, 'batch_size': 32, 'flip_prob': 0.0, 'lstm_hidden_dim': 128, 'lstm_layers': 2}. Best is trial 48 with value: 2.6973911761087157.
[I 2025-08-05 09:30:51,523] Trial 53 finished with value: 2.712338981754961 and parameters: {'channels_list': [32, 64], 'kernel_size': 3, 'padding': 1, 'pool_kernel': 2, 'dropout_rate': 0, 'fc_hidden_dim': 64, 'lr': 0.001131706077262801, 'weight_decay': 0.0054656477367619775, 'optimizer': 'sgd', 'activation': <class 'torch.nn.modules.activation.ReLU'>, 'batchnorm': True, 'epochs': 50, 'batch_size': 32, 'flip_prob': 0.0, 'lstm_hidden_dim': 128, 'lstm_layers': 2}. Best is trial 48 with value: 2.6973911761087157.
