[I 2025-08-04 18:18:36,510] Trial 294 finished with value: 2.710321893507954 and parameters: {'channels_list': [16, 32, 64], 'kernel_size': 3, 'padding': 1, 'pool_kernel': 2, 'dropout_rate': 0, 'fc_hidden_dim': 256, 'lr': 0.0011630282420368333, 'weight_decay': 8.535249371605162e-06, 'optimizer': 'rmsprop', 'activation': <class 'torch.nn.modules.activation.LeakyReLU'>, 'batchnorm': True, 'epochs': 35, 'batch_size': 32, 'flip_prob': 0.0}. Best is trial 269 with value: 2.690232738856096.
[I 2025-08-04 18:19:46,042] Trial 295 finished with value: 2.7504289858879023 and parameters: {'channels_list': [16, 32, 64], 'kernel_size': 3, 'padding': 1, 'pool_kernel': 2, 'dropout_rate': 0, 'fc_hidden_dim': 256, 'lr': 0.0011806121879474713, 'weight_decay': 5.531907050071256e-06, 'optimizer': 'rmsprop', 'activation': <class 'torch.nn.modules.activation.LeakyReLU'>, 'batchnorm': True, 'epochs': 35, 'batch_size': 32, 'flip_prob': 0.0}. Best is trial 269 with value: 2.690232738856096.
[I 2025-08-04 18:20:50,016] Trial 296 finished with value: 2.7218775281572514 and parameters: {'channels_list': [16, 32, 64], 'kernel_size': 3, 'padding': 1, 'pool_kernel': 2, 'dropout_rate': 0, 'fc_hidden_dim': 256, 'lr': 0.0010779375068579234, 'weight_decay': 8.873354036884087e-06, 'optimizer': 'rmsprop', 'activation': <class 'torch.nn.modules.activation.LeakyReLU'>, 'batchnorm': True, 'epochs': 35, 'batch_size': 32, 'flip_prob': 0.0}. Best is trial 269 with value: 2.690232738856096.
[I 2025-08-04 18:21:48,439] Trial 297 finished with value: 2.6951331082816865 and parameters: {'channels_list': [16, 32, 64], 'kernel_size': 3, 'padding': 1, 'pool_kernel': 2, 'dropout_rate': 0, 'fc_hidden_dim': 256, 'lr': 0.0011649657917532409, 'weight_decay': 7.03383736206129e-06, 'optimizer': 'rmsprop', 'activation': <class 'torch.nn.modules.activation.LeakyReLU'>, 'batchnorm': True, 'epochs': 35, 'batch_size': 32, 'flip_prob': 0.0}. Best is trial 269 with value: 2.690232738856096.
[I 2025-08-04 18:22:38,508] Trial 298 finished with value: 2.713690431558036 and parameters: {'channels_list': [16, 32, 64], 'kernel_size': 3, 'padding': 1, 'pool_kernel': 2, 'dropout_rate': 0, 'fc_hidden_dim': 256, 'lr': 0.0010347831842610262, 'weight_decay': 6.618996798183705e-06, 'optimizer': 'rmsprop', 'activation': <class 'torch.nn.modules.activation.LeakyReLU'>, 'batchnorm': True, 'epochs': 35, 'batch_size': 32, 'flip_prob': 0.0}. Best is trial 269 with value: 2.690232738856096.
[I 2025-08-04 18:23:45,468] Trial 299 finished with value: 2.7256788330285193 and parameters: {'channels_list': [16, 32, 64], 'kernel_size': 3, 'padding': 1, 'pool_kernel': 2, 'dropout_rate': 0, 'fc_hidden_dim': 256, 'lr': 0.0009671520277682944, 'weight_decay': 1.1986516499905544e-05, 'optimizer': 'rmsprop', 'activation': <class 'torch.nn.modules.activation.LeakyReLU'>, 'batchnorm': True, 'epochs': 35, 'batch_size': 32, 'flip_prob': 0.0}. Best is trial 269 with value: 2.690232738856096.
[I 2025-08-04 18:24:49,128] Trial 300 finished with value: 2.7206882815596853 and parameters: {'channels_list': [16, 32, 64], 'kernel_size': 3, 'padding': 1, 'pool_kernel': 2, 'dropout_rate': 0, 'fc_hidden_dim': 256, 'lr': 0.0010278184124246537, 'weight_decay': 6.601794002666981e-06, 'optimizer': 'rmsprop', 'activation': <class 'torch.nn.modules.activation.LeakyReLU'>, 'batchnorm': True, 'epochs': 35, 'batch_size': 32, 'flip_prob': 0.0}. Best is trial 269 with value: 2.690232738856096.
[I 2025-08-04 18:25:48,400] Trial 301 finished with value: 2.712854770009279 and parameters: {'channels_list': [16, 32, 64], 'kernel_size': 3, 'padding': 1, 'pool_kernel': 2, 'dropout_rate': 0, 'fc_hidden_dim': 256, 'lr': 0.0010231899760186692, 'weight_decay': 6.637089123153542e-06, 'optimizer': 'rmsprop', 'activation': <class 'torch.nn.modules.activation.LeakyReLU'>, 'batchnorm': True, 'epochs': 35, 'batch_size': 32, 'flip_prob': 0.0}. Best is trial 269 with value: 2.690232738856096.
[I 2025-08-04 18:26:28,153] Trial 302 finished with value: 2.744172313158705 and parameters: {'channels_list': [16, 32, 64], 'kernel_size': 3, 'padding': 1, 'pool_kernel': 2, 'dropout_rate': 0, 'fc_hidden_dim': 256, 'lr': 0.001055189190302036, 'weight_decay': 8.154469659320661e-06, 'optimizer': 'rmsprop', 'activation': <class 'torch.nn.modules.activation.LeakyReLU'>, 'batchnorm': True, 'epochs': 35, 'batch_size': 32, 'flip_prob': 0.0}. Best is trial 269 with value: 2.690232738856096.
[I 2025-08-04 18:27:45,838] Trial 303 finished with value: 2.7078170913838937 and parameters: {'channels_list': [16, 32, 64], 'kernel_size': 3, 'padding': 1, 'pool_kernel': 2, 'dropout_rate': 0, 'fc_hidden_dim': 256, 'lr': 0.0011194811470267086, 'weight_decay': 1.06191832512654e-05, 'optimizer': 'rmsprop', 'activation': <class 'torch.nn.modules.activation.LeakyReLU'>, 'batchnorm': True, 'epochs': 35, 'batch_size': 32, 'flip_prob': 0.0}. Best is trial 269 with value: 2.690232738856096.
[I 2025-08-04 18:28:55,177] Trial 304 finished with value: 2.7936001980692975 and parameters: {'channels_list': [16, 32, 64], 'kernel_size': 3, 'padding': 0, 'pool_kernel': 2, 'dropout_rate': 0, 'fc_hidden_dim': 256, 'lr': 0.0011477039567164905, 'weight_decay': 1.065460203629822e-05, 'optimizer': 'rmsprop', 'activation': <class 'torch.nn.modules.activation.LeakyReLU'>, 'batchnorm': True, 'epochs': 35, 'batch_size': 32, 'flip_prob': 0.0}. Best is trial 269 with value: 2.690232738856096.
[I 2025-08-04 18:30:01,701] Trial 305 finished with value: 2.7252057493667694 and parameters: {'channels_list': [16, 32, 64], 'kernel_size': 3, 'padding': 1, 'pool_kernel': 2, 'dropout_rate': 0, 'fc_hidden_dim': 256, 'lr': 0.000966821462305305, 'weight_decay': 5.704697863604409e-06, 'optimizer': 'rmsprop', 'activation': <class 'torch.nn.modules.activation.LeakyReLU'>, 'batchnorm': True, 'epochs': 35, 'batch_size': 32, 'flip_prob': 0.0}. Best is trial 269 with value: 2.690232738856096.
[I 2025-08-04 18:30:43,814] Trial 306 finished with value: 2.7345001772315713 and parameters: {'channels_list': [16, 32, 64], 'kernel_size': 3, 'padding': 1, 'pool_kernel': 2, 'dropout_rate': 0, 'fc_hidden_dim': 256, 'lr': 0.0011814587941835935, 'weight_decay': 6.339273812775942e-06, 'optimizer': 'rmsprop', 'activation': <class 'torch.nn.modules.activation.LeakyReLU'>, 'batchnorm': True, 'epochs': 35, 'batch_size': 32, 'flip_prob': 0.0}. Best is trial 269 with value: 2.690232738856096.
[I 2025-08-04 18:31:04,980] Trial 307 finished with value: 2.7765529863221796 and parameters: {'channels_list': [16, 32, 64], 'kernel_size': 3, 'padding': 1, 'pool_kernel': 2, 'dropout_rate': 0, 'fc_hidden_dim': 256, 'lr': 0.0010175030641567787, 'weight_decay': 7.753477864226676e-06, 'optimizer': 'rmsprop', 'activation': <class 'torch.nn.modules.activation.LeakyReLU'>, 'batchnorm': True, 'epochs': 35, 'batch_size': 64, 'flip_prob': 0.0}. Best is trial 269 with value: 2.690232738856096.
[I 2025-08-04 18:31:05,005] Trial 308 pruned. 
[I 2025-08-04 18:31:47,110] Trial 309 finished with value: 2.7279957320923107 and parameters: {'channels_list': [16, 32, 64], 'kernel_size': 3, 'padding': 1, 'pool_kernel': 2, 'dropout_rate': 0, 'fc_hidden_dim': 256, 'lr': 0.0012125867335282035, 'weight_decay': 6.085375103590459e-06, 'optimizer': 'rmsprop', 'activation': <class 'torch.nn.modules.activation.LeakyReLU'>, 'batchnorm': True, 'epochs': 35, 'batch_size': 32, 'flip_prob': 0.0}. Best is trial 269 with value: 2.690232738856096.
[I 2025-08-04 18:32:50,800] Trial 310 finished with value: 2.72494659308789 and parameters: {'channels_list': [16, 32, 64], 'kernel_size': 3, 'padding': 1, 'pool_kernel': 2, 'dropout_rate': 0, 'fc_hidden_dim': 64, 'lr': 0.0010740421131531352, 'weight_decay': 6.497637910718717e-06, 'optimizer': 'rmsprop', 'activation': <class 'torch.nn.modules.activation.LeakyReLU'>, 'batchnorm': True, 'epochs': 35, 'batch_size': 32, 'flip_prob': 0.0}. Best is trial 269 with value: 2.690232738856096.
[I 2025-08-04 18:33:58,930] Trial 311 finished with value: 2.7079644768603317 and parameters: {'channels_list': [16, 32, 64], 'kernel_size': 3, 'padding': 1, 'pool_kernel': 2, 'dropout_rate': 0, 'fc_hidden_dim': 256, 'lr': 0.0012111568119189534, 'weight_decay': 8.206447760823491e-06, 'optimizer': 'rmsprop', 'activation': <class 'torch.nn.modules.activation.LeakyReLU'>, 'batchnorm': True, 'epochs': 35, 'batch_size': 32, 'flip_prob': 0.0}. Best is trial 269 with value: 2.690232738856096.
[I 2025-08-04 18:34:37,252] Trial 312 finished with value: 2.7467256884810722 and parameters: {'channels_list': [16, 32, 64], 'kernel_size': 3, 'padding': 1, 'pool_kernel': 2, 'dropout_rate': 0, 'fc_hidden_dim': 256, 'lr': 0.0009396977360613657, 'weight_decay': 9.278245291518695e-06, 'optimizer': 'rmsprop', 'activation': <class 'torch.nn.modules.activation.LeakyReLU'>, 'batchnorm': True, 'epochs': 35, 'batch_size': 32, 'flip_prob': 0.0}. Best is trial 269 with value: 2.690232738856096.
[I 2025-08-04 18:35:29,131] Trial 313 finished with value: 2.7250662887053267 and parameters: {'channels_list': [16, 32, 64], 'kernel_size': 3, 'padding': 1, 'pool_kernel': 2, 'dropout_rate': 0, 'fc_hidden_dim': 256, 'lr': 0.001149904928361608, 'weight_decay': 7.849087953077004e-06, 'optimizer': 'rmsprop', 'activation': <class 'torch.nn.modules.activation.LeakyReLU'>, 'batchnorm': True, 'epochs': 35, 'batch_size': 32, 'flip_prob': 0.0}. Best is trial 269 with value: 2.690232738856096.
[I 2025-08-04 18:35:29,159] Trial 314 pruned. 
[I 2025-08-04 18:36:24,420] Trial 315 finished with value: 2.7133951953869535 and parameters: {'channels_list': [16, 32, 64], 'kernel_size': 3, 'padding': 1, 'pool_kernel': 2, 'dropout_rate': 0, 'fc_hidden_dim': 256, 'lr': 0.0012363669763010043, 'weight_decay': 1.3908689716057084e-05, 'optimizer': 'rmsprop', 'activation': <class 'torch.nn.modules.activation.LeakyReLU'>, 'batchnorm': True, 'epochs': 35, 'batch_size': 32, 'flip_prob': 0.0}. Best is trial 269 with value: 2.690232738856096.
[I 2025-08-04 18:37:25,472] Trial 316 finished with value: 2.747487129779719 and parameters: {'channels_list': [16, 32, 64], 'kernel_size': 3, 'padding': 1, 'pool_kernel': 2, 'dropout_rate': 0, 'fc_hidden_dim': 256, 'lr': 0.0011963673275704725, 'weight_decay': 1.080391277867122e-05, 'optimizer': 'rmsprop', 'activation': <class 'torch.nn.modules.activation.LeakyReLU'>, 'batchnorm': True, 'epochs': 35, 'batch_size': 32, 'flip_prob': 0.0}. Best is trial 269 with value: 2.690232738856096.
[I 2025-08-04 18:38:31,716] Trial 317 finished with value: 2.731446552334131 and parameters: {'channels_list': [16, 32, 64], 'kernel_size': 3, 'padding': 1, 'pool_kernel': 2, 'dropout_rate': 0, 'fc_hidden_dim': 256, 'lr': 0.0010895552504134331, 'weight_decay': 7.279593828072088e-06, 'optimizer': 'rmsprop', 'activation': <class 'torch.nn.modules.activation.LeakyReLU'>, 'batchnorm': True, 'epochs': 35, 'batch_size': 32, 'flip_prob': 0.0}. Best is trial 269 with value: 2.690232738856096.
[I 2025-08-04 18:39:36,464] Trial 318 finished with value: 2.7072153684457336 and parameters: {'channels_list': [16, 32, 64], 'kernel_size': 3, 'padding': 1, 'pool_kernel': 2, 'dropout_rate': 0, 'fc_hidden_dim': 256, 'lr': 0.0012532457046551314, 'weight_decay': 1.582025016778074e-05, 'optimizer': 'rmsprop', 'activation': <class 'torch.nn.modules.activation.LeakyReLU'>, 'batchnorm': True, 'epochs': 35, 'batch_size': 32, 'flip_prob': 0.0}. Best is trial 269 with value: 2.690232738856096.
[I 2025-08-04 18:40:06,347] Trial 319 finished with value: 2.853960771813755 and parameters: {'channels_list': [16, 32, 64], 'kernel_size': 3, 'padding': 1, 'pool_kernel': 2, 'dropout_rate': 0, 'fc_hidden_dim': 256, 'lr': 0.0012300585401677664, 'weight_decay': 1.720619780999014e-05, 'optimizer': 'rmsprop', 'activation': <class 'torch.nn.modules.activation.LeakyReLU'>, 'batchnorm': True, 'epochs': 35, 'batch_size': 64, 'flip_prob': 0.0}. Best is trial 269 with value: 2.690232738856096.
[I 2025-08-04 18:41:32,603] Trial 320 finished with value: 2.7111254127810747 and parameters: {'channels_list': [16, 32, 64], 'kernel_size': 3, 'padding': 1, 'pool_kernel': 2, 'dropout_rate': 0, 'fc_hidden_dim': 256, 'lr': 0.0010244966892156667, 'weight_decay': 1.2902116178452251e-05, 'optimizer': 'rmsprop', 'activation': <class 'torch.nn.modules.activation.LeakyReLU'>, 'batchnorm': True, 'epochs': 35, 'batch_size': 32, 'flip_prob': 0.0}. Best is trial 269 with value: 2.690232738856096.
[I 2025-08-04 18:42:44,593] Trial 321 finished with value: 2.7228729433835057 and parameters: {'channels_list': [16, 32, 64], 'kernel_size': 3, 'padding': 1, 'pool_kernel': 2, 'dropout_rate': 0, 'fc_hidden_dim': 256, 'lr': 0.0009030985038517095, 'weight_decay': 9.133725305581268e-06, 'optimizer': 'rmsprop', 'activation': <class 'torch.nn.modules.activation.LeakyReLU'>, 'batchnorm': True, 'epochs': 35, 'batch_size': 32, 'flip_prob': 0.0}. Best is trial 269 with value: 2.690232738856096.
[I 2025-08-04 18:44:21,053] Trial 322 finished with value: 2.730766600492636 and parameters: {'channels_list': [16, 32, 64], 'kernel_size': 3, 'padding': 1, 'pool_kernel': 2, 'dropout_rate': 0, 'fc_hidden_dim': 256, 'lr': 0.0009898569603749015, 'weight_decay': 1.2780528886572278e-05, 'optimizer': 'rmsprop', 'activation': <class 'torch.nn.modules.activation.LeakyReLU'>, 'batchnorm': True, 'epochs': 35, 'batch_size': 32, 'flip_prob': 0.0}. Best is trial 269 with value: 2.690232738856096.
[I 2025-08-04 18:45:10,930] Trial 323 finished with value: 2.742595114840242 and parameters: {'channels_list': [16, 32, 64], 'kernel_size': 3, 'padding': 1, 'pool_kernel': 2, 'dropout_rate': 0, 'fc_hidden_dim': 256, 'lr': 0.001058453796767086, 'weight_decay': 1.4651231966884885e-05, 'optimizer': 'rmsprop', 'activation': <class 'torch.nn.modules.activation.LeakyReLU'>, 'batchnorm': True, 'epochs': 35, 'batch_size': 32, 'flip_prob': 0.0}. Best is trial 269 with value: 2.690232738856096.
[I 2025-08-04 18:46:16,846] Trial 324 finished with value: 2.8022089430736545 and parameters: {'channels_list': [16, 32, 64], 'kernel_size': 3, 'padding': 0, 'pool_kernel': 2, 'dropout_rate': 0, 'fc_hidden_dim': 256, 'lr': 0.0011505203918805342, 'weight_decay': 1.3029509609315962e-05, 'optimizer': 'rmsprop', 'activation': <class 'torch.nn.modules.activation.LeakyReLU'>, 'batchnorm': True, 'epochs': 35, 'batch_size': 32, 'flip_prob': 0.0}. Best is trial 269 with value: 2.690232738856096.
[I 2025-08-04 18:47:11,429] Trial 325 finished with value: 2.735680044804609 and parameters: {'channels_list': [16, 32, 64], 'kernel_size': 3, 'padding': 1, 'pool_kernel': 2, 'dropout_rate': 0, 'fc_hidden_dim': 256, 'lr': 0.001223388063823905, 'weight_decay': 1.893973368406508e-05, 'optimizer': 'rmsprop', 'activation': <class 'torch.nn.modules.activation.LeakyReLU'>, 'batchnorm': True, 'epochs': 35, 'batch_size': 32, 'flip_prob': 0.0}. Best is trial 269 with value: 2.690232738856096.
[I 2025-08-04 18:48:14,806] Trial 326 finished with value: 2.715165033846626 and parameters: {'channels_list': [16, 32, 64], 'kernel_size': 3, 'padding': 1, 'pool_kernel': 2, 'dropout_rate': 0, 'fc_hidden_dim': 256, 'lr': 0.0010836067993863165, 'weight_decay': 1.3685647768849689e-05, 'optimizer': 'rmsprop', 'activation': <class 'torch.nn.modules.activation.LeakyReLU'>, 'batchnorm': True, 'epochs': 35, 'batch_size': 32, 'flip_prob': 0.0}. Best is trial 269 with value: 2.690232738856096.
[I 2025-08-04 18:48:14,831] Trial 327 pruned. 
[I 2025-08-04 18:48:40,157] Trial 328 finished with value: 2.7764000911620617 and parameters: {'channels_list': [16, 32, 64], 'kernel_size': 3, 'padding': 1, 'pool_kernel': 2, 'dropout_rate': 0, 'fc_hidden_dim': 256, 'lr': 0.000996125525974266, 'weight_decay': 1.178510035827115e-05, 'optimizer': 'rmsprop', 'activation': <class 'torch.nn.modules.activation.LeakyReLU'>, 'batchnorm': True, 'epochs': 35, 'batch_size': 32, 'flip_prob': 0.0}. Best is trial 269 with value: 2.690232738856096.
[I 2025-08-04 18:49:59,441] Trial 329 finished with value: 2.735375422936728 and parameters: {'channels_list': [16, 32, 64], 'kernel_size': 3, 'padding': 1, 'pool_kernel': 2, 'dropout_rate': 0, 'fc_hidden_dim': 256, 'lr': 0.001273791388816938, 'weight_decay': 2.2068020649662552e-05, 'optimizer': 'rmsprop', 'activation': <class 'torch.nn.modules.activation.LeakyReLU'>, 'batchnorm': True, 'epochs': 35, 'batch_size': 32, 'flip_prob': 0.0}. Best is trial 269 with value: 2.690232738856096.
[I 2025-08-04 18:51:00,062] Trial 330 finished with value: 2.75034403191257 and parameters: {'channels_list': [16, 32, 64], 'kernel_size': 3, 'padding': 1, 'pool_kernel': 2, 'dropout_rate': 0, 'fc_hidden_dim': 256, 'lr': 0.0010756941416978358, 'weight_decay': 1.338383056885099e-05, 'optimizer': 'rmsprop', 'activation': <class 'torch.nn.modules.activation.LeakyReLU'>, 'batchnorm': True, 'epochs': 35, 'batch_size': 32, 'flip_prob': 0.0}. Best is trial 269 with value: 2.690232738856096.
[I 2025-08-04 18:51:34,397] Trial 331 finished with value: 2.7347120881512024 and parameters: {'channels_list': [16, 32, 64], 'kernel_size': 3, 'padding': 1, 'pool_kernel': 2, 'dropout_rate': 0, 'fc_hidden_dim': 256, 'lr': 0.0012509074718870725, 'weight_decay': 9.524801239105554e-06, 'optimizer': 'rmsprop', 'activation': <class 'torch.nn.modules.activation.LeakyReLU'>, 'batchnorm': True, 'epochs': 35, 'batch_size': 64, 'flip_prob': 0.0}. Best is trial 269 with value: 2.690232738856096.
[I 2025-08-04 18:52:54,447] Trial 332 finished with value: 2.6997691408141242 and parameters: {'channels_list': [16, 32, 64], 'kernel_size': 3, 'padding': 1, 'pool_kernel': 2, 'dropout_rate': 0, 'fc_hidden_dim': 256, 'lr': 0.00095687003320487, 'weight_decay': 7.528477746657816e-06, 'optimizer': 'rmsprop', 'activation': <class 'torch.nn.modules.activation.LeakyReLU'>, 'batchnorm': True, 'epochs': 35, 'batch_size': 32, 'flip_prob': 0.0}. Best is trial 269 with value: 2.690232738856096.
[I 2025-08-04 18:53:40,816] Trial 333 finished with value: 2.7518359454031875 and parameters: {'channels_list': [16, 32, 64], 'kernel_size': 3, 'padding': 1, 'pool_kernel': 2, 'dropout_rate': 0, 'fc_hidden_dim': 64, 'lr': 0.000901316683118917, 'weight_decay': 8.538220272796775e-06, 'optimizer': 'rmsprop', 'activation': <class 'torch.nn.modules.activation.LeakyReLU'>, 'batchnorm': True, 'epochs': 35, 'batch_size': 32, 'flip_prob': 0.0}. Best is trial 269 with value: 2.690232738856096.
[I 2025-08-04 18:54:28,371] Trial 334 finished with value: 2.7292880065766116 and parameters: {'channels_list': [16, 32, 64], 'kernel_size': 3, 'padding': 1, 'pool_kernel': 2, 'dropout_rate': 0, 'fc_hidden_dim': 256, 'lr': 0.0010361380763626695, 'weight_decay': 7.211636140382273e-06, 'optimizer': 'rmsprop', 'activation': <class 'torch.nn.modules.activation.LeakyReLU'>, 'batchnorm': True, 'epochs': 35, 'batch_size': 32, 'flip_prob': 0.0}. Best is trial 269 with value: 2.690232738856096.
[I 2025-08-04 18:55:29,219] Trial 335 finished with value: 2.7365044671462444 and parameters: {'channels_list': [16, 32, 64], 'kernel_size': 3, 'padding': 1, 'pool_kernel': 2, 'dropout_rate': 0, 'fc_hidden_dim': 256, 'lr': 0.0011174101028802023, 'weight_decay': 5.867480116485601e-06, 'optimizer': 'rmsprop', 'activation': <class 'torch.nn.modules.activation.LeakyReLU'>, 'batchnorm': True, 'epochs': 35, 'batch_size': 32, 'flip_prob': 0.0}. Best is trial 269 with value: 2.690232738856096.
[I 2025-08-04 18:55:29,245] Trial 336 pruned. 
[I 2025-08-04 18:56:21,998] Trial 337 finished with value: 2.7277515780077337 and parameters: {'channels_list': [16, 32, 64], 'kernel_size': 3, 'padding': 1, 'pool_kernel': 2, 'dropout_rate': 0, 'fc_hidden_dim': 256, 'lr': 0.0012194909899771842, 'weight_decay': 3.304223554067348e-05, 'optimizer': 'rmsprop', 'activation': <class 'torch.nn.modules.activation.LeakyReLU'>, 'batchnorm': True, 'epochs': 35, 'batch_size': 32, 'flip_prob': 0.0}. Best is trial 269 with value: 2.690232738856096.
[I 2025-08-04 18:57:31,195] Trial 338 finished with value: 2.7247315997525203 and parameters: {'channels_list': [16, 32, 64], 'kernel_size': 3, 'padding': 1, 'pool_kernel': 2, 'dropout_rate': 0, 'fc_hidden_dim': 256, 'lr': 0.001137522723104171, 'weight_decay': 1.7802233212457683e-05, 'optimizer': 'rmsprop', 'activation': <class 'torch.nn.modules.activation.LeakyReLU'>, 'batchnorm': True, 'epochs': 35, 'batch_size': 32, 'flip_prob': 0.0}. Best is trial 269 with value: 2.690232738856096.
[I 2025-08-04 18:58:20,896] Trial 339 finished with value: 2.7118956653861863 and parameters: {'channels_list': [16, 32, 64], 'kernel_size': 3, 'padding': 1, 'pool_kernel': 2, 'dropout_rate': 0, 'fc_hidden_dim': 256, 'lr': 0.0010047942069941612, 'weight_decay': 6.790877986820082e-06, 'optimizer': 'rmsprop', 'activation': <class 'torch.nn.modules.activation.LeakyReLU'>, 'batchnorm': True, 'epochs': 35, 'batch_size': 32, 'flip_prob': 0.0}. Best is trial 269 with value: 2.690232738856096.
[I 2025-08-04 18:59:10,999] Trial 340 finished with value: 2.71935282541558 and parameters: {'channels_list': [16, 32, 64], 'kernel_size': 3, 'padding': 1, 'pool_kernel': 2, 'dropout_rate': 0, 'fc_hidden_dim': 256, 'lr': 0.0009654012283565815, 'weight_decay': 7.170598917713237e-06, 'optimizer': 'rmsprop', 'activation': <class 'torch.nn.modules.activation.LeakyReLU'>, 'batchnorm': True, 'epochs': 35, 'batch_size': 32, 'flip_prob': 0.0}. Best is trial 269 with value: 2.690232738856096.
[I 2025-08-04 18:59:50,001] Trial 341 finished with value: 2.73851792475858 and parameters: {'channels_list': [16, 32, 64], 'kernel_size': 3, 'padding': 1, 'pool_kernel': 2, 'dropout_rate': 0, 'fc_hidden_dim': 256, 'lr': 0.0009982770311554028, 'weight_decay': 5.283827789724992e-06, 'optimizer': 'rmsprop', 'activation': <class 'torch.nn.modules.activation.LeakyReLU'>, 'batchnorm': True, 'epochs': 35, 'batch_size': 32, 'flip_prob': 0.0}. Best is trial 269 with value: 2.690232738856096.
