[I 2025-08-04 15:44:01,370] Trial 104 finished with value: 2.74902169736073 and parameters: {'channels_list': [16, 32, 64, 128], 'kernel_size': 3, 'padding': 1, 'pool_kernel': 2, 'dropout_rate': 0, 'fc_hidden_dim': 256, 'lr': 0.000990026677955632, 'weight_decay': 0.008511732672261336, 'optimizer': 'sgd', 'activation': <class 'torch.nn.modules.activation.ReLU'>, 'batchnorm': True, 'epochs': 35, 'batch_size': 32, 'flip_prob': 0.0}. Best is trial 47 with value: 2.711872135169256.
[I 2025-08-04 15:45:03,620] Trial 105 finished with value: 2.743733644830591 and parameters: {'channels_list': [16, 32, 64], 'kernel_size': 3, 'padding': 1, 'pool_kernel': 2, 'dropout_rate': 0, 'fc_hidden_dim': 256, 'lr': 0.000795324520693163, 'weight_decay': 0.0001779853138280076, 'optimizer': 'sgd', 'activation': <class 'torch.nn.modules.activation.ReLU'>, 'batchnorm': True, 'epochs': 35, 'batch_size': 32, 'flip_prob': 0.0}. Best is trial 47 with value: 2.711872135169256.
[I 2025-08-04 15:45:38,967] Trial 106 finished with value: 2.759924431732969 and parameters: {'channels_list': [32, 64, 128], 'kernel_size': 3, 'padding': 1, 'pool_kernel': 2, 'dropout_rate': 0, 'fc_hidden_dim': 256, 'lr': 0.0008606243267301453, 'weight_decay': 0.0031437468046768232, 'optimizer': 'sgd', 'activation': <class 'torch.nn.modules.activation.ReLU'>, 'batchnorm': True, 'epochs': 35, 'batch_size': 32, 'flip_prob': 0.0}. Best is trial 47 with value: 2.711872135169256.
[I 2025-08-04 15:45:53,281] Trial 107 finished with value: 2.819395153715182 and parameters: {'channels_list': [16, 32, 64, 128], 'kernel_size': 3, 'padding': 1, 'pool_kernel': 2, 'dropout_rate': 0, 'fc_hidden_dim': 64, 'lr': 0.0014799377420935123, 'weight_decay': 0.0017443404021672438, 'optimizer': 'sgd', 'activation': <class 'torch.nn.modules.activation.ReLU'>, 'batchnorm': True, 'epochs': 35, 'batch_size': 128, 'flip_prob': 0.0}. Best is trial 47 with value: 2.711872135169256.
[I 2025-08-04 15:45:53,298] Trial 108 pruned. 
[I 2025-08-04 15:46:36,947] Trial 109 finished with value: 2.7823168158099794 and parameters: {'channels_list': [32, 64, 128], 'kernel_size': 3, 'padding': 1, 'pool_kernel': 2, 'dropout_rate': 0, 'fc_hidden_dim': 256, 'lr': 0.005078419559368516, 'weight_decay': 0.009808114418489701, 'optimizer': 'rmsprop', 'activation': <class 'torch.nn.modules.activation.ReLU'>, 'batchnorm': True, 'epochs': 35, 'batch_size': 128, 'flip_prob': 0.0}. Best is trial 47 with value: 2.711872135169256.
[I 2025-08-04 15:47:28,619] Trial 110 finished with value: 2.752480082805252 and parameters: {'channels_list': [16, 32, 64], 'kernel_size': 3, 'padding': 1, 'pool_kernel': 2, 'dropout_rate': 0, 'fc_hidden_dim': 256, 'lr': 0.0016574867361201975, 'weight_decay': 0.005280668234077341, 'optimizer': 'sgd', 'activation': <class 'torch.nn.modules.activation.ReLU'>, 'batchnorm': True, 'epochs': 35, 'batch_size': 32, 'flip_prob': 0.0}. Best is trial 47 with value: 2.711872135169256.
[I 2025-08-04 15:48:14,984] Trial 111 finished with value: 2.7368997866627103 and parameters: {'channels_list': [16, 32, 64], 'kernel_size': 3, 'padding': 1, 'pool_kernel': 2, 'dropout_rate': 0, 'fc_hidden_dim': 256, 'lr': 0.0005033480627761925, 'weight_decay': 0.00020099209108595775, 'optimizer': 'sgd', 'activation': <class 'torch.nn.modules.activation.ReLU'>, 'batchnorm': True, 'epochs': 35, 'batch_size': 32, 'flip_prob': 0.0}. Best is trial 47 with value: 2.711872135169256.
[I 2025-08-04 15:49:11,474] Trial 112 finished with value: 2.7615151951195105 and parameters: {'channels_list': [16, 32, 64], 'kernel_size': 3, 'padding': 1, 'pool_kernel': 2, 'dropout_rate': 0, 'fc_hidden_dim': 256, 'lr': 0.0002900142868148462, 'weight_decay': 8.974579333881608e-05, 'optimizer': 'sgd', 'activation': <class 'torch.nn.modules.activation.ReLU'>, 'batchnorm': True, 'epochs': 35, 'batch_size': 32, 'flip_prob': 0.0}. Best is trial 47 with value: 2.711872135169256.
[I 2025-08-04 15:50:03,095] Trial 113 finished with value: 2.7743383057298647 and parameters: {'channels_list': [16, 32, 64], 'kernel_size': 3, 'padding': 1, 'pool_kernel': 2, 'dropout_rate': 0, 'fc_hidden_dim': 256, 'lr': 0.000487907221226045, 'weight_decay': 0.004535379202400423, 'optimizer': 'sgd', 'activation': <class 'torch.nn.modules.activation.ReLU'>, 'batchnorm': True, 'epochs': 35, 'batch_size': 32, 'flip_prob': 0.0}. Best is trial 47 with value: 2.711872135169256.
[I 2025-08-04 15:51:17,293] Trial 114 finished with value: 2.776225439343148 and parameters: {'channels_list': [16, 32, 64], 'kernel_size': 3, 'padding': 1, 'pool_kernel': 2, 'dropout_rate': 0, 'fc_hidden_dim': 256, 'lr': 0.00038500942766098384, 'weight_decay': 7.094536101232624e-05, 'optimizer': 'sgd', 'activation': <class 'torch.nn.modules.activation.ReLU'>, 'batchnorm': True, 'epochs': 35, 'batch_size': 32, 'flip_prob': 0.0}. Best is trial 47 with value: 2.711872135169256.
[I 2025-08-04 15:52:25,382] Trial 115 finished with value: 2.755690933855653 and parameters: {'channels_list': [16, 32, 64], 'kernel_size': 3, 'padding': 1, 'pool_kernel': 2, 'dropout_rate': 0, 'fc_hidden_dim': 256, 'lr': 0.001171016982381292, 'weight_decay': 0.0003393698917745767, 'optimizer': 'sgd', 'activation': <class 'torch.nn.modules.activation.ReLU'>, 'batchnorm': True, 'epochs': 35, 'batch_size': 32, 'flip_prob': 0.0}. Best is trial 47 with value: 2.711872135169256.
[I 2025-08-04 15:52:38,201] Trial 116 finished with value: 2.9715768992972746 and parameters: {'channels_list': [32, 64, 128], 'kernel_size': 3, 'padding': 1, 'pool_kernel': 2, 'dropout_rate': 0, 'fc_hidden_dim': 256, 'lr': 0.0005300870959619613, 'weight_decay': 0.006970440265545815, 'optimizer': 'sgd', 'activation': <class 'torch.nn.modules.activation.ReLU'>, 'batchnorm': True, 'epochs': 35, 'batch_size': 128, 'flip_prob': 0.0}. Best is trial 47 with value: 2.711872135169256.
[I 2025-08-04 15:52:38,220] Trial 117 pruned. 
[I 2025-08-04 15:53:27,859] Trial 118 finished with value: 2.785127035987679 and parameters: {'channels_list': [32, 64], 'kernel_size': 3, 'padding': 1, 'pool_kernel': 3, 'dropout_rate': 0, 'fc_hidden_dim': 256, 'lr': 0.00023723254133824467, 'weight_decay': 0.0006669622495599668, 'optimizer': 'rmsprop', 'activation': <class 'torch.nn.modules.activation.ReLU'>, 'batchnorm': True, 'epochs': 35, 'batch_size': 32, 'flip_prob': 0.0}. Best is trial 47 with value: 2.711872135169256.
[I 2025-08-04 15:53:45,246] Trial 119 finished with value: 2.775717288363541 and parameters: {'channels_list': [16, 32, 64], 'kernel_size': 3, 'padding': 1, 'pool_kernel': 2, 'dropout_rate': 0, 'fc_hidden_dim': 256, 'lr': 0.0022637885701278404, 'weight_decay': 0.00821555083465721, 'optimizer': 'sgd', 'activation': <class 'torch.nn.modules.activation.ReLU'>, 'batchnorm': True, 'epochs': 35, 'batch_size': 128, 'flip_prob': 0.0}. Best is trial 47 with value: 2.711872135169256.
[I 2025-08-04 15:54:07,294] Trial 120 finished with value: 2.8596740867030346 and parameters: {'channels_list': [32, 64, 128], 'kernel_size': 3, 'padding': 1, 'pool_kernel': 2, 'dropout_rate': 0, 'fc_hidden_dim': 64, 'lr': 0.0008843500020691031, 'weight_decay': 1.9916251720797947e-06, 'optimizer': 'sgd', 'activation': <class 'torch.nn.modules.activation.ReLU'>, 'batchnorm': True, 'epochs': 35, 'batch_size': 32, 'flip_prob': 0.0}. Best is trial 47 with value: 2.711872135169256.
[I 2025-08-04 15:54:42,830] Trial 121 finished with value: 2.775575532499067 and parameters: {'channels_list': [16, 32, 64], 'kernel_size': 3, 'padding': 1, 'pool_kernel': 2, 'dropout_rate': 0, 'fc_hidden_dim': 256, 'lr': 0.0007794834266530589, 'weight_decay': 0.00012237176673972257, 'optimizer': 'sgd', 'activation': <class 'torch.nn.modules.activation.ReLU'>, 'batchnorm': True, 'epochs': 35, 'batch_size': 32, 'flip_prob': 0.0}. Best is trial 47 with value: 2.711872135169256.
[I 2025-08-04 15:55:10,249] Trial 122 finished with value: 2.814868388101189 and parameters: {'channels_list': [16, 32, 64], 'kernel_size': 3, 'padding': 1, 'pool_kernel': 2, 'dropout_rate': 0, 'fc_hidden_dim': 256, 'lr': 0.0007248030877259876, 'weight_decay': 0.00014110988110494396, 'optimizer': 'sgd', 'activation': <class 'torch.nn.modules.activation.ReLU'>, 'batchnorm': True, 'epochs': 35, 'batch_size': 32, 'flip_prob': 0.0}. Best is trial 47 with value: 2.711872135169256.
[I 2025-08-04 15:55:45,077] Trial 123 finished with value: 2.795996993413449 and parameters: {'channels_list': [16, 32, 64], 'kernel_size': 3, 'padding': 1, 'pool_kernel': 2, 'dropout_rate': 0, 'fc_hidden_dim': 256, 'lr': 0.0009585074630710591, 'weight_decay': 0.00020100894804234542, 'optimizer': 'sgd', 'activation': <class 'torch.nn.modules.activation.ReLU'>, 'batchnorm': True, 'epochs': 35, 'batch_size': 32, 'flip_prob': 0.0}. Best is trial 47 with value: 2.711872135169256.
[I 2025-08-04 15:56:48,342] Trial 124 finished with value: 2.7432121124428632 and parameters: {'channels_list': [16, 32, 64], 'kernel_size': 3, 'padding': 1, 'pool_kernel': 2, 'dropout_rate': 0, 'fc_hidden_dim': 256, 'lr': 0.0008078287200721485, 'weight_decay': 0.000201760011546513, 'optimizer': 'sgd', 'activation': <class 'torch.nn.modules.activation.ReLU'>, 'batchnorm': True, 'epochs': 35, 'batch_size': 32, 'flip_prob': 0.0}. Best is trial 47 with value: 2.711872135169256.
[I 2025-08-04 15:57:04,240] Trial 125 finished with value: 2.8752481835598824 and parameters: {'channels_list': [16, 32, 64], 'kernel_size': 3, 'padding': 1, 'pool_kernel': 2, 'dropout_rate': 0, 'fc_hidden_dim': 256, 'lr': 0.0010578751415558857, 'weight_decay': 0.0011125690489246966, 'optimizer': 'sgd', 'activation': <class 'torch.nn.modules.activation.ReLU'>, 'batchnorm': True, 'epochs': 35, 'batch_size': 64, 'flip_prob': 0.0}. Best is trial 47 with value: 2.711872135169256.
[I 2025-08-04 15:58:02,031] Trial 126 finished with value: 2.787710852732273 and parameters: {'channels_list': [32, 64], 'kernel_size': 7, 'padding': 1, 'pool_kernel': 2, 'dropout_rate': 0, 'fc_hidden_dim': 256, 'lr': 0.0012504854891458182, 'weight_decay': 2.7853056692364164e-05, 'optimizer': 'sgd', 'activation': <class 'torch.nn.modules.activation.ReLU'>, 'batchnorm': True, 'epochs': 35, 'batch_size': 32, 'flip_prob': 0.0}. Best is trial 47 with value: 2.711872135169256.
[I 2025-08-04 15:58:11,931] Trial 127 finished with value: 2.9678215096454137 and parameters: {'channels_list': [32, 64], 'kernel_size': 3, 'padding': 1, 'pool_kernel': 2, 'dropout_rate': 0, 'fc_hidden_dim': 256, 'lr': 0.0009403054673293121, 'weight_decay': 0.0022141503280334414, 'optimizer': 'adam', 'activation': <class 'torch.nn.modules.activation.ReLU'>, 'batchnorm': True, 'epochs': 35, 'batch_size': 128, 'flip_prob': 0.0}. Best is trial 47 with value: 2.711872135169256.
[I 2025-08-04 15:58:53,644] Trial 128 finished with value: 2.759775628571919 and parameters: {'channels_list': [16, 32, 64], 'kernel_size': 5, 'padding': 1, 'pool_kernel': 2, 'dropout_rate': 0, 'fc_hidden_dim': 128, 'lr': 0.0033657068634001678, 'weight_decay': 0.0002724634352312948, 'optimizer': 'sgd', 'activation': <class 'torch.nn.modules.activation.ReLU'>, 'batchnorm': True, 'epochs': 35, 'batch_size': 64, 'flip_prob': 0.0}. Best is trial 47 with value: 2.711872135169256.
[I 2025-08-04 15:59:49,265] Trial 129 finished with value: 2.7602190703908556 and parameters: {'channels_list': [32, 64], 'kernel_size': 3, 'padding': 1, 'pool_kernel': 2, 'dropout_rate': 0, 'fc_hidden_dim': 256, 'lr': 0.005946079313770477, 'weight_decay': 5.055213177469868e-05, 'optimizer': 'rmsprop', 'activation': <class 'torch.nn.modules.activation.ReLU'>, 'batchnorm': True, 'epochs': 35, 'batch_size': 32, 'flip_prob': 0.0}. Best is trial 47 with value: 2.711872135169256.
[I 2025-08-04 16:00:34,516] Trial 130 finished with value: 2.7524973573097995 and parameters: {'channels_list': [16, 32, 64, 128], 'kernel_size': 3, 'padding': 1, 'pool_kernel': 2, 'dropout_rate': 0, 'fc_hidden_dim': 256, 'lr': 0.008608665221371388, 'weight_decay': 0.00041880299598879287, 'optimizer': 'sgd', 'activation': <class 'torch.nn.modules.activation.ReLU'>, 'batchnorm': True, 'epochs': 35, 'batch_size': 32, 'flip_prob': 0.0}. Best is trial 47 with value: 2.711872135169256.
[I 2025-08-04 16:01:18,280] Trial 131 finished with value: 2.750287801020108 and parameters: {'channels_list': [16, 32, 64], 'kernel_size': 3, 'padding': 1, 'pool_kernel': 2, 'dropout_rate': 0, 'fc_hidden_dim': 256, 'lr': 0.0008482380183990984, 'weight_decay': 0.0001729997867410516, 'optimizer': 'sgd', 'activation': <class 'torch.nn.modules.activation.ReLU'>, 'batchnorm': True, 'epochs': 35, 'batch_size': 32, 'flip_prob': 0.0}. Best is trial 47 with value: 2.711872135169256.
[I 2025-08-04 16:01:48,430] Trial 132 finished with value: 2.8003854168913764 and parameters: {'channels_list': [16, 32, 64], 'kernel_size': 3, 'padding': 1, 'pool_kernel': 2, 'dropout_rate': 0, 'fc_hidden_dim': 256, 'lr': 0.0007832971939073414, 'weight_decay': 0.00016684725766395736, 'optimizer': 'sgd', 'activation': <class 'torch.nn.modules.activation.ReLU'>, 'batchnorm': True, 'epochs': 35, 'batch_size': 32, 'flip_prob': 0.0}. Best is trial 47 with value: 2.711872135169256.
[I 2025-08-04 16:02:46,049] Trial 133 finished with value: 2.747247190153354 and parameters: {'channels_list': [16, 32, 64], 'kernel_size': 3, 'padding': 1, 'pool_kernel': 2, 'dropout_rate': 0, 'fc_hidden_dim': 256, 'lr': 0.0005945686125278212, 'weight_decay': 0.00028330124727089936, 'optimizer': 'sgd', 'activation': <class 'torch.nn.modules.activation.ReLU'>, 'batchnorm': True, 'epochs': 35, 'batch_size': 32, 'flip_prob': 0.0}. Best is trial 47 with value: 2.711872135169256.
[I 2025-08-04 16:04:10,059] Trial 134 finished with value: 2.7542696406959193 and parameters: {'channels_list': [16, 32, 64], 'kernel_size': 3, 'padding': 1, 'pool_kernel': 2, 'dropout_rate': 0, 'fc_hidden_dim': 256, 'lr': 0.0006564598474565827, 'weight_decay': 0.0002343834705433574, 'optimizer': 'sgd', 'activation': <class 'torch.nn.modules.activation.ReLU'>, 'batchnorm': True, 'epochs': 35, 'batch_size': 32, 'flip_prob': 0.0}. Best is trial 47 with value: 2.711872135169256.
[I 2025-08-04 16:05:17,916] Trial 135 finished with value: 2.7515183068587206 and parameters: {'channels_list': [16, 32, 64], 'kernel_size': 3, 'padding': 1, 'pool_kernel': 2, 'dropout_rate': 0, 'fc_hidden_dim': 256, 'lr': 0.0011158859258264297, 'weight_decay': 0.0005273636843137432, 'optimizer': 'sgd', 'activation': <class 'torch.nn.modules.activation.ReLU'>, 'batchnorm': True, 'epochs': 35, 'batch_size': 32, 'flip_prob': 0.0}. Best is trial 47 with value: 2.711872135169256.
[I 2025-08-04 16:05:58,513] Trial 136 finished with value: 2.780794642141271 and parameters: {'channels_list': [32, 64, 128], 'kernel_size': 5, 'padding': 1, 'pool_kernel': 2, 'dropout_rate': 0, 'fc_hidden_dim': 128, 'lr': 0.0005167219597383756, 'weight_decay': 0.007687325260485119, 'optimizer': 'sgd', 'activation': <class 'torch.nn.modules.activation.ReLU'>, 'batchnorm': True, 'epochs': 35, 'batch_size': 64, 'flip_prob': 0.0}. Best is trial 47 with value: 2.711872135169256.
[I 2025-08-04 16:06:21,599] Trial 137 finished with value: 2.9084525999315396 and parameters: {'channels_list': [32, 64], 'kernel_size': 3, 'padding': 0, 'pool_kernel': 2, 'dropout_rate': 0, 'fc_hidden_dim': 256, 'lr': 0.002019843331187855, 'weight_decay': 0.009615687203483334, 'optimizer': 'adam', 'activation': <class 'torch.nn.modules.activation.ReLU'>, 'batchnorm': True, 'epochs': 35, 'batch_size': 128, 'flip_prob': 0.0}. Best is trial 47 with value: 2.711872135169256.
[I 2025-08-04 16:07:07,868] Trial 138 finished with value: 2.748518768179402 and parameters: {'channels_list': [16, 32, 64], 'kernel_size': 3, 'padding': 1, 'pool_kernel': 2, 'dropout_rate': 0, 'fc_hidden_dim': 256, 'lr': 0.0008251974240119766, 'weight_decay': 0.006530044890024953, 'optimizer': 'sgd', 'activation': <class 'torch.nn.modules.activation.ReLU'>, 'batchnorm': True, 'epochs': 35, 'batch_size': 32, 'flip_prob': 0.0}. Best is trial 47 with value: 2.711872135169256.
[I 2025-08-04 16:08:25,237] Trial 139 finished with value: 2.7733964710097547 and parameters: {'channels_list': [32, 64], 'kernel_size': 3, 'padding': 1, 'pool_kernel': 3, 'dropout_rate': 0, 'fc_hidden_dim': 256, 'lr': 0.0007016186673921105, 'weight_decay': 0.003757767591092536, 'optimizer': 'sgd', 'activation': <class 'torch.nn.modules.activation.ReLU'>, 'batchnorm': True, 'epochs': 35, 'batch_size': 32, 'flip_prob': 0.0}. Best is trial 47 with value: 2.711872135169256.
[I 2025-08-04 16:08:52,361] Trial 140 finished with value: 2.7538178029767852 and parameters: {'channels_list': [16, 32, 64, 128], 'kernel_size': 3, 'padding': 1, 'pool_kernel': 2, 'dropout_rate': 0, 'fc_hidden_dim': 256, 'lr': 0.0013993602146433327, 'weight_decay': 9.611794102491538e-05, 'optimizer': 'sgd', 'activation': <class 'torch.nn.modules.activation.ReLU'>, 'batchnorm': True, 'epochs': 35, 'batch_size': 64, 'flip_prob': 0.0}. Best is trial 47 with value: 2.711872135169256.
[I 2025-08-04 16:09:52,651] Trial 141 finished with value: 2.730425046120104 and parameters: {'channels_list': [32, 64], 'kernel_size': 3, 'padding': 1, 'pool_kernel': 2, 'dropout_rate': 0, 'fc_hidden_dim': 256, 'lr': 0.003499573462334547, 'weight_decay': 0.0077599865271106155, 'optimizer': 'sgd', 'activation': <class 'torch.nn.modules.activation.ReLU'>, 'batchnorm': True, 'epochs': 35, 'batch_size': 32, 'flip_prob': 0.0}. Best is trial 47 with value: 2.711872135169256.
[I 2025-08-04 16:11:05,089] Trial 142 finished with value: 2.7519313348073005 and parameters: {'channels_list': [32, 64], 'kernel_size': 3, 'padding': 1, 'pool_kernel': 2, 'dropout_rate': 0, 'fc_hidden_dim': 256, 'lr': 0.007082066419932663, 'weight_decay': 0.005211614788280755, 'optimizer': 'sgd', 'activation': <class 'torch.nn.modules.activation.ReLU'>, 'batchnorm': True, 'epochs': 35, 'batch_size': 32, 'flip_prob': 0.0}. Best is trial 47 with value: 2.711872135169256.
[I 2025-08-04 16:12:00,041] Trial 143 finished with value: 2.7750161677706804 and parameters: {'channels_list': [32, 64], 'kernel_size': 3, 'padding': 1, 'pool_kernel': 2, 'dropout_rate': 0, 'fc_hidden_dim': 256, 'lr': 0.004094244978662427, 'weight_decay': 0.00814934398557579, 'optimizer': 'sgd', 'activation': <class 'torch.nn.modules.activation.ReLU'>, 'batchnorm': True, 'epochs': 35, 'batch_size': 32, 'flip_prob': 0.0}. Best is trial 47 with value: 2.711872135169256.
[I 2025-08-04 16:13:09,986] Trial 144 finished with value: 2.7499620556687563 and parameters: {'channels_list': [32, 64], 'kernel_size': 3, 'padding': 1, 'pool_kernel': 2, 'dropout_rate': 0, 'fc_hidden_dim': 256, 'lr': 0.0030002436402243138, 'weight_decay': 0.006148438057370913, 'optimizer': 'sgd', 'activation': <class 'torch.nn.modules.activation.ReLU'>, 'batchnorm': True, 'epochs': 35, 'batch_size': 32, 'flip_prob': 0.0}. Best is trial 47 with value: 2.711872135169256.
[I 2025-08-04 16:14:07,559] Trial 145 finished with value: 2.7546895050743663 and parameters: {'channels_list': [32, 64], 'kernel_size': 3, 'padding': 1, 'pool_kernel': 2, 'dropout_rate': 0, 'fc_hidden_dim': 256, 'lr': 0.0046797934416303, 'weight_decay': 0.0009056253271384678, 'optimizer': 'sgd', 'activation': <class 'torch.nn.modules.activation.ReLU'>, 'batchnorm': True, 'epochs': 35, 'batch_size': 32, 'flip_prob': 0.0}. Best is trial 47 with value: 2.711872135169256.
[I 2025-08-04 16:14:25,207] Trial 146 finished with value: 2.817820418269269 and parameters: {'channels_list': [32, 64, 128], 'kernel_size': 5, 'padding': 1, 'pool_kernel': 2, 'dropout_rate': 0, 'fc_hidden_dim': 128, 'lr': 0.00101967810461642, 'weight_decay': 0.004507909175602969, 'optimizer': 'adam', 'activation': <class 'torch.nn.modules.activation.ReLU'>, 'batchnorm': True, 'epochs': 35, 'batch_size': 128, 'flip_prob': 0.0}. Best is trial 47 with value: 2.711872135169256.
[I 2025-08-04 16:15:54,163] Trial 147 finished with value: 2.7926631015805197 and parameters: {'channels_list': [32, 64], 'kernel_size': 3, 'padding': 1, 'pool_kernel': 2, 'dropout_rate': 0, 'fc_hidden_dim': 256, 'lr': 0.00346934706914083, 'weight_decay': 0.009448674457218495, 'optimizer': 'rmsprop', 'activation': <class 'torch.nn.modules.activation.ReLU'>, 'batchnorm': True, 'epochs': 35, 'batch_size': 32, 'flip_prob': 0.0}. Best is trial 47 with value: 2.711872135169256.
[I 2025-08-04 16:17:12,754] Trial 148 finished with value: 2.758017938185946 and parameters: {'channels_list': [16, 32, 64], 'kernel_size': 3, 'padding': 1, 'pool_kernel': 2, 'dropout_rate': 0, 'fc_hidden_dim': 64, 'lr': 0.0009010496357057626, 'weight_decay': 0.007083999882830084, 'optimizer': 'sgd', 'activation': <class 'torch.nn.modules.activation.ReLU'>, 'batchnorm': True, 'epochs': 35, 'batch_size': 32, 'flip_prob': 0.0}. Best is trial 47 with value: 2.711872135169256.
[I 2025-08-04 16:17:53,554] Trial 149 finished with value: 2.755990344163736 and parameters: {'channels_list': [32, 64], 'kernel_size': 3, 'padding': 1, 'pool_kernel': 2, 'dropout_rate': 0, 'fc_hidden_dim': 256, 'lr': 0.0031266820620935846, 'weight_decay': 0.0033159480341538703, 'optimizer': 'sgd', 'activation': <class 'torch.nn.modules.activation.ReLU'>, 'batchnorm': True, 'epochs': 35, 'batch_size': 64, 'flip_prob': 0.0}. Best is trial 47 with value: 2.711872135169256.
[I 2025-08-04 16:17:53,581] Trial 150 pruned. 
[I 2025-08-04 16:19:03,328] Trial 151 finished with value: 2.7185211090184525 and parameters: {'channels_list': [32, 64], 'kernel_size': 3, 'padding': 1, 'pool_kernel': 2, 'dropout_rate': 0, 'fc_hidden_dim': 256, 'lr': 0.0027131193913661226, 'weight_decay': 0.008120524541774513, 'optimizer': 'sgd', 'activation': <class 'torch.nn.modules.activation.ReLU'>, 'batchnorm': True, 'epochs': 35, 'batch_size': 32, 'flip_prob': 0.0}. Best is trial 47 with value: 2.711872135169256.
