[I 2025-07-01 00:10:37,033] Trial 215 finished with value: 15.976343359733649 and parameters: {'kernel_size': 3, 'channel_list': [16, 32, 64, 128], 'padding': 1, 'pool_kernel': 2, 'dropout_rate': 0.1, 'fc_hidden_dim': 64, 'lr': 0.0033930894300235946, 'weight_decay': 4.069786939912922e-06, 'optimizer': 'adam', 'activation': <class 'torch.nn.modules.activation.LeakyReLU'>, 'batchnorm': True, 'epochs': 10, 'batch_size': 64, 'flip_prob': 0.0}. Best is trial 121 with value: 15.493945159799877.
[I 2025-07-01 00:11:26,022] Trial 216 finished with value: 15.93118703517309 and parameters: {'kernel_size': 3, 'channel_list': [16, 32, 64, 128], 'padding': 1, 'pool_kernel': 2, 'dropout_rate': 0.1, 'fc_hidden_dim': 64, 'lr': 0.004000032700026163, 'weight_decay': 5.880673364972486e-06, 'optimizer': 'adam', 'activation': <class 'torch.nn.modules.activation.LeakyReLU'>, 'batchnorm': True, 'epochs': 20, 'batch_size': 64, 'flip_prob': 0.0}. Best is trial 121 with value: 15.493945159799877.
[I 2025-07-01 00:12:33,384] Trial 217 finished with value: inf and parameters: {'kernel_size': 3, 'channel_list': [16, 32, 64, 128], 'padding': 1, 'pool_kernel': 2, 'dropout_rate': 0.1, 'fc_hidden_dim': 128, 'lr': 0.004641274265483158, 'weight_decay': 1.0813466484036394e-05, 'optimizer': 'sgd', 'activation': <class 'torch.nn.modules.activation.LeakyReLU'>, 'batchnorm': True, 'epochs': 20, 'batch_size': 32, 'flip_prob': 0.0}. Best is trial 121 with value: 15.493945159799877.
[I 2025-07-01 00:13:21,496] Trial 218 finished with value: 15.949955039883251 and parameters: {'kernel_size': 3, 'channel_list': [16, 32, 64, 128], 'padding': 1, 'pool_kernel': 2, 'dropout_rate': 0.1, 'fc_hidden_dim': 128, 'lr': 0.00611726806245888, 'weight_decay': 3.2817053846573627e-06, 'optimizer': 'adam', 'activation': <class 'torch.nn.modules.activation.LeakyReLU'>, 'batchnorm': True, 'epochs': 20, 'batch_size': 64, 'flip_prob': 0.0}. Best is trial 121 with value: 15.493945159799877.
[I 2025-07-01 00:14:36,050] Trial 219 finished with value: 16.23522863017067 and parameters: {'kernel_size': 3, 'channel_list': [16, 32, 64, 128], 'padding': 1, 'pool_kernel': 2, 'dropout_rate': 0.1, 'fc_hidden_dim': 128, 'lr': 0.0011850581311677127, 'weight_decay': 2.165191217487033e-06, 'optimizer': 'adam', 'activation': <class 'torch.nn.modules.activation.ReLU'>, 'batchnorm': True, 'epochs': 30, 'batch_size': 64, 'flip_prob': 0.0}. Best is trial 121 with value: 15.493945159799877.
[I 2025-07-01 00:15:24,931] Trial 220 finished with value: 15.588127336068728 and parameters: {'kernel_size': 3, 'channel_list': [16, 32, 64, 128], 'padding': 1, 'pool_kernel': 2, 'dropout_rate': 0, 'fc_hidden_dim': 64, 'lr': 0.007523750308607497, 'weight_decay': 4.030197668171005e-06, 'optimizer': 'adam', 'activation': <class 'torch.nn.modules.activation.LeakyReLU'>, 'batchnorm': True, 'epochs': 20, 'batch_size': 64, 'flip_prob': 0.0}. Best is trial 121 with value: 15.493945159799877.
[I 2025-07-01 00:16:13,547] Trial 221 finished with value: 16.03730785055619 and parameters: {'kernel_size': 3, 'channel_list': [16, 32, 64, 128], 'padding': 1, 'pool_kernel': 2, 'dropout_rate': 0, 'fc_hidden_dim': 64, 'lr': 0.006999073242648791, 'weight_decay': 3.852028245615846e-06, 'optimizer': 'adam', 'activation': <class 'torch.nn.modules.activation.LeakyReLU'>, 'batchnorm': True, 'epochs': 20, 'batch_size': 64, 'flip_prob': 0.0}. Best is trial 121 with value: 15.493945159799877.
[I 2025-07-01 00:17:02,872] Trial 222 finished with value: 15.936493813426482 and parameters: {'kernel_size': 3, 'channel_list': [16, 32, 64, 128], 'padding': 1, 'pool_kernel': 2, 'dropout_rate': 0, 'fc_hidden_dim': 64, 'lr': 0.00808819427146239, 'weight_decay': 4.613699576967113e-06, 'optimizer': 'adam', 'activation': <class 'torch.nn.modules.activation.LeakyReLU'>, 'batchnorm': True, 'epochs': 20, 'batch_size': 64, 'flip_prob': 0.0}. Best is trial 121 with value: 15.493945159799877.
[I 2025-07-01 00:17:52,079] Trial 223 finished with value: 15.89784013979495 and parameters: {'kernel_size': 3, 'channel_list': [16, 32, 64, 128], 'padding': 1, 'pool_kernel': 2, 'dropout_rate': 0, 'fc_hidden_dim': 64, 'lr': 0.007412377980364961, 'weight_decay': 2.768277640300636e-06, 'optimizer': 'adam', 'activation': <class 'torch.nn.modules.activation.LeakyReLU'>, 'batchnorm': True, 'epochs': 20, 'batch_size': 64, 'flip_prob': 0.0}. Best is trial 121 with value: 15.493945159799877.
[I 2025-07-01 00:18:40,903] Trial 224 finished with value: 15.884052110443164 and parameters: {'kernel_size': 3, 'channel_list': [16, 32, 64, 128], 'padding': 1, 'pool_kernel': 2, 'dropout_rate': 0, 'fc_hidden_dim': 64, 'lr': 0.0066972614577271135, 'weight_decay': 0.00014827285059453274, 'optimizer': 'adam', 'activation': <class 'torch.nn.modules.activation.LeakyReLU'>, 'batchnorm': True, 'epochs': 20, 'batch_size': 64, 'flip_prob': 0.0}. Best is trial 121 with value: 15.493945159799877.
[I 2025-07-01 00:19:29,362] Trial 225 finished with value: 15.687922105480542 and parameters: {'kernel_size': 3, 'channel_list': [16, 32, 64, 128], 'padding': 1, 'pool_kernel': 2, 'dropout_rate': 0, 'fc_hidden_dim': 64, 'lr': 0.00900000665822984, 'weight_decay': 6.772509025447105e-06, 'optimizer': 'adam', 'activation': <class 'torch.nn.modules.activation.LeakyReLU'>, 'batchnorm': True, 'epochs': 20, 'batch_size': 64, 'flip_prob': 0.0}. Best is trial 121 with value: 15.493945159799877.
[I 2025-07-01 00:20:19,170] Trial 226 finished with value: 15.780781626194745 and parameters: {'kernel_size': 3, 'channel_list': [16, 32, 64, 128], 'padding': 1, 'pool_kernel': 2, 'dropout_rate': 0, 'fc_hidden_dim': 128, 'lr': 0.009071772722117155, 'weight_decay': 8.484538861286103e-06, 'optimizer': 'adam', 'activation': <class 'torch.nn.modules.activation.LeakyReLU'>, 'batchnorm': True, 'epochs': 20, 'batch_size': 64, 'flip_prob': 0.0}. Best is trial 121 with value: 15.493945159799877.
[I 2025-07-01 00:21:29,426] Trial 227 finished with value: 17.951829797109383 and parameters: {'kernel_size': 3, 'channel_list': [16, 32, 64, 128], 'padding': 1, 'pool_kernel': 2, 'dropout_rate': 0, 'fc_hidden_dim': 64, 'lr': 0.00840568175932914, 'weight_decay': 6.1390938412731345e-06, 'optimizer': 'adam', 'activation': <class 'torch.nn.modules.activation.LeakyReLU'>, 'batchnorm': False, 'epochs': 30, 'batch_size': 64, 'flip_prob': 0.75}. Best is trial 121 with value: 15.493945159799877.
[I 2025-07-01 00:22:18,739] Trial 228 finished with value: 15.876900580008071 and parameters: {'kernel_size': 3, 'channel_list': [16, 32, 64, 128], 'padding': 1, 'pool_kernel': 2, 'dropout_rate': 0, 'fc_hidden_dim': 128, 'lr': 0.008927468104483367, 'weight_decay': 7.2618283132366044e-06, 'optimizer': 'adam', 'activation': <class 'torch.nn.modules.activation.LeakyReLU'>, 'batchnorm': True, 'epochs': 20, 'batch_size': 64, 'flip_prob': 0.0}. Best is trial 121 with value: 15.493945159799877.
[I 2025-07-01 00:22:18,764] Trial 229 pruned. 
[I 2025-07-01 00:23:41,268] Trial 230 finished with value: 28.405593008182922 and parameters: {'kernel_size': 3, 'channel_list': [16, 32, 64, 128], 'padding': 1, 'pool_kernel': 2, 'dropout_rate': 0, 'fc_hidden_dim': 128, 'lr': 0.007550856274955779, 'weight_decay': 5.170477458977234e-06, 'optimizer': 'adam', 'activation': <class 'torch.nn.modules.activation.LeakyReLU'>, 'batchnorm': True, 'epochs': 30, 'batch_size': 64, 'flip_prob': 1}. Best is trial 121 with value: 15.493945159799877.
[I 2025-07-01 00:24:30,502] Trial 231 finished with value: 15.68347912639058 and parameters: {'kernel_size': 3, 'channel_list': [16, 32, 64, 128], 'padding': 1, 'pool_kernel': 2, 'dropout_rate': 0.1, 'fc_hidden_dim': 64, 'lr': 0.0030585768065011527, 'weight_decay': 3.743083876437031e-06, 'optimizer': 'adam', 'activation': <class 'torch.nn.modules.activation.LeakyReLU'>, 'batchnorm': True, 'epochs': 20, 'batch_size': 64, 'flip_prob': 0.0}. Best is trial 121 with value: 15.493945159799877.
[I 2025-07-01 00:25:19,684] Trial 232 finished with value: 15.818565306923833 and parameters: {'kernel_size': 3, 'channel_list': [16, 32, 64, 128], 'padding': 1, 'pool_kernel': 2, 'dropout_rate': 0.1, 'fc_hidden_dim': 64, 'lr': 0.0026925408090448834, 'weight_decay': 3.2964553233796397e-06, 'optimizer': 'adam', 'activation': <class 'torch.nn.modules.activation.LeakyReLU'>, 'batchnorm': True, 'epochs': 20, 'batch_size': 64, 'flip_prob': 0.0}. Best is trial 121 with value: 15.493945159799877.
[I 2025-07-01 00:26:08,894] Trial 233 finished with value: 15.833759105528987 and parameters: {'kernel_size': 3, 'channel_list': [16, 32, 64, 128], 'padding': 1, 'pool_kernel': 2, 'dropout_rate': 0, 'fc_hidden_dim': 64, 'lr': 0.003022506748652891, 'weight_decay': 4.193978311733663e-06, 'optimizer': 'adam', 'activation': <class 'torch.nn.modules.activation.LeakyReLU'>, 'batchnorm': True, 'epochs': 20, 'batch_size': 64, 'flip_prob': 0.0}. Best is trial 121 with value: 15.493945159799877.
[I 2025-07-01 00:26:58,832] Trial 234 finished with value: 15.812026296654883 and parameters: {'kernel_size': 3, 'channel_list': [16, 32, 64, 128], 'padding': 1, 'pool_kernel': 2, 'dropout_rate': 0.1, 'fc_hidden_dim': 64, 'lr': 0.007843765241875607, 'weight_decay': 6.7430088475731974e-06, 'optimizer': 'adam', 'activation': <class 'torch.nn.modules.activation.LeakyReLU'>, 'batchnorm': True, 'epochs': 20, 'batch_size': 64, 'flip_prob': 0.0}. Best is trial 121 with value: 15.493945159799877.
[I 2025-07-01 00:27:48,471] Trial 235 finished with value: 15.629216716039332 and parameters: {'kernel_size': 3, 'channel_list': [16, 32, 64, 128], 'padding': 1, 'pool_kernel': 2, 'dropout_rate': 0.5, 'fc_hidden_dim': 64, 'lr': 0.002916531077324891, 'weight_decay': 2.5278572122978365e-06, 'optimizer': 'adam', 'activation': <class 'torch.nn.modules.activation.LeakyReLU'>, 'batchnorm': True, 'epochs': 20, 'batch_size': 64, 'flip_prob': 0.0}. Best is trial 121 with value: 15.493945159799877.
[I 2025-07-01 00:28:37,030] Trial 236 finished with value: 15.87033356276553 and parameters: {'kernel_size': 3, 'channel_list': [16, 32, 64, 128], 'padding': 1, 'pool_kernel': 2, 'dropout_rate': 0.5, 'fc_hidden_dim': 64, 'lr': 0.0029137796324711415, 'weight_decay': 2.5378010243385967e-06, 'optimizer': 'adam', 'activation': <class 'torch.nn.modules.activation.LeakyReLU'>, 'batchnorm': True, 'epochs': 20, 'batch_size': 64, 'flip_prob': 0.0}. Best is trial 121 with value: 15.493945159799877.
[I 2025-07-01 00:28:37,057] Trial 237 pruned. 
[I 2025-07-01 00:29:25,416] Trial 238 finished with value: 15.701213388047059 and parameters: {'kernel_size': 3, 'channel_list': [16, 32, 64, 128], 'padding': 1, 'pool_kernel': 2, 'dropout_rate': 0.5, 'fc_hidden_dim': 128, 'lr': 0.003313107560946119, 'weight_decay': 1.7450136618742302e-06, 'optimizer': 'adam', 'activation': <class 'torch.nn.modules.activation.ReLU'>, 'batchnorm': True, 'epochs': 20, 'batch_size': 64, 'flip_prob': 0.0}. Best is trial 121 with value: 15.493945159799877.
[I 2025-07-01 00:30:39,541] Trial 239 finished with value: 15.692296542853224 and parameters: {'kernel_size': 3, 'channel_list': [16, 32, 64, 128], 'padding': 1, 'pool_kernel': 2, 'dropout_rate': 0.5, 'fc_hidden_dim': 64, 'lr': 0.0029864647538281825, 'weight_decay': 2.00312829663633e-06, 'optimizer': 'adam', 'activation': <class 'torch.nn.modules.activation.LeakyReLU'>, 'batchnorm': True, 'epochs': 30, 'batch_size': 64, 'flip_prob': 0.0}. Best is trial 121 with value: 15.493945159799877.
[I 2025-07-01 00:31:29,154] Trial 240 finished with value: 15.766142501594118 and parameters: {'kernel_size': 3, 'channel_list': [16, 32, 64, 128], 'padding': 1, 'pool_kernel': 2, 'dropout_rate': 0.5, 'fc_hidden_dim': 128, 'lr': 0.0034617980023126695, 'weight_decay': 2.541272335355312e-06, 'optimizer': 'adam', 'activation': <class 'torch.nn.modules.activation.LeakyReLU'>, 'batchnorm': True, 'epochs': 20, 'batch_size': 64, 'flip_prob': 0.0}. Best is trial 121 with value: 15.493945159799877.
[I 2025-07-01 00:32:18,535] Trial 241 finished with value: 16.337093823405798 and parameters: {'kernel_size': 3, 'channel_list': [16, 32, 64, 128], 'padding': 1, 'pool_kernel': 2, 'dropout_rate': 0.1, 'fc_hidden_dim': 64, 'lr': 0.0006894260191364759, 'weight_decay': 3.6934320883420666e-06, 'optimizer': 'adam', 'activation': <class 'torch.nn.modules.activation.LeakyReLU'>, 'batchnorm': True, 'epochs': 20, 'batch_size': 64, 'flip_prob': 0.0}. Best is trial 121 with value: 15.493945159799877.
[I 2025-07-01 00:33:07,005] Trial 242 finished with value: 15.816777342166258 and parameters: {'kernel_size': 3, 'channel_list': [16, 32, 64, 128], 'padding': 1, 'pool_kernel': 2, 'dropout_rate': 0.1, 'fc_hidden_dim': 64, 'lr': 0.00231547954107536, 'weight_decay': 4.81860814361029e-06, 'optimizer': 'adam', 'activation': <class 'torch.nn.modules.activation.LeakyReLU'>, 'batchnorm': True, 'epochs': 20, 'batch_size': 64, 'flip_prob': 0.0}. Best is trial 121 with value: 15.493945159799877.
[I 2025-07-01 00:33:55,238] Trial 243 finished with value: 16.107061516424142 and parameters: {'kernel_size': 3, 'channel_list': [16, 32, 64, 128], 'padding': 1, 'pool_kernel': 2, 'dropout_rate': 0.1, 'fc_hidden_dim': 64, 'lr': 0.0004108348263554947, 'weight_decay': 5.675272363544399e-06, 'optimizer': 'adam', 'activation': <class 'torch.nn.modules.activation.LeakyReLU'>, 'batchnorm': True, 'epochs': 20, 'batch_size': 64, 'flip_prob': 0.0}. Best is trial 121 with value: 15.493945159799877.
[I 2025-07-01 00:34:42,973] Trial 244 finished with value: 15.64637061184861 and parameters: {'kernel_size': 3, 'channel_list': [16, 32, 64, 128], 'padding': 1, 'pool_kernel': 2, 'dropout_rate': 0, 'fc_hidden_dim': 64, 'lr': 0.006172919523909882, 'weight_decay': 3.271891601661782e-06, 'optimizer': 'adam', 'activation': <class 'torch.nn.modules.activation.LeakyReLU'>, 'batchnorm': True, 'epochs': 20, 'batch_size': 64, 'flip_prob': 0.0}. Best is trial 121 with value: 15.493945159799877.
[I 2025-07-01 00:35:32,016] Trial 245 finished with value: 15.725179774810302 and parameters: {'kernel_size': 3, 'channel_list': [16, 32, 64, 128], 'padding': 1, 'pool_kernel': 2, 'dropout_rate': 0.1, 'fc_hidden_dim': 64, 'lr': 0.0060103718948525614, 'weight_decay': 3.351090781041983e-06, 'optimizer': 'adam', 'activation': <class 'torch.nn.modules.activation.LeakyReLU'>, 'batchnorm': True, 'epochs': 20, 'batch_size': 64, 'flip_prob': 0.0}. Best is trial 121 with value: 15.493945159799877.
[I 2025-07-01 00:36:13,555] Trial 246 finished with value: 16.401521075742235 and parameters: {'kernel_size': 3, 'channel_list': [32, 64, 128], 'padding': 1, 'pool_kernel': 2, 'dropout_rate': 0.1, 'fc_hidden_dim': 256, 'lr': 0.00537259337681419, 'weight_decay': 2.1759896538999586e-06, 'optimizer': 'adam', 'activation': <class 'torch.nn.modules.activation.LeakyReLU'>, 'batchnorm': True, 'epochs': 12, 'batch_size': 64, 'flip_prob': 0.0}. Best is trial 121 with value: 15.493945159799877.
[I 2025-07-01 00:36:55,785] Trial 247 finished with value: 15.854883944999942 and parameters: {'kernel_size': 3, 'channel_list': [16, 32, 64], 'padding': 1, 'pool_kernel': 2, 'dropout_rate': 0.5, 'fc_hidden_dim': 128, 'lr': 0.006270124868087393, 'weight_decay': 2.8027038531709026e-06, 'optimizer': 'adam', 'activation': <class 'torch.nn.modules.activation.LeakyReLU'>, 'batchnorm': True, 'epochs': 20, 'batch_size': 64, 'flip_prob': 0.0}. Best is trial 121 with value: 15.493945159799877.
[I 2025-07-01 00:37:45,136] Trial 248 finished with value: 15.916865692375609 and parameters: {'kernel_size': 3, 'channel_list': [16, 32, 64, 128], 'padding': 1, 'pool_kernel': 2, 'dropout_rate': 0.1, 'fc_hidden_dim': 64, 'lr': 0.0067332773497658545, 'weight_decay': 4.1000030842644965e-06, 'optimizer': 'adam', 'activation': <class 'torch.nn.modules.activation.LeakyReLU'>, 'batchnorm': True, 'epochs': 20, 'batch_size': 64, 'flip_prob': 0.0}. Best is trial 121 with value: 15.493945159799877.
[I 2025-07-01 00:38:46,317] Trial 249 finished with value: 16.465337082388043 and parameters: {'kernel_size': 3, 'channel_list': [16, 32, 64, 128], 'padding': 1, 'pool_kernel': 2, 'dropout_rate': 0.1, 'fc_hidden_dim': 128, 'lr': 0.005656760131194326, 'weight_decay': 3.1947593354138792e-06, 'optimizer': 'adam', 'activation': <class 'torch.nn.modules.activation.ReLU'>, 'batchnorm': True, 'epochs': 30, 'batch_size': 128, 'flip_prob': 0.5}. Best is trial 121 with value: 15.493945159799877.
[I 2025-07-01 00:38:46,350] Trial 250 pruned. 
[I 2025-07-01 00:39:48,640] Trial 251 finished with value: 15.958485112310274 and parameters: {'kernel_size': 3, 'channel_list': [16, 32, 64, 128], 'padding': 1, 'pool_kernel': 2, 'dropout_rate': 0.1, 'fc_hidden_dim': 64, 'lr': 0.0032086230681249617, 'weight_decay': 4.146657397113755e-06, 'optimizer': 'adam', 'activation': <class 'torch.nn.modules.activation.LeakyReLU'>, 'batchnorm': True, 'epochs': 25, 'batch_size': 64, 'flip_prob': 0.0}. Best is trial 121 with value: 15.493945159799877.
[I 2025-07-01 00:40:35,350] Trial 252 finished with value: 16.17869099420284 and parameters: {'kernel_size': 3, 'channel_list': [16, 32, 64, 128], 'padding': 1, 'pool_kernel': 2, 'dropout_rate': 0.1, 'fc_hidden_dim': 128, 'lr': 0.002806848665515709, 'weight_decay': 3.5351460212574813e-06, 'optimizer': 'sgd', 'activation': <class 'torch.nn.modules.activation.LeakyReLU'>, 'batchnorm': True, 'epochs': 20, 'batch_size': 64, 'flip_prob': 0.0}. Best is trial 121 with value: 15.493945159799877.
[I 2025-07-01 00:40:54,848] Trial 253 finished with value: 16.65580137339477 and parameters: {'kernel_size': 3, 'channel_list': [16, 32, 64, 128], 'padding': 1, 'pool_kernel': 2, 'dropout_rate': 0.1, 'fc_hidden_dim': 64, 'lr': 0.005155320372481944, 'weight_decay': 1.5246082268265641e-06, 'optimizer': 'adam', 'activation': <class 'torch.nn.modules.activation.ReLU'>, 'batchnorm': True, 'epochs': 5, 'batch_size': 32, 'flip_prob': 0.25}. Best is trial 121 with value: 15.493945159799877.
[I 2025-07-01 00:42:07,736] Trial 254 finished with value: 15.665086875596286 and parameters: {'kernel_size': 3, 'channel_list': [16, 32, 64, 128], 'padding': 1, 'pool_kernel': 2, 'dropout_rate': 0, 'fc_hidden_dim': 128, 'lr': 0.007055393790165219, 'weight_decay': 2.7742550119517976e-06, 'optimizer': 'adam', 'activation': <class 'torch.nn.modules.activation.LeakyReLU'>, 'batchnorm': True, 'epochs': 30, 'batch_size': 64, 'flip_prob': 0.0}. Best is trial 121 with value: 15.493945159799877.
[I 2025-07-01 00:42:56,709] Trial 255 finished with value: 15.846330801386115 and parameters: {'kernel_size': 3, 'channel_list': [16, 32, 64, 128], 'padding': 1, 'pool_kernel': 2, 'dropout_rate': 0, 'fc_hidden_dim': 128, 'lr': 0.006356385803764656, 'weight_decay': 2.9097952686688764e-06, 'optimizer': 'adam', 'activation': <class 'torch.nn.modules.activation.LeakyReLU'>, 'batchnorm': True, 'epochs': 20, 'batch_size': 64, 'flip_prob': 0.0}. Best is trial 121 with value: 15.493945159799877.
[I 2025-07-01 00:44:11,434] Trial 256 finished with value: 16.136680131334227 and parameters: {'kernel_size': 3, 'channel_list': [16, 32, 64, 128], 'padding': 1, 'pool_kernel': 2, 'dropout_rate': 0, 'fc_hidden_dim': 128, 'lr': 0.006615754070632103, 'weight_decay': 4.844770487820124e-06, 'optimizer': 'adam', 'activation': <class 'torch.nn.modules.activation.LeakyReLU'>, 'batchnorm': True, 'epochs': 30, 'batch_size': 64, 'flip_prob': 0.0}. Best is trial 121 with value: 15.493945159799877.
[I 2025-07-01 00:44:53,435] Trial 257 finished with value: 16.834353141435496 and parameters: {'kernel_size': 3, 'channel_list': [16, 32, 64, 128], 'padding': 1, 'pool_kernel': 2, 'dropout_rate': 0, 'fc_hidden_dim': 64, 'lr': 0.007361096085103507, 'weight_decay': 2.629261004627966e-06, 'optimizer': 'adam', 'activation': <class 'torch.nn.modules.activation.LeakyReLU'>, 'batchnorm': False, 'epochs': 20, 'batch_size': 64, 'flip_prob': 0.0}. Best is trial 121 with value: 15.493945159799877.
[I 2025-07-01 00:45:18,717] Trial 258 finished with value: 16.1597889631782 and parameters: {'kernel_size': 3, 'channel_list': [16, 32, 64, 128], 'padding': 1, 'pool_kernel': 2, 'dropout_rate': 0, 'fc_hidden_dim': 128, 'lr': 0.006049536196837644, 'weight_decay': 3.978458309474245e-06, 'optimizer': 'adam', 'activation': <class 'torch.nn.modules.activation.LeakyReLU'>, 'batchnorm': True, 'epochs': 10, 'batch_size': 64, 'flip_prob': 0.0}. Best is trial 121 with value: 15.493945159799877.
[I 2025-07-01 00:45:18,745] Trial 259 pruned. 
[I 2025-07-01 00:46:10,226] Trial 260 finished with value: 15.661522836613475 and parameters: {'kernel_size': 3, 'channel_list': [16, 32, 64, 128], 'padding': 1, 'pool_kernel': 2, 'dropout_rate': 0.1, 'fc_hidden_dim': 64, 'lr': 0.006951083905195404, 'weight_decay': 0.0001042538710970538, 'optimizer': 'adam', 'activation': <class 'torch.nn.modules.activation.LeakyReLU'>, 'batchnorm': True, 'epochs': 20, 'batch_size': 64, 'flip_prob': 0.0}. Best is trial 121 with value: 15.493945159799877.
[I 2025-07-01 00:47:23,345] Trial 261 finished with value: 16.015857805337497 and parameters: {'kernel_size': 3, 'channel_list': [16, 32, 64, 128], 'padding': 1, 'pool_kernel': 2, 'dropout_rate': 0.1, 'fc_hidden_dim': 64, 'lr': 0.007203001179406252, 'weight_decay': 0.00010776159025995349, 'optimizer': 'adam', 'activation': <class 'torch.nn.modules.activation.LeakyReLU'>, 'batchnorm': True, 'epochs': 30, 'batch_size': 64, 'flip_prob': 0.0}. Best is trial 121 with value: 15.493945159799877.
[I 2025-07-01 00:48:12,494] Trial 262 finished with value: 15.810442845000672 and parameters: {'kernel_size': 3, 'channel_list': [16, 32, 64, 128], 'padding': 1, 'pool_kernel': 2, 'dropout_rate': 0, 'fc_hidden_dim': 64, 'lr': 0.007053158078960715, 'weight_decay': 8.606218809355648e-05, 'optimizer': 'adam', 'activation': <class 'torch.nn.modules.activation.LeakyReLU'>, 'batchnorm': True, 'epochs': 20, 'batch_size': 64, 'flip_prob': 0.0}. Best is trial 121 with value: 15.493945159799877.
[I 2025-07-01 00:48:12,521] Trial 263 pruned. 
[I 2025-07-01 00:48:12,547] Trial 264 pruned. 
