[I 2025-08-05 09:31:48,077] Trial 54 finished with value: 2.707430394509733 and parameters: {'channels_list': [32, 64], 'kernel_size': 3, 'padding': 1, 'pool_kernel': 2, 'dropout_rate': 0, 'fc_hidden_dim': 64, 'lr': 0.0007241762657177036, 'weight_decay': 0.005562952336690334, 'optimizer': 'sgd', 'activation': <class 'torch.nn.modules.activation.ReLU'>, 'batchnorm': True, 'epochs': 50, 'batch_size': 32, 'flip_prob': 0.0, 'lstm_hidden_dim': 128, 'lstm_layers': 2}. Best is trial 48 with value: 2.6973911761087157.
[I 2025-08-05 09:33:14,030] Trial 55 finished with value: 2.7197984136919637 and parameters: {'channels_list': [32, 64], 'kernel_size': 3, 'padding': 1, 'pool_kernel': 2, 'dropout_rate': 0, 'fc_hidden_dim': 64, 'lr': 0.0006886756009946974, 'weight_decay': 0.009902788196187472, 'optimizer': 'sgd', 'activation': <class 'torch.nn.modules.activation.ReLU'>, 'batchnorm': True, 'epochs': 50, 'batch_size': 32, 'flip_prob': 0.0, 'lstm_hidden_dim': 128, 'lstm_layers': 2}. Best is trial 48 with value: 2.6973911761087157.
[I 2025-08-05 09:34:34,073] Trial 56 finished with value: 2.7257131204386527 and parameters: {'channels_list': [32, 64], 'kernel_size': 3, 'padding': 1, 'pool_kernel': 2, 'dropout_rate': 0, 'fc_hidden_dim': 64, 'lr': 0.0006769983095006556, 'weight_decay': 0.009291968814441153, 'optimizer': 'sgd', 'activation': <class 'torch.nn.modules.activation.ReLU'>, 'batchnorm': True, 'epochs': 50, 'batch_size': 32, 'flip_prob': 0.0, 'lstm_hidden_dim': 128, 'lstm_layers': 2}. Best is trial 48 with value: 2.6973911761087157.
[I 2025-08-05 09:36:14,407] Trial 57 finished with value: 2.756572380974727 and parameters: {'channels_list': [32, 64], 'kernel_size': 3, 'padding': 1, 'pool_kernel': 3, 'dropout_rate': 0, 'fc_hidden_dim': 64, 'lr': 0.000884226796074601, 'weight_decay': 0.004749203528872969, 'optimizer': 'sgd', 'activation': <class 'torch.nn.modules.activation.ReLU'>, 'batchnorm': True, 'epochs': 50, 'batch_size': 32, 'flip_prob': 0.0, 'lstm_hidden_dim': 128, 'lstm_layers': 1}. Best is trial 48 with value: 2.6973911761087157.
[I 2025-08-05 09:37:25,877] Trial 58 finished with value: 2.7850025193682626 and parameters: {'channels_list': [32, 64], 'kernel_size': 3, 'padding': 0, 'pool_kernel': 2, 'dropout_rate': 0, 'fc_hidden_dim': 64, 'lr': 0.0002689246045765913, 'weight_decay': 0.007887680862410528, 'optimizer': 'sgd', 'activation': <class 'torch.nn.modules.activation.ReLU'>, 'batchnorm': True, 'epochs': 50, 'batch_size': 32, 'flip_prob': 0.0, 'lstm_hidden_dim': 128, 'lstm_layers': 2}. Best is trial 48 with value: 2.6973911761087157.
[I 2025-08-05 09:38:44,862] Trial 59 finished with value: 2.7285572456364466 and parameters: {'channels_list': [32, 64], 'kernel_size': 3, 'padding': 1, 'pool_kernel': 2, 'dropout_rate': 0, 'fc_hidden_dim': 64, 'lr': 0.0005180682633047027, 'weight_decay': 0.004130126363107813, 'optimizer': 'sgd', 'activation': <class 'torch.nn.modules.activation.ReLU'>, 'batchnorm': True, 'epochs': 50, 'batch_size': 32, 'flip_prob': 0.0, 'lstm_hidden_dim': 128, 'lstm_layers': 2}. Best is trial 48 with value: 2.6973911761087157.
[I 2025-08-05 09:40:10,151] Trial 60 finished with value: 2.7670910805931137 and parameters: {'channels_list': [32, 64], 'kernel_size': 7, 'padding': 1, 'pool_kernel': 2, 'dropout_rate': 0, 'fc_hidden_dim': 64, 'lr': 0.00016089488797343273, 'weight_decay': 0.0029722128796570986, 'optimizer': 'sgd', 'activation': <class 'torch.nn.modules.activation.ReLU'>, 'batchnorm': True, 'epochs': 50, 'batch_size': 32, 'flip_prob': 0.0, 'lstm_hidden_dim': 128, 'lstm_layers': 2}. Best is trial 48 with value: 2.6973911761087157.
[I 2025-08-05 09:41:09,770] Trial 61 finished with value: 2.7084087824505114 and parameters: {'channels_list': [32, 64], 'kernel_size': 3, 'padding': 1, 'pool_kernel': 2, 'dropout_rate': 0, 'fc_hidden_dim': 64, 'lr': 0.0010734156891292355, 'weight_decay': 0.005358191108982392, 'optimizer': 'sgd', 'activation': <class 'torch.nn.modules.activation.ReLU'>, 'batchnorm': True, 'epochs': 50, 'batch_size': 32, 'flip_prob': 0.0, 'lstm_hidden_dim': 128, 'lstm_layers': 2}. Best is trial 48 with value: 2.6973911761087157.
[I 2025-08-05 09:42:21,107] Trial 62 finished with value: 2.6962937268186966 and parameters: {'channels_list': [32, 64], 'kernel_size': 3, 'padding': 1, 'pool_kernel': 2, 'dropout_rate': 0, 'fc_hidden_dim': 64, 'lr': 0.0011363657654599472, 'weight_decay': 0.006596989709530007, 'optimizer': 'sgd', 'activation': <class 'torch.nn.modules.activation.ReLU'>, 'batchnorm': True, 'epochs': 50, 'batch_size': 32, 'flip_prob': 0.0, 'lstm_hidden_dim': 128, 'lstm_layers': 2}. Best is trial 62 with value: 2.6962937268186966.
[I 2025-08-05 09:43:54,034] Trial 63 finished with value: 2.7064473637050543 and parameters: {'channels_list': [32, 64], 'kernel_size': 3, 'padding': 1, 'pool_kernel': 2, 'dropout_rate': 0, 'fc_hidden_dim': 64, 'lr': 0.001073569263087961, 'weight_decay': 0.006615938946390399, 'optimizer': 'sgd', 'activation': <class 'torch.nn.modules.activation.ReLU'>, 'batchnorm': True, 'epochs': 50, 'batch_size': 32, 'flip_prob': 0.0, 'lstm_hidden_dim': 128, 'lstm_layers': 2}. Best is trial 62 with value: 2.6962937268186966.
[I 2025-08-05 09:44:53,685] Trial 64 finished with value: 2.7173442657088773 and parameters: {'channels_list': [32, 64], 'kernel_size': 3, 'padding': 1, 'pool_kernel': 2, 'dropout_rate': 0, 'fc_hidden_dim': 64, 'lr': 0.0011655720183266717, 'weight_decay': 0.007053012490241441, 'optimizer': 'sgd', 'activation': <class 'torch.nn.modules.activation.ReLU'>, 'batchnorm': True, 'epochs': 50, 'batch_size': 32, 'flip_prob': 0.0, 'lstm_hidden_dim': 128, 'lstm_layers': 2}. Best is trial 62 with value: 2.6962937268186966.
[I 2025-08-05 09:46:06,848] Trial 65 finished with value: 2.722159138922237 and parameters: {'channels_list': [32, 64], 'kernel_size': 3, 'padding': 1, 'pool_kernel': 2, 'dropout_rate': 0, 'fc_hidden_dim': 64, 'lr': 0.0009676335760412969, 'weight_decay': 0.0006049854453923293, 'optimizer': 'sgd', 'activation': <class 'torch.nn.modules.activation.ReLU'>, 'batchnorm': True, 'epochs': 50, 'batch_size': 32, 'flip_prob': 0.0, 'lstm_hidden_dim': 128, 'lstm_layers': 2}. Best is trial 62 with value: 2.6962937268186966.
[I 2025-08-05 09:47:06,934] Trial 66 finished with value: 2.7302352611348484 and parameters: {'channels_list': [32, 64], 'kernel_size': 3, 'padding': 1, 'pool_kernel': 2, 'dropout_rate': 0, 'fc_hidden_dim': 64, 'lr': 0.0014881781972029865, 'weight_decay': 0.004139158313349618, 'optimizer': 'sgd', 'activation': <class 'torch.nn.modules.activation.ReLU'>, 'batchnorm': True, 'epochs': 50, 'batch_size': 32, 'flip_prob': 0.0, 'lstm_hidden_dim': 128, 'lstm_layers': 2}. Best is trial 62 with value: 2.6962937268186966.
[I 2025-08-05 09:47:47,147] Trial 67 finished with value: 2.7566444904870377 and parameters: {'channels_list': [32, 64], 'kernel_size': 3, 'padding': 1, 'pool_kernel': 2, 'dropout_rate': 0, 'fc_hidden_dim': 64, 'lr': 0.0010763497601305827, 'weight_decay': 0.0014133193012199072, 'optimizer': 'sgd', 'activation': <class 'torch.nn.modules.activation.ReLU'>, 'batchnorm': True, 'epochs': 50, 'batch_size': 32, 'flip_prob': 0.0, 'lstm_hidden_dim': 128, 'lstm_layers': 2}. Best is trial 62 with value: 2.6962937268186966.
[I 2025-08-05 09:49:16,767] Trial 68 finished with value: 2.7628509023940175 and parameters: {'channels_list': [32, 64], 'kernel_size': 5, 'padding': 1, 'pool_kernel': 2, 'dropout_rate': 0, 'fc_hidden_dim': 64, 'lr': 0.0020705992907097794, 'weight_decay': 0.0022596057884739975, 'optimizer': 'sgd', 'activation': <class 'torch.nn.modules.activation.LeakyReLU'>, 'batchnorm': True, 'epochs': 50, 'batch_size': 32, 'flip_prob': 0.0, 'lstm_hidden_dim': 128, 'lstm_layers': 2}. Best is trial 62 with value: 2.6962937268186966.
[I 2025-08-05 09:50:32,251] Trial 69 finished with value: 2.705966014022275 and parameters: {'channels_list': [32, 64], 'kernel_size': 3, 'padding': 1, 'pool_kernel': 2, 'dropout_rate': 0, 'fc_hidden_dim': 64, 'lr': 0.0016668830744821742, 'weight_decay': 0.003359722965905037, 'optimizer': 'sgd', 'activation': <class 'torch.nn.modules.activation.ReLU'>, 'batchnorm': True, 'epochs': 50, 'batch_size': 32, 'flip_prob': 0.0, 'lstm_hidden_dim': 128, 'lstm_layers': 1}. Best is trial 62 with value: 2.6962937268186966.
[I 2025-08-05 09:51:16,532] Trial 70 finished with value: 2.7371242657213934 and parameters: {'channels_list': [32, 64], 'kernel_size': 3, 'padding': 1, 'pool_kernel': 2, 'dropout_rate': 0, 'fc_hidden_dim': 64, 'lr': 0.0034472158111935464, 'weight_decay': 0.0034261263158782405, 'optimizer': 'sgd', 'activation': <class 'torch.nn.modules.activation.ReLU'>, 'batchnorm': True, 'epochs': 50, 'batch_size': 32, 'flip_prob': 0.0, 'lstm_hidden_dim': 128, 'lstm_layers': 1}. Best is trial 62 with value: 2.6962937268186966.
[I 2025-08-05 09:51:57,711] Trial 71 finished with value: 2.7278117810860185 and parameters: {'channels_list': [32, 64], 'kernel_size': 3, 'padding': 1, 'pool_kernel': 2, 'dropout_rate': 0, 'fc_hidden_dim': 64, 'lr': 0.0016411195626555766, 'weight_decay': 0.006360578409546339, 'optimizer': 'sgd', 'activation': <class 'torch.nn.modules.activation.ReLU'>, 'batchnorm': True, 'epochs': 50, 'batch_size': 32, 'flip_prob': 0.0, 'lstm_hidden_dim': 128, 'lstm_layers': 1}. Best is trial 62 with value: 2.6962937268186966.
[I 2025-08-05 09:52:42,011] Trial 72 finished with value: 2.7421850078499936 and parameters: {'channels_list': [32, 64], 'kernel_size': 3, 'padding': 1, 'pool_kernel': 2, 'dropout_rate': 0, 'fc_hidden_dim': 64, 'lr': 0.0010171707959036429, 'weight_decay': 0.004956780431365015, 'optimizer': 'sgd', 'activation': <class 'torch.nn.modules.activation.ReLU'>, 'batchnorm': True, 'epochs': 50, 'batch_size': 32, 'flip_prob': 0.0, 'lstm_hidden_dim': 128, 'lstm_layers': 1}. Best is trial 62 with value: 2.6962937268186966.
[I 2025-08-05 09:53:32,256] Trial 73 finished with value: 2.7114206914015933 and parameters: {'channels_list': [32, 64], 'kernel_size': 3, 'padding': 1, 'pool_kernel': 2, 'dropout_rate': 0, 'fc_hidden_dim': 64, 'lr': 0.0009399458366637925, 'weight_decay': 0.007460741867607484, 'optimizer': 'sgd', 'activation': <class 'torch.nn.modules.activation.ReLU'>, 'batchnorm': True, 'epochs': 50, 'batch_size': 32, 'flip_prob': 0.0, 'lstm_hidden_dim': 128, 'lstm_layers': 1}. Best is trial 62 with value: 2.6962937268186966.
[I 2025-08-05 09:54:44,760] Trial 74 finished with value: 2.6790329756581452 and parameters: {'channels_list': [32, 64], 'kernel_size': 3, 'padding': 1, 'pool_kernel': 2, 'dropout_rate': 0, 'fc_hidden_dim': 64, 'lr': 0.0008983595018759805, 'weight_decay': 0.007707832251181762, 'optimizer': 'sgd', 'activation': <class 'torch.nn.modules.activation.ReLU'>, 'batchnorm': True, 'epochs': 50, 'batch_size': 32, 'flip_prob': 0.0, 'lstm_hidden_dim': 128, 'lstm_layers': 1}. Best is trial 74 with value: 2.6790329756581452.
[I 2025-08-05 09:55:40,774] Trial 75 finished with value: 2.6867642522864807 and parameters: {'channels_list': [32, 64], 'kernel_size': 3, 'padding': 1, 'pool_kernel': 2, 'dropout_rate': 0, 'fc_hidden_dim': 64, 'lr': 0.0007037105810543325, 'weight_decay': 0.003980570318362209, 'optimizer': 'sgd', 'activation': <class 'torch.nn.modules.activation.ReLU'>, 'batchnorm': True, 'epochs': 50, 'batch_size': 32, 'flip_prob': 0.0, 'lstm_hidden_dim': 128, 'lstm_layers': 1}. Best is trial 74 with value: 2.6790329756581452.
[I 2025-08-05 09:56:37,056] Trial 76 finished with value: 2.7844958424424378 and parameters: {'channels_list': [32, 64], 'kernel_size': 3, 'padding': 1, 'pool_kernel': 3, 'dropout_rate': 0, 'fc_hidden_dim': 64, 'lr': 0.0007249975102962179, 'weight_decay': 0.001979408789065141, 'optimizer': 'sgd', 'activation': <class 'torch.nn.modules.activation.ReLU'>, 'batchnorm': True, 'epochs': 50, 'batch_size': 32, 'flip_prob': 0.0, 'lstm_hidden_dim': 128, 'lstm_layers': 1}. Best is trial 74 with value: 2.6790329756581452.
[I 2025-08-05 09:57:26,923] Trial 77 finished with value: 2.7616335678445703 and parameters: {'channels_list': [32, 64], 'kernel_size': 3, 'padding': 0, 'pool_kernel': 2, 'dropout_rate': 0, 'fc_hidden_dim': 64, 'lr': 0.0007740973928128255, 'weight_decay': 0.0032669867649904737, 'optimizer': 'sgd', 'activation': <class 'torch.nn.modules.activation.ReLU'>, 'batchnorm': True, 'epochs': 50, 'batch_size': 32, 'flip_prob': 0.0, 'lstm_hidden_dim': 128, 'lstm_layers': 1}. Best is trial 74 with value: 2.6790329756581452.
[I 2025-08-05 09:58:25,724] Trial 78 finished with value: 2.8019165135120168 and parameters: {'channels_list': [32, 64], 'kernel_size': 7, 'padding': 1, 'pool_kernel': 2, 'dropout_rate': 0, 'fc_hidden_dim': 64, 'lr': 0.0022803253431043415, 'weight_decay': 0.007736645467356245, 'optimizer': 'sgd', 'activation': <class 'torch.nn.modules.activation.ReLU'>, 'batchnorm': True, 'epochs': 50, 'batch_size': 32, 'flip_prob': 0.0, 'lstm_hidden_dim': 128, 'lstm_layers': 1}. Best is trial 74 with value: 2.6790329756581452.
[I 2025-08-05 09:59:37,075] Trial 79 finished with value: 2.7064303373398912 and parameters: {'channels_list': [32, 64], 'kernel_size': 3, 'padding': 1, 'pool_kernel': 2, 'dropout_rate': 0, 'fc_hidden_dim': 64, 'lr': 0.0013675673582603392, 'weight_decay': 0.0012294853998565769, 'optimizer': 'sgd', 'activation': <class 'torch.nn.modules.activation.ReLU'>, 'batchnorm': True, 'epochs': 50, 'batch_size': 32, 'flip_prob': 0.0, 'lstm_hidden_dim': 128, 'lstm_layers': 1}. Best is trial 74 with value: 2.6790329756581452.
[I 2025-08-05 10:00:48,404] Trial 80 finished with value: 2.7183456216704 and parameters: {'channels_list': [32, 64], 'kernel_size': 3, 'padding': 1, 'pool_kernel': 2, 'dropout_rate': 0, 'fc_hidden_dim': 128, 'lr': 0.0018282130832392438, 'weight_decay': 0.0014255745762109951, 'optimizer': 'sgd', 'activation': <class 'torch.nn.modules.activation.LeakyReLU'>, 'batchnorm': True, 'epochs': 50, 'batch_size': 32, 'flip_prob': 0.0, 'lstm_hidden_dim': 128, 'lstm_layers': 1}. Best is trial 74 with value: 2.6790329756581452.
[I 2025-08-05 10:01:44,364] Trial 81 finished with value: 2.714987518934059 and parameters: {'channels_list': [32, 64], 'kernel_size': 3, 'padding': 1, 'pool_kernel': 2, 'dropout_rate': 0, 'fc_hidden_dim': 64, 'lr': 0.001444564438685801, 'weight_decay': 0.0038606697160261053, 'optimizer': 'sgd', 'activation': <class 'torch.nn.modules.activation.ReLU'>, 'batchnorm': True, 'epochs': 50, 'batch_size': 32, 'flip_prob': 0.0, 'lstm_hidden_dim': 128, 'lstm_layers': 1}. Best is trial 74 with value: 2.6790329756581452.
[I 2025-08-05 10:02:43,445] Trial 82 finished with value: 2.717486400914854 and parameters: {'channels_list': [32, 64], 'kernel_size': 3, 'padding': 1, 'pool_kernel': 2, 'dropout_rate': 0, 'fc_hidden_dim': 64, 'lr': 0.0008358541373945152, 'weight_decay': 0.002402140410090923, 'optimizer': 'sgd', 'activation': <class 'torch.nn.modules.activation.ReLU'>, 'batchnorm': True, 'epochs': 50, 'batch_size': 32, 'flip_prob': 0.0, 'lstm_hidden_dim': 128, 'lstm_layers': 1}. Best is trial 74 with value: 2.6790329756581452.
[I 2025-08-05 10:03:44,480] Trial 83 finished with value: 2.720127620915596 and parameters: {'channels_list': [32, 64], 'kernel_size': 3, 'padding': 1, 'pool_kernel': 2, 'dropout_rate': 0, 'fc_hidden_dim': 64, 'lr': 0.001271813996955249, 'weight_decay': 0.0029654712915974297, 'optimizer': 'sgd', 'activation': <class 'torch.nn.modules.activation.ReLU'>, 'batchnorm': True, 'epochs': 50, 'batch_size': 32, 'flip_prob': 0.0, 'lstm_hidden_dim': 128, 'lstm_layers': 1}. Best is trial 74 with value: 2.6790329756581452.
[I 2025-08-05 10:04:46,261] Trial 84 finished with value: 2.723896551132202 and parameters: {'channels_list': [32, 64, 128], 'kernel_size': 3, 'padding': 1, 'pool_kernel': 2, 'dropout_rate': 0, 'fc_hidden_dim': 64, 'lr': 0.0013411430626086732, 'weight_decay': 0.004360844784784695, 'optimizer': 'sgd', 'activation': <class 'torch.nn.modules.activation.ReLU'>, 'batchnorm': True, 'epochs': 50, 'batch_size': 32, 'flip_prob': 0.0, 'lstm_hidden_dim': 32, 'lstm_layers': 1}. Best is trial 74 with value: 2.6790329756581452.
[I 2025-08-05 10:06:12,644] Trial 85 finished with value: 2.6957601796300907 and parameters: {'channels_list': [32, 64], 'kernel_size': 3, 'padding': 1, 'pool_kernel': 2, 'dropout_rate': 0, 'fc_hidden_dim': 64, 'lr': 0.0009433984550788466, 'weight_decay': 0.006794492332295323, 'optimizer': 'sgd', 'activation': <class 'torch.nn.modules.activation.ReLU'>, 'batchnorm': True, 'epochs': 50, 'batch_size': 32, 'flip_prob': 0.0, 'lstm_hidden_dim': 128, 'lstm_layers': 1}. Best is trial 74 with value: 2.6790329756581452.
[I 2025-08-05 10:06:51,948] Trial 86 finished with value: 2.7295921838758077 and parameters: {'channels_list': [32, 64], 'kernel_size': 5, 'padding': 1, 'pool_kernel': 2, 'dropout_rate': 0, 'fc_hidden_dim': 64, 'lr': 0.0009235255144509519, 'weight_decay': 0.007136250276669889, 'optimizer': 'sgd', 'activation': <class 'torch.nn.modules.activation.ReLU'>, 'batchnorm': True, 'epochs': 50, 'batch_size': 64, 'flip_prob': 0.0, 'lstm_hidden_dim': 128, 'lstm_layers': 1}. Best is trial 74 with value: 2.6790329756581452.
[I 2025-08-05 10:08:11,101] Trial 87 finished with value: 2.704464847705045 and parameters: {'channels_list': [32, 64], 'kernel_size': 3, 'padding': 1, 'pool_kernel': 2, 'dropout_rate': 0, 'fc_hidden_dim': 64, 'lr': 0.0005251517610130429, 'weight_decay': 0.009182896649777363, 'optimizer': 'sgd', 'activation': <class 'torch.nn.modules.activation.ReLU'>, 'batchnorm': True, 'epochs': 50, 'batch_size': 32, 'flip_prob': 0.0, 'lstm_hidden_dim': 128, 'lstm_layers': 1}. Best is trial 74 with value: 2.6790329756581452.
[I 2025-08-05 10:09:41,507] Trial 88 finished with value: 2.756203169126706 and parameters: {'channels_list': [32, 64], 'kernel_size': 3, 'padding': 1, 'pool_kernel': 3, 'dropout_rate': 0, 'fc_hidden_dim': 64, 'lr': 0.000511340010531494, 'weight_decay': 0.009433748205440549, 'optimizer': 'sgd', 'activation': <class 'torch.nn.modules.activation.ReLU'>, 'batchnorm': True, 'epochs': 50, 'batch_size': 32, 'flip_prob': 0.0, 'lstm_hidden_dim': 128, 'lstm_layers': 1}. Best is trial 74 with value: 2.6790329756581452.
[I 2025-08-05 10:11:01,824] Trial 89 finished with value: 2.722559753746981 and parameters: {'channels_list': [32, 64], 'kernel_size': 3, 'padding': 1, 'pool_kernel': 2, 'dropout_rate': 0, 'fc_hidden_dim': 64, 'lr': 0.001553069082726416, 'weight_decay': 0.007914840806627426, 'optimizer': 'sgd', 'activation': <class 'torch.nn.modules.activation.ReLU'>, 'batchnorm': True, 'epochs': 50, 'batch_size': 32, 'flip_prob': 0.0, 'lstm_hidden_dim': 128, 'lstm_layers': 1}. Best is trial 74 with value: 2.6790329756581452.
[I 2025-08-05 10:11:36,519] Trial 90 finished with value: 2.8100995843171788 and parameters: {'channels_list': [32, 64], 'kernel_size': 3, 'padding': 0, 'pool_kernel': 2, 'dropout_rate': 0, 'fc_hidden_dim': 128, 'lr': 0.0017151466487006124, 'weight_decay': 0.0007242620255996931, 'optimizer': 'sgd', 'activation': <class 'torch.nn.modules.activation.ReLU'>, 'batchnorm': True, 'epochs': 50, 'batch_size': 32, 'flip_prob': 0.0, 'lstm_hidden_dim': 128, 'lstm_layers': 1}. Best is trial 74 with value: 2.6790329756581452.
[I 2025-08-05 10:13:34,002] Trial 91 finished with value: 2.7041004357493255 and parameters: {'channels_list': [32, 64], 'kernel_size': 3, 'padding': 1, 'pool_kernel': 2, 'dropout_rate': 0, 'fc_hidden_dim': 64, 'lr': 0.0005493960099857561, 'weight_decay': 0.006289221441341535, 'optimizer': 'sgd', 'activation': <class 'torch.nn.modules.activation.ReLU'>, 'batchnorm': True, 'epochs': 50, 'batch_size': 32, 'flip_prob': 0.0, 'lstm_hidden_dim': 128, 'lstm_layers': 1}. Best is trial 74 with value: 2.6790329756581452.
[I 2025-08-05 10:14:17,872] Trial 92 finished with value: 2.7908316379289433 and parameters: {'channels_list': [32, 64], 'kernel_size': 3, 'padding': 1, 'pool_kernel': 2, 'dropout_rate': 0, 'fc_hidden_dim': 64, 'lr': 0.0005790359940802586, 'weight_decay': 0.006321896904671196, 'optimizer': 'sgd', 'activation': <class 'torch.nn.modules.activation.ReLU'>, 'batchnorm': True, 'epochs': 50, 'batch_size': 32, 'flip_prob': 0.0, 'lstm_hidden_dim': 128, 'lstm_layers': 1}. Best is trial 74 with value: 2.6790329756581452.
[I 2025-08-05 10:15:20,381] Trial 93 finished with value: 2.7206719035550107 and parameters: {'channels_list': [32, 64], 'kernel_size': 3, 'padding': 1, 'pool_kernel': 2, 'dropout_rate': 0, 'fc_hidden_dim': 64, 'lr': 0.0004416619338527385, 'weight_decay': 0.003907788930444233, 'optimizer': 'sgd', 'activation': <class 'torch.nn.modules.activation.ReLU'>, 'batchnorm': True, 'epochs': 50, 'batch_size': 32, 'flip_prob': 0.0, 'lstm_hidden_dim': 128, 'lstm_layers': 1}. Best is trial 74 with value: 2.6790329756581452.
[I 2025-08-05 10:16:04,255] Trial 94 finished with value: 2.7341187375302196 and parameters: {'channels_list': [32, 64], 'kernel_size': 3, 'padding': 1, 'pool_kernel': 2, 'dropout_rate': 0, 'fc_hidden_dim': 64, 'lr': 0.0006505154576898855, 'weight_decay': 1.0287025451439763e-06, 'optimizer': 'sgd', 'activation': <class 'torch.nn.modules.activation.ReLU'>, 'batchnorm': True, 'epochs': 50, 'batch_size': 32, 'flip_prob': 0.0, 'lstm_hidden_dim': 128, 'lstm_layers': 1}. Best is trial 74 with value: 2.6790329756581452.
[I 2025-08-05 10:16:56,416] Trial 95 finished with value: 2.771297542321236 and parameters: {'channels_list': [32, 64, 128], 'kernel_size': 3, 'padding': 1, 'pool_kernel': 2, 'dropout_rate': 0, 'fc_hidden_dim': 64, 'lr': 0.0003627622888777402, 'weight_decay': 0.003001343404776074, 'optimizer': 'sgd', 'activation': <class 'torch.nn.modules.activation.ReLU'>, 'batchnorm': True, 'epochs': 50, 'batch_size': 32, 'flip_prob': 0.0, 'lstm_hidden_dim': 32, 'lstm_layers': 1}. Best is trial 74 with value: 2.6790329756581452.
