[I 2025-08-04 15:10:54,557] Trial 55 finished with value: 2.735106647028998 and parameters: {'channels_list': [32, 64], 'kernel_size': 3, 'padding': 1, 'pool_kernel': 2, 'dropout_rate': 0, 'fc_hidden_dim': 256, 'lr': 0.000940195370302627, 'weight_decay': 0.0064140831012879495, 'optimizer': 'sgd', 'activation': <class 'torch.nn.modules.activation.ReLU'>, 'batchnorm': True, 'epochs': 35, 'batch_size': 64, 'flip_prob': 0.0}. Best is trial 47 with value: 2.711872135169256.
[I 2025-08-04 15:11:50,003] Trial 56 finished with value: 2.7361147389337153 and parameters: {'channels_list': [32, 64], 'kernel_size': 5, 'padding': 1, 'pool_kernel': 2, 'dropout_rate': 0, 'fc_hidden_dim': 128, 'lr': 0.0008502294286564503, 'weight_decay': 1.877690348926283e-06, 'optimizer': 'adam', 'activation': <class 'torch.nn.modules.activation.ReLU'>, 'batchnorm': True, 'epochs': 35, 'batch_size': 64, 'flip_prob': 0.0}. Best is trial 47 with value: 2.711872135169256.
[I 2025-08-04 15:12:25,663] Trial 57 finished with value: 2.817342173147259 and parameters: {'channels_list': [32, 64], 'kernel_size': 5, 'padding': 1, 'pool_kernel': 3, 'dropout_rate': 0, 'fc_hidden_dim': 128, 'lr': 0.0009545783800465544, 'weight_decay': 2.032031780251197e-06, 'optimizer': 'adam', 'activation': <class 'torch.nn.modules.activation.ReLU'>, 'batchnorm': True, 'epochs': 35, 'batch_size': 64, 'flip_prob': 0.0}. Best is trial 47 with value: 2.711872135169256.
[I 2025-08-04 15:13:12,150] Trial 58 finished with value: 2.7468755301002714 and parameters: {'channels_list': [32, 64], 'kernel_size': 5, 'padding': 1, 'pool_kernel': 2, 'dropout_rate': 0, 'fc_hidden_dim': 128, 'lr': 0.0008867434996314971, 'weight_decay': 3.948259147303011e-06, 'optimizer': 'adam', 'activation': <class 'torch.nn.modules.activation.LeakyReLU'>, 'batchnorm': True, 'epochs': 35, 'batch_size': 64, 'flip_prob': 0.0}. Best is trial 47 with value: 2.711872135169256.
[I 2025-08-04 15:13:58,090] Trial 59 finished with value: 2.807290722291346 and parameters: {'channels_list': [32, 64], 'kernel_size': 5, 'padding': 1, 'pool_kernel': 2, 'dropout_rate': 0, 'fc_hidden_dim': 128, 'lr': 0.0012544502498878553, 'weight_decay': 0.006355369082291214, 'optimizer': 'adam', 'activation': <class 'torch.nn.modules.activation.ReLU'>, 'batchnorm': True, 'epochs': 35, 'batch_size': 64, 'flip_prob': 0.0}. Best is trial 47 with value: 2.711872135169256.
[I 2025-08-04 15:15:03,754] Trial 60 finished with value: 2.7512550756065637 and parameters: {'channels_list': [32, 64], 'kernel_size': 5, 'padding': 1, 'pool_kernel': 2, 'dropout_rate': 0, 'fc_hidden_dim': 128, 'lr': 0.009980622483237358, 'weight_decay': 6.362782188515374e-06, 'optimizer': 'adam', 'activation': <class 'torch.nn.modules.activation.ReLU'>, 'batchnorm': True, 'epochs': 35, 'batch_size': 32, 'flip_prob': 0.0}. Best is trial 47 with value: 2.711872135169256.
[I 2025-08-04 15:15:48,335] Trial 61 finished with value: 2.7606442928889403 and parameters: {'channels_list': [32, 64], 'kernel_size': 5, 'padding': 1, 'pool_kernel': 2, 'dropout_rate': 0, 'fc_hidden_dim': 128, 'lr': 0.0008301978728135369, 'weight_decay': 2.6812169637219296e-06, 'optimizer': 'adam', 'activation': <class 'torch.nn.modules.activation.LeakyReLU'>, 'batchnorm': True, 'epochs': 35, 'batch_size': 64, 'flip_prob': 0.0}. Best is trial 47 with value: 2.711872135169256.
[I 2025-08-04 15:16:11,748] Trial 62 finished with value: 2.8254976231168922 and parameters: {'channels_list': [32, 64], 'kernel_size': 5, 'padding': 1, 'pool_kernel': 2, 'dropout_rate': 0, 'fc_hidden_dim': 128, 'lr': 0.0014920789747744961, 'weight_decay': 3.358241877086477e-06, 'optimizer': 'adam', 'activation': <class 'torch.nn.modules.activation.LeakyReLU'>, 'batchnorm': True, 'epochs': 35, 'batch_size': 64, 'flip_prob': 0.0}. Best is trial 47 with value: 2.711872135169256.
[I 2025-08-04 15:16:50,182] Trial 63 finished with value: 2.7566021633953466 and parameters: {'channels_list': [32, 64], 'kernel_size': 5, 'padding': 1, 'pool_kernel': 2, 'dropout_rate': 0, 'fc_hidden_dim': 128, 'lr': 0.0005550036995507074, 'weight_decay': 4.6953785080674445e-06, 'optimizer': 'adam', 'activation': <class 'torch.nn.modules.activation.LeakyReLU'>, 'batchnorm': True, 'epochs': 35, 'batch_size': 64, 'flip_prob': 0.0}. Best is trial 47 with value: 2.711872135169256.
[I 2025-08-04 15:17:15,350] Trial 64 finished with value: 2.8194141094014498 and parameters: {'channels_list': [32, 64], 'kernel_size': 5, 'padding': 1, 'pool_kernel': 2, 'dropout_rate': 0, 'fc_hidden_dim': 128, 'lr': 0.0008679669356668685, 'weight_decay': 1.3276477028625483e-06, 'optimizer': 'adam', 'activation': <class 'torch.nn.modules.activation.LeakyReLU'>, 'batchnorm': True, 'epochs': 35, 'batch_size': 64, 'flip_prob': 0.0}. Best is trial 47 with value: 2.711872135169256.
[I 2025-08-04 15:17:38,111] Trial 65 finished with value: 2.850647941458211 and parameters: {'channels_list': [32, 64], 'kernel_size': 5, 'padding': 1, 'pool_kernel': 2, 'dropout_rate': 0, 'fc_hidden_dim': 128, 'lr': 0.0004357274452310683, 'weight_decay': 1.4617542859777767e-06, 'optimizer': 'adam', 'activation': <class 'torch.nn.modules.activation.LeakyReLU'>, 'batchnorm': True, 'epochs': 35, 'batch_size': 64, 'flip_prob': 0.0}. Best is trial 47 with value: 2.711872135169256.
[I 2025-08-04 15:18:35,140] Trial 66 finished with value: 2.780884525427916 and parameters: {'channels_list': [32, 64], 'kernel_size': 5, 'padding': 1, 'pool_kernel': 2, 'dropout_rate': 0, 'fc_hidden_dim': 128, 'lr': 0.0015567799746385189, 'weight_decay': 0.007819758146276853, 'optimizer': 'adam', 'activation': <class 'torch.nn.modules.activation.LeakyReLU'>, 'batchnorm': True, 'epochs': 35, 'batch_size': 64, 'flip_prob': 0.0}. Best is trial 47 with value: 2.711872135169256.
[I 2025-08-04 15:19:00,097] Trial 67 finished with value: 2.8057985160261643 and parameters: {'channels_list': [32, 64], 'kernel_size': 5, 'padding': 1, 'pool_kernel': 2, 'dropout_rate': 0, 'fc_hidden_dim': 128, 'lr': 0.0010878169041149517, 'weight_decay': 1.0058273498954062e-05, 'optimizer': 'rmsprop', 'activation': <class 'torch.nn.modules.activation.ReLU'>, 'batchnorm': True, 'epochs': 35, 'batch_size': 64, 'flip_prob': 0.0}. Best is trial 47 with value: 2.711872135169256.
[I 2025-08-04 15:19:45,691] Trial 68 finished with value: 2.824698113934985 and parameters: {'channels_list': [32, 64], 'kernel_size': 3, 'padding': 1, 'pool_kernel': 2, 'dropout_rate': 0, 'fc_hidden_dim': 64, 'lr': 0.0006853180063981781, 'weight_decay': 0.004622419576017848, 'optimizer': 'adam', 'activation': <class 'torch.nn.modules.activation.ReLU'>, 'batchnorm': True, 'epochs': 35, 'batch_size': 32, 'flip_prob': 0.0}. Best is trial 47 with value: 2.711872135169256.
[I 2025-08-04 15:19:45,708] Trial 69 pruned. 
[I 2025-08-04 15:19:56,293] Trial 70 finished with value: 3.017552798619748 and parameters: {'channels_list': [32, 64], 'kernel_size': 3, 'padding': 0, 'pool_kernel': 2, 'dropout_rate': 0, 'fc_hidden_dim': 256, 'lr': 0.0003749869821145859, 'weight_decay': 1.0247425329843105e-06, 'optimizer': 'rmsprop', 'activation': <class 'torch.nn.modules.activation.ReLU'>, 'batchnorm': True, 'epochs': 35, 'batch_size': 128, 'flip_prob': 0.0}. Best is trial 47 with value: 2.711872135169256.
[I 2025-08-04 15:20:41,591] Trial 71 finished with value: 2.7653563205525726 and parameters: {'channels_list': [32, 64], 'kernel_size': 5, 'padding': 1, 'pool_kernel': 2, 'dropout_rate': 0, 'fc_hidden_dim': 128, 'lr': 0.009561177805340703, 'weight_decay': 5.3326130621321e-06, 'optimizer': 'adam', 'activation': <class 'torch.nn.modules.activation.ReLU'>, 'batchnorm': True, 'epochs': 35, 'batch_size': 32, 'flip_prob': 0.0}. Best is trial 47 with value: 2.711872135169256.
[I 2025-08-04 15:21:44,385] Trial 72 finished with value: 2.765678265356471 and parameters: {'channels_list': [32, 64], 'kernel_size': 5, 'padding': 1, 'pool_kernel': 2, 'dropout_rate': 0, 'fc_hidden_dim': 128, 'lr': 0.00800838965617191, 'weight_decay': 8.990381742042335e-06, 'optimizer': 'adam', 'activation': <class 'torch.nn.modules.activation.ReLU'>, 'batchnorm': True, 'epochs': 35, 'batch_size': 32, 'flip_prob': 0.0}. Best is trial 47 with value: 2.711872135169256.
[I 2025-08-04 15:22:54,657] Trial 73 finished with value: 2.7406353872849083 and parameters: {'channels_list': [32, 64], 'kernel_size': 5, 'padding': 1, 'pool_kernel': 2, 'dropout_rate': 0, 'fc_hidden_dim': 128, 'lr': 0.005988012475682065, 'weight_decay': 3.355093132570549e-06, 'optimizer': 'adam', 'activation': <class 'torch.nn.modules.activation.ReLU'>, 'batchnorm': True, 'epochs': 35, 'batch_size': 32, 'flip_prob': 0.0}. Best is trial 47 with value: 2.711872135169256.
[I 2025-08-04 15:24:07,739] Trial 74 finished with value: 2.7648915845896282 and parameters: {'channels_list': [32, 64, 128], 'kernel_size': 5, 'padding': 1, 'pool_kernel': 2, 'dropout_rate': 0, 'fc_hidden_dim': 128, 'lr': 0.0065287038573776015, 'weight_decay': 2.5643637125487618e-06, 'optimizer': 'adam', 'activation': <class 'torch.nn.modules.activation.ReLU'>, 'batchnorm': True, 'epochs': 35, 'batch_size': 32, 'flip_prob': 0.0}. Best is trial 47 with value: 2.711872135169256.
[I 2025-08-04 15:24:51,100] Trial 75 finished with value: 2.766606172290153 and parameters: {'channels_list': [32, 64], 'kernel_size': 5, 'padding': 1, 'pool_kernel': 2, 'dropout_rate': 0, 'fc_hidden_dim': 128, 'lr': 0.004484950848446588, 'weight_decay': 4.11412890157929e-06, 'optimizer': 'adam', 'activation': <class 'torch.nn.modules.activation.ReLU'>, 'batchnorm': True, 'epochs': 35, 'batch_size': 32, 'flip_prob': 0.0}. Best is trial 47 with value: 2.711872135169256.
[I 2025-08-04 15:25:04,859] Trial 76 finished with value: 2.829790962101898 and parameters: {'channels_list': [32, 64, 128], 'kernel_size': 3, 'padding': 1, 'pool_kernel': 2, 'dropout_rate': 0, 'fc_hidden_dim': 256, 'lr': 0.003703536097327299, 'weight_decay': 1.7510409432441452e-06, 'optimizer': 'sgd', 'activation': <class 'torch.nn.modules.activation.ReLU'>, 'batchnorm': True, 'epochs': 35, 'batch_size': 128, 'flip_prob': 0.0}. Best is trial 47 with value: 2.711872135169256.
[I 2025-08-04 15:25:36,337] Trial 77 finished with value: 2.7697611579849 and parameters: {'channels_list': [32, 64], 'kernel_size': 5, 'padding': 1, 'pool_kernel': 2, 'dropout_rate': 0, 'fc_hidden_dim': 128, 'lr': 0.0058333684073151705, 'weight_decay': 2.108572069535712e-05, 'optimizer': 'sgd', 'activation': <class 'torch.nn.modules.activation.ReLU'>, 'batchnorm': True, 'epochs': 35, 'batch_size': 64, 'flip_prob': 0.0}. Best is trial 47 with value: 2.711872135169256.
[I 2025-08-04 15:26:08,852] Trial 78 finished with value: 2.823265139415267 and parameters: {'channels_list': [32, 64, 128], 'kernel_size': 3, 'padding': 1, 'pool_kernel': 2, 'dropout_rate': 0, 'fc_hidden_dim': 256, 'lr': 0.007637241034851188, 'weight_decay': 0.005718440694592951, 'optimizer': 'adam', 'activation': <class 'torch.nn.modules.activation.LeakyReLU'>, 'batchnorm': True, 'epochs': 35, 'batch_size': 128, 'flip_prob': 0.0}. Best is trial 47 with value: 2.711872135169256.
[I 2025-08-04 15:27:30,752] Trial 79 finished with value: 2.742012471082846 and parameters: {'channels_list': [32, 64], 'kernel_size': 3, 'padding': 1, 'pool_kernel': 2, 'dropout_rate': 0, 'fc_hidden_dim': 256, 'lr': 0.0030728716365619377, 'weight_decay': 0.008033538541521404, 'optimizer': 'sgd', 'activation': <class 'torch.nn.modules.activation.ReLU'>, 'batchnorm': True, 'epochs': 35, 'batch_size': 32, 'flip_prob': 0.0}. Best is trial 47 with value: 2.711872135169256.
[I 2025-08-04 15:28:41,169] Trial 80 finished with value: 2.786702451774956 and parameters: {'channels_list': [32, 64, 128], 'kernel_size': 3, 'padding': 0, 'pool_kernel': 2, 'dropout_rate': 0, 'fc_hidden_dim': 256, 'lr': 0.004733499842268126, 'weight_decay': 0.007605868607156495, 'optimizer': 'sgd', 'activation': <class 'torch.nn.modules.activation.ReLU'>, 'batchnorm': True, 'epochs': 35, 'batch_size': 32, 'flip_prob': 0.0}. Best is trial 47 with value: 2.711872135169256.
[I 2025-08-04 15:29:48,373] Trial 81 finished with value: 2.7570474102931373 and parameters: {'channels_list': [32, 64], 'kernel_size': 3, 'padding': 1, 'pool_kernel': 2, 'dropout_rate': 0, 'fc_hidden_dim': 256, 'lr': 0.0028731849233849267, 'weight_decay': 0.004997992936503074, 'optimizer': 'sgd', 'activation': <class 'torch.nn.modules.activation.ReLU'>, 'batchnorm': True, 'epochs': 35, 'batch_size': 32, 'flip_prob': 0.0}. Best is trial 47 with value: 2.711872135169256.
[I 2025-08-04 15:30:39,584] Trial 82 finished with value: 2.760327569423165 and parameters: {'channels_list': [32, 64], 'kernel_size': 3, 'padding': 1, 'pool_kernel': 2, 'dropout_rate': 0, 'fc_hidden_dim': 256, 'lr': 0.003780650318728621, 'weight_decay': 0.0034224738732003025, 'optimizer': 'sgd', 'activation': <class 'torch.nn.modules.activation.ReLU'>, 'batchnorm': True, 'epochs': 35, 'batch_size': 32, 'flip_prob': 0.0}. Best is trial 47 with value: 2.711872135169256.
[I 2025-08-04 15:31:16,277] Trial 83 finished with value: 2.7669260064712913 and parameters: {'channels_list': [32, 64], 'kernel_size': 3, 'padding': 1, 'pool_kernel': 2, 'dropout_rate': 0, 'fc_hidden_dim': 256, 'lr': 0.005459424103797234, 'weight_decay': 0.009088726206378869, 'optimizer': 'sgd', 'activation': <class 'torch.nn.modules.activation.ReLU'>, 'batchnorm': True, 'epochs': 35, 'batch_size': 32, 'flip_prob': 0.0}. Best is trial 47 with value: 2.711872135169256.
[I 2025-08-04 15:31:27,105] Trial 84 finished with value: 2.889516228099496 and parameters: {'channels_list': [32, 64], 'kernel_size': 3, 'padding': 1, 'pool_kernel': 2, 'dropout_rate': 0, 'fc_hidden_dim': 256, 'lr': 0.008561632803877412, 'weight_decay': 4.163109136744553e-05, 'optimizer': 'sgd', 'activation': <class 'torch.nn.modules.activation.ReLU'>, 'batchnorm': True, 'epochs': 35, 'batch_size': 128, 'flip_prob': 0.0}. Best is trial 47 with value: 2.711872135169256.
[I 2025-08-04 15:32:39,338] Trial 85 finished with value: 2.7493651728865895 and parameters: {'channels_list': [32, 64], 'kernel_size': 3, 'padding': 1, 'pool_kernel': 2, 'dropout_rate': 0, 'fc_hidden_dim': 64, 'lr': 0.0026957873448298247, 'weight_decay': 0.0077800644835857545, 'optimizer': 'sgd', 'activation': <class 'torch.nn.modules.activation.ReLU'>, 'batchnorm': True, 'epochs': 35, 'batch_size': 32, 'flip_prob': 0.0}. Best is trial 47 with value: 2.711872135169256.
[I 2025-08-04 15:32:39,355] Trial 86 pruned. 
[I 2025-08-04 15:33:02,087] Trial 87 finished with value: 2.762961217721495 and parameters: {'channels_list': [32, 64, 128], 'kernel_size': 3, 'padding': 1, 'pool_kernel': 2, 'dropout_rate': 0, 'fc_hidden_dim': 256, 'lr': 0.0012032078768054529, 'weight_decay': 0.00586495484927749, 'optimizer': 'sgd', 'activation': <class 'torch.nn.modules.activation.ReLU'>, 'batchnorm': True, 'epochs': 35, 'batch_size': 64, 'flip_prob': 0.0}. Best is trial 47 with value: 2.711872135169256.
[I 2025-08-04 15:33:19,681] Trial 88 finished with value: 2.7818890631414583 and parameters: {'channels_list': [32, 64], 'kernel_size': 3, 'padding': 1, 'pool_kernel': 2, 'dropout_rate': 0, 'fc_hidden_dim': 256, 'lr': 0.00321827802290202, 'weight_decay': 6.804806313433252e-06, 'optimizer': 'sgd', 'activation': <class 'torch.nn.modules.activation.ReLU'>, 'batchnorm': True, 'epochs': 35, 'batch_size': 128, 'flip_prob': 0.0}. Best is trial 47 with value: 2.711872135169256.
[I 2025-08-04 15:33:45,039] Trial 89 finished with value: 2.876826764706104 and parameters: {'channels_list': [16, 32, 64], 'kernel_size': 5, 'padding': 1, 'pool_kernel': 2, 'dropout_rate': 0, 'fc_hidden_dim': 128, 'lr': 0.0018680193254150353, 'weight_decay': 0.002770220956433708, 'optimizer': 'adam', 'activation': <class 'torch.nn.modules.activation.ReLU'>, 'batchnorm': True, 'epochs': 35, 'batch_size': 64, 'flip_prob': 0.0}. Best is trial 47 with value: 2.711872135169256.
[I 2025-08-04 15:34:35,416] Trial 90 finished with value: 2.7590851118251125 and parameters: {'channels_list': [32, 64], 'kernel_size': 3, 'padding': 1, 'pool_kernel': 2, 'dropout_rate': 0, 'fc_hidden_dim': 256, 'lr': 0.006720671244396217, 'weight_decay': 3.202398375191038e-06, 'optimizer': 'sgd', 'activation': <class 'torch.nn.modules.activation.LeakyReLU'>, 'batchnorm': True, 'epochs': 35, 'batch_size': 32, 'flip_prob': 0.0}. Best is trial 47 with value: 2.711872135169256.
[I 2025-08-04 15:35:18,511] Trial 91 finished with value: 2.746702118805723 and parameters: {'channels_list': [32, 64], 'kernel_size': 3, 'padding': 1, 'pool_kernel': 2, 'dropout_rate': 0, 'fc_hidden_dim': 256, 'lr': 0.0027046942521932586, 'weight_decay': 0.007674662756236358, 'optimizer': 'sgd', 'activation': <class 'torch.nn.modules.activation.ReLU'>, 'batchnorm': True, 'epochs': 35, 'batch_size': 32, 'flip_prob': 0.0}. Best is trial 47 with value: 2.711872135169256.
[I 2025-08-04 15:36:00,122] Trial 92 finished with value: 2.773521506570648 and parameters: {'channels_list': [32, 64], 'kernel_size': 3, 'padding': 1, 'pool_kernel': 2, 'dropout_rate': 0, 'fc_hidden_dim': 256, 'lr': 0.003749003084875676, 'weight_decay': 0.006669447602929859, 'optimizer': 'sgd', 'activation': <class 'torch.nn.modules.activation.ReLU'>, 'batchnorm': True, 'epochs': 35, 'batch_size': 32, 'flip_prob': 0.0}. Best is trial 47 with value: 2.711872135169256.
[I 2025-08-04 15:36:58,639] Trial 93 finished with value: 2.7436956053044743 and parameters: {'channels_list': [32, 64], 'kernel_size': 3, 'padding': 1, 'pool_kernel': 2, 'dropout_rate': 0, 'fc_hidden_dim': 256, 'lr': 0.0010527152461949243, 'weight_decay': 0.0036587821483546573, 'optimizer': 'sgd', 'activation': <class 'torch.nn.modules.activation.ReLU'>, 'batchnorm': True, 'epochs': 35, 'batch_size': 32, 'flip_prob': 0.0}. Best is trial 47 with value: 2.711872135169256.
[I 2025-08-04 15:37:33,449] Trial 94 finished with value: 2.7976392322052517 and parameters: {'channels_list': [32, 64], 'kernel_size': 3, 'padding': 1, 'pool_kernel': 2, 'dropout_rate': 0, 'fc_hidden_dim': 256, 'lr': 0.002713700851245875, 'weight_decay': 0.003753979462763517, 'optimizer': 'sgd', 'activation': <class 'torch.nn.modules.activation.ReLU'>, 'batchnorm': True, 'epochs': 35, 'batch_size': 32, 'flip_prob': 0.0}. Best is trial 47 with value: 2.711872135169256.
[I 2025-08-04 15:38:39,030] Trial 95 finished with value: 2.732704819643598 and parameters: {'channels_list': [16, 32, 64, 128], 'kernel_size': 3, 'padding': 1, 'pool_kernel': 2, 'dropout_rate': 0, 'fc_hidden_dim': 256, 'lr': 0.0010293460006499146, 'weight_decay': 0.009277635665949205, 'optimizer': 'sgd', 'activation': <class 'torch.nn.modules.activation.ReLU'>, 'batchnorm': True, 'epochs': 35, 'batch_size': 32, 'flip_prob': 0.0}. Best is trial 47 with value: 2.711872135169256.
[I 2025-08-04 15:39:35,634] Trial 96 finished with value: 2.7249343586198096 and parameters: {'channels_list': [16, 32, 64, 128], 'kernel_size': 3, 'padding': 1, 'pool_kernel': 2, 'dropout_rate': 0, 'fc_hidden_dim': 256, 'lr': 0.0010881538955110001, 'weight_decay': 0.009844654862603039, 'optimizer': 'sgd', 'activation': <class 'torch.nn.modules.activation.ReLU'>, 'batchnorm': True, 'epochs': 35, 'batch_size': 32, 'flip_prob': 0.0}. Best is trial 47 with value: 2.711872135169256.
[I 2025-08-04 15:40:20,470] Trial 97 finished with value: 2.7769417595374426 and parameters: {'channels_list': [16, 32, 64, 128], 'kernel_size': 3, 'padding': 1, 'pool_kernel': 2, 'dropout_rate': 0, 'fc_hidden_dim': 256, 'lr': 0.00015830594221773387, 'weight_decay': 0.009940407405585414, 'optimizer': 'sgd', 'activation': <class 'torch.nn.modules.activation.ReLU'>, 'batchnorm': True, 'epochs': 35, 'batch_size': 32, 'flip_prob': 0.0}. Best is trial 47 with value: 2.711872135169256.
[I 2025-08-04 15:40:20,487] Trial 98 pruned. 
[I 2025-08-04 15:40:20,513] Trial 99 pruned. 
[I 2025-08-04 15:40:49,970] Trial 100 finished with value: 2.789073993673658 and parameters: {'channels_list': [16, 32, 64, 128], 'kernel_size': 3, 'padding': 1, 'pool_kernel': 2, 'dropout_rate': 0, 'fc_hidden_dim': 256, 'lr': 0.0007010089610086315, 'weight_decay': 0.005578728865401165, 'optimizer': 'rmsprop', 'activation': <class 'torch.nn.modules.activation.ReLU'>, 'batchnorm': True, 'epochs': 35, 'batch_size': 128, 'flip_prob': 0.0}. Best is trial 47 with value: 2.711872135169256.
[I 2025-08-04 15:41:31,952] Trial 101 finished with value: 2.751628144716325 and parameters: {'channels_list': [16, 32, 64, 128], 'kernel_size': 3, 'padding': 1, 'pool_kernel': 2, 'dropout_rate': 0, 'fc_hidden_dim': 256, 'lr': 0.0010101321943081208, 'weight_decay': 0.006535286314607674, 'optimizer': 'sgd', 'activation': <class 'torch.nn.modules.activation.ReLU'>, 'batchnorm': True, 'epochs': 35, 'batch_size': 32, 'flip_prob': 0.0}. Best is trial 47 with value: 2.711872135169256.
[I 2025-08-04 15:42:28,578] Trial 102 finished with value: 2.7473507184602672 and parameters: {'channels_list': [16, 32, 64, 128], 'kernel_size': 3, 'padding': 1, 'pool_kernel': 2, 'dropout_rate': 0, 'fc_hidden_dim': 256, 'lr': 0.0013362080006248675, 'weight_decay': 0.00402779706542435, 'optimizer': 'sgd', 'activation': <class 'torch.nn.modules.activation.ReLU'>, 'batchnorm': True, 'epochs': 35, 'batch_size': 32, 'flip_prob': 0.0}. Best is trial 47 with value: 2.711872135169256.
[I 2025-08-04 15:43:13,520] Trial 103 finished with value: 2.748155623609683 and parameters: {'channels_list': [16, 32, 64, 128], 'kernel_size': 3, 'padding': 1, 'pool_kernel': 2, 'dropout_rate': 0, 'fc_hidden_dim': 256, 'lr': 0.0010791312650348319, 'weight_decay': 0.002570748646184206, 'optimizer': 'sgd', 'activation': <class 'torch.nn.modules.activation.ReLU'>, 'batchnorm': True, 'epochs': 35, 'batch_size': 32, 'flip_prob': 0.0}. Best is trial 47 with value: 2.711872135169256.
