[I 2025-08-05 07:54:45,595] Trial 248 finished with value: 2.7588315048608907 and parameters: {'patch_size': 6, 'emb_dim': 256, 'depth': 2, 'n_heads': 2, 'mlp_dim': 128, 'dropout_rate': 0, 'lr': 0.003181372340968265, 'weight_decay': 0.0017993056905647995, 'optimizer': 'sgd', 'activation': <class 'torch.nn.modules.activation.ReLU'>, 'epochs': 100, 'batch_size': 32, 'flip_prob': 0.0}. Best is trial 102 with value: 2.7074620693814193.
[I 2025-08-05 07:56:25,680] Trial 249 finished with value: 2.7650076606736684 and parameters: {'patch_size': 6, 'emb_dim': 256, 'depth': 2, 'n_heads': 2, 'mlp_dim': 128, 'dropout_rate': 0, 'lr': 0.003700549982741247, 'weight_decay': 0.0015541315879044138, 'optimizer': 'sgd', 'activation': <class 'torch.nn.modules.activation.ReLU'>, 'epochs': 100, 'batch_size': 32, 'flip_prob': 0.0}. Best is trial 102 with value: 2.7074620693814193.
[I 2025-08-05 07:59:20,493] Trial 250 finished with value: 2.812043376653416 and parameters: {'patch_size': 4, 'emb_dim': 256, 'depth': 2, 'n_heads': 2, 'mlp_dim': 128, 'dropout_rate': 0, 'lr': 0.0030168345133534703, 'weight_decay': 0.001518058726279723, 'optimizer': 'rmsprop', 'activation': <class 'torch.nn.modules.activation.ReLU'>, 'epochs': 100, 'batch_size': 32, 'flip_prob': 0.0}. Best is trial 102 with value: 2.7074620693814193.
[I 2025-08-05 08:02:17,357] Trial 251 finished with value: 2.7503520235652945 and parameters: {'patch_size': 6, 'emb_dim': 128, 'depth': 2, 'n_heads': 2, 'mlp_dim': 128, 'dropout_rate': 0, 'lr': 0.003390172912793817, 'weight_decay': 0.0021227498583508003, 'optimizer': 'sgd', 'activation': <class 'torch.nn.modules.activation.ReLU'>, 'epochs': 100, 'batch_size': 32, 'flip_prob': 0.0}. Best is trial 102 with value: 2.7074620693814193.
[I 2025-08-05 08:05:44,992] Trial 252 finished with value: 2.7785451402997796 and parameters: {'patch_size': 6, 'emb_dim': 64, 'depth': 2, 'n_heads': 2, 'mlp_dim': 128, 'dropout_rate': 0, 'lr': 0.002600155921822167, 'weight_decay': 0.0023920819824289744, 'optimizer': 'sgd', 'activation': <class 'torch.nn.modules.activation.ReLU'>, 'epochs': 100, 'batch_size': 32, 'flip_prob': 0.0}. Best is trial 102 with value: 2.7074620693814193.
[I 2025-08-05 08:08:03,721] Trial 253 finished with value: 2.7761682184240066 and parameters: {'patch_size': 6, 'emb_dim': 256, 'depth': 2, 'n_heads': 8, 'mlp_dim': 128, 'dropout_rate': 0, 'lr': 0.0021166039942779307, 'weight_decay': 0.0018557682796639771, 'optimizer': 'sgd', 'activation': <class 'torch.nn.modules.activation.ReLU'>, 'epochs': 100, 'batch_size': 32, 'flip_prob': 0.0}. Best is trial 102 with value: 2.7074620693814193.
[I 2025-08-05 08:09:39,264] Trial 254 finished with value: 2.7656066725998936 and parameters: {'patch_size': 6, 'emb_dim': 256, 'depth': 2, 'n_heads': 2, 'mlp_dim': 128, 'dropout_rate': 0, 'lr': 0.002434482693777144, 'weight_decay': 0.0013445620181649096, 'optimizer': 'sgd', 'activation': <class 'torch.nn.modules.activation.ReLU'>, 'epochs': 100, 'batch_size': 32, 'flip_prob': 0.0}. Best is trial 102 with value: 2.7074620693814193.
[I 2025-08-05 08:10:32,184] Trial 255 finished with value: 2.8189682756315815 and parameters: {'patch_size': 6, 'emb_dim': 256, 'depth': 2, 'n_heads': 2, 'mlp_dim': 128, 'dropout_rate': 0, 'lr': 0.0016920196993873294, 'weight_decay': 0.0015092810280995348, 'optimizer': 'sgd', 'activation': <class 'torch.nn.modules.activation.ReLU'>, 'epochs': 100, 'batch_size': 64, 'flip_prob': 0.0}. Best is trial 102 with value: 2.7074620693814193.
[I 2025-08-05 08:13:46,483] Trial 256 finished with value: 2.7795860629317555 and parameters: {'patch_size': 6, 'emb_dim': 256, 'depth': 4, 'n_heads': 2, 'mlp_dim': 128, 'dropout_rate': 0, 'lr': 0.0028728216855161376, 'weight_decay': 0.0017302900801654433, 'optimizer': 'sgd', 'activation': <class 'torch.nn.modules.activation.ReLU'>, 'epochs': 100, 'batch_size': 32, 'flip_prob': 0.0}. Best is trial 102 with value: 2.7074620693814193.
[I 2025-08-05 08:16:18,505] Trial 257 finished with value: 2.7457753115310024 and parameters: {'patch_size': 6, 'emb_dim': 256, 'depth': 2, 'n_heads': 2, 'mlp_dim': 128, 'dropout_rate': 0, 'lr': 0.0037813379082699793, 'weight_decay': 0.0012860409465242071, 'optimizer': 'sgd', 'activation': <class 'torch.nn.modules.activation.ReLU'>, 'epochs': 100, 'batch_size': 32, 'flip_prob': 0.0}. Best is trial 102 with value: 2.7074620693814193.
[I 2025-08-05 08:18:24,282] Trial 258 finished with value: 2.7730184300242056 and parameters: {'patch_size': 6, 'emb_dim': 256, 'depth': 2, 'n_heads': 2, 'mlp_dim': 128, 'dropout_rate': 0, 'lr': 0.0019562089873529634, 'weight_decay': 0.0010745957962592576, 'optimizer': 'sgd', 'activation': <class 'torch.nn.modules.activation.GELU'>, 'epochs': 100, 'batch_size': 32, 'flip_prob': 0.0}. Best is trial 102 with value: 2.7074620693814193.
[I 2025-08-05 08:20:34,653] Trial 259 finished with value: 2.76093133821706 and parameters: {'patch_size': 6, 'emb_dim': 256, 'depth': 2, 'n_heads': 2, 'mlp_dim': 128, 'dropout_rate': 0, 'lr': 0.0026088861317805205, 'weight_decay': 0.0006907191994073666, 'optimizer': 'sgd', 'activation': <class 'torch.nn.modules.activation.ReLU'>, 'epochs': 100, 'batch_size': 32, 'flip_prob': 0.0}. Best is trial 102 with value: 2.7074620693814193.
[I 2025-08-05 08:22:48,351] Trial 260 finished with value: 2.7610831477529896 and parameters: {'patch_size': 6, 'emb_dim': 128, 'depth': 2, 'n_heads': 2, 'mlp_dim': 128, 'dropout_rate': 0, 'lr': 0.003157389359124035, 'weight_decay': 6.265827739659895e-05, 'optimizer': 'sgd', 'activation': <class 'torch.nn.modules.activation.ReLU'>, 'epochs': 100, 'batch_size': 32, 'flip_prob': 0.0}. Best is trial 102 with value: 2.7074620693814193.
[I 2025-08-05 08:26:08,469] Trial 261 finished with value: 2.7437240299758634 and parameters: {'patch_size': 4, 'emb_dim': 256, 'depth': 2, 'n_heads': 2, 'mlp_dim': 128, 'dropout_rate': 0, 'lr': 0.002196524019429695, 'weight_decay': 0.001319539328717528, 'optimizer': 'sgd', 'activation': <class 'torch.nn.modules.activation.ReLU'>, 'epochs': 100, 'batch_size': 32, 'flip_prob': 0.0}. Best is trial 102 with value: 2.7074620693814193.
[I 2025-08-05 08:27:22,816] Trial 262 finished with value: 2.7987435958066236 and parameters: {'patch_size': 6, 'emb_dim': 256, 'depth': 2, 'n_heads': 2, 'mlp_dim': 128, 'dropout_rate': 0, 'lr': 0.002424451734936267, 'weight_decay': 0.0009611575052849494, 'optimizer': 'sgd', 'activation': <class 'torch.nn.modules.activation.ReLU'>, 'epochs': 100, 'batch_size': 128, 'flip_prob': 0.25}. Best is trial 102 with value: 2.7074620693814193.
[I 2025-08-05 08:30:25,895] Trial 263 finished with value: 2.7452934662596884 and parameters: {'patch_size': 6, 'emb_dim': 256, 'depth': 2, 'n_heads': 2, 'mlp_dim': 128, 'dropout_rate': 0, 'lr': 0.0018401562878667035, 'weight_decay': 0.0016645601983606003, 'optimizer': 'sgd', 'activation': <class 'torch.nn.modules.activation.ReLU'>, 'epochs': 100, 'batch_size': 32, 'flip_prob': 0.0}. Best is trial 102 with value: 2.7074620693814193.
[I 2025-08-05 08:32:32,453] Trial 264 finished with value: 2.786650738238713 and parameters: {'patch_size': 6, 'emb_dim': 256, 'depth': 2, 'n_heads': 2, 'mlp_dim': 128, 'dropout_rate': 0, 'lr': 0.002768180767513926, 'weight_decay': 0.0007001086115529957, 'optimizer': 'sgd', 'activation': <class 'torch.nn.modules.activation.ReLU'>, 'epochs': 100, 'batch_size': 32, 'flip_prob': 0.5}. Best is trial 102 with value: 2.7074620693814193.
[I 2025-08-05 08:33:19,585] Trial 265 finished with value: 2.8910830866442083 and parameters: {'patch_size': 6, 'emb_dim': 256, 'depth': 2, 'n_heads': 2, 'mlp_dim': 128, 'dropout_rate': 0, 'lr': 0.002058161275336779, 'weight_decay': 9.408195059834686e-05, 'optimizer': 'adamw', 'activation': <class 'torch.nn.modules.activation.ReLU'>, 'epochs': 100, 'batch_size': 64, 'flip_prob': 0.0}. Best is trial 102 with value: 2.7074620693814193.
[I 2025-08-05 08:34:42,670] Trial 266 finished with value: 2.778875872136888 and parameters: {'patch_size': 6, 'emb_dim': 256, 'depth': 2, 'n_heads': 2, 'mlp_dim': 128, 'dropout_rate': 0, 'lr': 0.003458542127693524, 'weight_decay': 0.0011899551406339454, 'optimizer': 'sgd', 'activation': <class 'torch.nn.modules.activation.ReLU'>, 'epochs': 100, 'batch_size': 32, 'flip_prob': 0.0}. Best is trial 102 with value: 2.7074620693814193.
[I 2025-08-05 08:37:02,704] Trial 267 finished with value: 2.755771891717025 and parameters: {'patch_size': 6, 'emb_dim': 256, 'depth': 2, 'n_heads': 2, 'mlp_dim': 512, 'dropout_rate': 0, 'lr': 0.0023884003496146273, 'weight_decay': 0.0005616666675044441, 'optimizer': 'sgd', 'activation': <class 'torch.nn.modules.activation.ReLU'>, 'epochs': 100, 'batch_size': 32, 'flip_prob': 0.0}. Best is trial 102 with value: 2.7074620693814193.
[I 2025-08-05 08:38:56,547] Trial 268 finished with value: 2.7692834701699143 and parameters: {'patch_size': 6, 'emb_dim': 256, 'depth': 2, 'n_heads': 2, 'mlp_dim': 128, 'dropout_rate': 0, 'lr': 0.003042075012869397, 'weight_decay': 0.002474724397499743, 'optimizer': 'sgd', 'activation': <class 'torch.nn.modules.activation.ReLU'>, 'epochs': 100, 'batch_size': 32, 'flip_prob': 0.0}. Best is trial 102 with value: 2.7074620693814193.
[I 2025-08-05 08:42:58,394] Trial 269 finished with value: 2.726125355652647 and parameters: {'patch_size': 6, 'emb_dim': 128, 'depth': 2, 'n_heads': 2, 'mlp_dim': 128, 'dropout_rate': 0, 'lr': 0.0017252279478939471, 'weight_decay': 0.000939070059158263, 'optimizer': 'sgd', 'activation': <class 'torch.nn.modules.activation.ReLU'>, 'epochs': 100, 'batch_size': 32, 'flip_prob': 0.0}. Best is trial 102 with value: 2.7074620693814193.
[I 2025-08-05 08:45:29,915] Trial 270 finished with value: 2.7689908856505796 and parameters: {'patch_size': 6, 'emb_dim': 128, 'depth': 2, 'n_heads': 2, 'mlp_dim': 128, 'dropout_rate': 0, 'lr': 0.0016155451842857149, 'weight_decay': 0.0009467015800313691, 'optimizer': 'sgd', 'activation': <class 'torch.nn.modules.activation.ReLU'>, 'epochs': 100, 'batch_size': 32, 'flip_prob': 0.0}. Best is trial 102 with value: 2.7074620693814193.
[I 2025-08-05 08:48:49,740] Trial 271 finished with value: 2.727274966556287 and parameters: {'patch_size': 6, 'emb_dim': 128, 'depth': 2, 'n_heads': 2, 'mlp_dim': 128, 'dropout_rate': 0, 'lr': 0.0014565077431006553, 'weight_decay': 0.0008438804885227225, 'optimizer': 'sgd', 'activation': <class 'torch.nn.modules.activation.ReLU'>, 'epochs': 100, 'batch_size': 32, 'flip_prob': 0.0}. Best is trial 102 with value: 2.7074620693814193.
[I 2025-08-05 08:50:48,111] Trial 272 finished with value: 2.7859102081763587 and parameters: {'patch_size': 6, 'emb_dim': 128, 'depth': 2, 'n_heads': 8, 'mlp_dim': 128, 'dropout_rate': 0, 'lr': 0.0014865715111375204, 'weight_decay': 0.0007915990891109959, 'optimizer': 'sgd', 'activation': <class 'torch.nn.modules.activation.ReLU'>, 'epochs': 100, 'batch_size': 32, 'flip_prob': 0.0}. Best is trial 102 with value: 2.7074620693814193.
[I 2025-08-05 08:53:56,074] Trial 273 finished with value: 2.7526064259007987 and parameters: {'patch_size': 4, 'emb_dim': 128, 'depth': 2, 'n_heads': 2, 'mlp_dim': 128, 'dropout_rate': 0, 'lr': 0.0016928239665763324, 'weight_decay': 0.0009804514171447237, 'optimizer': 'sgd', 'activation': <class 'torch.nn.modules.activation.ReLU'>, 'epochs': 100, 'batch_size': 32, 'flip_prob': 0.0}. Best is trial 102 with value: 2.7074620693814193.
