[I 2025-08-04 20:54:11,373] Trial 499 finished with value: 2.7048409888195044 and parameters: {'channels_list': [16, 32, 64], 'kernel_size': 3, 'padding': 1, 'pool_kernel': 2, 'dropout_rate': 0, 'fc_hidden_dim': 256, 'lr': 0.0014238405960560624, 'weight_decay': 1.7170698720919819e-06, 'optimizer': 'rmsprop', 'activation': <class 'torch.nn.modules.activation.LeakyReLU'>, 'batchnorm': True, 'epochs': 35, 'batch_size': 32, 'flip_prob': 0.0}. Best is trial 269 with value: 2.690232738856096.
CUDA available: True
Device count: 1
CUDA version: 12.6
Torch version: 2.7.0
Using GPU: NVIDIA RTX A6000
[Trial 0] skipped due to model construction error: Calculated padded input size per channel: (9 x 3). Kernel size: (5 x 5). Kernel size can't be greater than actual input size
[Trial 1] skipped due to model construction error: Calculated padded input size per channel: (7 x 1). Kernel size: (7 x 7). Kernel size can't be greater than actual input size
val phase, Epoch 1/35, Loss: 3.470815
val phase, Epoch 2/35, Loss: 2.919182
val phase, Epoch 3/35, Loss: 3.528092
val phase, Epoch 4/35, Loss: 3.657215
val phase, Epoch 5/35, Loss: 2.994650
val phase, Epoch 6/35, Loss: 2.927734
[Epoch 5] LR reduced from 4.230552e-03 to 2.115276e-03
val phase, Epoch 7/35, Loss: 2.873639
val phase, Epoch 8/35, Loss: 3.043577
val phase, Epoch 9/35, Loss: 2.762898
val phase, Epoch 10/35, Loss: 3.028945
val phase, Epoch 11/35, Loss: 2.843042
val phase, Epoch 12/35, Loss: 3.098262
val phase, Epoch 13/35, Loss: 2.953011
[Epoch 12] LR reduced from 2.115276e-03 to 1.057638e-03
val phase, Epoch 14/35, Loss: 3.271547
val phase, Epoch 15/35, Loss: 3.068244
val phase, Epoch 16/35, Loss: 3.360141
Early stopping at epoch 16 due to no improvement in val loss.
[Trial 3] skipped due to model construction error: Calculated padded input size per channel: (9 x 3). Kernel size: (5 x 5). Kernel size can't be greater than actual input size
val phase, Epoch 1/35, Loss: 4.655047
val phase, Epoch 2/35, Loss: 3.469199
val phase, Epoch 3/35, Loss: 3.588662
val phase, Epoch 4/35, Loss: 3.030419
val phase, Epoch 5/35, Loss: 3.085929
val phase, Epoch 6/35, Loss: 2.982344
val phase, Epoch 7/35, Loss: 3.070969
val phase, Epoch 8/35, Loss: 3.426355
val phase, Epoch 9/35, Loss: 2.933587
val phase, Epoch 10/35, Loss: 2.996531
val phase, Epoch 11/35, Loss: 3.111538
val phase, Epoch 12/35, Loss: 3.583229
val phase, Epoch 13/35, Loss: 3.428419
[Epoch 12] LR reduced from 1.433603e-03 to 7.168014e-04
val phase, Epoch 14/35, Loss: 3.594179
val phase, Epoch 15/35, Loss: 3.300934
val phase, Epoch 16/35, Loss: 2.953441
Early stopping at epoch 16 due to no improvement in val loss.
[Trial 5] skipped due to model construction error: Calculated padded input size per channel: (4 x 1). Kernel size: (3 x 3). Kernel size can't be greater than actual input size
val phase, Epoch 1/35, Loss: 2.960860
val phase, Epoch 2/35, Loss: 2.953151
val phase, Epoch 3/35, Loss: 2.976352
val phase, Epoch 4/35, Loss: 2.880230
val phase, Epoch 5/35, Loss: 2.841722
val phase, Epoch 6/35, Loss: 2.918544
val phase, Epoch 7/35, Loss: 2.810166
val phase, Epoch 8/35, Loss: 3.185541
val phase, Epoch 9/35, Loss: 3.346950
val phase, Epoch 10/35, Loss: 2.803483
val phase, Epoch 11/35, Loss: 3.745724
val phase, Epoch 12/35, Loss: 2.993745
val phase, Epoch 13/35, Loss: 2.901282
val phase, Epoch 14/35, Loss: 3.827742
[Epoch 13] LR reduced from 4.197685e-03 to 2.098842e-03
val phase, Epoch 15/35, Loss: 2.794079
val phase, Epoch 16/35, Loss: 2.783787
val phase, Epoch 17/35, Loss: 2.934513
val phase, Epoch 18/35, Loss: 2.840141
val phase, Epoch 19/35, Loss: 3.992231
val phase, Epoch 20/35, Loss: 3.347084
[Epoch 19] LR reduced from 2.098842e-03 to 1.049421e-03
val phase, Epoch 21/35, Loss: 3.155104
val phase, Epoch 22/35, Loss: 2.809242
val phase, Epoch 23/35, Loss: 2.923888
Early stopping at epoch 23 due to no improvement in val loss.
[Trial 7] skipped due to model construction error: Given input size: (64x10x2). Calculated output size: (64x3x0). Output size is too small
[Trial 8] skipped due to model construction error: Given input size: (32x10x2). Calculated output size: (32x3x0). Output size is too small
[Trial 9] skipped due to model construction error: Given input size: (32x10x2). Calculated output size: (32x3x0). Output size is too small
val phase, Epoch 1/35, Loss: 3.583231
val phase, Epoch 2/35, Loss: 3.709385
val phase, Epoch 3/35, Loss: 2.909347
val phase, Epoch 4/35, Loss: 5.796546
val phase, Epoch 5/35, Loss: 3.354957
val phase, Epoch 6/35, Loss: 3.509515
val phase, Epoch 7/35, Loss: 2.852681
val phase, Epoch 8/35, Loss: 3.438668
val phase, Epoch 9/35, Loss: 4.024088
val phase, Epoch 10/35, Loss: 2.940588
val phase, Epoch 11/35, Loss: 3.361528
[Epoch 10] LR reduced from 8.328591e-03 to 4.164296e-03
val phase, Epoch 12/35, Loss: 2.799183
val phase, Epoch 13/35, Loss: 3.328322
val phase, Epoch 14/35, Loss: 3.756389
val phase, Epoch 15/35, Loss: 2.780283
val phase, Epoch 16/35, Loss: 2.790049
val phase, Epoch 17/35, Loss: 3.066561
val phase, Epoch 18/35, Loss: 3.141023
val phase, Epoch 19/35, Loss: 2.839997
[Epoch 18] LR reduced from 4.164296e-03 to 2.082148e-03
val phase, Epoch 20/35, Loss: 3.178398
val phase, Epoch 21/35, Loss: 4.274245
val phase, Epoch 22/35, Loss: 2.739631
val phase, Epoch 23/35, Loss: 3.302972
val phase, Epoch 24/35, Loss: 2.943943
val phase, Epoch 25/35, Loss: 3.246404
val phase, Epoch 26/35, Loss: 3.493102
[Epoch 25] LR reduced from 2.082148e-03 to 1.041074e-03
val phase, Epoch 27/35, Loss: 3.924374
val phase, Epoch 28/35, Loss: 3.722583
val phase, Epoch 29/35, Loss: 2.735224
val phase, Epoch 30/35, Loss: 3.145093
val phase, Epoch 31/35, Loss: 3.287708
val phase, Epoch 32/35, Loss: 2.959046
val phase, Epoch 33/35, Loss: 3.729913
[Epoch 32] LR reduced from 1.041074e-03 to 5.205370e-04
val phase, Epoch 34/35, Loss: 3.310369
val phase, Epoch 35/35, Loss: 2.780190
val phase, Epoch 1/35, Loss: 3.939166
val phase, Epoch 2/35, Loss: 2.998495
val phase, Epoch 3/35, Loss: 3.048886
val phase, Epoch 4/35, Loss: 4.323612
val phase, Epoch 5/35, Loss: 2.851370
val phase, Epoch 6/35, Loss: 2.957167
val phase, Epoch 7/35, Loss: 2.998573
val phase, Epoch 8/35, Loss: 3.161802
val phase, Epoch 9/35, Loss: 2.810007
val phase, Epoch 10/35, Loss: 3.162228
val phase, Epoch 11/35, Loss: 3.479163
val phase, Epoch 12/35, Loss: 2.770328
val phase, Epoch 13/35, Loss: 3.706834
val phase, Epoch 14/35, Loss: 3.122252
val phase, Epoch 15/35, Loss: 3.606052
val phase, Epoch 16/35, Loss: 2.957113
[Epoch 15] LR reduced from 8.739220e-03 to 4.369610e-03
val phase, Epoch 17/35, Loss: 3.325728
val phase, Epoch 18/35, Loss: 3.028460
val phase, Epoch 19/35, Loss: 3.235410
Early stopping at epoch 19 due to no improvement in val loss.
val phase, Epoch 1/35, Loss: 3.188601
val phase, Epoch 2/35, Loss: 3.183677
val phase, Epoch 3/35, Loss: 3.606788
val phase, Epoch 4/35, Loss: 3.414130
val phase, Epoch 5/35, Loss: 2.939874
val phase, Epoch 6/35, Loss: 2.984446
val phase, Epoch 7/35, Loss: 3.368950
val phase, Epoch 8/35, Loss: 3.409269
val phase, Epoch 9/35, Loss: 3.095762
val phase, Epoch 10/35, Loss: 3.331658
val phase, Epoch 11/35, Loss: 3.008440
val phase, Epoch 12/35, Loss: 3.541943
Early stopping at epoch 12 due to no improvement in val loss.
val phase, Epoch 1/35, Loss: 3.156156
val phase, Epoch 2/35, Loss: 2.881960
val phase, Epoch 3/35, Loss: 3.558926
val phase, Epoch 4/35, Loss: 3.417938
val phase, Epoch 5/35, Loss: 3.361614
val phase, Epoch 6/35, Loss: 3.500297
[Epoch 5] LR reduced from 8.779402e-03 to 4.389701e-03
val phase, Epoch 7/35, Loss: 3.079650
val phase, Epoch 8/35, Loss: 3.071484
val phase, Epoch 9/35, Loss: 3.402033
Early stopping at epoch 9 due to no improvement in val loss.
val phase, Epoch 1/35, Loss: 3.697529
val phase, Epoch 2/35, Loss: 3.293345
val phase, Epoch 3/35, Loss: 3.094192
val phase, Epoch 4/35, Loss: 3.687591
val phase, Epoch 5/35, Loss: 3.937672
val phase, Epoch 6/35, Loss: 2.923798
val phase, Epoch 7/35, Loss: 3.079817
val phase, Epoch 8/35, Loss: 3.360203
val phase, Epoch 9/35, Loss: 3.238459
val phase, Epoch 10/35, Loss: 3.082381
[Epoch 9] LR reduced from 2.518674e-03 to 1.259337e-03
val phase, Epoch 11/35, Loss: 2.812807
val phase, Epoch 12/35, Loss: 2.757199
val phase, Epoch 13/35, Loss: 2.794813
val phase, Epoch 14/35, Loss: 3.380699
val phase, Epoch 15/35, Loss: 3.259307
val phase, Epoch 16/35, Loss: 3.742773
[Epoch 15] LR reduced from 1.259337e-03 to 6.296686e-04
val phase, Epoch 17/35, Loss: 3.630854
val phase, Epoch 18/35, Loss: 3.633398
val phase, Epoch 19/35, Loss: 3.340966
Early stopping at epoch 19 due to no improvement in val loss.
val phase, Epoch 1/35, Loss: 3.101002
val phase, Epoch 2/35, Loss: 3.520725
val phase, Epoch 3/35, Loss: 3.128663
val phase, Epoch 4/35, Loss: 2.828570
val phase, Epoch 5/35, Loss: 3.099041
val phase, Epoch 6/35, Loss: 3.290943
val phase, Epoch 7/35, Loss: 3.136407
val phase, Epoch 8/35, Loss: 3.613280
[Epoch 7] LR reduced from 2.461552e-03 to 1.230776e-03
val phase, Epoch 9/35, Loss: 2.898866
val phase, Epoch 10/35, Loss: 2.815556
val phase, Epoch 11/35, Loss: 3.045831
val phase, Epoch 12/35, Loss: 3.303482
val phase, Epoch 13/35, Loss: 3.393359
val phase, Epoch 14/35, Loss: 3.046127
[Epoch 13] LR reduced from 1.230776e-03 to 6.153881e-04
val phase, Epoch 15/35, Loss: 2.921421
val phase, Epoch 16/35, Loss: 3.352678
val phase, Epoch 17/35, Loss: 3.191015
Early stopping at epoch 17 due to no improvement in val loss.
val phase, Epoch 1/35, Loss: 3.628027
val phase, Epoch 2/35, Loss: 4.019366
val phase, Epoch 3/35, Loss: 3.120267
val phase, Epoch 4/35, Loss: 3.307971
val phase, Epoch 5/35, Loss: 3.172965
val phase, Epoch 6/35, Loss: 3.493176
val phase, Epoch 7/35, Loss: 2.831974
val phase, Epoch 8/35, Loss: 4.739484
val phase, Epoch 9/35, Loss: 2.779848
val phase, Epoch 10/35, Loss: 3.295078
val phase, Epoch 11/35, Loss: 3.187619
val phase, Epoch 12/35, Loss: 3.339886
val phase, Epoch 13/35, Loss: 3.823101
[Epoch 12] LR reduced from 9.664424e-03 to 4.832212e-03
val phase, Epoch 14/35, Loss: 3.130139
val phase, Epoch 15/35, Loss: 3.248886
val phase, Epoch 16/35, Loss: 2.905123
Early stopping at epoch 16 due to no improvement in val loss.
val phase, Epoch 1/35, Loss: 3.399177
val phase, Epoch 2/35, Loss: 2.942436
val phase, Epoch 3/35, Loss: 3.379199
val phase, Epoch 4/35, Loss: 3.063365
val phase, Epoch 5/35, Loss: 3.503372
val phase, Epoch 6/35, Loss: 3.375364
[Epoch 5] LR reduced from 2.525767e-03 to 1.262884e-03
val phase, Epoch 7/35, Loss: 3.087824
val phase, Epoch 8/35, Loss: 2.988895
val phase, Epoch 9/35, Loss: 2.890070
val phase, Epoch 10/35, Loss: 3.196012
val phase, Epoch 11/35, Loss: 3.166469
val phase, Epoch 12/35, Loss: 3.402065
val phase, Epoch 13/35, Loss: 3.425885
[Epoch 12] LR reduced from 1.262884e-03 to 6.314418e-04
val phase, Epoch 14/35, Loss: 3.245347
val phase, Epoch 15/35, Loss: 3.224354
val phase, Epoch 16/35, Loss: 2.759782
val phase, Epoch 17/35, Loss: 3.017647
val phase, Epoch 18/35, Loss: 3.137190
val phase, Epoch 19/35, Loss: 3.053964
val phase, Epoch 20/35, Loss: 2.893506
[Epoch 19] LR reduced from 6.314418e-04 to 3.157209e-04
val phase, Epoch 21/35, Loss: 3.195266
val phase, Epoch 22/35, Loss: 2.932565
val phase, Epoch 23/35, Loss: 3.172495
Early stopping at epoch 23 due to no improvement in val loss.
val phase, Epoch 1/35, Loss: 4.080914
val phase, Epoch 2/35, Loss: 3.255707
val phase, Epoch 3/35, Loss: 3.287649
val phase, Epoch 4/35, Loss: 3.187866
val phase, Epoch 5/35, Loss: 4.052333
val phase, Epoch 6/35, Loss: 3.189326
val phase, Epoch 7/35, Loss: 5.093957
val phase, Epoch 8/35, Loss: 3.615938
[Epoch 7] LR reduced from 5.993737e-03 to 2.996868e-03
val phase, Epoch 9/35, Loss: 3.095882
val phase, Epoch 10/35, Loss: 4.044072
val phase, Epoch 11/35, Loss: 3.880892
val phase, Epoch 12/35, Loss: 2.830742
val phase, Epoch 13/35, Loss: 3.286657
val phase, Epoch 14/35, Loss: 4.745896
val phase, Epoch 15/35, Loss: 3.729970
val phase, Epoch 16/35, Loss: 3.992636
[Epoch 15] LR reduced from 2.996868e-03 to 1.498434e-03
val phase, Epoch 17/35, Loss: 3.168116
val phase, Epoch 18/35, Loss: 3.008554
val phase, Epoch 19/35, Loss: 3.792371
Early stopping at epoch 19 due to no improvement in val loss.
val phase, Epoch 1/35, Loss: 3.577441
val phase, Epoch 2/35, Loss: 3.049357
val phase, Epoch 3/35, Loss: 2.889966
val phase, Epoch 4/35, Loss: 3.888535
val phase, Epoch 5/35, Loss: 3.200905
val phase, Epoch 6/35, Loss: 2.929965
val phase, Epoch 7/35, Loss: 3.079446
[Epoch 6] LR reduced from 6.657129e-04 to 3.328564e-04
val phase, Epoch 8/35, Loss: 2.783354
val phase, Epoch 9/35, Loss: 2.837401
val phase, Epoch 10/35, Loss: 2.917587
val phase, Epoch 11/35, Loss: 3.982152
val phase, Epoch 12/35, Loss: 3.014947
[Epoch 11] LR reduced from 3.328564e-04 to 1.664282e-04
val phase, Epoch 13/35, Loss: 2.805519
val phase, Epoch 14/35, Loss: 4.715364
val phase, Epoch 15/35, Loss: 3.394607
Early stopping at epoch 15 due to no improvement in val loss.
val phase, Epoch 1/35, Loss: 3.235668
val phase, Epoch 2/35, Loss: 3.202474
val phase, Epoch 3/35, Loss: 3.438564
val phase, Epoch 4/35, Loss: 2.934075
val phase, Epoch 5/35, Loss: 3.054189
val phase, Epoch 6/35, Loss: 3.330799
val phase, Epoch 7/35, Loss: 3.348225
val phase, Epoch 8/35, Loss: 3.286894
[Epoch 7] LR reduced from 2.411552e-03 to 1.205776e-03
val phase, Epoch 9/35, Loss: 3.024508
val phase, Epoch 10/35, Loss: 2.988054
val phase, Epoch 11/35, Loss: 2.773461
val phase, Epoch 12/35, Loss: 3.369075
val phase, Epoch 13/35, Loss: 3.478403
val phase, Epoch 14/35, Loss: 2.986895
val phase, Epoch 15/35, Loss: 3.090240
[Epoch 14] LR reduced from 1.205776e-03 to 6.028881e-04
val phase, Epoch 16/35, Loss: 3.019434
val phase, Epoch 17/35, Loss: 3.316657
val phase, Epoch 18/35, Loss: 3.009461
Early stopping at epoch 18 due to no improvement in val loss.
val phase, Epoch 1/35, Loss: 3.516731
val phase, Epoch 2/35, Loss: 3.367438
val phase, Epoch 3/35, Loss: 3.380843
val phase, Epoch 4/35, Loss: 3.541789
val phase, Epoch 5/35, Loss: 3.711042
val phase, Epoch 6/35, Loss: 3.358221
val phase, Epoch 7/35, Loss: 3.290516
val phase, Epoch 8/35, Loss: 3.908256
val phase, Epoch 9/35, Loss: 3.015805
val phase, Epoch 10/35, Loss: 2.980398
val phase, Epoch 11/35, Loss: 2.821115
val phase, Epoch 12/35, Loss: 3.032046
val phase, Epoch 13/35, Loss: 3.051127
val phase, Epoch 14/35, Loss: 3.513869
val phase, Epoch 15/35, Loss: 3.086792
[Epoch 14] LR reduced from 2.536516e-03 to 1.268258e-03
val phase, Epoch 16/35, Loss: 2.928106
val phase, Epoch 17/35, Loss: 3.062781
val phase, Epoch 18/35, Loss: 2.909237
Early stopping at epoch 18 due to no improvement in val loss.
val phase, Epoch 1/35, Loss: 3.310289
val phase, Epoch 2/35, Loss: 3.494507
val phase, Epoch 3/35, Loss: 3.593519
val phase, Epoch 4/35, Loss: 2.847014
val phase, Epoch 5/35, Loss: 3.308673
val phase, Epoch 6/35, Loss: 3.490571
val phase, Epoch 7/35, Loss: 3.569547
val phase, Epoch 8/35, Loss: 3.108327
[Epoch 7] LR reduced from 1.087980e-03 to 5.439901e-04
val phase, Epoch 9/35, Loss: 3.006032
val phase, Epoch 10/35, Loss: 3.232611
val phase, Epoch 11/35, Loss: 2.942273
Early stopping at epoch 11 due to no improvement in val loss.
val phase, Epoch 1/35, Loss: 3.118539
val phase, Epoch 2/35, Loss: 3.435496
val phase, Epoch 3/35, Loss: 3.291379
val phase, Epoch 4/35, Loss: 2.854173
val phase, Epoch 5/35, Loss: 2.813534
val phase, Epoch 6/35, Loss: 3.295160
val phase, Epoch 7/35, Loss: 3.167256
val phase, Epoch 8/35, Loss: 2.802379
val phase, Epoch 9/35, Loss: 3.413764
val phase, Epoch 10/35, Loss: 3.544116
val phase, Epoch 11/35, Loss: 3.184351
val phase, Epoch 12/35, Loss: 2.768442
val phase, Epoch 13/35, Loss: 3.049031
val phase, Epoch 14/35, Loss: 3.097247
val phase, Epoch 15/35, Loss: 3.204165
val phase, Epoch 16/35, Loss: 3.074488
[Epoch 15] LR reduced from 3.129436e-03 to 1.564718e-03
val phase, Epoch 17/35, Loss: 3.217630
val phase, Epoch 18/35, Loss: 2.957115
val phase, Epoch 19/35, Loss: 3.091498
Early stopping at epoch 19 due to no improvement in val loss.
val phase, Epoch 1/35, Loss: 3.796953
val phase, Epoch 2/35, Loss: 3.516568
val phase, Epoch 3/35, Loss: 3.185056
val phase, Epoch 4/35, Loss: 3.316188
val phase, Epoch 5/35, Loss: 3.688693
val phase, Epoch 6/35, Loss: 3.241316
val phase, Epoch 7/35, Loss: 2.989617
val phase, Epoch 8/35, Loss: 3.533800
val phase, Epoch 9/35, Loss: 3.627094
val phase, Epoch 10/35, Loss: 2.798887
val phase, Epoch 11/35, Loss: 2.981307
val phase, Epoch 12/35, Loss: 3.917367
val phase, Epoch 13/35, Loss: 3.065724
val phase, Epoch 14/35, Loss: 2.787547
val phase, Epoch 15/35, Loss: 3.731400
val phase, Epoch 16/35, Loss: 3.312085
val phase, Epoch 17/35, Loss: 2.784128
val phase, Epoch 18/35, Loss: 3.213545
val phase, Epoch 19/35, Loss: 3.162673
val phase, Epoch 20/35, Loss: 3.199620
val phase, Epoch 21/35, Loss: 2.835024
[Epoch 20] LR reduced from 6.267783e-03 to 3.133891e-03
val phase, Epoch 22/35, Loss: 3.178851
val phase, Epoch 23/35, Loss: 2.804649
val phase, Epoch 24/35, Loss: 3.829826
Early stopping at epoch 24 due to no improvement in val loss.
val phase, Epoch 1/35, Loss: 3.328141
val phase, Epoch 2/35, Loss: 3.257569
val phase, Epoch 3/35, Loss: 3.664820
val phase, Epoch 4/35, Loss: 3.499176
val phase, Epoch 5/35, Loss: 3.523423
val phase, Epoch 6/35, Loss: 3.393975
[Epoch 5] LR reduced from 1.989690e-03 to 9.948448e-04
val phase, Epoch 7/35, Loss: 2.805372
val phase, Epoch 8/35, Loss: 3.260751
val phase, Epoch 9/35, Loss: 3.440094
val phase, Epoch 10/35, Loss: 3.181077
val phase, Epoch 11/35, Loss: 3.266598
[Epoch 10] LR reduced from 9.948448e-04 to 4.974224e-04
val phase, Epoch 12/35, Loss: 3.005094
val phase, Epoch 13/35, Loss: 3.260879
val phase, Epoch 14/35, Loss: 3.363972
Early stopping at epoch 14 due to no improvement in val loss.
[Trial 26] skipped due to model construction error: Calculated padded input size per channel: (4 x 1). Kernel size: (3 x 3). Kernel size can't be greater than actual input size
val phase, Epoch 1/35, Loss: 3.466864
val phase, Epoch 2/35, Loss: 3.229620
val phase, Epoch 3/35, Loss: 3.585609
val phase, Epoch 4/35, Loss: 3.361337
val phase, Epoch 5/35, Loss: 3.984797
val phase, Epoch 6/35, Loss: 4.338928
[Epoch 5] LR reduced from 1.007646e-03 to 5.038230e-04
val phase, Epoch 7/35, Loss: 4.234106
val phase, Epoch 8/35, Loss: 3.333761
val phase, Epoch 9/35, Loss: 3.297457
Early stopping at epoch 9 due to no improvement in val loss.
[Trial 28] skipped due to model construction error: Calculated padded input size per channel: (6 x 3). Kernel size: (5 x 5). Kernel size can't be greater than actual input size
[Trial 29] skipped due to model construction error: Calculated padded input size per channel: (7 x 1). Kernel size: (7 x 7). Kernel size can't be greater than actual input size
val phase, Epoch 1/35, Loss: 3.213357
val phase, Epoch 2/35, Loss: 2.865465
val phase, Epoch 3/35, Loss: 3.100416
val phase, Epoch 4/35, Loss: 3.275899
val phase, Epoch 5/35, Loss: 3.089648
val phase, Epoch 6/35, Loss: 2.862693
val phase, Epoch 7/35, Loss: 3.038809
val phase, Epoch 8/35, Loss: 3.138058
val phase, Epoch 9/35, Loss: 2.926246
val phase, Epoch 10/35, Loss: 3.099810
[Epoch 9] LR reduced from 7.198213e-03 to 3.599107e-03
val phase, Epoch 11/35, Loss: 2.826505
val phase, Epoch 12/35, Loss: 2.875142
val phase, Epoch 13/35, Loss: 4.624678
val phase, Epoch 14/35, Loss: 2.782335
val phase, Epoch 15/35, Loss: 2.922657
val phase, Epoch 16/35, Loss: 3.111517
val phase, Epoch 17/35, Loss: 4.001085
val phase, Epoch 18/35, Loss: 3.018518
[Epoch 17] LR reduced from 3.599107e-03 to 1.799553e-03
val phase, Epoch 19/35, Loss: 3.169716
val phase, Epoch 20/35, Loss: 3.084134
val phase, Epoch 21/35, Loss: 3.259518
Early stopping at epoch 21 due to no improvement in val loss.
val phase, Epoch 1/35, Loss: 2.958059
val phase, Epoch 2/35, Loss: 3.673157
val phase, Epoch 3/35, Loss: 3.169050
val phase, Epoch 4/35, Loss: 2.795507
val phase, Epoch 5/35, Loss: 3.362585
val phase, Epoch 6/35, Loss: 2.905807
val phase, Epoch 7/35, Loss: 2.925557
val phase, Epoch 8/35, Loss: 3.250364
[Epoch 7] LR reduced from 4.194013e-03 to 2.097006e-03
val phase, Epoch 9/35, Loss: 3.168102
val phase, Epoch 10/35, Loss: 3.126655
val phase, Epoch 11/35, Loss: 3.156766
Early stopping at epoch 11 due to no improvement in val loss.
val phase, Epoch 1/35, Loss: 3.121315
val phase, Epoch 2/35, Loss: 4.838624
val phase, Epoch 3/35, Loss: 3.553737
val phase, Epoch 4/35, Loss: 2.805080
val phase, Epoch 5/35, Loss: 3.210853
val phase, Epoch 6/35, Loss: 2.958178
val phase, Epoch 7/35, Loss: 2.794903
val phase, Epoch 8/35, Loss: 3.622900
val phase, Epoch 9/35, Loss: 3.536895
val phase, Epoch 10/35, Loss: 3.044527
val phase, Epoch 11/35, Loss: 3.057598
[Epoch 10] LR reduced from 3.609201e-03 to 1.804600e-03
val phase, Epoch 12/35, Loss: 3.244081
val phase, Epoch 13/35, Loss: 2.752032
val phase, Epoch 14/35, Loss: 2.862101
val phase, Epoch 15/35, Loss: 2.743183
val phase, Epoch 16/35, Loss: 3.780155
val phase, Epoch 17/35, Loss: 3.647425
val phase, Epoch 18/35, Loss: 2.809862
val phase, Epoch 19/35, Loss: 3.094602
[Epoch 18] LR reduced from 1.804600e-03 to 9.023002e-04
val phase, Epoch 20/35, Loss: 3.009492
val phase, Epoch 21/35, Loss: 3.001590
val phase, Epoch 22/35, Loss: 3.124556
Early stopping at epoch 22 due to no improvement in val loss.
val phase, Epoch 1/35, Loss: 3.351374
val phase, Epoch 2/35, Loss: 3.400898
val phase, Epoch 3/35, Loss: 3.418060
val phase, Epoch 4/35, Loss: 3.155504
val phase, Epoch 5/35, Loss: 2.791947
val phase, Epoch 6/35, Loss: 3.262284
val phase, Epoch 7/35, Loss: 2.810133
val phase, Epoch 8/35, Loss: 3.654689
val phase, Epoch 9/35, Loss: 2.862051
[Epoch 8] LR reduced from 3.350718e-03 to 1.675359e-03
val phase, Epoch 10/35, Loss: 3.404908
val phase, Epoch 11/35, Loss: 3.194270
val phase, Epoch 12/35, Loss: 3.663665
Early stopping at epoch 12 due to no improvement in val loss.
val phase, Epoch 1/35, Loss: 2.990345
val phase, Epoch 2/35, Loss: 3.646815
val phase, Epoch 3/35, Loss: 2.895626
val phase, Ep