[I 2025-07-01 02:15:53,638] Trial 370 finished with value: 15.890758035852457 and parameters: {'kernel_size': 3, 'channel_list': [16, 32, 64, 128], 'padding': 1, 'pool_kernel': 2, 'dropout_rate': 0, 'fc_hidden_dim': 128, 'lr': 0.006271232068137192, 'weight_decay': 5.672457151388811e-06, 'optimizer': 'sgd', 'activation': <class 'torch.nn.modules.activation.LeakyReLU'>, 'batchnorm': True, 'epochs': 30, 'batch_size': 64, 'flip_prob': 0.0}. Best is trial 121 with value: 15.493945159799877.
[I 2025-07-01 02:16:49,358] Trial 371 finished with value: 16.806544708558725 and parameters: {'kernel_size': 3, 'channel_list': [16, 32, 64, 128], 'padding': 1, 'pool_kernel': 2, 'dropout_rate': 0.1, 'fc_hidden_dim': 128, 'lr': 0.004450603886248122, 'weight_decay': 1.3407118511444096e-06, 'optimizer': 'adam', 'activation': <class 'torch.nn.modules.activation.LeakyReLU'>, 'batchnorm': True, 'epochs': 20, 'batch_size': 64, 'flip_prob': 0.75}. Best is trial 121 with value: 15.493945159799877.
[I 2025-07-01 02:17:58,364] Trial 372 finished with value: 30.07035487911677 and parameters: {'kernel_size': 3, 'channel_list': [16, 32, 64, 128], 'padding': 1, 'pool_kernel': 2, 'dropout_rate': 0.1, 'fc_hidden_dim': 64, 'lr': 0.005008073776453361, 'weight_decay': 3.426720155835578e-06, 'optimizer': 'adam', 'activation': <class 'torch.nn.modules.activation.ReLU'>, 'batchnorm': True, 'epochs': 25, 'batch_size': 64, 'flip_prob': 1}. Best is trial 121 with value: 15.493945159799877.
[I 2025-07-01 02:18:48,305] Trial 373 finished with value: 16.034477598646102 and parameters: {'kernel_size': 3, 'channel_list': [16, 32, 64, 128], 'padding': 1, 'pool_kernel': 2, 'dropout_rate': 0, 'fc_hidden_dim': 128, 'lr': 0.005636499335140336, 'weight_decay': 1.8801422065519644e-06, 'optimizer': 'adam', 'activation': <class 'torch.nn.modules.activation.LeakyReLU'>, 'batchnorm': True, 'epochs': 20, 'batch_size': 64, 'flip_prob': 0.0}. Best is trial 121 with value: 15.493945159799877.
[I 2025-07-01 02:19:00,819] Trial 374 finished with value: 16.413808621234775 and parameters: {'kernel_size': 3, 'channel_list': [16, 32, 64, 128], 'padding': 1, 'pool_kernel': 2, 'dropout_rate': 0.1, 'fc_hidden_dim': 64, 'lr': 0.007768072926811033, 'weight_decay': 2.446404969674406e-06, 'optimizer': 'adam', 'activation': <class 'torch.nn.modules.activation.LeakyReLU'>, 'batchnorm': True, 'epochs': 5, 'batch_size': 64, 'flip_prob': 0.0}. Best is trial 121 with value: 15.493945159799877.
[I 2025-07-01 02:19:43,006] Trial 375 finished with value: 16.783625193381084 and parameters: {'kernel_size': 3, 'channel_list': [16, 32, 64, 128], 'padding': 1, 'pool_kernel': 2, 'dropout_rate': 0.5, 'fc_hidden_dim': 256, 'lr': 0.0025483263018895815, 'weight_decay': 7.2866787643034424e-06, 'optimizer': 'adam', 'activation': <class 'torch.nn.modules.activation.LeakyReLU'>, 'batchnorm': False, 'epochs': 20, 'batch_size': 64, 'flip_prob': 0.0}. Best is trial 121 with value: 15.493945159799877.
[I 2025-07-01 02:19:43,041] Trial 376 pruned. 
[I 2025-07-01 02:20:33,189] Trial 377 finished with value: 15.897220202854701 and parameters: {'kernel_size': 3, 'channel_list': [16, 32, 64, 128], 'padding': 1, 'pool_kernel': 2, 'dropout_rate': 0, 'fc_hidden_dim': 128, 'lr': 0.0041263679046270344, 'weight_decay': 2.9525480608794755e-06, 'optimizer': 'adam', 'activation': <class 'torch.nn.modules.activation.ReLU'>, 'batchnorm': True, 'epochs': 20, 'batch_size': 64, 'flip_prob': 0.0}. Best is trial 121 with value: 15.493945159799877.
[I 2025-07-01 02:20:33,224] Trial 378 pruned. 
[I 2025-07-01 02:21:27,557] Trial 379 finished with value: 15.762848617127222 and parameters: {'kernel_size': 3, 'channel_list': [16, 32, 64, 128], 'padding': 1, 'pool_kernel': 2, 'dropout_rate': 0.1, 'fc_hidden_dim': 128, 'lr': 0.0032485387016384574, 'weight_decay': 6.21821501764348e-05, 'optimizer': 'adam', 'activation': <class 'torch.nn.modules.activation.LeakyReLU'>, 'batchnorm': True, 'epochs': 20, 'batch_size': 64, 'flip_prob': 0.0}. Best is trial 121 with value: 15.493945159799877.
[I 2025-07-01 02:21:27,589] Trial 380 pruned. 
[I 2025-07-01 02:22:10,104] Trial 381 finished with value: 16.172131760052583 and parameters: {'kernel_size': 3, 'channel_list': [16, 32, 64], 'padding': 1, 'pool_kernel': 2, 'dropout_rate': 0.1, 'fc_hidden_dim': 128, 'lr': 0.007097157537686149, 'weight_decay': 1.6772300493844967e-06, 'optimizer': 'adam', 'activation': <class 'torch.nn.modules.activation.ReLU'>, 'batchnorm': True, 'epochs': 20, 'batch_size': 64, 'flip_prob': 0.0}. Best is trial 121 with value: 15.493945159799877.
[I 2025-07-01 02:22:59,679] Trial 382 finished with value: 15.649250991674139 and parameters: {'kernel_size': 3, 'channel_list': [16, 32, 64, 128], 'padding': 1, 'pool_kernel': 2, 'dropout_rate': 0.1, 'fc_hidden_dim': 128, 'lr': 0.0029169807177894013, 'weight_decay': 2.279439168078824e-06, 'optimizer': 'adam', 'activation': <class 'torch.nn.modules.activation.LeakyReLU'>, 'batchnorm': True, 'epochs': 20, 'batch_size': 64, 'flip_prob': 0.0}. Best is trial 121 with value: 15.493945159799877.
[I 2025-07-01 02:23:49,628] Trial 383 finished with value: 15.877462622775639 and parameters: {'kernel_size': 3, 'channel_list': [16, 32, 64, 128], 'padding': 1, 'pool_kernel': 2, 'dropout_rate': 0.1, 'fc_hidden_dim': 64, 'lr': 0.0028396917436710974, 'weight_decay': 2.1935929953900127e-06, 'optimizer': 'adam', 'activation': <class 'torch.nn.modules.activation.LeakyReLU'>, 'batchnorm': True, 'epochs': 20, 'batch_size': 64, 'flip_prob': 0.0}. Best is trial 121 with value: 15.493945159799877.
[I 2025-07-01 02:25:03,623] Trial 384 finished with value: 15.91473989028407 and parameters: {'kernel_size': 3, 'channel_list': [16, 32, 64, 128], 'padding': 1, 'pool_kernel': 2, 'dropout_rate': 0, 'fc_hidden_dim': 128, 'lr': 0.008182865540089157, 'weight_decay': 0.008564721462531682, 'optimizer': 'adam', 'activation': <class 'torch.nn.modules.activation.LeakyReLU'>, 'batchnorm': True, 'epochs': 30, 'batch_size': 64, 'flip_prob': 0.0}. Best is trial 121 with value: 15.493945159799877.
[I 2025-07-01 02:26:07,185] Trial 385 finished with value: 16.17091808119565 and parameters: {'kernel_size': 3, 'channel_list': [32, 64, 128], 'padding': 1, 'pool_kernel': 2, 'dropout_rate': 0.1, 'fc_hidden_dim': 128, 'lr': 0.005831120567720277, 'weight_decay': 2.5735527352489523e-06, 'optimizer': 'adam', 'activation': <class 'torch.nn.modules.activation.LeakyReLU'>, 'batchnorm': True, 'epochs': 20, 'batch_size': 64, 'flip_prob': 0.5}. Best is trial 121 with value: 15.493945159799877.
[I 2025-07-01 02:26:57,444] Trial 386 finished with value: 16.01568719802163 and parameters: {'kernel_size': 3, 'channel_list': [16, 32, 64, 128], 'padding': 1, 'pool_kernel': 2, 'dropout_rate': 0.1, 'fc_hidden_dim': 64, 'lr': 0.0022821225079888443, 'weight_decay': 1.9958085423349984e-06, 'optimizer': 'adam', 'activation': <class 'torch.nn.modules.activation.ReLU'>, 'batchnorm': True, 'epochs': 20, 'batch_size': 64, 'flip_prob': 0.0}. Best is trial 121 with value: 15.493945159799877.
[I 2025-07-01 02:27:32,992] Trial 387 finished with value: 15.582723690505587 and parameters: {'kernel_size': 3, 'channel_list': [16, 32, 64, 128], 'padding': 1, 'pool_kernel': 2, 'dropout_rate': 0, 'fc_hidden_dim': 128, 'lr': 0.004758897718729073, 'weight_decay': 1.5631350053981895e-06, 'optimizer': 'adam', 'activation': <class 'torch.nn.modules.activation.LeakyReLU'>, 'batchnorm': True, 'epochs': 20, 'batch_size': 128, 'flip_prob': 0.0}. Best is trial 121 with value: 15.493945159799877.
[I 2025-07-01 02:27:33,037] Trial 388 pruned. 
[I 2025-07-01 02:28:10,010] Trial 389 finished with value: 15.861310777106134 and parameters: {'kernel_size': 3, 'channel_list': [16, 32, 64, 128], 'padding': 1, 'pool_kernel': 2, 'dropout_rate': 0, 'fc_hidden_dim': 128, 'lr': 0.004919638631301604, 'weight_decay': 1.241619813861275e-06, 'optimizer': 'adam', 'activation': <class 'torch.nn.modules.activation.LeakyReLU'>, 'batchnorm': True, 'epochs': 20, 'batch_size': 128, 'flip_prob': 0.25}. Best is trial 121 with value: 15.493945159799877.
[I 2025-07-01 02:28:46,537] Trial 390 finished with value: 15.842171222877564 and parameters: {'kernel_size': 3, 'channel_list': [16, 32, 64, 128], 'padding': 1, 'pool_kernel': 2, 'dropout_rate': 0, 'fc_hidden_dim': 128, 'lr': 0.0054867801611938475, 'weight_decay': 1.6724389026380182e-06, 'optimizer': 'adam', 'activation': <class 'torch.nn.modules.activation.LeakyReLU'>, 'batchnorm': True, 'epochs': 20, 'batch_size': 128, 'flip_prob': 0.0}. Best is trial 121 with value: 15.493945159799877.
[I 2025-07-01 02:29:37,330] Trial 391 finished with value: 16.999162832947874 and parameters: {'kernel_size': 3, 'channel_list': [16, 32, 64, 128], 'padding': 1, 'pool_kernel': 2, 'dropout_rate': 0, 'fc_hidden_dim': 128, 'lr': 0.006326029674611169, 'weight_decay': 1.4189017308340937e-06, 'optimizer': 'sgd', 'activation': <class 'torch.nn.modules.activation.ReLU'>, 'batchnorm': True, 'epochs': 15, 'batch_size': 32, 'flip_prob': 0.0}. Best is trial 121 with value: 15.493945159799877.
[I 2025-07-01 02:30:12,920] Trial 392 finished with value: 15.898598762305198 and parameters: {'kernel_size': 3, 'channel_list': [16, 32, 64, 128], 'padding': 1, 'pool_kernel': 2, 'dropout_rate': 0, 'fc_hidden_dim': 128, 'lr': 0.009150588637267794, 'weight_decay': 1.8160847273265795e-06, 'optimizer': 'adam', 'activation': <class 'torch.nn.modules.activation.LeakyReLU'>, 'batchnorm': True, 'epochs': 20, 'batch_size': 128, 'flip_prob': 0.0}. Best is trial 121 with value: 15.493945159799877.
[I 2025-07-01 02:31:09,820] Trial 393 finished with value: 15.967796484369513 and parameters: {'kernel_size': 3, 'channel_list': [16, 32, 64, 128], 'padding': 1, 'pool_kernel': 2, 'dropout_rate': 0, 'fc_hidden_dim': 128, 'lr': 0.005396325311538278, 'weight_decay': 2.2160313411834755e-06, 'optimizer': 'adam', 'activation': <class 'torch.nn.modules.activation.LeakyReLU'>, 'batchnorm': True, 'epochs': 30, 'batch_size': 128, 'flip_prob': 0.0}. Best is trial 121 with value: 15.493945159799877.
[I 2025-07-01 02:31:47,790] Trial 394 finished with value: 16.09949083412422 and parameters: {'kernel_size': 3, 'channel_list': [16, 32, 64, 128], 'padding': 1, 'pool_kernel': 2, 'dropout_rate': 0, 'fc_hidden_dim': 128, 'lr': 0.002637088242718856, 'weight_decay': 1.1624094533522899e-06, 'optimizer': 'adam', 'activation': <class 'torch.nn.modules.activation.LeakyReLU'>, 'batchnorm': True, 'epochs': 20, 'batch_size': 128, 'flip_prob': 0.0}. Best is trial 121 with value: 15.493945159799877.
[I 2025-07-01 02:32:18,947] Trial 395 finished with value: 16.779285177135435 and parameters: {'kernel_size': 3, 'channel_list': [16, 32, 64, 128], 'padding': 1, 'pool_kernel': 2, 'dropout_rate': 0, 'fc_hidden_dim': 128, 'lr': 0.0069378956552538186, 'weight_decay': 2.6488014059492934e-06, 'optimizer': 'adam', 'activation': <class 'torch.nn.modules.activation.LeakyReLU'>, 'batchnorm': False, 'epochs': 20, 'batch_size': 128, 'flip_prob': 0.0}. Best is trial 121 with value: 15.493945159799877.
[I 2025-07-01 02:33:19,628] Trial 396 finished with value: 15.959495604915064 and parameters: {'kernel_size': 3, 'channel_list': [16, 32, 64, 128], 'padding': 1, 'pool_kernel': 2, 'dropout_rate': 0.5, 'fc_hidden_dim': 256, 'lr': 0.005918151324352002, 'weight_decay': 1.9497708837058405e-06, 'optimizer': 'adam', 'activation': <class 'torch.nn.modules.activation.ReLU'>, 'batchnorm': True, 'epochs': 30, 'batch_size': 128, 'flip_prob': 0.0}. Best is trial 121 with value: 15.493945159799877.
[I 2025-07-01 02:33:19,664] Trial 397 pruned. 
[I 2025-07-01 02:34:10,223] Trial 398 finished with value: 15.686610930493627 and parameters: {'kernel_size': 3, 'channel_list': [16, 32, 64, 128], 'padding': 1, 'pool_kernel': 2, 'dropout_rate': 0, 'fc_hidden_dim': 128, 'lr': 0.005197009081152631, 'weight_decay': 1.5891317081760016e-06, 'optimizer': 'adam', 'activation': <class 'torch.nn.modules.activation.LeakyReLU'>, 'batchnorm': True, 'epochs': 20, 'batch_size': 64, 'flip_prob': 0.0}. Best is trial 121 with value: 15.493945159799877.
[I 2025-07-01 02:35:25,318] Trial 399 finished with value: 16.597383590179472 and parameters: {'kernel_size': 3, 'channel_list': [16, 32, 64, 128], 'padding': 1, 'pool_kernel': 2, 'dropout_rate': 0, 'fc_hidden_dim': 128, 'lr': 0.0003324610967988254, 'weight_decay': 8.924133661816842e-05, 'optimizer': 'adam', 'activation': <class 'torch.nn.modules.activation.LeakyReLU'>, 'batchnorm': True, 'epochs': 30, 'batch_size': 64, 'flip_prob': 0.0}. Best is trial 121 with value: 15.493945159799877.
[I 2025-07-01 02:35:25,352] Trial 400 pruned. 
[I 2025-07-01 02:36:15,209] Trial 401 finished with value: 15.79107549978495 and parameters: {'kernel_size': 3, 'channel_list': [16, 32, 64, 128], 'padding': 1, 'pool_kernel': 2, 'dropout_rate': 0.1, 'fc_hidden_dim': 128, 'lr': 0.006519003683101974, 'weight_decay': 2.3548527519706603e-06, 'optimizer': 'adam', 'activation': <class 'torch.nn.modules.activation.LeakyReLU'>, 'batchnorm': True, 'epochs': 20, 'batch_size': 64, 'flip_prob': 0.0}. Best is trial 121 with value: 15.493945159799877.
[I 2025-07-01 02:36:15,247] Trial 402 pruned. 
[I 2025-07-01 02:37:17,376] Trial 403 finished with value: 15.847580432735965 and parameters: {'kernel_size': 3, 'channel_list': [16, 32, 64, 128], 'padding': 1, 'pool_kernel': 2, 'dropout_rate': 0, 'fc_hidden_dim': 128, 'lr': 0.003022880281165144, 'weight_decay': 0.00014751664655564018, 'optimizer': 'adam', 'activation': <class 'torch.nn.modules.activation.LeakyReLU'>, 'batchnorm': True, 'epochs': 25, 'batch_size': 64, 'flip_prob': 0.0}. Best is trial 121 with value: 15.493945159799877.
[I 2025-07-01 02:37:28,453] Trial 404 finished with value: 16.560988404073527 and parameters: {'kernel_size': 3, 'channel_list': [16, 32, 64], 'padding': 1, 'pool_kernel': 2, 'dropout_rate': 0.1, 'fc_hidden_dim': 256, 'lr': 0.00597890397128498, 'weight_decay': 1.8189444691073516e-06, 'optimizer': 'adam', 'activation': <class 'torch.nn.modules.activation.ReLU'>, 'batchnorm': True, 'epochs': 5, 'batch_size': 64, 'flip_prob': 0.0}. Best is trial 121 with value: 15.493945159799877.
[I 2025-07-01 02:38:19,191] Trial 405 finished with value: 15.787930382587973 and parameters: {'kernel_size': 3, 'channel_list': [16, 32, 64, 128], 'padding': 1, 'pool_kernel': 2, 'dropout_rate': 0.1, 'fc_hidden_dim': 128, 'lr': 0.00706792591616422, 'weight_decay': 3.164944136690487e-06, 'optimizer': 'adam', 'activation': <class 'torch.nn.modules.activation.LeakyReLU'>, 'batchnorm': True, 'epochs': 20, 'batch_size': 64, 'flip_prob': 0.0}. Best is trial 121 with value: 15.493945159799877.
[I 2025-07-01 02:39:34,347] Trial 406 finished with value: 15.760668282884522 and parameters: {'kernel_size': 3, 'channel_list': [16, 32, 64, 128], 'padding': 1, 'pool_kernel': 2, 'dropout_rate': 0, 'fc_hidden_dim': 128, 'lr': 0.008145325593950169, 'weight_decay': 2.124412815605215e-06, 'optimizer': 'adam', 'activation': <class 'torch.nn.modules.activation.LeakyReLU'>, 'batchnorm': True, 'epochs': 30, 'batch_size': 64, 'flip_prob': 0.0}. Best is trial 121 with value: 15.493945159799877.
[I 2025-07-01 02:40:38,289] Trial 407 finished with value: 15.554110615578459 and parameters: {'kernel_size': 3, 'channel_list': [32, 64, 128], 'padding': 1, 'pool_kernel': 2, 'dropout_rate': 0.1, 'fc_hidden_dim': 128, 'lr': 0.002654250394729803, 'weight_decay': 0.0002605222048932745, 'optimizer': 'adam', 'activation': <class 'torch.nn.modules.activation.LeakyReLU'>, 'batchnorm': True, 'epochs': 20, 'batch_size': 128, 'flip_prob': 0.0}. Best is trial 121 with value: 15.493945159799877.
[I 2025-07-01 02:41:34,335] Trial 408 finished with value: 15.739779500721248 and parameters: {'kernel_size': 3, 'channel_list': [32, 64, 128], 'padding': 1, 'pool_kernel': 2, 'dropout_rate': 0.1, 'fc_hidden_dim': 128, 'lr': 0.0021561915458325792, 'weight_decay': 1.000086221136296e-06, 'optimizer': 'adam', 'activation': <class 'torch.nn.modules.activation.LeakyReLU'>, 'batchnorm': True, 'epochs': 20, 'batch_size': 128, 'flip_prob': 0.0}. Best is trial 121 with value: 15.493945159799877.
[I 2025-07-01 02:42:37,971] Trial 409 finished with value: 15.960547431304821 and parameters: {'kernel_size': 3, 'channel_list': [32, 64, 128], 'padding': 1, 'pool_kernel': 2, 'dropout_rate': 0.1, 'fc_hidden_dim': 64, 'lr': 0.0025183175975168315, 'weight_decay': 0.0004786483987743688, 'optimizer': 'adam', 'activation': <class 'torch.nn.modules.activation.ReLU'>, 'batchnorm': True, 'epochs': 20, 'batch_size': 128, 'flip_prob': 0.0}. Best is trial 121 with value: 15.493945159799877.
[I 2025-07-01 02:43:37,799] Trial 410 finished with value: inf and parameters: {'kernel_size': 3, 'channel_list': [32, 64, 128], 'padding': 1, 'pool_kernel': 2, 'dropout_rate': 0, 'fc_hidden_dim': 128, 'lr': 0.0028129589632322123, 'weight_decay': 0.0002671668393354236, 'optimizer': 'sgd', 'activation': <class 'torch.nn.modules.activation.LeakyReLU'>, 'batchnorm': True, 'epochs': 20, 'batch_size': 128, 'flip_prob': 0.0}. Best is trial 121 with value: 15.493945159799877.
[I 2025-07-01 02:44:40,310] Trial 411 finished with value: 16.033991281796844 and parameters: {'kernel_size': 3, 'channel_list': [32, 64, 128], 'padding': 1, 'pool_kernel': 2, 'dropout_rate': 0.1, 'fc_hidden_dim': 128, 'lr': 0.0023637301616246335, 'weight_decay': 0.0010239831366387377, 'optimizer': 'adam', 'activation': <class 'torch.nn.modules.activation.LeakyReLU'>, 'batchnorm': True, 'epochs': 20, 'batch_size': 128, 'flip_prob': 0.0}. Best is trial 121 with value: 15.493945159799877.
[I 2025-07-01 02:44:40,349] Trial 412 pruned. 
[I 2025-07-01 02:45:52,946] Trial 413 finished with value: 15.842591309711098 and parameters: {'kernel_size': 3, 'channel_list': [32, 64, 128], 'padding': 1, 'pool_kernel': 2, 'dropout_rate': 0.1, 'fc_hidden_dim': 128, 'lr': 0.0030102921465964233, 'weight_decay': 3.7490796592299605e-05, 'optimizer': 'adam', 'activation': <class 'torch.nn.modules.activation.LeakyReLU'>, 'batchnorm': True, 'epochs': 20, 'batch_size': 128, 'flip_prob': 0.0}. Best is trial 121 with value: 15.493945159799877.
[I 2025-07-01 02:46:28,537] Trial 414 finished with value: 15.770771322783476 and parameters: {'kernel_size': 3, 'channel_list': [16, 32, 64, 128], 'padding': 1, 'pool_kernel': 2, 'dropout_rate': 0.1, 'fc_hidden_dim': 64, 'lr': 0.002860922615898508, 'weight_decay': 0.0004236819716137614, 'optimizer': 'adam', 'activation': <class 'torch.nn.modules.activation.ReLU'>, 'batchnorm': True, 'epochs': 20, 'batch_size': 128, 'flip_prob': 0.0}. Best is trial 121 with value: 15.493945159799877.
[I 2025-07-01 02:47:16,347] Trial 415 finished with value: 16.215587678630587 and parameters: {'kernel_size': 3, 'channel_list': [32, 64, 128], 'padding': 1, 'pool_kernel': 2, 'dropout_rate': 0.5, 'fc_hidden_dim': 256, 'lr': 0.0032567620096679833, 'weight_decay': 0.000254883638645007, 'optimizer': 'adam', 'activation': <class 'torch.nn.modules.activation.LeakyReLU'>, 'batchnorm': False, 'epochs': 20, 'batch_size': 128, 'flip_prob': 0.0}. Best is trial 121 with value: 15.493945159799877.
[I 2025-07-01 02:48:45,891] Trial 416 finished with value: 15.87178815895921 and parameters: {'kernel_size': 3, 'channel_list': [32, 64, 128], 'padding': 1, 'pool_kernel': 2, 'dropout_rate': 0, 'fc_hidden_dim': 128, 'lr': 0.0025013555147486307, 'weight_decay': 3.5282735306411354e-06, 'optimizer': 'adam', 'activation': <class 'torch.nn.modules.activation.LeakyReLU'>, 'batchnorm': True, 'epochs': 20, 'batch_size': 32, 'flip_prob': 0.0}. Best is trial 121 with value: 15.493945159799877.
[I 2025-07-01 02:48:45,928] Trial 417 pruned. 
[I 2025-07-01 02:49:35,633] Trial 418 finished with value: 16.085714371074218 and parameters: {'kernel_size': 3, 'channel_list': [16, 32, 64, 128], 'padding': 1, 'pool_kernel': 2, 'dropout_rate': 0.1, 'fc_hidden_dim': 128, 'lr': 0.0019893894171614493, 'weight_decay': 1.5077641318168985e-06, 'optimizer': 'adam', 'activation': <class 'torch.nn.modules.activation.ReLU'>, 'batchnorm': True, 'epochs': 20, 'batch_size': 64, 'flip_prob': 0.0}. Best is trial 121 with value: 15.493945159799877.
[I 2025-07-01 02:50:11,244] Trial 419 finished with value: 15.595106918307525 and parameters: {'kernel_size': 3, 'channel_list': [16, 32, 64, 128], 'padding': 1, 'pool_kernel': 2, 'dropout_rate': 0, 'fc_hidden_dim': 128, 'lr': 0.004302223154093729, 'weight_decay': 6.180043958050294e-06, 'optimizer': 'adam', 'activation': <class 'torch.nn.modules.activation.LeakyReLU'>, 'batchnorm': True, 'epochs': 20, 'batch_size': 128, 'flip_prob': 0.0}. Best is trial 121 with value: 15.493945159799877.
[I 2025-07-01 02:50:46,337] Trial 420 finished with value: 15.736723810054384 and parameters: {'kernel_size': 3, 'channel_list': [16, 32, 64, 128], 'padding': 1, 'pool_kernel': 2, 'dropout_rate': 0.1, 'fc_hidden_dim': 64, 'lr': 0.004008426989949886, 'weight_decay': 0.0005890044385755818, 'optimizer': 'adam', 'activation': <class 'torch.nn.modules.activation.LeakyReLU'>, 'batchnorm': True, 'epochs': 20, 'batch_size': 128, 'flip_prob': 0.0}. Best is trial 121 with value: 15.493945159799877.
[I 2025-07-01 02:50:46,373] Trial 421 pruned. 
[I 2025-07-01 02:51:21,974] Trial 422 finished with value: 16.020092031697736 and parameters: {'kernel_size': 3, 'channel_list': [16, 32, 64, 128], 'padding': 1, 'pool_kernel': 2, 'dropout_rate': 0.1, 'fc_hidden_dim': 128, 'lr': 0.0037377343003801183, 'weight_decay': 5.890301553642645e-06, 'optimizer': 'adam', 'activation': <class 'torch.nn.modules.activation.LeakyReLU'>, 'batchnorm': True, 'epochs': 20, 'batch_size': 128, 'flip_prob': 0.0}. Best is trial 121 with value: 15.493945159799877.
