[I 2025-07-01 03:26:11,691] Trial 468 finished with value: 15.836981851316503 and parameters: {'kernel_size': 3, 'channel_list': [16, 32, 64, 128], 'padding': 1, 'pool_kernel': 2, 'dropout_rate': 0.1, 'fc_hidden_dim': 128, 'lr': 0.003654379760313921, 'weight_decay': 1.239162230761273e-06, 'optimizer': 'adam', 'activation': <class 'torch.nn.modules.activation.LeakyReLU'>, 'batchnorm': True, 'epochs': 20, 'batch_size': 64, 'flip_prob': 0.0}. Best is trial 121 with value: 15.493945159799877.
[Trial 0] Skipped due to model construction error: Calculated padded input size per channel: (9 x 3). Kernel size: (5 x 5). Kernel size can't be greater than actual input size
[Trial 1] Skipped due to model construction error: Calculated padded input size per channel: (11 x 5). Kernel size: (7 x 7). Kernel size can't be greater than actual input size
[Trial 2] Skipped due to model construction error: Calculated padded input size per channel: (9 x 3). Kernel size: (5 x 5). Kernel size can't be greater than actual input size
[Trial 3] Skipped due to model construction error: Calculated padded input size per channel: (11 x 5). Kernel size: (7 x 7). Kernel size can't be greater than actual input size
[Trial 4] Skipped due to model construction error: Calculated padded input size per channel: (4 x 1). Kernel size: (3 x 3). Kernel size can't be greater than actual input size
[Trial 5] Skipped due to model construction error: Calculated padded input size per channel: (7 x 1). Kernel size: (7 x 7). Kernel size can't be greater than actual input size
[Trial 6] Skipped due to model construction error: Given input size: (64x10x2). Calculated output size: (64x3x0). Output size is too small
[Trial 7] Skipped due to model construction error: Calculated padded input size per channel: (6 x 3). Kernel size: (5 x 5). Kernel size can't be greater than actual input size
train phase, Epoch 1/10, Loss: nan
val phase, Epoch 1/10, Loss: nan
Val Best Loss: inf
Epoch loss: nan
train phase, Epoch 2/10, Loss: nan
val phase, Epoch 2/10, Loss: nan
Val Best Loss: inf
Epoch loss: nan
train phase, Epoch 3/10, Loss: nan
val phase, Epoch 3/10, Loss: nan
Val Best Loss: inf
Epoch loss: nan
train phase, Epoch 4/10, Loss: nan
val phase, Epoch 4/10, Loss: nan
Val Best Loss: inf
Epoch loss: nan
train phase, Epoch 5/10, Loss: nan
val phase, Epoch 5/10, Loss: nan
Val Best Loss: inf
Epoch loss: nan
train phase, Epoch 6/10, Loss: nan
val phase, Epoch 6/10, Loss: nan
Val Best Loss: inf
Epoch loss: nan
train phase, Epoch 7/10, Loss: nan
val phase, Epoch 7/10, Loss: nan
Val Best Loss: inf
Epoch loss: nan
train phase, Epoch 8/10, Loss: nan
val phase, Epoch 8/10, Loss: nan
Val Best Loss: inf
Epoch loss: nan
train phase, Epoch 9/10, Loss: nan
val phase, Epoch 9/10, Loss: nan
Val Best Loss: inf
Epoch loss: nan
train phase, Epoch 10/10, Loss: nan
val phase, Epoch 10/10, Loss: nan
Val Best Loss: inf
Epoch loss: nan
train phase, Epoch 1/10, Loss: 20.021058
val phase, Epoch 1/10, Loss: 32.105935
Val Best Loss: 32.105935
Epoch loss: 32.105935
train phase, Epoch 2/10, Loss: 17.793747
val phase, Epoch 2/10, Loss: 31.372737
Val Best Loss: 31.372737
Epoch loss: 31.372737
train phase, Epoch 3/10, Loss: 17.321126
val phase, Epoch 3/10, Loss: 31.865895
Val Best Loss: 31.372737
Epoch loss: 31.865895
train phase, Epoch 4/10, Loss: 17.265311
val phase, Epoch 4/10, Loss: 35.084214
Val Best Loss: 31.372737
Epoch loss: 35.084214
train phase, Epoch 5/10, Loss: 16.651401
val phase, Epoch 5/10, Loss: 34.037441
Val Best Loss: 31.372737
Epoch loss: 34.037441
train phase, Epoch 6/10, Loss: 16.670912
val phase, Epoch 6/10, Loss: 34.925274
Val Best Loss: 31.372737
Epoch loss: 34.925274
train phase, Epoch 7/10, Loss: 16.129497
val phase, Epoch 7/10, Loss: 36.998742
Val Best Loss: 31.372737
Epoch loss: 36.998742
train phase, Epoch 8/10, Loss: 15.991393
val phase, Epoch 8/10, Loss: 38.151227
Val Best Loss: 31.372737
Epoch loss: 38.151227
train phase, Epoch 9/10, Loss: 15.863458
val phase, Epoch 9/10, Loss: 39.764588
Val Best Loss: 31.372737
Epoch loss: 39.764588
train phase, Epoch 10/10, Loss: 15.546902
val phase, Epoch 10/10, Loss: 41.166417
Val Best Loss: 31.372737
Epoch loss: 41.166417
[Trial 10] Skipped due to model construction error: Given input size: (128x5x2). Calculated output size: (128x1x0). Output size is too small
train phase, Epoch 1/10, Loss: nan
val phase, Epoch 1/10, Loss: nan
Val Best Loss: inf
Epoch loss: nan
train phase, Epoch 2/10, Loss: nan
val phase, Epoch 2/10, Loss: nan
Val Best Loss: inf
Epoch loss: nan
train phase, Epoch 3/10, Loss: nan
val phase, Epoch 3/10, Loss: nan
Val Best Loss: inf
Epoch loss: nan
train phase, Epoch 4/10, Loss: nan
val phase, Epoch 4/10, Loss: nan
Val Best Loss: inf
Epoch loss: nan
train phase, Epoch 5/10, Loss: nan
val phase, Epoch 5/10, Loss: nan
Val Best Loss: inf
Epoch loss: nan
train phase, Epoch 6/10, Loss: nan
val phase, Epoch 6/10, Loss: nan
Val Best Loss: inf
Epoch loss: nan
train phase, Epoch 7/10, Loss: nan
val phase, Epoch 7/10, Loss: nan
Val Best Loss: inf
Epoch loss: nan
train phase, Epoch 8/10, Loss: nan
val phase, Epoch 8/10, Loss: nan
Val Best Loss: inf
Epoch loss: nan
train phase, Epoch 9/10, Loss: nan
val phase, Epoch 9/10, Loss: nan
Val Best Loss: inf
Epoch loss: nan
train phase, Epoch 10/10, Loss: nan
val phase, Epoch 10/10, Loss: nan
Val Best Loss: inf
Epoch loss: nan
train phase, Epoch 1/30, Loss: nan
val phase, Epoch 1/30, Loss: nan
Val Best Loss: inf
Epoch loss: nan
train phase, Epoch 2/30, Loss: nan
val phase, Epoch 2/30, Loss: nan
Val Best Loss: inf
Epoch loss: nan
train phase, Epoch 3/30, Loss: nan
val phase, Epoch 3/30, Loss: nan
Val Best Loss: inf
Epoch loss: nan
train phase, Epoch 4/30, Loss: nan
val phase, Epoch 4/30, Loss: nan
Val Best Loss: inf
Epoch loss: nan
train phase, Epoch 5/30, Loss: nan
val phase, Epoch 5/30, Loss: nan
Val Best Loss: inf
Epoch loss: nan
train phase, Epoch 6/30, Loss: nan
val phase, Epoch 6/30, Loss: nan
Val Best Loss: inf
Epoch loss: nan
train phase, Epoch 7/30, Loss: nan
val phase, Epoch 7/30, Loss: nan
Val Best Loss: inf
Epoch loss: nan
train phase, Epoch 8/30, Loss: nan
val phase, Epoch 8/30, Loss: nan
Val Best Loss: inf
Epoch loss: nan
train phase, Epoch 9/30, Loss: nan
val phase, Epoch 9/30, Loss: nan
Val Best Loss: inf
Epoch loss: nan
train phase, Epoch 10/30, Loss: nan
val phase, Epoch 10/30, Loss: nan
Val Best Loss: inf
Epoch loss: nan
train phase, Epoch 11/30, Loss: nan
val phase, Epoch 11/30, Loss: nan
Val Best Loss: inf
Epoch loss: nan
train phase, Epoch 12/30, Loss: nan
val phase, Epoch 12/30, Loss: nan
Val Best Loss: inf
Epoch loss: nan
train phase, Epoch 13/30, Loss: nan
val phase, Epoch 13/30, Loss: nan
Val Best Loss: inf
Epoch loss: nan
train phase, Epoch 14/30, Loss: nan
val phase, Epoch 14/30, Loss: nan
Val Best Loss: inf
Epoch loss: nan
train phase, Epoch 15/30, Loss: nan
val phase, Epoch 15/30, Loss: nan
Val Best Loss: inf
Epoch loss: nan
train phase, Epoch 16/30, Loss: nan
val phase, Epoch 16/30, Loss: nan
Val Best Loss: inf
Epoch loss: nan
train phase, Epoch 17/30, Loss: nan
val phase, Epoch 17/30, Loss: nan
Val Best Loss: inf
Epoch loss: nan
train phase, Epoch 18/30, Loss: nan
val phase, Epoch 18/30, Loss: nan
Val Best Loss: inf
Epoch loss: nan
train phase, Epoch 19/30, Loss: nan
val phase, Epoch 19/30, Loss: nan
Val Best Loss: inf
Epoch loss: nan
train phase, Epoch 20/30, Loss: nan
val phase, Epoch 20/30, Loss: nan
Val Best Loss: inf
Epoch loss: nan
train phase, Epoch 21/30, Loss: nan
val phase, Epoch 21/30, Loss: nan
Val Best Loss: inf
Epoch loss: nan
train phase, Epoch 22/30, Loss: nan
val phase, Epoch 22/30, Loss: nan
Val Best Loss: inf
Epoch loss: nan
train phase, Epoch 23/30, Loss: nan
val phase, Epoch 23/30, Loss: nan
Val Best Loss: inf
Epoch loss: nan
train phase, Epoch 24/30, Loss: nan
val phase, Epoch 24/30, Loss: nan
Val Best Loss: inf
Epoch loss: nan
train phase, Epoch 25/30, Loss: nan
val phase, Epoch 25/30, Loss: nan
Val Best Loss: inf
Epoch loss: nan
train phase, Epoch 26/30, Loss: nan
val phase, Epoch 26/30, Loss: nan
Val Best Loss: inf
Epoch loss: nan
train phase, Epoch 27/30, Loss: nan
val phase, Epoch 27/30, Loss: nan
Val Best Loss: inf
Epoch loss: nan
train phase, Epoch 28/30, Loss: nan
val phase, Epoch 28/30, Loss: nan
Val Best Loss: inf
Epoch loss: nan
train phase, Epoch 29/30, Loss: nan
val phase, Epoch 29/30, Loss: nan
Val Best Loss: inf
Epoch loss: nan
train phase, Epoch 30/30, Loss: nan
val phase, Epoch 30/30, Loss: nan
Val Best Loss: inf
Epoch loss: nan
train phase, Epoch 1/10, Loss: 25.790138
val phase, Epoch 1/10, Loss: 17.919299
Val Best Loss: 17.919299
Epoch loss: 17.919299
train phase, Epoch 2/10, Loss: 18.315667
val phase, Epoch 2/10, Loss: 17.397957
Val Best Loss: 17.397957
Epoch loss: 17.397957
train phase, Epoch 3/10, Loss: 17.970486
val phase, Epoch 3/10, Loss: 19.220793
Val Best Loss: 17.397957
Epoch loss: 19.220793
train phase, Epoch 4/10, Loss: 17.471168
val phase, Epoch 4/10, Loss: 16.910163
Val Best Loss: 16.910163
Epoch loss: 16.910163
train phase, Epoch 5/10, Loss: 17.139143
val phase, Epoch 5/10, Loss: 17.193914
Val Best Loss: 16.910163
Epoch loss: 17.193914
train phase, Epoch 6/10, Loss: 17.462781
val phase, Epoch 6/10, Loss: 16.678880
Val Best Loss: 16.678880
Epoch loss: 16.678880
train phase, Epoch 7/10, Loss: 17.343978
val phase, Epoch 7/10, Loss: 17.957825
Val Best Loss: 16.678880
Epoch loss: 17.957825
train phase, Epoch 8/10, Loss: 16.997797
val phase, Epoch 8/10, Loss: 16.466291
Val Best Loss: 16.466291
Epoch loss: 16.466291
train phase, Epoch 9/10, Loss: 16.564694
val phase, Epoch 9/10, Loss: 16.857266
Val Best Loss: 16.466291
Epoch loss: 16.857266
train phase, Epoch 10/10, Loss: 16.623019
val phase, Epoch 10/10, Loss: 16.141186
Val Best Loss: 16.141186
Epoch loss: 16.141186
train phase, Epoch 1/10, Loss: 20.366782
val phase, Epoch 1/10, Loss: 17.781527
Val Best Loss: 17.781527
Epoch loss: 17.781527
train phase, Epoch 2/10, Loss: 17.607800
val phase, Epoch 2/10, Loss: 17.479560
Val Best Loss: 17.479560
Epoch loss: 17.479560
train phase, Epoch 3/10, Loss: 17.365796
val phase, Epoch 3/10, Loss: 17.632649
Val Best Loss: 17.479560
Epoch loss: 17.632649
train phase, Epoch 4/10, Loss: 17.036518
val phase, Epoch 4/10, Loss: 20.272790
Val Best Loss: 17.479560
Epoch loss: 20.272790
train phase, Epoch 5/10, Loss: 16.797420
val phase, Epoch 5/10, Loss: 17.605974
Val Best Loss: 17.479560
Epoch loss: 17.605974
train phase, Epoch 6/10, Loss: 16.572104
val phase, Epoch 6/10, Loss: 16.908548
Val Best Loss: 16.908548
Epoch loss: 16.908548
train phase, Epoch 7/10, Loss: 16.176866
val phase, Epoch 7/10, Loss: 17.006040
Val Best Loss: 16.908548
Epoch loss: 17.006040
train phase, Epoch 8/10, Loss: 16.176224
val phase, Epoch 8/10, Loss: 16.831816
Val Best Loss: 16.831816
Epoch loss: 16.831816
train phase, Epoch 9/10, Loss: 15.902722
val phase, Epoch 9/10, Loss: 16.757031
Val Best Loss: 16.757031
Epoch loss: 16.757031
train phase, Epoch 10/10, Loss: 15.829191
val phase, Epoch 10/10, Loss: 17.436213
Val Best Loss: 16.757031
Epoch loss: 17.436213
train phase, Epoch 1/10, Loss: 23.038538
val phase, Epoch 1/10, Loss: 17.390381
Val Best Loss: 17.390381
Epoch loss: 17.390381
train phase, Epoch 2/10, Loss: 17.395476
val phase, Epoch 2/10, Loss: 17.392095
Val Best Loss: 17.390381
Epoch loss: 17.392095
train phase, Epoch 3/10, Loss: 17.063882
val phase, Epoch 3/10, Loss: 17.092559
Val Best Loss: 17.092559
Epoch loss: 17.092559
train phase, Epoch 4/10, Loss: 16.827594
val phase, Epoch 4/10, Loss: 17.429340
Val Best Loss: 17.092559
Epoch loss: 17.429340
train phase, Epoch 5/10, Loss: 16.488660
val phase, Epoch 5/10, Loss: 16.987471
Val Best Loss: 16.987471
Epoch loss: 16.987471
train phase, Epoch 6/10, Loss: 16.232240
val phase, Epoch 6/10, Loss: 17.087876
Val Best Loss: 16.987471
Epoch loss: 17.087876
train phase, Epoch 7/10, Loss: 16.050673
val phase, Epoch 7/10, Loss: 16.958473
Val Best Loss: 16.958473
Epoch loss: 16.958473
train phase, Epoch 8/10, Loss: 15.708625
val phase, Epoch 8/10, Loss: 17.276026
Val Best Loss: 16.958473
Epoch loss: 17.276026
train phase, Epoch 9/10, Loss: 15.610525
val phase, Epoch 9/10, Loss: 17.834650
Val Best Loss: 16.958473
Epoch loss: 17.834650
train phase, Epoch 10/10, Loss: 15.511875
val phase, Epoch 10/10, Loss: 17.685030
Val Best Loss: 16.958473
Epoch loss: 17.685030
train phase, Epoch 1/15, Loss: 22.601088
val phase, Epoch 1/15, Loss: 17.293130
Val Best Loss: 17.293130
Epoch loss: 17.293130
train phase, Epoch 2/15, Loss: 17.332652
val phase, Epoch 2/15, Loss: 17.064063
Val Best Loss: 17.064063
Epoch loss: 17.064063
train phase, Epoch 3/15, Loss: 16.950313
val phase, Epoch 3/15, Loss: 16.742340
Val Best Loss: 16.742340
Epoch loss: 16.742340
train phase, Epoch 4/15, Loss: 16.827583
val phase, Epoch 4/15, Loss: 16.529351
Val Best Loss: 16.529351
Epoch loss: 16.529351
train phase, Epoch 5/15, Loss: 16.378848
val phase, Epoch 5/15, Loss: 18.148651
Val Best Loss: 16.529351
Epoch loss: 18.148651
train phase, Epoch 6/15, Loss: 16.118976
val phase, Epoch 6/15, Loss: 16.411100
Val Best Loss: 16.411100
Epoch loss: 16.411100
train phase, Epoch 7/15, Loss: 16.055297
val phase, Epoch 7/15, Loss: 16.386414
Val Best Loss: 16.386414
Epoch loss: 16.386414
train phase, Epoch 8/15, Loss: 15.631903
val phase, Epoch 8/15, Loss: 16.342575
Val Best Loss: 16.342575
Epoch loss: 16.342575
train phase, Epoch 9/15, Loss: 15.376918
val phase, Epoch 9/15, Loss: 16.208158
Val Best Loss: 16.208158
Epoch loss: 16.208158
train phase, Epoch 10/15, Loss: 15.305880
val phase, Epoch 10/15, Loss: 16.522644
Val Best Loss: 16.208158
Epoch loss: 16.522644
train phase, Epoch 11/15, Loss: 14.833986
val phase, Epoch 11/15, Loss: 18.374818
Val Best Loss: 16.208158
Epoch loss: 18.374818
train phase, Epoch 12/15, Loss: 14.703545
val phase, Epoch 12/15, Loss: 17.709944
Val Best Loss: 16.208158
Epoch loss: 17.709944
train phase, Epoch 13/15, Loss: 14.507761
val phase, Epoch 13/15, Loss: 16.903756
Val Best Loss: 16.208158
Epoch loss: 16.903756
train phase, Epoch 14/15, Loss: 14.166703
val phase, Epoch 14/15, Loss: 17.396875
Val Best Loss: 16.208158
Epoch loss: 17.396875
train phase, Epoch 15/15, Loss: 13.843912
val phase, Epoch 15/15, Loss: 16.894000
Val Best Loss: 16.208158
Epoch loss: 16.894000
train phase, Epoch 1/15, Loss: 21.682302
val phase, Epoch 1/15, Loss: 17.886411
Val Best Loss: 17.886411
Epoch loss: 17.886411
train phase, Epoch 2/15, Loss: 17.355345
val phase, Epoch 2/15, Loss: 16.822879
Val Best Loss: 16.822879
Epoch loss: 16.822879
train phase, Epoch 3/15, Loss: 17.020173
val phase, Epoch 3/15, Loss: 16.933642
Val Best Loss: 16.822879
Epoch loss: 16.933642
train phase, Epoch 4/15, Loss: 16.777969
val phase, Epoch 4/15, Loss: 16.809165
Val Best Loss: 16.809165
Epoch loss: 16.809165
train phase, Epoch 5/15, Loss: 16.485892
val phase, Epoch 5/15, Loss: 16.993910
Val Best Loss: 16.809165
Epoch loss: 16.993910
train phase, Epoch 6/15, Loss: 16.074121
val phase, Epoch 6/15, Loss: 16.465897
Val Best Loss: 16.465897
Epoch loss: 16.465897
train phase, Epoch 7/15, Loss: 15.784393
val phase, Epoch 7/15, Loss: 16.660059
Val Best Loss: 16.465897
Epoch loss: 16.660059
train phase, Epoch 8/15, Loss: 15.697121
val phase, Epoch 8/15, Loss: 16.713446
Val Best Loss: 16.465897
Epoch loss: 16.713446
train phase, Epoch 9/15, Loss: 15.410450
val phase, Epoch 9/15, Loss: 17.670068
Val Best Loss: 16.465897
Epoch loss: 17.670068
train phase, Epoch 10/15, Loss: 15.072480
val phase, Epoch 10/15, Loss: 16.932210
Val Best Loss: 16.465897
Epoch loss: 16.932210
train phase, Epoch 11/15, Loss: 14.796086
val phase, Epoch 11/15, Loss: 17.003384
Val Best Loss: 16.465897
Epoch loss: 17.003384
train phase, Epoch 12/15, Loss: 14.240894
val phase, Epoch 12/15, Loss: 17.193703
Val Best Loss: 16.465897
Epoch loss: 17.193703
train phase, Epoch 13/15, Loss: 14.147388
val phase, Epoch 13/15, Loss: 16.474177
Val Best Loss: 16.465897
Epoch loss: 16.474177
train phase, Epoch 14/15, Loss: 13.928965
val phase, Epoch 14/15, Loss: 17.033635
Val Best Loss: 16.465897
Epoch loss: 17.033635
train phase, Epoch 15/15, Loss: 13.653650
val phase, Epoch 15/15, Loss: 16.803132
Val Best Loss: 16.465897
Epoch loss: 16.803132
[Trial 18] Skipped due to model construction error: Given input size: (128x5x2). Calculated output size: (128x1x0). Output size is too small
[Trial 19] Skipped due to model construction error: Calculated padded input size per channel: (11 x 5). Kernel size: (7 x 7). Kernel size can't be greater than actual input size
train phase, Epoch 1/20, Loss: 20.298126
val phase, Epoch 1/20, Loss: 17.680110
Val Best Loss: 17.680110
Epoch loss: 17.680110
train phase, Epoch 2/20, Loss: 17.922785
val phase, Epoch 2/20, Loss: 16.650320
Val Best Loss: 16.650320
Epoch loss: 16.650320
train phase, Epoch 3/20, Loss: 17.423713
val phase, Epoch 3/20, Loss: 16.625736
Val Best Loss: 16.625736
Epoch loss: 16.625736
train phase, Epoch 4/20, Loss: 17.041690
val phase, Epoch 4/20, Loss: 16.463801
Val Best Loss: 16.463801
Epoch loss: 16.463801
train phase, Epoch 5/20, Loss: 17.117908
val phase, Epoch 5/20, Loss: 17.753484
Val Best Loss: 16.463801
Epoch loss: 17.753484
train phase, Epoch 6/20, Loss: 16.894508
val phase, Epoch 6/20, Loss: 16.004438
Val Best Loss: 16.004438
Epoch loss: 16.004438
train phase, Epoch 7/20, Loss: 16.766223
val phase, Epoch 7/20, Loss: 17.072421
Val Best Loss: 16.004438
Epoch loss: 17.072421
train phase, Epoch 8/20, Loss: 16.157510
val phase, Epoch 8/20, Loss: 17.167629
Val Best Loss: 16.004438
Epoch loss: 17.167629
train phase, Epoch 9/20, Loss: 16.147146
val phase, Epoch 9/20, Loss: 16.075646
Val Best Loss: 16.004438
Epoch loss: 16.075646
train phase, Epoch 10/20, Loss: 16.290243
val phase, Epoch 10/20, Loss: 15.890804
Val Best Loss: 15.890804
Epoch loss: 15.890804
train phase, Epoch 11/20, Loss: 16.048773
val phase, Epoch 11/20, Loss: 16.056500
Val Best Loss: 15.890804
Epoch loss: 16.056500
train phase, Epoch 12/20, Loss: 15.810921
val phase, Epoch 12/20, Loss: 15.882607
Val Best Loss: 15.882607
Epoch loss: 15.882607
train phase, Epoch 13/20, Loss: 15.797162
val phase, Epoch 13/20, Loss: 16.978050
Val Best Loss: 15.882607
Epoch loss: 16.978050
train phase, Epoch 14/20, Loss: 15.325082
val phase, Epoch 14/20, Loss: 16.714169
Val Best Loss: 15.882607
Epoch loss: 16.714169
train phase, Epoch 15/20, Loss: 15.451712
val phase, Epoch 15/20, Loss: 16.071338
Val Best Loss: 15.882607
Epoch loss: 16.071338
train phase, Epoch 16/20, Loss: 15.083888
val phase, Epoch 16/20, Loss: 16.278631
Val Best Loss: 15.882607
Epoch loss: 16.278631
train phase, Epoch 17/20, Loss: 15.029750
val phase, Epoch 17/20, Loss: 16.055289
Val Best Loss: 15.882607
Epoch loss: 16.055289
train phase, Epoch 18/20, Loss: 14.672996
val phase, Epoch 18/20, Loss: 17.446603
Val Best Loss: 15.882607
Epoch loss: 17.446603
train phase, Epoch 19/20, Loss: 14.417607
val phase, Epoch 19/20, Loss: 17.539102
Val Best Loss: 15.882607
Epoch loss: 17.539102
train phase, Epoch 20/20, Loss: 14.074668
val phase, Epoch 20/20, Loss: 16.322666
Val Best Loss: 15.882607
Epoch loss: 16.322666
train phase, Epoch 1/20, Loss: 19.864104
val phase, Epoch 1/20, Loss: 18.362289
Val Best Loss: 18.362289
Epoch loss: 18.362289
train phase, Epoch 2/20, Loss: 17.645437
val phase, Epoch 2/20, Loss: 16.892705
Val Best Loss: 16.892705
Epoch loss: 16.892705
train phase, Epoch 3/20, Loss: 17.160714
val phase, Epoch 3/20, Loss: 16.420020
Val Best Loss: 16.420020
Epoch loss: 16.420020
train phase, Epoch 4/20, Loss: 17.315514
val phase, Epoch 4/20, Loss: 17.072831
Val Best Loss: 16.420020
Epoch loss: 17.072831
train phase, Epoch 5/20, Loss: 16.740038
val phase, Epoch 5/20, Loss: 16.388827
Val Best Loss: 16.388827
Epoch loss: 16.388827
train phase, Epoch 6/20, Loss: 17.026856
val phase, Epoch 6/20, Loss: 16.312849
Val Best Loss: 16.312849
Epoch loss: 16.312849
train phase, Epoch 7/20, Loss: 16.537643
val phase, Epoch 7/20, Loss: 15.879996
Val Best Loss: 15.879996
Epoch loss: 15.879996
train phase, Epoch 8/20, Loss: 16.182949
val phase, Epoch 8/20, Loss: 17.336431
Val Best Loss: 15.879996
Epoch loss: 17.336431
train phase, Epoch 9/20, Loss: 16.128912
val phase, Epoch 9/20, Loss: 15.839313
Val Best Loss: 15.839313
Epoch loss: 15.839313
train phase, Epoch 10/20, Loss: 15.856251
val phase, Epoch 10/20, Loss: 15.921867
Val Best Loss: 15.839313
Epoch loss: 15.921867
train phase, Epoch 11/20, Loss: 15.740892
val phase, Epoch 11/20, Loss: 16.465038
Val Best Loss: 15.839313
Epoch loss: 16.465038
train phase, Epoch 12/20, Loss: 16.077630
val phase, Epoch 12/20, Loss: 16.480370
Val Best Loss: 15.839313
Epoch loss: 16.480370
train phase, Epoch 13/20, Loss: 15.593564
val phase, Epoch 13/20, Loss: 15.970328
Val Best Loss: 15.839313
Epoch loss: 15.970328
train phase, Epoch 14/20, Loss: 15.175045
val phase, Epoch 14/20, Loss: 17.073286
Val Best Loss: 15.839313
Epoch loss: 17.073286
train phase, Epoch 15/20, Loss: 15.190859
val phase, Epoch 15/20, Loss: 16.079164
Val Best Loss: 15.839313
Epoch loss: 16.079164
train phase, Epoch 16/20, Loss: 14.906585
val phase, Epoch 16/20, Loss: 17.374556
Val Best Loss: 15.839313
Epoch loss: 17.374556
train phase, Epoch 17/20, Loss: 14.724853
val phase, Epoch 17/20, Loss: 16.179403
Val Best Loss: 15.839313
Epoch loss: 16.179403
train phase, Epoch 18/20, Loss: 14.710641
val phase, Epoch 18/20, Loss: 15.854697
Val Best Loss: 15.839313
Epoch loss: 15.854697
train phase, Epoch 19/20, Loss: 14.239560
val phase, Epoch 19/20, Loss: 16.084948
Val Best Loss: 15.839313
Epoch loss: 16.084948
train phase, Epoch 20/20, Loss: 13.979339
val phase, Epoch 20/20, Loss: 16.149603
Val Best Loss: 15.839313
Epoch loss: 16.149603
train phase, Epoch 1/20, Loss: 20.094278
val phase, Epoch 1/20, Loss: 18.658085
Val Best Loss: 18.658085
Epoch loss: 18.658085
train phase, Epoch 2/20, Loss: 18.043222
val phase, Epoch 2/20, Loss: 17.264410
Val Best Loss: 17.264410
Epoch loss: 17.264410
train phase, Epoch 3/20, Loss: 17.585231
val phase, Epoch 3/20, Loss: 17.676729
Val Best Loss: 17.264410
Epoch loss: 17.676729
train phase, Epoch 4/20, Loss: 17.133237
val phase