[I 2025-08-05 10:59:56,260] Trial 138 finished with value: 2.718352669082016 and parameters: {'channels_list': [32, 64], 'kernel_size': 3, 'padding': 1, 'pool_kernel': 2, 'dropout_rate': 0, 'fc_hidden_dim': 64, 'lr': 0.006990068748495133, 'weight_decay': 0.00979733135655701, 'optimizer': 'sgd', 'activation': <class 'torch.nn.modules.activation.ReLU'>, 'batchnorm': True, 'epochs': 50, 'batch_size': 32, 'flip_prob': 0.0, 'lstm_hidden_dim': 128, 'lstm_layers': 1}. Best is trial 74 with value: 2.6790329756581452.
[I 2025-08-05 11:00:40,501] Trial 139 finished with value: 2.7333915636248984 and parameters: {'channels_list': [32, 64], 'kernel_size': 3, 'padding': 1, 'pool_kernel': 2, 'dropout_rate': 0, 'fc_hidden_dim': 64, 'lr': 0.0007275474443295737, 'weight_decay': 0.0066357809817745314, 'optimizer': 'sgd', 'activation': <class 'torch.nn.modules.activation.ReLU'>, 'batchnorm': True, 'epochs': 50, 'batch_size': 32, 'flip_prob': 0.0, 'lstm_hidden_dim': 128, 'lstm_layers': 1}. Best is trial 74 with value: 2.6790329756581452.
[I 2025-08-05 11:02:24,250] Trial 140 finished with value: 2.728910987368539 and parameters: {'channels_list': [32, 64], 'kernel_size': 7, 'padding': 1, 'pool_kernel': 2, 'dropout_rate': 0, 'fc_hidden_dim': 256, 'lr': 0.0012534765279452586, 'weight_decay': 0.007932276098750605, 'optimizer': 'sgd', 'activation': <class 'torch.nn.modules.activation.ReLU'>, 'batchnorm': True, 'epochs': 50, 'batch_size': 32, 'flip_prob': 0.0, 'lstm_hidden_dim': 128, 'lstm_layers': 1}. Best is trial 74 with value: 2.6790329756581452.
[I 2025-08-05 11:03:30,326] Trial 141 finished with value: 2.7120551067324685 and parameters: {'channels_list': [32, 64], 'kernel_size': 3, 'padding': 1, 'pool_kernel': 2, 'dropout_rate': 0, 'fc_hidden_dim': 64, 'lr': 0.0009519857312019192, 'weight_decay': 0.005352488783181531, 'optimizer': 'sgd', 'activation': <class 'torch.nn.modules.activation.ReLU'>, 'batchnorm': True, 'epochs': 50, 'batch_size': 32, 'flip_prob': 0.0, 'lstm_hidden_dim': 128, 'lstm_layers': 1}. Best is trial 74 with value: 2.6790329756581452.
[I 2025-08-05 11:04:30,149] Trial 142 finished with value: 2.720395408867352 and parameters: {'channels_list': [32, 64], 'kernel_size': 3, 'padding': 1, 'pool_kernel': 2, 'dropout_rate': 0, 'fc_hidden_dim': 64, 'lr': 0.0009958912182355458, 'weight_decay': 0.0042430081334048665, 'optimizer': 'sgd', 'activation': <class 'torch.nn.modules.activation.ReLU'>, 'batchnorm': True, 'epochs': 50, 'batch_size': 32, 'flip_prob': 0.0, 'lstm_hidden_dim': 128, 'lstm_layers': 1}. Best is trial 74 with value: 2.6790329756581452.
[I 2025-08-05 11:04:59,274] Trial 143 finished with value: 2.8045043527145292 and parameters: {'channels_list': [32, 64], 'kernel_size': 3, 'padding': 1, 'pool_kernel': 2, 'dropout_rate': 0, 'fc_hidden_dim': 64, 'lr': 0.00092584333745459, 'weight_decay': 0.009956547468250535, 'optimizer': 'sgd', 'activation': <class 'torch.nn.modules.activation.ReLU'>, 'batchnorm': True, 'epochs': 50, 'batch_size': 32, 'flip_prob': 0.0, 'lstm_hidden_dim': 128, 'lstm_layers': 1}. Best is trial 74 with value: 2.6790329756581452.
[I 2025-08-05 11:06:29,340] Trial 144 finished with value: 2.710955660363302 and parameters: {'channels_list': [32, 64], 'kernel_size': 3, 'padding': 1, 'pool_kernel': 2, 'dropout_rate': 0, 'fc_hidden_dim': 64, 'lr': 0.0004741849788231619, 'weight_decay': 0.0072953074750581595, 'optimizer': 'sgd', 'activation': <class 'torch.nn.modules.activation.ReLU'>, 'batchnorm': True, 'epochs': 50, 'batch_size': 32, 'flip_prob': 0.0, 'lstm_hidden_dim': 128, 'lstm_layers': 1}. Best is trial 74 with value: 2.6790329756581452.
[I 2025-08-05 11:07:17,888] Trial 145 finished with value: 2.730685904230226 and parameters: {'channels_list': [32, 64], 'kernel_size': 3, 'padding': 1, 'pool_kernel': 2, 'dropout_rate': 0, 'fc_hidden_dim': 64, 'lr': 0.0007670369715158608, 'weight_decay': 0.005824676759699781, 'optimizer': 'sgd', 'activation': <class 'torch.nn.modules.activation.ReLU'>, 'batchnorm': True, 'epochs': 50, 'batch_size': 32, 'flip_prob': 0.0, 'lstm_hidden_dim': 128, 'lstm_layers': 1}. Best is trial 74 with value: 2.6790329756581452.
[I 2025-08-05 11:08:31,320] Trial 146 finished with value: 2.713698148842456 and parameters: {'channels_list': [32, 64], 'kernel_size': 3, 'padding': 1, 'pool_kernel': 2, 'dropout_rate': 0, 'fc_hidden_dim': 64, 'lr': 0.0006494399686863199, 'weight_decay': 0.004850560627815027, 'optimizer': 'sgd', 'activation': <class 'torch.nn.modules.activation.ReLU'>, 'batchnorm': True, 'epochs': 50, 'batch_size': 32, 'flip_prob': 0.0, 'lstm_hidden_dim': 128, 'lstm_layers': 1}. Best is trial 74 with value: 2.6790329756581452.
[I 2025-08-05 11:09:12,882] Trial 147 finished with value: 2.743382775740399 and parameters: {'channels_list': [16, 32, 64, 128], 'kernel_size': 3, 'padding': 1, 'pool_kernel': 2, 'dropout_rate': 0, 'fc_hidden_dim': 64, 'lr': 0.0011089929993366645, 'weight_decay': 0.008089049425004224, 'optimizer': 'sgd', 'activation': <class 'torch.nn.modules.activation.ReLU'>, 'batchnorm': True, 'epochs': 50, 'batch_size': 32, 'flip_prob': 0.0, 'lstm_hidden_dim': 128, 'lstm_layers': 1}. Best is trial 74 with value: 2.6790329756581452.
[I 2025-08-05 11:10:29,250] Trial 148 finished with value: 2.70016091862116 and parameters: {'channels_list': [32, 64], 'kernel_size': 3, 'padding': 1, 'pool_kernel': 2, 'dropout_rate': 0, 'fc_hidden_dim': 64, 'lr': 0.0008421651267233873, 'weight_decay': 0.0040411485628833, 'optimizer': 'sgd', 'activation': <class 'torch.nn.modules.activation.ReLU'>, 'batchnorm': True, 'epochs': 50, 'batch_size': 32, 'flip_prob': 0.0, 'lstm_hidden_dim': 128, 'lstm_layers': 1}. Best is trial 74 with value: 2.6790329756581452.
[I 2025-08-05 11:12:26,631] Trial 149 finished with value: 2.762757563792322 and parameters: {'channels_list': [32, 64], 'kernel_size': 3, 'padding': 1, 'pool_kernel': 3, 'dropout_rate': 0, 'fc_hidden_dim': 128, 'lr': 0.0008628667267277363, 'weight_decay': 0.006680615018296538, 'optimizer': 'sgd', 'activation': <class 'torch.nn.modules.activation.ReLU'>, 'batchnorm': True, 'epochs': 50, 'batch_size': 32, 'flip_prob': 0.0, 'lstm_hidden_dim': 128, 'lstm_layers': 1}. Best is trial 74 with value: 2.6790329756581452.
[I 2025-08-05 11:13:58,180] Trial 150 finished with value: 2.770244066275216 and parameters: {'channels_list': [32, 64], 'kernel_size': 5, 'padding': 0, 'pool_kernel': 2, 'dropout_rate': 0, 'fc_hidden_dim': 64, 'lr': 0.0005368987751600733, 'weight_decay': 0.002871954236524701, 'optimizer': 'sgd', 'activation': <class 'torch.nn.modules.activation.ReLU'>, 'batchnorm': True, 'epochs': 50, 'batch_size': 32, 'flip_prob': 0.0, 'lstm_hidden_dim': 128, 'lstm_layers': 1}. Best is trial 74 with value: 2.6790329756581452.
[I 2025-08-05 11:15:22,922] Trial 151 finished with value: 2.7031555141844708 and parameters: {'channels_list': [32, 64], 'kernel_size': 3, 'padding': 1, 'pool_kernel': 2, 'dropout_rate': 0, 'fc_hidden_dim': 64, 'lr': 0.0010184866300465766, 'weight_decay': 0.003916344029081535, 'optimizer': 'sgd', 'activation': <class 'torch.nn.modules.activation.ReLU'>, 'batchnorm': True, 'epochs': 50, 'batch_size': 32, 'flip_prob': 0.0, 'lstm_hidden_dim': 128, 'lstm_layers': 1}. Best is trial 74 with value: 2.6790329756581452.
[I 2025-08-05 11:16:25,622] Trial 152 finished with value: 2.734011754368413 and parameters: {'channels_list': [32, 64], 'kernel_size': 3, 'padding': 1, 'pool_kernel': 2, 'dropout_rate': 0, 'fc_hidden_dim': 64, 'lr': 0.001214952534753915, 'weight_decay': 1.4353173864275494e-06, 'optimizer': 'sgd', 'activation': <class 'torch.nn.modules.activation.ReLU'>, 'batchnorm': True, 'epochs': 50, 'batch_size': 32, 'flip_prob': 0.0, 'lstm_hidden_dim': 128, 'lstm_layers': 1}. Best is trial 74 with value: 2.6790329756581452.
[I 2025-08-05 11:17:31,470] Trial 153 finished with value: 2.6958629751378003 and parameters: {'channels_list': [32, 64], 'kernel_size': 3, 'padding': 1, 'pool_kernel': 2, 'dropout_rate': 0, 'fc_hidden_dim': 64, 'lr': 0.0010649739509737007, 'weight_decay': 0.00386254362373608, 'optimizer': 'sgd', 'activation': <class 'torch.nn.modules.activation.ReLU'>, 'batchnorm': True, 'epochs': 50, 'batch_size': 32, 'flip_prob': 0.0, 'lstm_hidden_dim': 128, 'lstm_layers': 1}. Best is trial 74 with value: 2.6790329756581452.
[I 2025-08-05 11:18:31,093] Trial 154 finished with value: 2.6936853715392735 and parameters: {'channels_list': [32, 64], 'kernel_size': 3, 'padding': 1, 'pool_kernel': 2, 'dropout_rate': 0, 'fc_hidden_dim': 64, 'lr': 0.001007341438780561, 'weight_decay': 0.0033688900733783484, 'optimizer': 'sgd', 'activation': <class 'torch.nn.modules.activation.ReLU'>, 'batchnorm': True, 'epochs': 50, 'batch_size': 32, 'flip_prob': 0.0, 'lstm_hidden_dim': 128, 'lstm_layers': 1}. Best is trial 74 with value: 2.6790329756581452.
[I 2025-08-05 11:19:40,024] Trial 155 finished with value: 2.725968216584301 and parameters: {'channels_list': [32, 64], 'kernel_size': 3, 'padding': 1, 'pool_kernel': 2, 'dropout_rate': 0, 'fc_hidden_dim': 64, 'lr': 0.0010453302300459653, 'weight_decay': 0.003593700242562029, 'optimizer': 'sgd', 'activation': <class 'torch.nn.modules.activation.ReLU'>, 'batchnorm': True, 'epochs': 50, 'batch_size': 32, 'flip_prob': 0.0, 'lstm_hidden_dim': 128, 'lstm_layers': 1}. Best is trial 74 with value: 2.6790329756581452.
[I 2025-08-05 11:20:45,887] Trial 156 finished with value: 2.7022499762628276 and parameters: {'channels_list': [32, 64], 'kernel_size': 3, 'padding': 1, 'pool_kernel': 2, 'dropout_rate': 0, 'fc_hidden_dim': 64, 'lr': 0.0011566865965631308, 'weight_decay': 0.003215316047985814, 'optimizer': 'sgd', 'activation': <class 'torch.nn.modules.activation.ReLU'>, 'batchnorm': True, 'epochs': 50, 'batch_size': 32, 'flip_prob': 0.0, 'lstm_hidden_dim': 128, 'lstm_layers': 1}. Best is trial 74 with value: 2.6790329756581452.
[I 2025-08-05 11:21:35,674] Trial 157 finished with value: 2.732608979861325 and parameters: {'channels_list': [32, 64], 'kernel_size': 3, 'padding': 1, 'pool_kernel': 2, 'dropout_rate': 0, 'fc_hidden_dim': 256, 'lr': 0.001252578818043194, 'weight_decay': 0.0021947936363636987, 'optimizer': 'sgd', 'activation': <class 'torch.nn.modules.activation.ReLU'>, 'batchnorm': True, 'epochs': 50, 'batch_size': 32, 'flip_prob': 0.0, 'lstm_hidden_dim': 32, 'lstm_layers': 1}. Best is trial 74 with value: 2.6790329756581452.
[I 2025-08-05 11:22:32,161] Trial 158 finished with value: 2.724936727390358 and parameters: {'channels_list': [32, 64], 'kernel_size': 3, 'padding': 1, 'pool_kernel': 2, 'dropout_rate': 0, 'fc_hidden_dim': 64, 'lr': 0.0011282130695282745, 'weight_decay': 0.0027486568564787273, 'optimizer': 'sgd', 'activation': <class 'torch.nn.modules.activation.ReLU'>, 'batchnorm': True, 'epochs': 50, 'batch_size': 32, 'flip_prob': 0.0, 'lstm_hidden_dim': 128, 'lstm_layers': 1}. Best is trial 74 with value: 2.6790329756581452.
[I 2025-08-05 11:23:07,465] Trial 159 finished with value: 2.7962014537093434 and parameters: {'channels_list': [16, 32, 64], 'kernel_size': 3, 'padding': 1, 'pool_kernel': 2, 'dropout_rate': 0, 'fc_hidden_dim': 64, 'lr': 0.000877185981493665, 'weight_decay': 0.0019233977378369902, 'optimizer': 'rmsprop', 'activation': <class 'torch.nn.modules.activation.ReLU'>, 'batchnorm': True, 'epochs': 50, 'batch_size': 32, 'flip_prob': 0.0, 'lstm_hidden_dim': 128, 'lstm_layers': 1}. Best is trial 74 with value: 2.6790329756581452.
[I 2025-08-05 11:23:37,563] Trial 160 finished with value: 2.747788864223172 and parameters: {'channels_list': [32, 64], 'kernel_size': 3, 'padding': 1, 'pool_kernel': 2, 'dropout_rate': 0, 'fc_hidden_dim': 64, 'lr': 0.000797156574102856, 'weight_decay': 0.0050723717624933246, 'optimizer': 'sgd', 'activation': <class 'torch.nn.modules.activation.LeakyReLU'>, 'batchnorm': True, 'epochs': 50, 'batch_size': 64, 'flip_prob': 0.0, 'lstm_hidden_dim': 128, 'lstm_layers': 1}. Best is trial 74 with value: 2.6790329756581452.
[I 2025-08-05 11:24:34,168] Trial 161 finished with value: 2.7236095554434634 and parameters: {'channels_list': [32, 64], 'kernel_size': 3, 'padding': 1, 'pool_kernel': 2, 'dropout_rate': 0, 'fc_hidden_dim': 64, 'lr': 0.0010148156833192353, 'weight_decay': 0.0038577468094816774, 'optimizer': 'sgd', 'activation': <class 'torch.nn.modules.activation.ReLU'>, 'batchnorm': True, 'epochs': 50, 'batch_size': 32, 'flip_prob': 0.0, 'lstm_hidden_dim': 128, 'lstm_layers': 1}. Best is trial 74 with value: 2.6790329756581452.
[I 2025-08-05 11:25:21,669] Trial 162 finished with value: 2.7323610216630816 and parameters: {'channels_list': [32, 64], 'kernel_size': 3, 'padding': 1, 'pool_kernel': 2, 'dropout_rate': 0, 'fc_hidden_dim': 64, 'lr': 0.0013293779698693641, 'weight_decay': 0.004451528091488137, 'optimizer': 'sgd', 'activation': <class 'torch.nn.modules.activation.ReLU'>, 'batchnorm': True, 'epochs': 50, 'batch_size': 32, 'flip_prob': 0.0, 'lstm_hidden_dim': 128, 'lstm_layers': 1}. Best is trial 74 with value: 2.6790329756581452.
[I 2025-08-05 11:27:02,050] Trial 163 finished with value: 2.7172751976008582 and parameters: {'channels_list': [32, 64], 'kernel_size': 3, 'padding': 1, 'pool_kernel': 2, 'dropout_rate': 0, 'fc_hidden_dim': 64, 'lr': 0.0010493018516905125, 'weight_decay': 0.0033667089921283803, 'optimizer': 'sgd', 'activation': <class 'torch.nn.modules.activation.ReLU'>, 'batchnorm': True, 'epochs': 50, 'batch_size': 32, 'flip_prob': 0.0, 'lstm_hidden_dim': 128, 'lstm_layers': 1}. Best is trial 74 with value: 2.6790329756581452.
[I 2025-08-05 11:28:05,044] Trial 164 finished with value: 2.714694762891394 and parameters: {'channels_list': [32, 64], 'kernel_size': 3, 'padding': 1, 'pool_kernel': 2, 'dropout_rate': 0, 'fc_hidden_dim': 64, 'lr': 0.000947626281646093, 'weight_decay': 0.005450396196333297, 'optimizer': 'sgd', 'activation': <class 'torch.nn.modules.activation.ReLU'>, 'batchnorm': True, 'epochs': 50, 'batch_size': 32, 'flip_prob': 0.0, 'lstm_hidden_dim': 128, 'lstm_layers': 1}. Best is trial 74 with value: 2.6790329756581452.
[I 2025-08-05 11:28:49,216] Trial 165 finished with value: 2.756122974434865 and parameters: {'channels_list': [32, 64], 'kernel_size': 3, 'padding': 1, 'pool_kernel': 2, 'dropout_rate': 0, 'fc_hidden_dim': 64, 'lr': 0.0008192807488397086, 'weight_decay': 0.0031616744052130608, 'optimizer': 'sgd', 'activation': <class 'torch.nn.modules.activation.ReLU'>, 'batchnorm': True, 'epochs': 50, 'batch_size': 32, 'flip_prob': 0.0, 'lstm_hidden_dim': 128, 'lstm_layers': 1}. Best is trial 74 with value: 2.6790329756581452.
[I 2025-08-05 11:29:36,480] Trial 166 finished with value: 2.7031996192633025 and parameters: {'channels_list': [32, 64], 'kernel_size': 3, 'padding': 1, 'pool_kernel': 2, 'dropout_rate': 0, 'fc_hidden_dim': 64, 'lr': 0.0011779808917241161, 'weight_decay': 0.002415494089954398, 'optimizer': 'sgd', 'activation': <class 'torch.nn.modules.activation.ReLU'>, 'batchnorm': True, 'epochs': 50, 'batch_size': 32, 'flip_prob': 0.0, 'lstm_hidden_dim': 128, 'lstm_layers': 1}. Best is trial 74 with value: 2.6790329756581452.
[I 2025-08-05 11:30:56,056] Trial 167 finished with value: 2.6919823494118575 and parameters: {'channels_list': [32, 64, 128], 'kernel_size': 3, 'padding': 1, 'pool_kernel': 2, 'dropout_rate': 0, 'fc_hidden_dim': 64, 'lr': 0.0014545120858729887, 'weight_decay': 0.007051839392413039, 'optimizer': 'sgd', 'activation': <class 'torch.nn.modules.activation.ReLU'>, 'batchnorm': True, 'epochs': 50, 'batch_size': 32, 'flip_prob': 0.0, 'lstm_hidden_dim': 128, 'lstm_layers': 1}. Best is trial 74 with value: 2.6790329756581452.
[I 2025-08-05 11:31:48,167] Trial 168 finished with value: 2.7221235303453137 and parameters: {'channels_list': [32, 64, 128], 'kernel_size': 3, 'padding': 1, 'pool_kernel': 2, 'dropout_rate': 0, 'fc_hidden_dim': 64, 'lr': 0.00145277132117327, 'weight_decay': 0.007892234904359505, 'optimizer': 'sgd', 'activation': <class 'torch.nn.modules.activation.ReLU'>, 'batchnorm': True, 'epochs': 50, 'batch_size': 32, 'flip_prob': 0.0, 'lstm_hidden_dim': 128, 'lstm_layers': 1}. Best is trial 74 with value: 2.6790329756581452.
[I 2025-08-05 11:32:43,803] Trial 169 finished with value: 2.714284569621805 and parameters: {'channels_list': [32, 64, 128], 'kernel_size': 3, 'padding': 1, 'pool_kernel': 2, 'dropout_rate': 0, 'fc_hidden_dim': 64, 'lr': 0.0011386778791242088, 'weight_decay': 0.006757075035605796, 'optimizer': 'sgd', 'activation': <class 'torch.nn.modules.activation.ReLU'>, 'batchnorm': True, 'epochs': 50, 'batch_size': 32, 'flip_prob': 0.0, 'lstm_hidden_dim': 128, 'lstm_layers': 1}. Best is trial 74 with value: 2.6790329756581452.
[I 2025-08-05 11:32:43,827] Trial 170 pruned. 
[I 2025-08-05 11:33:46,760] Trial 171 finished with value: 2.729068019105384 and parameters: {'channels_list': [32, 64, 128], 'kernel_size': 3, 'padding': 1, 'pool_kernel': 2, 'dropout_rate': 0, 'fc_hidden_dim': 64, 'lr': 0.0009978406419309629, 'weight_decay': 0.003979582783391658, 'optimizer': 'sgd', 'activation': <class 'torch.nn.modules.activation.ReLU'>, 'batchnorm': True, 'epochs': 50, 'batch_size': 32, 'flip_prob': 0.0, 'lstm_hidden_dim': 128, 'lstm_layers': 1}. Best is trial 74 with value: 2.6790329756581452.
[I 2025-08-05 11:34:28,907] Trial 172 finished with value: 2.7247314833329295 and parameters: {'channels_list': [32, 64, 128], 'kernel_size': 3, 'padding': 1, 'pool_kernel': 2, 'dropout_rate': 0, 'fc_hidden_dim': 64, 'lr': 0.0008890375932060027, 'weight_decay': 0.004861910934448878, 'optimizer': 'sgd', 'activation': <class 'torch.nn.modules.activation.ReLU'>, 'batchnorm': True, 'epochs': 50, 'batch_size': 32, 'flip_prob': 0.0, 'lstm_hidden_dim': 128, 'lstm_layers': 1}. Best is trial 74 with value: 2.6790329756581452.
[I 2025-08-05 11:36:09,798] Trial 173 finished with value: 2.684614100818611 and parameters: {'channels_list': [32, 64], 'kernel_size': 3, 'padding': 1, 'pool_kernel': 2, 'dropout_rate': 0, 'fc_hidden_dim': 64, 'lr': 0.0010620395373659513, 'weight_decay': 0.008284714645394662, 'optimizer': 'sgd', 'activation': <class 'torch.nn.modules.activation.ReLU'>, 'batchnorm': True, 'epochs': 50, 'batch_size': 32, 'flip_prob': 0.0, 'lstm_hidden_dim': 128, 'lstm_layers': 1}. Best is trial 74 with value: 2.6790329756581452.
[I 2025-08-05 11:37:40,581] Trial 174 finished with value: 2.6885430038622404 and parameters: {'channels_list': [32, 64], 'kernel_size': 3, 'padding': 1, 'pool_kernel': 2, 'dropout_rate': 0, 'fc_hidden_dim': 64, 'lr': 0.0007440532410332638, 'weight_decay': 0.008251633707331901, 'optimizer': 'sgd', 'activation': <class 'torch.nn.modules.activation.ReLU'>, 'batchnorm': True, 'epochs': 50, 'batch_size': 32, 'flip_prob': 0.0, 'lstm_hidden_dim': 128, 'lstm_layers': 1}. Best is trial 74 with value: 2.6790329756581452.
[I 2025-08-05 11:38:58,538] Trial 175 finished with value: 2.7090185077400344 and parameters: {'channels_list': [32, 64], 'kernel_size': 3, 'padding': 1, 'pool_kernel': 2, 'dropout_rate': 0, 'fc_hidden_dim': 256, 'lr': 0.0007401888075313645, 'weight_decay': 0.007485792949617621, 'optimizer': 'sgd', 'activation': <class 'torch.nn.modules.activation.ReLU'>, 'batchnorm': True, 'epochs': 50, 'batch_size': 32, 'flip_prob': 0.0, 'lstm_hidden_dim': 128, 'lstm_layers': 1}. Best is trial 74 with value: 2.6790329756581452.
[I 2025-08-05 11:40:20,750] Trial 176 finished with value: 2.7228240793663 and parameters: {'channels_list': [32, 64], 'kernel_size': 3, 'padding': 1, 'pool_kernel': 2, 'dropout_rate': 0, 'fc_hidden_dim': 64, 'lr': 0.0011321979887885106, 'weight_decay': 0.008273120931115983, 'optimizer': 'adam', 'activation': <class 'torch.nn.modules.activation.ReLU'>, 'batchnorm': True, 'epochs': 50, 'batch_size': 32, 'flip_prob': 0.0, 'lstm_hidden_dim': 128, 'lstm_layers': 1}. Best is trial 74 with value: 2.6790329756581452.
[I 2025-08-05 11:41:30,402] Trial 177 finished with value: 2.730800174085021 and parameters: {'channels_list': [16, 32, 64, 128], 'kernel_size': 3, 'padding': 1, 'pool_kernel': 2, 'dropout_rate': 0, 'fc_hidden_dim': 64, 'lr': 0.0013792852262283837, 'weight_decay': 0.006251952197219643, 'optimizer': 'sgd', 'activation': <class 'torch.nn.modules.activation.ReLU'>, 'batchnorm': True, 'epochs': 50, 'batch_size': 32, 'flip_prob': 0.0, 'lstm_hidden_dim': 128, 'lstm_layers': 1}. Best is trial 74 with value: 2.6790329756581452.
[I 2025-08-05 11:42:17,821] Trial 178 finished with value: 2.762267365645442 and parameters: {'channels_list': [32, 64], 'kernel_size': 3, 'padding': 1, 'pool_kernel': 3, 'dropout_rate': 0, 'fc_hidden_dim': 64, 'lr': 0.0009380996704496879, 'weight_decay': 0.0073951553722892945, 'optimizer': 'sgd', 'activation': <class 'torch.nn.modules.activation.ReLU'>, 'batchnorm': True, 'epochs': 50, 'batch_size': 32, 'flip_prob': 0.0, 'lstm_hidden_dim': 128, 'lstm_layers': 1}. Best is trial 74 with value: 2.6790329756581452.
[I 2025-08-05 11:43:52,093] Trial 179 finished with value: 2.6950707102569655 and parameters: {'channels_list': [32, 64], 'kernel_size': 3, 'padding': 1, 'pool_kernel': 2, 'dropout_rate': 0, 'fc_hidden_dim': 64, 'lr': 0.0012600693695201154, 'weight_decay': 0.00530935173882675, 'optimizer': 'sgd', 'activation': <class 'torch.nn.modules.activation.ReLU'>, 'batchnorm': True, 'epochs': 50, 'batch_size': 32, 'flip_prob': 0.0, 'lstm_hidden_dim': 128, 'lstm_layers': 1}. Best is trial 74 with value: 2.6790329756581452.
[I 2025-08-05 11:44:54,878] Trial 180 finished with value: 2.7073908837482925 and parameters: {'channels_list': [32, 64], 'kernel_size': 3, 'padding': 1, 'pool_kernel': 2, 'dropout_rate': 0, 'fc_hidden_dim': 64, 'lr': 0.0015023130390781029, 'weight_decay': 0.0054949623453364235, 'optimizer': 'sgd', 'activation': <class 'torch.nn.modules.activation.ReLU'>, 'batchnorm': True, 'epochs': 50, 'batch_size': 32, 'flip_prob': 0.0, 'lstm_hidden_dim': 128, 'lstm_layers': 2}. Best is trial 74 with value: 2.6790329756581452.
