[I 2025-06-30 22:13:09,101] Trial 62 finished with value: 15.749580033194126 and parameters: {'kernel_size': 3, 'channel_list': [16, 32, 64, 128], 'padding': 1, 'pool_kernel': 2, 'dropout_rate': 0.1, 'fc_hidden_dim': 128, 'lr': 0.007185791774596803, 'weight_decay': 4.363156628861151e-06, 'optimizer': 'adam', 'activation': <class 'torch.nn.modules.activation.ReLU'>, 'batchnorm': True, 'epochs': 30, 'batch_size': 64, 'flip_prob': 0.0}. Best is trial 58 with value: 15.590755557733331.
[I 2025-06-30 22:14:22,014] Trial 63 finished with value: 16.44618278751579 and parameters: {'kernel_size': 3, 'channel_list': [16, 32, 64, 128], 'padding': 1, 'pool_kernel': 2, 'dropout_rate': 0.1, 'fc_hidden_dim': 128, 'lr': 0.00010772996696414988, 'weight_decay': 1.6206227528099138e-06, 'optimizer': 'adam', 'activation': <class 'torch.nn.modules.activation.ReLU'>, 'batchnorm': True, 'epochs': 30, 'batch_size': 64, 'flip_prob': 0.0}. Best is trial 58 with value: 15.590755557733331.
[I 2025-06-30 22:15:36,140] Trial 64 finished with value: 15.80299112569978 and parameters: {'kernel_size': 3, 'channel_list': [16, 32, 64, 128], 'padding': 1, 'pool_kernel': 2, 'dropout_rate': 0.1, 'fc_hidden_dim': 64, 'lr': 0.005363864958101513, 'weight_decay': 0.0001288947092189826, 'optimizer': 'adam', 'activation': <class 'torch.nn.modules.activation.LeakyReLU'>, 'batchnorm': True, 'epochs': 30, 'batch_size': 64, 'flip_prob': 0.0}. Best is trial 58 with value: 15.590755557733331.
[I 2025-06-30 22:16:01,170] Trial 65 finished with value: 16.118643142460762 and parameters: {'kernel_size': 3, 'channel_list': [16, 32, 64, 128], 'padding': 1, 'pool_kernel': 2, 'dropout_rate': 0, 'fc_hidden_dim': 128, 'lr': 0.003160479047788975, 'weight_decay': 1.385862903446737e-06, 'optimizer': 'adam', 'activation': <class 'torch.nn.modules.activation.LeakyReLU'>, 'batchnorm': True, 'epochs': 10, 'batch_size': 64, 'flip_prob': 0.0}. Best is trial 58 with value: 15.590755557733331.
[I 2025-06-30 22:16:42,132] Trial 66 finished with value: 16.262244839962886 and parameters: {'kernel_size': 3, 'channel_list': [16, 32, 64, 128], 'padding': 1, 'pool_kernel': 2, 'dropout_rate': 0.1, 'fc_hidden_dim': 128, 'lr': 0.004074493386960315, 'weight_decay': 1.373947789399505e-05, 'optimizer': 'adam', 'activation': <class 'torch.nn.modules.activation.LeakyReLU'>, 'batchnorm': True, 'epochs': 20, 'batch_size': 128, 'flip_prob': 0.5}. Best is trial 58 with value: 15.590755557733331.
[I 2025-06-30 22:17:50,487] Trial 67 finished with value: 17.687870299983704 and parameters: {'kernel_size': 3, 'channel_list': [16, 32, 64, 128], 'padding': 1, 'pool_kernel': 2, 'dropout_rate': 0.5, 'fc_hidden_dim': 128, 'lr': 0.008825650977507225, 'weight_decay': 4.065454919843914e-06, 'optimizer': 'sgd', 'activation': <class 'torch.nn.modules.activation.ReLU'>, 'batchnorm': True, 'epochs': 30, 'batch_size': 64, 'flip_prob': 0.0}. Best is trial 58 with value: 15.590755557733331.
[I 2025-06-30 22:18:57,464] Trial 68 finished with value: 15.81300613793644 and parameters: {'kernel_size': 3, 'channel_list': [32, 64, 128], 'padding': 1, 'pool_kernel': 2, 'dropout_rate': 0.1, 'fc_hidden_dim': 128, 'lr': 0.0012789378285663093, 'weight_decay': 7.807396472946821e-06, 'optimizer': 'adam', 'activation': <class 'torch.nn.modules.activation.LeakyReLU'>, 'batchnorm': True, 'epochs': 20, 'batch_size': 64, 'flip_prob': 0.0}. Best is trial 58 with value: 15.590755557733331.
[I 2025-06-30 22:18:57,485] Trial 69 pruned. 
[I 2025-06-30 22:19:38,786] Trial 70 finished with value: 17.198426363553125 and parameters: {'kernel_size': 3, 'channel_list': [16, 32, 64, 128], 'padding': 1, 'pool_kernel': 2, 'dropout_rate': 0.1, 'fc_hidden_dim': 64, 'lr': 0.006243054966061736, 'weight_decay': 0.0003106906996539559, 'optimizer': 'adam', 'activation': <class 'torch.nn.modules.activation.LeakyReLU'>, 'batchnorm': False, 'epochs': 20, 'batch_size': 64, 'flip_prob': 0.0}. Best is trial 58 with value: 15.590755557733331.
[I 2025-06-30 22:20:28,251] Trial 71 finished with value: 15.842961257094064 and parameters: {'kernel_size': 3, 'channel_list': [16, 32, 64, 128], 'padding': 1, 'pool_kernel': 2, 'dropout_rate': 0.1, 'fc_hidden_dim': 128, 'lr': 0.003737508995459656, 'weight_decay': 1.927732054528975e-05, 'optimizer': 'adam', 'activation': <class 'torch.nn.modules.activation.LeakyReLU'>, 'batchnorm': True, 'epochs': 20, 'batch_size': 64, 'flip_prob': 0.0}. Best is trial 58 with value: 15.590755557733331.
[I 2025-06-30 22:21:18,179] Trial 72 finished with value: 15.84703206439235 and parameters: {'kernel_size': 3, 'channel_list': [16, 32, 64, 128], 'padding': 1, 'pool_kernel': 2, 'dropout_rate': 0.1, 'fc_hidden_dim': 128, 'lr': 0.004731206614309696, 'weight_decay': 1.9968203669621322e-05, 'optimizer': 'adam', 'activation': <class 'torch.nn.modules.activation.LeakyReLU'>, 'batchnorm': True, 'epochs': 20, 'batch_size': 64, 'flip_prob': 0.0}. Best is trial 58 with value: 15.590755557733331.
[I 2025-06-30 22:22:06,895] Trial 73 finished with value: 15.927405752360958 and parameters: {'kernel_size': 3, 'channel_list': [16, 32, 64, 128], 'padding': 1, 'pool_kernel': 2, 'dropout_rate': 0.1, 'fc_hidden_dim': 128, 'lr': 0.009860781794451219, 'weight_decay': 3.066647365968102e-05, 'optimizer': 'adam', 'activation': <class 'torch.nn.modules.activation.LeakyReLU'>, 'batchnorm': True, 'epochs': 20, 'batch_size': 64, 'flip_prob': 0.0}. Best is trial 58 with value: 15.590755557733331.
[I 2025-06-30 22:22:06,913] Trial 74 pruned. 
[I 2025-06-30 22:22:36,214] Trial 75 finished with value: 15.873254057393817 and parameters: {'kernel_size': 3, 'channel_list': [16, 32, 64, 128], 'padding': 1, 'pool_kernel': 2, 'dropout_rate': 0.1, 'fc_hidden_dim': 128, 'lr': 0.0021745661141562797, 'weight_decay': 4.5958217983721354e-05, 'optimizer': 'adam', 'activation': <class 'torch.nn.modules.activation.LeakyReLU'>, 'batchnorm': True, 'epochs': 12, 'batch_size': 64, 'flip_prob': 0.0}. Best is trial 58 with value: 15.590755557733331.
[I 2025-06-30 22:22:36,232] Trial 76 pruned. 
[I 2025-06-30 22:23:52,760] Trial 77 finished with value: 15.94201876361918 and parameters: {'kernel_size': 5, 'channel_list': [32, 64, 128], 'padding': 1, 'pool_kernel': 2, 'dropout_rate': 0.1, 'fc_hidden_dim': 256, 'lr': 0.007584875725879331, 'weight_decay': 4.9073138157743866e-06, 'optimizer': 'adam', 'activation': <class 'torch.nn.modules.activation.ReLU'>, 'batchnorm': True, 'epochs': 25, 'batch_size': 64, 'flip_prob': 0.0}. Best is trial 58 with value: 15.590755557733331.
[I 2025-06-30 22:24:06,811] Trial 78 finished with value: 31.26812475933363 and parameters: {'kernel_size': 3, 'channel_list': [16, 32, 64, 128], 'padding': 1, 'pool_kernel': 2, 'dropout_rate': 0.1, 'fc_hidden_dim': 128, 'lr': 0.006446933228367098, 'weight_decay': 1.5509480496727466e-05, 'optimizer': 'adam', 'activation': <class 'torch.nn.modules.activation.LeakyReLU'>, 'batchnorm': True, 'epochs': 5, 'batch_size': 64, 'flip_prob': 1}. Best is trial 58 with value: 15.590755557733331.
[I 2025-06-30 22:24:22,494] Trial 79 finished with value: inf and parameters: {'kernel_size': 3, 'channel_list': [16, 32, 64], 'padding': 1, 'pool_kernel': 2, 'dropout_rate': 0, 'fc_hidden_dim': 128, 'lr': 0.00440233483115646, 'weight_decay': 2.6243459700343136e-05, 'optimizer': 'sgd', 'activation': <class 'torch.nn.modules.activation.LeakyReLU'>, 'batchnorm': True, 'epochs': 10, 'batch_size': 128, 'flip_prob': 0.0}. Best is trial 58 with value: 15.590755557733331.
[I 2025-06-30 22:24:22,515] Trial 80 pruned. 
[I 2025-06-30 22:25:36,885] Trial 81 finished with value: 15.921823479451943 and parameters: {'kernel_size': 3, 'channel_list': [16, 32, 64, 128], 'padding': 1, 'pool_kernel': 2, 'dropout_rate': 0.1, 'fc_hidden_dim': 128, 'lr': 0.0073482079131490866, 'weight_decay': 4.748388347406885e-06, 'optimizer': 'adam', 'activation': <class 'torch.nn.modules.activation.ReLU'>, 'batchnorm': True, 'epochs': 30, 'batch_size': 64, 'flip_prob': 0.0}. Best is trial 58 with value: 15.590755557733331.
[I 2025-06-30 22:26:50,829] Trial 82 finished with value: 16.076101783522986 and parameters: {'kernel_size': 3, 'channel_list': [16, 32, 64, 128], 'padding': 1, 'pool_kernel': 2, 'dropout_rate': 0.1, 'fc_hidden_dim': 128, 'lr': 0.0067892802898111716, 'weight_decay': 6.389130717807811e-06, 'optimizer': 'adam', 'activation': <class 'torch.nn.modules.activation.ReLU'>, 'batchnorm': True, 'epochs': 30, 'batch_size': 64, 'flip_prob': 0.0}. Best is trial 58 with value: 15.590755557733331.
[I 2025-06-30 22:28:06,706] Trial 83 finished with value: 15.861731373667523 and parameters: {'kernel_size': 3, 'channel_list': [16, 32, 64, 128], 'padding': 1, 'pool_kernel': 2, 'dropout_rate': 0.1, 'fc_hidden_dim': 128, 'lr': 0.008682434985554599, 'weight_decay': 2.8653213867595414e-06, 'optimizer': 'adam', 'activation': <class 'torch.nn.modules.activation.ReLU'>, 'batchnorm': True, 'epochs': 30, 'batch_size': 64, 'flip_prob': 0.0}. Best is trial 58 with value: 15.590755557733331.
[I 2025-06-30 22:29:22,322] Trial 84 finished with value: 15.852817202128785 and parameters: {'kernel_size': 3, 'channel_list': [16, 32, 64, 128], 'padding': 1, 'pool_kernel': 2, 'dropout_rate': 0.1, 'fc_hidden_dim': 128, 'lr': 0.0048686058733459995, 'weight_decay': 0.00011887749994512047, 'optimizer': 'adam', 'activation': <class 'torch.nn.modules.activation.ReLU'>, 'batchnorm': True, 'epochs': 30, 'batch_size': 64, 'flip_prob': 0.0}. Best is trial 58 with value: 15.590755557733331.
[I 2025-06-30 22:30:38,987] Trial 85 finished with value: 16.22551119050858 and parameters: {'kernel_size': 3, 'channel_list': [16, 32, 64, 128], 'padding': 1, 'pool_kernel': 2, 'dropout_rate': 0.5, 'fc_hidden_dim': 128, 'lr': 0.006014485147102767, 'weight_decay': 1.9685501452114766e-06, 'optimizer': 'adam', 'activation': <class 'torch.nn.modules.activation.ReLU'>, 'batchnorm': True, 'epochs': 20, 'batch_size': 32, 'flip_prob': 0.5}. Best is trial 58 with value: 15.590755557733331.
[I 2025-06-30 22:31:52,342] Trial 86 finished with value: 15.539556323098529 and parameters: {'kernel_size': 3, 'channel_list': [16, 32, 64, 128], 'padding': 1, 'pool_kernel': 2, 'dropout_rate': 0.1, 'fc_hidden_dim': 128, 'lr': 0.007842596392824521, 'weight_decay': 3.986203039807763e-06, 'optimizer': 'adam', 'activation': <class 'torch.nn.modules.activation.ReLU'>, 'batchnorm': True, 'epochs': 30, 'batch_size': 64, 'flip_prob': 0.0}. Best is trial 86 with value: 15.539556323098529.
[I 2025-06-30 22:31:52,360] Trial 87 pruned. 
[I 2025-06-30 22:32:40,424] Trial 88 finished with value: 15.79203264368013 and parameters: {'kernel_size': 3, 'channel_list': [16, 32, 64, 128], 'padding': 1, 'pool_kernel': 2, 'dropout_rate': 0.1, 'fc_hidden_dim': 128, 'lr': 0.0025127565020152073, 'weight_decay': 9.605049737192033e-06, 'optimizer': 'adam', 'activation': <class 'torch.nn.modules.activation.LeakyReLU'>, 'batchnorm': True, 'epochs': 20, 'batch_size': 64, 'flip_prob': 0.0}. Best is trial 86 with value: 15.539556323098529.
[I 2025-06-30 22:32:40,444] Trial 89 pruned. 
[I 2025-06-30 22:33:09,411] Trial 90 finished with value: 17.03670330646187 and parameters: {'kernel_size': 3, 'channel_list': [16, 32, 64], 'padding': 1, 'pool_kernel': 2, 'dropout_rate': 0, 'fc_hidden_dim': 128, 'lr': 0.004262693399349929, 'weight_decay': 1.0680607693411807e-06, 'optimizer': 'sgd', 'activation': <class 'torch.nn.modules.activation.ReLU'>, 'batchnorm': True, 'epochs': 15, 'batch_size': 64, 'flip_prob': 0.0}. Best is trial 86 with value: 15.539556323098529.
[I 2025-06-30 22:34:22,680] Trial 91 finished with value: 16.133089932244992 and parameters: {'kernel_size': 3, 'channel_list': [16, 32, 64, 128], 'padding': 1, 'pool_kernel': 2, 'dropout_rate': 0.1, 'fc_hidden_dim': 128, 'lr': 0.007246368326718788, 'weight_decay': 4.272628108793605e-06, 'optimizer': 'adam', 'activation': <class 'torch.nn.modules.activation.ReLU'>, 'batchnorm': True, 'epochs': 30, 'batch_size': 64, 'flip_prob': 0.0}. Best is trial 86 with value: 15.539556323098529.
[I 2025-06-30 22:35:35,525] Trial 92 finished with value: 15.856690982620323 and parameters: {'kernel_size': 3, 'channel_list': [16, 32, 64, 128], 'padding': 1, 'pool_kernel': 2, 'dropout_rate': 0.1, 'fc_hidden_dim': 128, 'lr': 0.00910181502559333, 'weight_decay': 0.00018685170254460613, 'optimizer': 'adam', 'activation': <class 'torch.nn.modules.activation.ReLU'>, 'batchnorm': True, 'epochs': 30, 'batch_size': 64, 'flip_prob': 0.0}. Best is trial 86 with value: 15.539556323098529.
[I 2025-06-30 22:36:48,796] Trial 93 finished with value: 15.606621866329077 and parameters: {'kernel_size': 3, 'channel_list': [16, 32, 64, 128], 'padding': 1, 'pool_kernel': 2, 'dropout_rate': 0.1, 'fc_hidden_dim': 128, 'lr': 0.006663715804399303, 'weight_decay': 5.808500080712077e-06, 'optimizer': 'adam', 'activation': <class 'torch.nn.modules.activation.ReLU'>, 'batchnorm': True, 'epochs': 30, 'batch_size': 64, 'flip_prob': 0.0}. Best is trial 86 with value: 15.539556323098529.
[I 2025-06-30 22:38:02,225] Trial 94 finished with value: 16.071257758351003 and parameters: {'kernel_size': 3, 'channel_list': [16, 32, 64, 128], 'padding': 1, 'pool_kernel': 2, 'dropout_rate': 0.1, 'fc_hidden_dim': 128, 'lr': 0.005771585621154527, 'weight_decay': 7.090550372985746e-06, 'optimizer': 'adam', 'activation': <class 'torch.nn.modules.activation.ReLU'>, 'batchnorm': True, 'epochs': 30, 'batch_size': 64, 'flip_prob': 0.0}. Best is trial 86 with value: 15.539556323098529.
[I 2025-06-30 22:39:15,428] Trial 95 finished with value: 15.898210889648556 and parameters: {'kernel_size': 3, 'channel_list': [16, 32, 64, 128], 'padding': 1, 'pool_kernel': 2, 'dropout_rate': 0.1, 'fc_hidden_dim': 256, 'lr': 0.005146670905020662, 'weight_decay': 5.8352996179355975e-06, 'optimizer': 'adam', 'activation': <class 'torch.nn.modules.activation.ReLU'>, 'batchnorm': True, 'epochs': 30, 'batch_size': 64, 'flip_prob': 0.0}. Best is trial 86 with value: 15.539556323098529.
[I 2025-06-30 22:39:49,549] Trial 96 finished with value: 34.56913733256335 and parameters: {'kernel_size': 3, 'channel_list': [16, 32, 64, 128], 'padding': 1, 'pool_kernel': 2, 'dropout_rate': 0.1, 'fc_hidden_dim': 128, 'lr': 0.006636589316494446, 'weight_decay': 1.3071031644568177e-05, 'optimizer': 'adam', 'activation': <class 'torch.nn.modules.activation.LeakyReLU'>, 'batchnorm': True, 'epochs': 12, 'batch_size': 64, 'flip_prob': 1}. Best is trial 86 with value: 15.539556323098529.
[I 2025-06-30 22:41:04,001] Trial 97 finished with value: 17.022791105534136 and parameters: {'kernel_size': 3, 'channel_list': [32, 64, 128], 'padding': 1, 'pool_kernel': 2, 'dropout_rate': 0.1, 'fc_hidden_dim': 128, 'lr': 0.000280464637085572, 'weight_decay': 3.2432192560695292e-06, 'optimizer': 'adam', 'activation': <class 'torch.nn.modules.activation.ReLU'>, 'batchnorm': True, 'epochs': 20, 'batch_size': 64, 'flip_prob': 0.75}. Best is trial 86 with value: 15.539556323098529.
[I 2025-06-30 22:41:04,023] Trial 98 pruned. 
[I 2025-06-30 22:41:23,242] Trial 99 finished with value: 16.640694690241695 and parameters: {'kernel_size': 3, 'channel_list': [16, 32, 64, 128], 'padding': 1, 'pool_kernel': 2, 'dropout_rate': 0.5, 'fc_hidden_dim': 128, 'lr': 0.0005466929841350151, 'weight_decay': 8.67483269209998e-06, 'optimizer': 'adam', 'activation': <class 'torch.nn.modules.activation.LeakyReLU'>, 'batchnorm': True, 'epochs': 5, 'batch_size': 32, 'flip_prob': 0.0}. Best is trial 86 with value: 15.539556323098529.
[I 2025-06-30 22:41:23,261] Trial 100 pruned. 
[I 2025-06-30 22:42:38,644] Trial 101 finished with value: 15.980899783356122 and parameters: {'kernel_size': 3, 'channel_list': [16, 32, 64, 128], 'padding': 1, 'pool_kernel': 2, 'dropout_rate': 0.1, 'fc_hidden_dim': 128, 'lr': 0.006916333078182059, 'weight_decay': 3.914687951722817e-06, 'optimizer': 'adam', 'activation': <class 'torch.nn.modules.activation.ReLU'>, 'batchnorm': True, 'epochs': 30, 'batch_size': 64, 'flip_prob': 0.0}. Best is trial 86 with value: 15.539556323098529.
[I 2025-06-30 22:43:53,467] Trial 102 finished with value: 15.921017440092568 and parameters: {'kernel_size': 3, 'channel_list': [16, 32, 64, 128], 'padding': 1, 'pool_kernel': 2, 'dropout_rate': 0.1, 'fc_hidden_dim': 128, 'lr': 0.008713019480373304, 'weight_decay': 1.166764144440016e-05, 'optimizer': 'adam', 'activation': <class 'torch.nn.modules.activation.ReLU'>, 'batchnorm': True, 'epochs': 30, 'batch_size': 64, 'flip_prob': 0.0}. Best is trial 86 with value: 15.539556323098529.
[I 2025-06-30 22:45:07,977] Trial 103 finished with value: 16.007201198816066 and parameters: {'kernel_size': 3, 'channel_list': [16, 32, 64, 128], 'padding': 1, 'pool_kernel': 2, 'dropout_rate': 0.1, 'fc_hidden_dim': 128, 'lr': 0.006143222407070918, 'weight_decay': 1.7366874392041187e-06, 'optimizer': 'adam', 'activation': <class 'torch.nn.modules.activation.ReLU'>, 'batchnorm': True, 'epochs': 30, 'batch_size': 64, 'flip_prob': 0.0}. Best is trial 86 with value: 15.539556323098529.
[I 2025-06-30 22:46:00,021] Trial 104 finished with value: 15.68131463081083 and parameters: {'kernel_size': 3, 'channel_list': [16, 32, 64, 128], 'padding': 1, 'pool_kernel': 2, 'dropout_rate': 0.1, 'fc_hidden_dim': 128, 'lr': 0.005629095624987271, 'weight_decay': 4.641013111874353e-06, 'optimizer': 'adam', 'activation': <class 'torch.nn.modules.activation.ReLU'>, 'batchnorm': True, 'epochs': 20, 'batch_size': 64, 'flip_prob': 0.0}. Best is trial 86 with value: 15.539556323098529.
[I 2025-06-30 22:46:48,909] Trial 105 finished with value: 15.922245109810008 and parameters: {'kernel_size': 3, 'channel_list': [16, 32, 64, 128], 'padding': 1, 'pool_kernel': 2, 'dropout_rate': 0.1, 'fc_hidden_dim': 128, 'lr': 0.0030743568069899444, 'weight_decay': 2.7209835375631475e-06, 'optimizer': 'adam', 'activation': <class 'torch.nn.modules.activation.ReLU'>, 'batchnorm': True, 'epochs': 20, 'batch_size': 64, 'flip_prob': 0.0}. Best is trial 86 with value: 15.539556323098529.
[I 2025-06-30 22:47:41,422] Trial 106 finished with value: 16.36767067898329 and parameters: {'kernel_size': 3, 'channel_list': [16, 32, 64, 128], 'padding': 1, 'pool_kernel': 2, 'dropout_rate': 0, 'fc_hidden_dim': 128, 'lr': 0.0048384059290705285, 'weight_decay': 5.099740846562057e-06, 'optimizer': 'adam', 'activation': <class 'torch.nn.modules.activation.ReLU'>, 'batchnorm': True, 'epochs': 20, 'batch_size': 64, 'flip_prob': 0.5}. Best is trial 86 with value: 15.539556323098529.
[I 2025-06-30 22:48:29,505] Trial 107 finished with value: 15.738331386956485 and parameters: {'kernel_size': 3, 'channel_list': [16, 32, 64, 128], 'padding': 1, 'pool_kernel': 2, 'dropout_rate': 0.1, 'fc_hidden_dim': 64, 'lr': 0.003934834312458436, 'weight_decay': 3.5875859835024653e-06, 'optimizer': 'adam', 'activation': <class 'torch.nn.modules.activation.LeakyReLU'>, 'batchnorm': True, 'epochs': 20, 'batch_size': 64, 'flip_prob': 0.0}. Best is trial 86 with value: 15.539556323098529.
[I 2025-06-30 22:49:18,972] Trial 108 finished with value: 15.690085081229533 and parameters: {'kernel_size': 3, 'channel_list': [16, 32, 64, 128], 'padding': 1, 'pool_kernel': 2, 'dropout_rate': 0.1, 'fc_hidden_dim': 64, 'lr': 0.0040127715905958535, 'weight_decay': 3.7321557038879764e-06, 'optimizer': 'adam', 'activation': <class 'torch.nn.modules.activation.LeakyReLU'>, 'batchnorm': True, 'epochs': 20, 'batch_size': 64, 'flip_prob': 0.0}. Best is trial 86 with value: 15.539556323098529.
[I 2025-06-30 22:50:07,278] Trial 109 finished with value: 15.909590932815517 and parameters: {'kernel_size': 3, 'channel_list': [16, 32, 64, 128], 'padding': 1, 'pool_kernel': 2, 'dropout_rate': 0.1, 'fc_hidden_dim': 64, 'lr': 0.003285416476817827, 'weight_decay': 5.531811040357661e-06, 'optimizer': 'adam', 'activation': <class 'torch.nn.modules.activation.ReLU'>, 'batchnorm': True, 'epochs': 20, 'batch_size': 64, 'flip_prob': 0.0}. Best is trial 86 with value: 15.539556323098529.
[I 2025-06-30 22:50:07,299] Trial 110 pruned. 
[I 2025-06-30 22:50:55,999] Trial 111 finished with value: 15.669376653251636 and parameters: {'kernel_size': 3, 'channel_list': [16, 32, 64, 128], 'padding': 1, 'pool_kernel': 2, 'dropout_rate': 0.1, 'fc_hidden_dim': 64, 'lr': 0.0039170755985334805, 'weight_decay': 3.823991990256713e-06, 'optimizer': 'adam', 'activation': <class 'torch.nn.modules.activation.LeakyReLU'>, 'batchnorm': True, 'epochs': 20, 'batch_size': 64, 'flip_prob': 0.0}. Best is trial 86 with value: 15.539556323098529.
[I 2025-06-30 22:51:44,449] Trial 112 finished with value: 15.69530313441316 and parameters: {'kernel_size': 3, 'channel_list': [16, 32, 64, 128], 'padding': 1, 'pool_kernel': 2, 'dropout_rate': 0.1, 'fc_hidden_dim': 64, 'lr': 0.0035556055433925244, 'weight_decay': 7.0934745234365285e-06, 'optimizer': 'adam', 'activation': <class 'torch.nn.modules.activation.LeakyReLU'>, 'batchnorm': True, 'epochs': 20, 'batch_size': 64, 'flip_prob': 0.0}. Best is trial 86 with value: 15.539556323098529.
[I 2025-06-30 22:52:32,980] Trial 113 finished with value: 15.644071251943089 and parameters: {'kernel_size': 3, 'channel_list': [16, 32, 64, 128], 'padding': 1, 'pool_kernel': 2, 'dropout_rate': 0.1, 'fc_hidden_dim': 64, 'lr': 0.002774595339864859, 'weight_decay': 4.28074534645577e-06, 'optimizer': 'adam', 'activation': <class 'torch.nn.modules.activation.LeakyReLU'>, 'batchnorm': True, 'epochs': 20, 'batch_size': 64, 'flip_prob': 0.0}. Best is trial 86 with value: 15.539556323098529.
[I 2025-06-30 22:53:21,346] Trial 114 finished with value: 15.613625946680912 and parameters: {'kernel_size': 3, 'channel_list': [16, 32, 64, 128], 'padding': 1, 'pool_kernel': 2, 'dropout_rate': 0.1, 'fc_hidden_dim': 64, 'lr': 0.0028682951726747494, 'weight_decay': 2.28819604504223e-06, 'optimizer': 'adam', 'activation': <class 'torch.nn.modules.activation.LeakyReLU'>, 'batchnorm': True, 'epochs': 20, 'batch_size': 64, 'flip_prob': 0.0}. Best is trial 86 with value: 15.539556323098529.
