[I 2025-07-01 02:51:57,709] Trial 423 finished with value: 15.756426251297022 and parameters: {'kernel_size': 3, 'channel_list': [16, 32, 64, 128], 'padding': 1, 'pool_kernel': 2, 'dropout_rate': 0.1, 'fc_hidden_dim': 64, 'lr': 0.004493183811433783, 'weight_decay': 8.04314990342996e-06, 'optimizer': 'adam', 'activation': <class 'torch.nn.modules.activation.ReLU'>, 'batchnorm': True, 'epochs': 20, 'batch_size': 128, 'flip_prob': 0.0}. Best is trial 121 with value: 15.493945159799877.
[I 2025-07-01 02:52:33,375] Trial 424 finished with value: 15.747657668009893 and parameters: {'kernel_size': 3, 'channel_list': [16, 32, 64, 128], 'padding': 1, 'pool_kernel': 2, 'dropout_rate': 0, 'fc_hidden_dim': 128, 'lr': 0.004779209003118202, 'weight_decay': 4.958440688368508e-06, 'optimizer': 'adam', 'activation': <class 'torch.nn.modules.activation.LeakyReLU'>, 'batchnorm': True, 'epochs': 20, 'batch_size': 128, 'flip_prob': 0.0}. Best is trial 121 with value: 15.493945159799877.
[I 2025-07-01 02:53:13,183] Trial 425 finished with value: 16.56959571476737 and parameters: {'kernel_size': 3, 'channel_list': [16, 32, 64, 128], 'padding': 1, 'pool_kernel': 2, 'dropout_rate': 0.1, 'fc_hidden_dim': 64, 'lr': 0.003490577437580249, 'weight_decay': 7.453316265664098e-06, 'optimizer': 'adam', 'activation': <class 'torch.nn.modules.activation.LeakyReLU'>, 'batchnorm': True, 'epochs': 20, 'batch_size': 128, 'flip_prob': 0.75}. Best is trial 121 with value: 15.493945159799877.
[I 2025-07-01 02:53:47,755] Trial 426 finished with value: 16.078134854115003 and parameters: {'kernel_size': 3, 'channel_list': [16, 32, 64, 128], 'padding': 1, 'pool_kernel': 2, 'dropout_rate': 0, 'fc_hidden_dim': 128, 'lr': 0.003056600152821704, 'weight_decay': 0.0002073080318024795, 'optimizer': 'adam', 'activation': <class 'torch.nn.modules.activation.LeakyReLU'>, 'batchnorm': True, 'epochs': 20, 'batch_size': 128, 'flip_prob': 0.0}. Best is trial 121 with value: 15.493945159799877.
[I 2025-07-01 02:53:47,793] Trial 427 pruned. 
[I 2025-07-01 02:54:22,631] Trial 428 finished with value: 27.923634898549555 and parameters: {'kernel_size': 3, 'channel_list': [16, 32, 64], 'padding': 1, 'pool_kernel': 2, 'dropout_rate': 0.5, 'fc_hidden_dim': 64, 'lr': 0.0013153380853524064, 'weight_decay': 4.199735000910144e-05, 'optimizer': 'adam', 'activation': <class 'torch.nn.modules.activation.LeakyReLU'>, 'batchnorm': True, 'epochs': 20, 'batch_size': 128, 'flip_prob': 1}. Best is trial 121 with value: 15.493945159799877.
[I 2025-07-01 02:55:08,458] Trial 429 finished with value: inf and parameters: {'kernel_size': 3, 'channel_list': [16, 32, 64, 128], 'padding': 1, 'pool_kernel': 2, 'dropout_rate': 0.1, 'fc_hidden_dim': 256, 'lr': 0.0049486159360722795, 'weight_decay': 6.029073353787278e-06, 'optimizer': 'sgd', 'activation': <class 'torch.nn.modules.activation.LeakyReLU'>, 'batchnorm': True, 'epochs': 20, 'batch_size': 64, 'flip_prob': 0.0}. Best is trial 121 with value: 15.493945159799877.
[I 2025-07-01 02:55:56,897] Trial 430 finished with value: 15.849912153657412 and parameters: {'kernel_size': 3, 'channel_list': [16, 32, 64, 128], 'padding': 1, 'pool_kernel': 2, 'dropout_rate': 0, 'fc_hidden_dim': 128, 'lr': 0.0033230573331574534, 'weight_decay': 4.725575183110811e-06, 'optimizer': 'adam', 'activation': <class 'torch.nn.modules.activation.LeakyReLU'>, 'batchnorm': True, 'epochs': 20, 'batch_size': 64, 'flip_prob': 0.0}. Best is trial 121 with value: 15.493945159799877.
[I 2025-07-01 02:56:45,798] Trial 431 finished with value: 15.826845569367423 and parameters: {'kernel_size': 3, 'channel_list': [16, 32, 64, 128], 'padding': 1, 'pool_kernel': 2, 'dropout_rate': 0.1, 'fc_hidden_dim': 128, 'lr': 0.0016659114536228422, 'weight_decay': 6.203762133837378e-06, 'optimizer': 'adam', 'activation': <class 'torch.nn.modules.activation.ReLU'>, 'batchnorm': True, 'epochs': 20, 'batch_size': 64, 'flip_prob': 0.0}. Best is trial 121 with value: 15.493945159799877.
[I 2025-07-01 02:57:21,963] Trial 432 finished with value: 15.779725988537082 and parameters: {'kernel_size': 3, 'channel_list': [16, 32, 64, 128], 'padding': 1, 'pool_kernel': 2, 'dropout_rate': 0, 'fc_hidden_dim': 64, 'lr': 0.0040059092714954695, 'weight_decay': 8.955652351747262e-06, 'optimizer': 'adam', 'activation': <class 'torch.nn.modules.activation.LeakyReLU'>, 'batchnorm': True, 'epochs': 15, 'batch_size': 64, 'flip_prob': 0.0}. Best is trial 121 with value: 15.493945159799877.
[I 2025-07-01 02:58:11,019] Trial 433 finished with value: 15.518504290535544 and parameters: {'kernel_size': 3, 'channel_list': [16, 32, 64, 128], 'padding': 1, 'pool_kernel': 2, 'dropout_rate': 0.1, 'fc_hidden_dim': 128, 'lr': 0.002637445115504491, 'weight_decay': 1.2280067210759948e-06, 'optimizer': 'adam', 'activation': <class 'torch.nn.modules.activation.LeakyReLU'>, 'batchnorm': True, 'epochs': 20, 'batch_size': 64, 'flip_prob': 0.0}. Best is trial 121 with value: 15.493945159799877.
[I 2025-07-01 02:58:11,060] Trial 434 pruned. 
[I 2025-07-01 02:58:53,572] Trial 435 finished with value: 16.742719331337916 and parameters: {'kernel_size': 3, 'channel_list': [16, 32, 64, 128], 'padding': 1, 'pool_kernel': 2, 'dropout_rate': 0, 'fc_hidden_dim': 128, 'lr': 0.002793442924632059, 'weight_decay': 1.2110801018771812e-06, 'optimizer': 'adam', 'activation': <class 'torch.nn.modules.activation.LeakyReLU'>, 'batchnorm': False, 'epochs': 20, 'batch_size': 64, 'flip_prob': 0.0}. Best is trial 121 with value: 15.493945159799877.
[I 2025-07-01 02:58:53,609] Trial 436 pruned. 
[I 2025-07-01 03:00:09,151] Trial 437 finished with value: 15.777423503236001 and parameters: {'kernel_size': 3, 'channel_list': [16, 32, 64, 128], 'padding': 1, 'pool_kernel': 2, 'dropout_rate': 0.1, 'fc_hidden_dim': 128, 'lr': 0.0025138007371395318, 'weight_decay': 1.020290689925095e-06, 'optimizer': 'adam', 'activation': <class 'torch.nn.modules.activation.LeakyReLU'>, 'batchnorm': True, 'epochs': 20, 'batch_size': 32, 'flip_prob': 0.0}. Best is trial 121 with value: 15.493945159799877.
[I 2025-07-01 03:00:47,656] Trial 438 finished with value: 16.431343571506087 and parameters: {'kernel_size': 3, 'channel_list': [32, 64, 128], 'padding': 1, 'pool_kernel': 2, 'dropout_rate': 0, 'fc_hidden_dim': 128, 'lr': 0.0029752622533007244, 'weight_decay': 1.6284575428142592e-06, 'optimizer': 'adam', 'activation': <class 'torch.nn.modules.activation.LeakyReLU'>, 'batchnorm': True, 'epochs': 12, 'batch_size': 64, 'flip_prob': 0.5}. Best is trial 121 with value: 15.493945159799877.
[I 2025-07-01 03:01:38,005] Trial 439 finished with value: 15.826791878656921 and parameters: {'kernel_size': 3, 'channel_list': [16, 32, 64, 128], 'padding': 1, 'pool_kernel': 2, 'dropout_rate': 0.1, 'fc_hidden_dim': 128, 'lr': 0.0007903512294118975, 'weight_decay': 4.103674469561947e-06, 'optimizer': 'adam', 'activation': <class 'torch.nn.modules.activation.LeakyReLU'>, 'batchnorm': True, 'epochs': 20, 'batch_size': 64, 'flip_prob': 0.0}. Best is trial 121 with value: 15.493945159799877.
[I 2025-07-01 03:01:38,042] Trial 440 pruned. 
[I 2025-07-01 03:02:27,682] Trial 441 finished with value: 15.84444482827662 and parameters: {'kernel_size': 3, 'channel_list': [16, 32, 64, 128], 'padding': 1, 'pool_kernel': 2, 'dropout_rate': 0.1, 'fc_hidden_dim': 128, 'lr': 0.0021851532005789155, 'weight_decay': 1.1230352021795234e-06, 'optimizer': 'adam', 'activation': <class 'torch.nn.modules.activation.ReLU'>, 'batchnorm': True, 'epochs': 20, 'batch_size': 64, 'flip_prob': 0.0}. Best is trial 121 with value: 15.493945159799877.
[I 2025-07-01 03:02:40,594] Trial 442 finished with value: 16.788654062708204 and parameters: {'kernel_size': 3, 'channel_list': [16, 32, 64, 128], 'padding': 1, 'pool_kernel': 2, 'dropout_rate': 0.5, 'fc_hidden_dim': 128, 'lr': 0.003232606806813428, 'weight_decay': 0.001856122145681617, 'optimizer': 'adam', 'activation': <class 'torch.nn.modules.activation.LeakyReLU'>, 'batchnorm': True, 'epochs': 5, 'batch_size': 64, 'flip_prob': 0.0}. Best is trial 121 with value: 15.493945159799877.
[I 2025-07-01 03:03:17,810] Trial 443 finished with value: 15.882025742694497 and parameters: {'kernel_size': 3, 'channel_list': [16, 32, 64, 128], 'padding': 1, 'pool_kernel': 2, 'dropout_rate': 0.1, 'fc_hidden_dim': 128, 'lr': 0.003667980348601803, 'weight_decay': 0.0003129570108610908, 'optimizer': 'adam', 'activation': <class 'torch.nn.modules.activation.LeakyReLU'>, 'batchnorm': True, 'epochs': 20, 'batch_size': 128, 'flip_prob': 0.25}. Best is trial 121 with value: 15.493945159799877.
[I 2025-07-01 03:04:19,820] Trial 444 finished with value: 15.65089259844428 and parameters: {'kernel_size': 3, 'channel_list': [16, 32, 64, 128], 'padding': 1, 'pool_kernel': 2, 'dropout_rate': 0, 'fc_hidden_dim': 128, 'lr': 0.003093500258670909, 'weight_decay': 1.6977049965507901e-06, 'optimizer': 'adam', 'activation': <class 'torch.nn.modules.activation.LeakyReLU'>, 'batchnorm': True, 'epochs': 25, 'batch_size': 64, 'flip_prob': 0.0}. Best is trial 121 with value: 15.493945159799877.
[I 2025-07-01 03:05:21,230] Trial 445 finished with value: 15.956782731015373 and parameters: {'kernel_size': 3, 'channel_list': [16, 32, 64, 128], 'padding': 1, 'pool_kernel': 2, 'dropout_rate': 0.1, 'fc_hidden_dim': 128, 'lr': 0.003063235451308494, 'weight_decay': 1.822167772519283e-06, 'optimizer': 'adam', 'activation': <class 'torch.nn.modules.activation.LeakyReLU'>, 'batchnorm': True, 'epochs': 25, 'batch_size': 64, 'flip_prob': 0.0}. Best is trial 121 with value: 15.493945159799877.
[I 2025-07-01 03:06:22,361] Trial 446 finished with value: 15.840152402842268 and parameters: {'kernel_size': 3, 'channel_list': [16, 32, 64, 128], 'padding': 1, 'pool_kernel': 2, 'dropout_rate': 0, 'fc_hidden_dim': 128, 'lr': 0.0028964151329792702, 'weight_decay': 5.197786997797065e-06, 'optimizer': 'adam', 'activation': <class 'torch.nn.modules.activation.LeakyReLU'>, 'batchnorm': True, 'epochs': 25, 'batch_size': 64, 'flip_prob': 0.0}. Best is trial 121 with value: 15.493945159799877.
[I 2025-07-01 03:07:23,555] Trial 447 finished with value: 15.715153460020955 and parameters: {'kernel_size': 3, 'channel_list': [16, 32, 64, 128], 'padding': 1, 'pool_kernel': 2, 'dropout_rate': 0.1, 'fc_hidden_dim': 256, 'lr': 0.003352777178059867, 'weight_decay': 2.4029705352033845e-06, 'optimizer': 'adam', 'activation': <class 'torch.nn.modules.activation.LeakyReLU'>, 'batchnorm': True, 'epochs': 25, 'batch_size': 64, 'flip_prob': 0.0}. Best is trial 121 with value: 15.493945159799877.
[I 2025-07-01 03:07:23,593] Trial 448 pruned. 
[I 2025-07-01 03:08:23,778] Trial 449 finished with value: 16.890310131283748 and parameters: {'kernel_size': 3, 'channel_list': [16, 32, 64, 128], 'padding': 1, 'pool_kernel': 2, 'dropout_rate': 0, 'fc_hidden_dim': 128, 'lr': 0.00010400808754370597, 'weight_decay': 2.067432833552971e-06, 'optimizer': 'adam', 'activation': <class 'torch.nn.modules.activation.LeakyReLU'>, 'batchnorm': True, 'epochs': 25, 'batch_size': 64, 'flip_prob': 0.0}. Best is trial 121 with value: 15.493945159799877.
[I 2025-07-01 03:09:19,961] Trial 450 finished with value: 15.704195100211287 and parameters: {'kernel_size': 3, 'channel_list': [16, 32, 64, 128], 'padding': 1, 'pool_kernel': 2, 'dropout_rate': 0.1, 'fc_hidden_dim': 128, 'lr': 0.0030851480658822877, 'weight_decay': 3.902266288180303e-06, 'optimizer': 'sgd', 'activation': <class 'torch.nn.modules.activation.LeakyReLU'>, 'batchnorm': True, 'epochs': 25, 'batch_size': 64, 'flip_prob': 0.0}. Best is trial 121 with value: 15.493945159799877.
[I 2025-07-01 03:10:19,440] Trial 451 finished with value: 15.6148816174485 and parameters: {'kernel_size': 3, 'channel_list': [32, 64, 128], 'padding': 1, 'pool_kernel': 2, 'dropout_rate': 0, 'fc_hidden_dim': 128, 'lr': 0.0036883173464140775, 'weight_decay': 6.997734331288216e-06, 'optimizer': 'adam', 'activation': <class 'torch.nn.modules.activation.LeakyReLU'>, 'batchnorm': True, 'epochs': 25, 'batch_size': 128, 'flip_prob': 0.0}. Best is trial 121 with value: 15.493945159799877.
[I 2025-07-01 03:11:59,767] Trial 452 finished with value: 16.431893388599146 and parameters: {'kernel_size': 3, 'channel_list': [32, 64, 128], 'padding': 1, 'pool_kernel': 2, 'dropout_rate': 0, 'fc_hidden_dim': 128, 'lr': 0.003714114560532583, 'weight_decay': 7.036195309031328e-06, 'optimizer': 'adam', 'activation': <class 'torch.nn.modules.activation.LeakyReLU'>, 'batchnorm': True, 'epochs': 25, 'batch_size': 128, 'flip_prob': 0.75}. Best is trial 121 with value: 15.493945159799877.
[I 2025-07-01 03:12:42,945] Trial 453 finished with value: 15.92084512963097 and parameters: {'kernel_size': 3, 'channel_list': [16, 32, 64, 128], 'padding': 1, 'pool_kernel': 2, 'dropout_rate': 0, 'fc_hidden_dim': 128, 'lr': 0.003366642786826907, 'weight_decay': 8.753863525686457e-06, 'optimizer': 'adam', 'activation': <class 'torch.nn.modules.activation.LeakyReLU'>, 'batchnorm': True, 'epochs': 25, 'batch_size': 128, 'flip_prob': 0.0}. Best is trial 121 with value: 15.493945159799877.
[I 2025-07-01 03:14:16,908] Trial 454 finished with value: 15.767181870671571 and parameters: {'kernel_size': 3, 'channel_list': [32, 64, 128], 'padding': 1, 'pool_kernel': 2, 'dropout_rate': 0, 'fc_hidden_dim': 128, 'lr': 0.0038132947311292397, 'weight_decay': 6.372969428604124e-06, 'optimizer': 'adam', 'activation': <class 'torch.nn.modules.activation.LeakyReLU'>, 'batchnorm': True, 'epochs': 25, 'batch_size': 128, 'flip_prob': 0.0}. Best is trial 121 with value: 15.493945159799877.
[I 2025-07-01 03:15:28,853] Trial 455 finished with value: 16.488851512324075 and parameters: {'kernel_size': 3, 'channel_list': [32, 64, 128], 'padding': 1, 'pool_kernel': 2, 'dropout_rate': 0, 'fc_hidden_dim': 128, 'lr': 0.0036340415648324215, 'weight_decay': 7.203782226353551e-06, 'optimizer': 'adam', 'activation': <class 'torch.nn.modules.activation.LeakyReLU'>, 'batchnorm': False, 'epochs': 25, 'batch_size': 128, 'flip_prob': 0.0}. Best is trial 121 with value: 15.493945159799877.
[I 2025-07-01 03:16:01,850] Trial 456 finished with value: 16.423341075202615 and parameters: {'kernel_size': 3, 'channel_list': [16, 32, 64], 'padding': 0, 'pool_kernel': 2, 'dropout_rate': 0, 'fc_hidden_dim': 256, 'lr': 0.004108973624534813, 'weight_decay': 1.085932217718958e-05, 'optimizer': 'adam', 'activation': <class 'torch.nn.modules.activation.LeakyReLU'>, 'batchnorm': True, 'epochs': 25, 'batch_size': 128, 'flip_prob': 0.0}. Best is trial 121 with value: 15.493945159799877.
[I 2025-07-01 03:16:01,889] Trial 457 pruned. 
[I 2025-07-01 03:17:43,349] Trial 458 finished with value: 26.777110075163428 and parameters: {'kernel_size': 3, 'channel_list': [32, 64, 128], 'padding': 1, 'pool_kernel': 2, 'dropout_rate': 0, 'fc_hidden_dim': 128, 'lr': 0.0024967737438668625, 'weight_decay': 9.868147797593777e-06, 'optimizer': 'adam', 'activation': <class 'torch.nn.modules.activation.LeakyReLU'>, 'batchnorm': True, 'epochs': 25, 'batch_size': 128, 'flip_prob': 1}. Best is trial 121 with value: 15.493945159799877.
[I 2025-07-01 03:18:42,607] Trial 459 finished with value: 15.962223331068575 and parameters: {'kernel_size': 3, 'channel_list': [32, 64, 128], 'padding': 1, 'pool_kernel': 2, 'dropout_rate': 0, 'fc_hidden_dim': 128, 'lr': 0.0028225553816937626, 'weight_decay': 7.783166533982974e-06, 'optimizer': 'adam', 'activation': <class 'torch.nn.modules.activation.LeakyReLU'>, 'batchnorm': True, 'epochs': 15, 'batch_size': 128, 'flip_prob': 0.0}. Best is trial 121 with value: 15.493945159799877.
[I 2025-07-01 03:18:42,647] Trial 460 pruned. 
[I 2025-07-01 03:20:21,416] Trial 461 finished with value: 15.689433255278233 and parameters: {'kernel_size': 3, 'channel_list': [32, 64, 128], 'padding': 1, 'pool_kernel': 2, 'dropout_rate': 0.5, 'fc_hidden_dim': 128, 'lr': 0.0023337782607633834, 'weight_decay': 1.6262048963332435e-06, 'optimizer': 'adam', 'activation': <class 'torch.nn.modules.activation.LeakyReLU'>, 'batchnorm': True, 'epochs': 25, 'batch_size': 128, 'flip_prob': 0.0}. Best is trial 121 with value: 15.493945159799877.
[I 2025-07-01 03:21:37,843] Trial 462 finished with value: 15.913448130472613 and parameters: {'kernel_size': 3, 'channel_list': [32, 64, 128], 'padding': 1, 'pool_kernel': 2, 'dropout_rate': 0, 'fc_hidden_dim': 64, 'lr': 0.004143517794316744, 'weight_decay': 4.511224696626266e-06, 'optimizer': 'adam', 'activation': <class 'torch.nn.modules.activation.LeakyReLU'>, 'batchnorm': True, 'epochs': 25, 'batch_size': 64, 'flip_prob': 0.0}. Best is trial 121 with value: 15.493945159799877.
[I 2025-07-01 03:22:23,220] Trial 463 finished with value: 15.969188845753864 and parameters: {'kernel_size': 3, 'channel_list': [16, 32, 64, 128], 'padding': 1, 'pool_kernel': 2, 'dropout_rate': 0, 'fc_hidden_dim': 128, 'lr': 0.0030579256725487866, 'weight_decay': 1.7437699622395316e-06, 'optimizer': 'adam', 'activation': <class 'torch.nn.modules.activation.LeakyReLU'>, 'batchnorm': True, 'epochs': 12, 'batch_size': 32, 'flip_prob': 0.0}. Best is trial 121 with value: 15.493945159799877.
[I 2025-07-01 03:23:39,593] Trial 464 finished with value: 16.058844708196087 and parameters: {'kernel_size': 3, 'channel_list': [32, 64, 128], 'padding': 1, 'pool_kernel': 2, 'dropout_rate': 0, 'fc_hidden_dim': 128, 'lr': 0.0039027531787965194, 'weight_decay': 5.259298618541297e-06, 'optimizer': 'adam', 'activation': <class 'torch.nn.modules.activation.LeakyReLU'>, 'batchnorm': True, 'epochs': 25, 'batch_size': 64, 'flip_prob': 0.0}. Best is trial 121 with value: 15.493945159799877.
[I 2025-07-01 03:24:18,506] Trial 465 finished with value: 16.105376693772975 and parameters: {'kernel_size': 3, 'channel_list': [16, 32, 64, 128], 'padding': 1, 'pool_kernel': 2, 'dropout_rate': 0, 'fc_hidden_dim': 64, 'lr': 0.002704838546113549, 'weight_decay': 1.3225819616255412e-06, 'optimizer': 'adam', 'activation': <class 'torch.nn.modules.activation.LeakyReLU'>, 'batchnorm': True, 'epochs': 20, 'batch_size': 128, 'flip_prob': 0.5}. Best is trial 121 with value: 15.493945159799877.
[I 2025-07-01 03:25:08,532] Trial 466 finished with value: 15.822672786880997 and parameters: {'kernel_size': 3, 'channel_list': [16, 32, 64, 128], 'padding': 1, 'pool_kernel': 2, 'dropout_rate': 0, 'fc_hidden_dim': 128, 'lr': 0.0031241739994330242, 'weight_decay': 8.092749550583395e-06, 'optimizer': 'adam', 'activation': <class 'torch.nn.modules.activation.LeakyReLU'>, 'batchnorm': True, 'epochs': 20, 'batch_size': 64, 'flip_prob': 0.0}. Best is trial 121 with value: 15.493945159799877.
[I 2025-07-01 03:25:21,562] Trial 467 finished with value: 16.105896554456187 and parameters: {'kernel_size': 3, 'channel_list': [16, 32, 64, 128], 'padding': 1, 'pool_kernel': 2, 'dropout_rate': 0.5, 'fc_hidden_dim': 256, 'lr': 0.003425278532964863, 'weight_decay': 2.099994392235074e-06, 'optimizer': 'adam', 'activation': <class 'torch.nn.modules.activation.LeakyReLU'>, 'batchnorm': True, 'epochs': 5, 'batch_size': 64, 'flip_prob': 0.0}. Best is trial 121 with value: 15.493945159799877.
