[I 2025-08-04 19:00:37,259] Trial 342 finished with value: 2.7217399946311702 and parameters: {'channels_list': [16, 32, 64], 'kernel_size': 3, 'padding': 1, 'pool_kernel': 2, 'dropout_rate': 0, 'fc_hidden_dim': 256, 'lr': 0.0008690815998053582, 'weight_decay': 8.29029283855462e-06, 'optimizer': 'rmsprop', 'activation': <class 'torch.nn.modules.activation.LeakyReLU'>, 'batchnorm': True, 'epochs': 35, 'batch_size': 32, 'flip_prob': 0.0}. Best is trial 269 with value: 2.690232738856096.
[I 2025-08-04 19:01:05,386] Trial 343 finished with value: 2.737606234717283 and parameters: {'channels_list': [16, 32, 64], 'kernel_size': 3, 'padding': 1, 'pool_kernel': 2, 'dropout_rate': 0, 'fc_hidden_dim': 256, 'lr': 0.001374058847082407, 'weight_decay': 6.354869765018644e-06, 'optimizer': 'rmsprop', 'activation': <class 'torch.nn.modules.activation.LeakyReLU'>, 'batchnorm': True, 'epochs': 35, 'batch_size': 64, 'flip_prob': 0.0}. Best is trial 269 with value: 2.690232738856096.
[I 2025-08-04 19:01:52,829] Trial 344 finished with value: 2.7157137206437647 and parameters: {'channels_list': [16, 32, 64], 'kernel_size': 3, 'padding': 1, 'pool_kernel': 2, 'dropout_rate': 0, 'fc_hidden_dim': 256, 'lr': 0.0010625133887309924, 'weight_decay': 5.036275949410495e-06, 'optimizer': 'rmsprop', 'activation': <class 'torch.nn.modules.activation.LeakyReLU'>, 'batchnorm': True, 'epochs': 35, 'batch_size': 32, 'flip_prob': 0.0}. Best is trial 269 with value: 2.690232738856096.
[I 2025-08-04 19:03:09,804] Trial 345 finished with value: 2.7934137435816453 and parameters: {'channels_list': [16, 32, 64], 'kernel_size': 3, 'padding': 0, 'pool_kernel': 2, 'dropout_rate': 0, 'fc_hidden_dim': 256, 'lr': 0.0010313173013707917, 'weight_decay': 1.0910142742258698e-05, 'optimizer': 'rmsprop', 'activation': <class 'torch.nn.modules.activation.LeakyReLU'>, 'batchnorm': True, 'epochs': 35, 'batch_size': 32, 'flip_prob': 0.0}. Best is trial 269 with value: 2.690232738856096.
[I 2025-08-04 19:04:17,882] Trial 346 finished with value: 2.709338190874806 and parameters: {'channels_list': [16, 32, 64], 'kernel_size': 3, 'padding': 1, 'pool_kernel': 2, 'dropout_rate': 0, 'fc_hidden_dim': 256, 'lr': 0.00107285923203559, 'weight_decay': 6.653994249517551e-06, 'optimizer': 'rmsprop', 'activation': <class 'torch.nn.modules.activation.LeakyReLU'>, 'batchnorm': True, 'epochs': 35, 'batch_size': 32, 'flip_prob': 0.0}. Best is trial 269 with value: 2.690232738856096.
[I 2025-08-04 19:05:37,554] Trial 347 finished with value: 2.7206923186275724 and parameters: {'channels_list': [16, 32, 64], 'kernel_size': 3, 'padding': 1, 'pool_kernel': 2, 'dropout_rate': 0, 'fc_hidden_dim': 256, 'lr': 0.0009455658932860222, 'weight_decay': 6.204925381395172e-06, 'optimizer': 'rmsprop', 'activation': <class 'torch.nn.modules.activation.LeakyReLU'>, 'batchnorm': True, 'epochs': 35, 'batch_size': 32, 'flip_prob': 0.0}. Best is trial 269 with value: 2.690232738856096.
[I 2025-08-04 19:05:37,579] Trial 348 pruned. 
[I 2025-08-04 19:06:49,282] Trial 349 finished with value: 2.7138746734982666 and parameters: {'channels_list': [16, 32, 64], 'kernel_size': 3, 'padding': 1, 'pool_kernel': 2, 'dropout_rate': 0, 'fc_hidden_dim': 256, 'lr': 0.0008617887753012902, 'weight_decay': 5.248783388292373e-06, 'optimizer': 'rmsprop', 'activation': <class 'torch.nn.modules.activation.LeakyReLU'>, 'batchnorm': True, 'epochs': 35, 'batch_size': 32, 'flip_prob': 0.0}. Best is trial 269 with value: 2.690232738856096.
[I 2025-08-04 19:07:47,429] Trial 350 finished with value: 2.711326541198896 and parameters: {'channels_list': [16, 32, 64], 'kernel_size': 3, 'padding': 1, 'pool_kernel': 2, 'dropout_rate': 0, 'fc_hidden_dim': 256, 'lr': 0.0007862120265659277, 'weight_decay': 5.181684562588967e-06, 'optimizer': 'rmsprop', 'activation': <class 'torch.nn.modules.activation.LeakyReLU'>, 'batchnorm': True, 'epochs': 35, 'batch_size': 32, 'flip_prob': 0.0}. Best is trial 269 with value: 2.690232738856096.
[I 2025-08-04 19:08:59,162] Trial 351 finished with value: 2.7163904402310655 and parameters: {'channels_list': [16, 32, 64], 'kernel_size': 3, 'padding': 1, 'pool_kernel': 2, 'dropout_rate': 0, 'fc_hidden_dim': 256, 'lr': 0.0007733052445220042, 'weight_decay': 5.068740045506516e-06, 'optimizer': 'rmsprop', 'activation': <class 'torch.nn.modules.activation.LeakyReLU'>, 'batchnorm': True, 'epochs': 35, 'batch_size': 32, 'flip_prob': 0.0}. Best is trial 269 with value: 2.690232738856096.
[I 2025-08-04 19:09:41,054] Trial 352 finished with value: 2.7708897660235876 and parameters: {'channels_list': [16, 32, 64], 'kernel_size': 3, 'padding': 1, 'pool_kernel': 2, 'dropout_rate': 0, 'fc_hidden_dim': 256, 'lr': 0.0008483853820900522, 'weight_decay': 5.671653924344983e-06, 'optimizer': 'rmsprop', 'activation': <class 'torch.nn.modules.activation.LeakyReLU'>, 'batchnorm': True, 'epochs': 35, 'batch_size': 32, 'flip_prob': 0.0}. Best is trial 269 with value: 2.690232738856096.
[I 2025-08-04 19:10:22,916] Trial 353 finished with value: 2.7353940812468673 and parameters: {'channels_list': [16, 32, 64], 'kernel_size': 3, 'padding': 1, 'pool_kernel': 2, 'dropout_rate': 0, 'fc_hidden_dim': 256, 'lr': 0.0008656953726496859, 'weight_decay': 8.74161373879923e-06, 'optimizer': 'rmsprop', 'activation': <class 'torch.nn.modules.activation.LeakyReLU'>, 'batchnorm': True, 'epochs': 35, 'batch_size': 32, 'flip_prob': 0.0}. Best is trial 269 with value: 2.690232738856096.
[I 2025-08-04 19:10:56,643] Trial 354 finished with value: 2.742857350428803 and parameters: {'channels_list': [16, 32, 64], 'kernel_size': 3, 'padding': 1, 'pool_kernel': 2, 'dropout_rate': 0, 'fc_hidden_dim': 256, 'lr': 0.0008055611022123864, 'weight_decay': 3.714405722711381e-06, 'optimizer': 'rmsprop', 'activation': <class 'torch.nn.modules.activation.LeakyReLU'>, 'batchnorm': True, 'epochs': 35, 'batch_size': 32, 'flip_prob': 0.0}. Best is trial 269 with value: 2.690232738856096.
[I 2025-08-04 19:12:08,727] Trial 355 finished with value: 2.779834211289667 and parameters: {'channels_list': [16, 32, 64], 'kernel_size': 3, 'padding': 1, 'pool_kernel': 2, 'dropout_rate': 0, 'fc_hidden_dim': 256, 'lr': 0.00011285625241057944, 'weight_decay': 6.749365241299754e-06, 'optimizer': 'rmsprop', 'activation': <class 'torch.nn.modules.activation.LeakyReLU'>, 'batchnorm': True, 'epochs': 35, 'batch_size': 32, 'flip_prob': 0.0}. Best is trial 269 with value: 2.690232738856096.
[I 2025-08-04 19:12:50,608] Trial 356 finished with value: 2.725325891738634 and parameters: {'channels_list': [16, 32, 64], 'kernel_size': 3, 'padding': 1, 'pool_kernel': 2, 'dropout_rate': 0, 'fc_hidden_dim': 256, 'lr': 0.000915881532621762, 'weight_decay': 5.31807285263914e-06, 'optimizer': 'rmsprop', 'activation': <class 'torch.nn.modules.activation.LeakyReLU'>, 'batchnorm': True, 'epochs': 35, 'batch_size': 64, 'flip_prob': 0.0}. Best is trial 269 with value: 2.690232738856096.
[I 2025-08-04 19:13:19,147] Trial 357 finished with value: 2.7843144424286623 and parameters: {'channels_list': [16, 32, 64], 'kernel_size': 3, 'padding': 1, 'pool_kernel': 2, 'dropout_rate': 0, 'fc_hidden_dim': 64, 'lr': 0.00103061422404969, 'weight_decay': 1.0690548138119678e-05, 'optimizer': 'rmsprop', 'activation': <class 'torch.nn.modules.activation.LeakyReLU'>, 'batchnorm': True, 'epochs': 35, 'batch_size': 32, 'flip_prob': 0.0}. Best is trial 269 with value: 2.690232738856096.
[I 2025-08-04 19:14:01,375] Trial 358 finished with value: 2.7314374751722568 and parameters: {'channels_list': [16, 32, 64], 'kernel_size': 3, 'padding': 1, 'pool_kernel': 2, 'dropout_rate': 0, 'fc_hidden_dim': 256, 'lr': 0.0007460727521584003, 'weight_decay': 1.4162471253906113e-05, 'optimizer': 'rmsprop', 'activation': <class 'torch.nn.modules.activation.LeakyReLU'>, 'batchnorm': True, 'epochs': 35, 'batch_size': 32, 'flip_prob': 0.0}. Best is trial 269 with value: 2.690232738856096.
[I 2025-08-04 19:14:01,402] Trial 359 pruned. 
[I 2025-08-04 19:15:06,110] Trial 360 finished with value: 2.749526546199877 and parameters: {'channels_list': [16, 32, 64], 'kernel_size': 5, 'padding': 1, 'pool_kernel': 2, 'dropout_rate': 0, 'fc_hidden_dim': 128, 'lr': 0.000992394699930501, 'weight_decay': 6.864209886082845e-06, 'optimizer': 'rmsprop', 'activation': <class 'torch.nn.modules.activation.LeakyReLU'>, 'batchnorm': True, 'epochs': 35, 'batch_size': 32, 'flip_prob': 0.0}. Best is trial 269 with value: 2.690232738856096.
[I 2025-08-04 19:16:24,960] Trial 361 finished with value: 2.731540816425558 and parameters: {'channels_list': [16, 32, 64], 'kernel_size': 3, 'padding': 1, 'pool_kernel': 2, 'dropout_rate': 0, 'fc_hidden_dim': 256, 'lr': 0.000683345756624734, 'weight_decay': 4.4244365055278744e-06, 'optimizer': 'rmsprop', 'activation': <class 'torch.nn.modules.activation.LeakyReLU'>, 'batchnorm': True, 'epochs': 35, 'batch_size': 32, 'flip_prob': 0.0}. Best is trial 269 with value: 2.690232738856096.
[I 2025-08-04 19:17:34,397] Trial 362 finished with value: 2.7377994571290056 and parameters: {'channels_list': [16, 32, 64], 'kernel_size': 3, 'padding': 1, 'pool_kernel': 2, 'dropout_rate': 0, 'fc_hidden_dim': 256, 'lr': 0.0010744849113548782, 'weight_decay': 8.320582830297345e-06, 'optimizer': 'rmsprop', 'activation': <class 'torch.nn.modules.activation.LeakyReLU'>, 'batchnorm': True, 'epochs': 35, 'batch_size': 32, 'flip_prob': 0.0}. Best is trial 269 with value: 2.690232738856096.
[I 2025-08-04 19:18:28,292] Trial 363 finished with value: 2.7257294293048155 and parameters: {'channels_list': [16, 32, 64], 'kernel_size': 3, 'padding': 1, 'pool_kernel': 2, 'dropout_rate': 0, 'fc_hidden_dim': 256, 'lr': 0.0008575845343617568, 'weight_decay': 6.006060279095579e-06, 'optimizer': 'rmsprop', 'activation': <class 'torch.nn.modules.activation.LeakyReLU'>, 'batchnorm': True, 'epochs': 35, 'batch_size': 32, 'flip_prob': 0.0}. Best is trial 269 with value: 2.690232738856096.
[I 2025-08-04 19:19:26,851] Trial 364 finished with value: 2.7247871522592835 and parameters: {'channels_list': [16, 32, 64], 'kernel_size': 3, 'padding': 1, 'pool_kernel': 2, 'dropout_rate': 0, 'fc_hidden_dim': 256, 'lr': 0.0011666347678674829, 'weight_decay': 5.105736104293099e-06, 'optimizer': 'rmsprop', 'activation': <class 'torch.nn.modules.activation.LeakyReLU'>, 'batchnorm': True, 'epochs': 35, 'batch_size': 32, 'flip_prob': 0.0}. Best is trial 269 with value: 2.690232738856096.
[I 2025-08-04 19:20:22,099] Trial 365 finished with value: 2.8139749116863073 and parameters: {'channels_list': [16, 32, 64], 'kernel_size': 3, 'padding': 0, 'pool_kernel': 2, 'dropout_rate': 0, 'fc_hidden_dim': 256, 'lr': 0.0010023681063787225, 'weight_decay': 1.122028257698167e-05, 'optimizer': 'rmsprop', 'activation': <class 'torch.nn.modules.activation.LeakyReLU'>, 'batchnorm': True, 'epochs': 35, 'batch_size': 32, 'flip_prob': 0.0}. Best is trial 269 with value: 2.690232738856096.
[I 2025-08-04 19:21:12,450] Trial 366 finished with value: 2.6972290675804036 and parameters: {'channels_list': [16, 32, 64], 'kernel_size': 3, 'padding': 1, 'pool_kernel': 2, 'dropout_rate': 0, 'fc_hidden_dim': 256, 'lr': 0.0012688372556514736, 'weight_decay': 3.064693368171294e-06, 'optimizer': 'rmsprop', 'activation': <class 'torch.nn.modules.activation.LeakyReLU'>, 'batchnorm': True, 'epochs': 35, 'batch_size': 32, 'flip_prob': 0.0}. Best is trial 269 with value: 2.690232738856096.
[I 2025-08-04 19:22:31,585] Trial 367 finished with value: 2.73330225426843 and parameters: {'channels_list': [16, 32, 64], 'kernel_size': 3, 'padding': 1, 'pool_kernel': 2, 'dropout_rate': 0, 'fc_hidden_dim': 256, 'lr': 0.0012635973099550115, 'weight_decay': 2.2901330362525267e-06, 'optimizer': 'rmsprop', 'activation': <class 'torch.nn.modules.activation.LeakyReLU'>, 'batchnorm': True, 'epochs': 35, 'batch_size': 32, 'flip_prob': 0.0}. Best is trial 269 with value: 2.690232738856096.
[I 2025-08-04 19:22:31,612] Trial 368 pruned. 
[I 2025-08-04 19:23:22,012] Trial 369 finished with value: 2.7083362138170672 and parameters: {'channels_list': [16, 32, 64], 'kernel_size': 3, 'padding': 1, 'pool_kernel': 2, 'dropout_rate': 0, 'fc_hidden_dim': 256, 'lr': 0.0012026428628777524, 'weight_decay': 2.5625029614515216e-05, 'optimizer': 'rmsprop', 'activation': <class 'torch.nn.modules.activation.LeakyReLU'>, 'batchnorm': True, 'epochs': 35, 'batch_size': 32, 'flip_prob': 0.0}. Best is trial 269 with value: 2.690232738856096.
[I 2025-08-04 19:24:50,381] Trial 370 finished with value: 2.7177718419649057 and parameters: {'channels_list': [16, 32, 64], 'kernel_size': 3, 'padding': 1, 'pool_kernel': 2, 'dropout_rate': 0, 'fc_hidden_dim': 256, 'lr': 0.0012055580894240118, 'weight_decay': 3.6811050905028418e-06, 'optimizer': 'rmsprop', 'activation': <class 'torch.nn.modules.activation.LeakyReLU'>, 'batchnorm': True, 'epochs': 35, 'batch_size': 32, 'flip_prob': 0.0}. Best is trial 269 with value: 2.690232738856096.
[I 2025-08-04 19:25:53,410] Trial 371 finished with value: 2.716809428586603 and parameters: {'channels_list': [16, 32, 64], 'kernel_size': 3, 'padding': 1, 'pool_kernel': 2, 'dropout_rate': 0, 'fc_hidden_dim': 256, 'lr': 0.0013741164152727301, 'weight_decay': 2.6761765631527223e-05, 'optimizer': 'rmsprop', 'activation': <class 'torch.nn.modules.activation.LeakyReLU'>, 'batchnorm': True, 'epochs': 35, 'batch_size': 32, 'flip_prob': 0.0}. Best is trial 269 with value: 2.690232738856096.
[I 2025-08-04 19:26:32,657] Trial 372 finished with value: 2.776246162835594 and parameters: {'channels_list': [16, 32, 64], 'kernel_size': 3, 'padding': 1, 'pool_kernel': 2, 'dropout_rate': 0, 'fc_hidden_dim': 256, 'lr': 0.0011657501380782922, 'weight_decay': 6.038479103904826e-05, 'optimizer': 'rmsprop', 'activation': <class 'torch.nn.modules.activation.LeakyReLU'>, 'batchnorm': True, 'epochs': 35, 'batch_size': 32, 'flip_prob': 0.0}. Best is trial 269 with value: 2.690232738856096.
[I 2025-08-04 19:27:42,251] Trial 373 finished with value: 2.726089003750441 and parameters: {'channels_list': [16, 32, 64], 'kernel_size': 3, 'padding': 1, 'pool_kernel': 2, 'dropout_rate': 0, 'fc_hidden_dim': 256, 'lr': 0.0007908945929260177, 'weight_decay': 9.132413781163154e-06, 'optimizer': 'rmsprop', 'activation': <class 'torch.nn.modules.activation.LeakyReLU'>, 'batchnorm': True, 'epochs': 35, 'batch_size': 32, 'flip_prob': 0.0}. Best is trial 269 with value: 2.690232738856096.
[I 2025-08-04 19:28:18,964] Trial 374 finished with value: 2.763303242546514 and parameters: {'channels_list': [16, 32, 64], 'kernel_size': 3, 'padding': 1, 'pool_kernel': 2, 'dropout_rate': 0, 'fc_hidden_dim': 256, 'lr': 0.0012960943165478648, 'weight_decay': 7.301338648118238e-06, 'optimizer': 'rmsprop', 'activation': <class 'torch.nn.modules.activation.LeakyReLU'>, 'batchnorm': True, 'epochs': 35, 'batch_size': 32, 'flip_prob': 0.0}. Best is trial 269 with value: 2.690232738856096.
[I 2025-08-04 19:29:17,695] Trial 375 finished with value: 2.726009139565996 and parameters: {'channels_list': [16, 32, 64], 'kernel_size': 3, 'padding': 1, 'pool_kernel': 2, 'dropout_rate': 0, 'fc_hidden_dim': 256, 'lr': 0.0009421826362860481, 'weight_decay': 2.2585944634315324e-05, 'optimizer': 'rmsprop', 'activation': <class 'torch.nn.modules.activation.LeakyReLU'>, 'batchnorm': True, 'epochs': 35, 'batch_size': 32, 'flip_prob': 0.0}. Best is trial 269 with value: 2.690232738856096.
[I 2025-08-04 19:30:10,857] Trial 376 finished with value: 2.7056474517136633 and parameters: {'channels_list': [16, 32, 64], 'kernel_size': 3, 'padding': 1, 'pool_kernel': 2, 'dropout_rate': 0, 'fc_hidden_dim': 256, 'lr': 0.001150567248216587, 'weight_decay': 2.943072813039906e-06, 'optimizer': 'rmsprop', 'activation': <class 'torch.nn.modules.activation.LeakyReLU'>, 'batchnorm': True, 'epochs': 35, 'batch_size': 32, 'flip_prob': 0.0}. Best is trial 269 with value: 2.690232738856096.
[I 2025-08-04 19:31:32,145] Trial 377 finished with value: 2.7212976292908118 and parameters: {'channels_list': [32, 64, 128], 'kernel_size': 3, 'padding': 1, 'pool_kernel': 2, 'dropout_rate': 0, 'fc_hidden_dim': 256, 'lr': 0.0011493694065919436, 'weight_decay': 2.771128040521806e-06, 'optimizer': 'rmsprop', 'activation': <class 'torch.nn.modules.activation.LeakyReLU'>, 'batchnorm': True, 'epochs': 35, 'batch_size': 32, 'flip_prob': 0.0}. Best is trial 269 with value: 2.690232738856096.
[I 2025-08-04 19:32:52,446] Trial 378 finished with value: 2.721910677715435 and parameters: {'channels_list': [16, 32, 64], 'kernel_size': 3, 'padding': 1, 'pool_kernel': 2, 'dropout_rate': 0, 'fc_hidden_dim': 256, 'lr': 0.0012942577444407253, 'weight_decay': 2.2818916119257904e-06, 'optimizer': 'rmsprop', 'activation': <class 'torch.nn.modules.activation.LeakyReLU'>, 'batchnorm': True, 'epochs': 35, 'batch_size': 32, 'flip_prob': 0.0}. Best is trial 269 with value: 2.690232738856096.
[I 2025-08-04 19:33:43,395] Trial 379 finished with value: 2.70941031568732 and parameters: {'channels_list': [16, 32, 64], 'kernel_size': 3, 'padding': 1, 'pool_kernel': 2, 'dropout_rate': 0, 'fc_hidden_dim': 256, 'lr': 0.001218403167844826, 'weight_decay': 3.3711636749359864e-06, 'optimizer': 'rmsprop', 'activation': <class 'torch.nn.modules.activation.LeakyReLU'>, 'batchnorm': True, 'epochs': 35, 'batch_size': 32, 'flip_prob': 0.0}. Best is trial 269 with value: 2.690232738856096.
[I 2025-08-04 19:34:01,563] Trial 380 finished with value: 2.886553111438728 and parameters: {'channels_list': [16, 32, 64], 'kernel_size': 3, 'padding': 1, 'pool_kernel': 2, 'dropout_rate': 0, 'fc_hidden_dim': 64, 'lr': 0.0013948618726680457, 'weight_decay': 3.6549355498179836e-06, 'optimizer': 'rmsprop', 'activation': <class 'torch.nn.modules.activation.LeakyReLU'>, 'batchnorm': True, 'epochs': 35, 'batch_size': 64, 'flip_prob': 0.0}. Best is trial 269 with value: 2.690232738856096.
[I 2025-08-04 19:35:13,939] Trial 381 finished with value: 2.7100322047533836 and parameters: {'channels_list': [16, 32, 64], 'kernel_size': 3, 'padding': 1, 'pool_kernel': 2, 'dropout_rate': 0, 'fc_hidden_dim': 256, 'lr': 0.0012561267917036367, 'weight_decay': 4.3162584102964795e-06, 'optimizer': 'rmsprop', 'activation': <class 'torch.nn.modules.activation.LeakyReLU'>, 'batchnorm': True, 'epochs': 35, 'batch_size': 32, 'flip_prob': 0.0}. Best is trial 269 with value: 2.690232738856096.
[I 2025-08-04 19:35:13,973] Trial 382 pruned. 
[I 2025-08-04 19:36:07,343] Trial 383 finished with value: 2.7241735855834186 and parameters: {'channels_list': [16, 32, 64], 'kernel_size': 5, 'padding': 1, 'pool_kernel': 2, 'dropout_rate': 0, 'fc_hidden_dim': 256, 'lr': 0.0011362536428687988, 'weight_decay': 1.9446699820681205e-06, 'optimizer': 'rmsprop', 'activation': <class 'torch.nn.modules.activation.LeakyReLU'>, 'batchnorm': True, 'epochs': 35, 'batch_size': 32, 'flip_prob': 0.0}. Best is trial 269 with value: 2.690232738856096.
[I 2025-08-04 19:36:38,742] Trial 384 finished with value: 2.8334025672318996 and parameters: {'channels_list': [16, 32, 64], 'kernel_size': 3, 'padding': 1, 'pool_kernel': 2, 'dropout_rate': 0, 'fc_hidden_dim': 256, 'lr': 0.001257875689889129, 'weight_decay': 3.156641616391874e-06, 'optimizer': 'rmsprop', 'activation': <class 'torch.nn.modules.activation.LeakyReLU'>, 'batchnorm': True, 'epochs': 35, 'batch_size': 32, 'flip_prob': 0.0}. Best is trial 269 with value: 2.690232738856096.
[I 2025-08-04 19:36:38,772] Trial 385 pruned. 
[I 2025-08-04 19:37:40,235] Trial 386 finished with value: 2.7436057871299715 and parameters: {'channels_list': [16, 32, 64], 'kernel_size': 3, 'padding': 1, 'pool_kernel': 2, 'dropout_rate': 0, 'fc_hidden_dim': 256, 'lr': 0.001291743410511903, 'weight_decay': 3.956106500223994e-06, 'optimizer': 'rmsprop', 'activation': <class 'torch.nn.modules.activation.LeakyReLU'>, 'batchnorm': True, 'epochs': 35, 'batch_size': 32, 'flip_prob': 0.0}. Best is trial 269 with value: 2.690232738856096.
[I 2025-08-04 19:37:40,265] Trial 387 pruned. 
[I 2025-08-04 19:38:28,231] Trial 388 finished with value: 2.8063051753510035 and parameters: {'channels_list': [16, 32, 64], 'kernel_size': 3, 'padding': 1, 'pool_kernel': 2, 'dropout_rate': 0, 'fc_hidden_dim': 256, 'lr': 0.0014153033468600512, 'weight_decay': 4.426807845844232e-06, 'optimizer': 'rmsprop', 'activation': <class 'torch.nn.modules.activation.LeakyReLU'>, 'batchnorm': True, 'epochs': 35, 'batch_size': 32, 'flip_prob': 0.0}. Best is trial 269 with value: 2.690232738856096.
[I 2025-08-04 19:39:35,256] Trial 389 finished with value: 2.7115408002970733 and parameters: {'channels_list': [16, 32, 64], 'kernel_size': 3, 'padding': 1, 'pool_kernel': 2, 'dropout_rate': 0, 'fc_hidden_dim': 256, 'lr': 0.0012134658194715047, 'weight_decay': 2.6734618283943336e-06, 'optimizer': 'rmsprop', 'activation': <class 'torch.nn.modules.activation.LeakyReLU'>, 'batchnorm': True, 'epochs': 35, 'batch_size': 32, 'flip_prob': 0.0}. Best is trial 269 with value: 2.690232738856096.
[I 2025-08-04 19:40:19,129] Trial 390 finished with value: 2.7289598106618955 and parameters: {'channels_list': [16, 32, 64], 'kernel_size': 3, 'padding': 1, 'pool_kernel': 2, 'dropout_rate': 0, 'fc_hidden_dim': 256, 'lr': 0.0013058284759803575, 'weight_decay': 2.408478034693807e-06, 'optimizer': 'rmsprop', 'activation': <class 'torch.nn.modules.activation.LeakyReLU'>, 'batchnorm': True, 'epochs': 35, 'batch_size': 32, 'flip_prob': 0.0}. Best is trial 269 with value: 2.690232738856096.
[I 2025-08-04 19:41:31,483] Trial 391 finished with value: 2.7218722425697797 and parameters: {'channels_list': [16, 32, 64], 'kernel_size': 3, 'padding': 1, 'pool_kernel': 2, 'dropout_rate': 0, 'fc_hidden_dim': 256, 'lr': 0.0014319882183846215, 'weight_decay': 3.5343919009139437e-06, 'optimizer': 'rmsprop', 'activation': <class 'torch.nn.modules.activation.LeakyReLU'>, 'batchnorm': True, 'epochs': 35, 'batch_size': 32, 'flip_prob': 0.0}. Best is trial 269 with value: 2.690232738856096.
