[I 2025-08-05 05:58:53,094] Trial 198 finished with value: 2.800482839036764 and parameters: {'patch_size': 6, 'emb_dim': 256, 'depth': 2, 'n_heads': 2, 'mlp_dim': 128, 'dropout_rate': 0, 'lr': 0.0016375983225701057, 'weight_decay': 0.00024978347752522493, 'optimizer': 'sgd', 'activation': <class 'torch.nn.modules.activation.ReLU'>, 'epochs': 100, 'batch_size': 32, 'flip_prob': 0.0}. Best is trial 102 with value: 2.7074620693814193.
[I 2025-08-05 06:00:26,215] Trial 199 finished with value: 2.7748873374142895 and parameters: {'patch_size': 6, 'emb_dim': 256, 'depth': 2, 'n_heads': 2, 'mlp_dim': 128, 'dropout_rate': 0, 'lr': 0.002405940571136797, 'weight_decay': 0.0010242453326640717, 'optimizer': 'sgd', 'activation': <class 'torch.nn.modules.activation.ReLU'>, 'epochs': 100, 'batch_size': 32, 'flip_prob': 0.0}. Best is trial 102 with value: 2.7074620693814193.
[I 2025-08-05 06:02:47,779] Trial 200 finished with value: 2.7476055618649657 and parameters: {'patch_size': 6, 'emb_dim': 256, 'depth': 2, 'n_heads': 2, 'mlp_dim': 128, 'dropout_rate': 0, 'lr': 0.001959730094813574, 'weight_decay': 0.001597013195156587, 'optimizer': 'sgd', 'activation': <class 'torch.nn.modules.activation.ReLU'>, 'epochs': 100, 'batch_size': 32, 'flip_prob': 0.0}. Best is trial 102 with value: 2.7074620693814193.
[I 2025-08-05 06:04:54,968] Trial 201 finished with value: 2.7385649094966986 and parameters: {'patch_size': 6, 'emb_dim': 256, 'depth': 2, 'n_heads': 2, 'mlp_dim': 128, 'dropout_rate': 0, 'lr': 0.0027690229046916886, 'weight_decay': 0.000655122254908829, 'optimizer': 'sgd', 'activation': <class 'torch.nn.modules.activation.ReLU'>, 'epochs': 100, 'batch_size': 32, 'flip_prob': 0.0}. Best is trial 102 with value: 2.7074620693814193.
[I 2025-08-05 06:06:52,977] Trial 202 finished with value: 2.749472010638947 and parameters: {'patch_size': 6, 'emb_dim': 256, 'depth': 2, 'n_heads': 2, 'mlp_dim': 128, 'dropout_rate': 0, 'lr': 0.003252399582216813, 'weight_decay': 0.0007811090025397662, 'optimizer': 'sgd', 'activation': <class 'torch.nn.modules.activation.ReLU'>, 'epochs': 100, 'batch_size': 32, 'flip_prob': 0.0}. Best is trial 102 with value: 2.7074620693814193.
[I 2025-08-05 06:09:38,682] Trial 203 finished with value: 2.7219094102143955 and parameters: {'patch_size': 6, 'emb_dim': 256, 'depth': 2, 'n_heads': 2, 'mlp_dim': 128, 'dropout_rate': 0, 'lr': 0.0021888686619956715, 'weight_decay': 0.0005952318072093607, 'optimizer': 'sgd', 'activation': <class 'torch.nn.modules.activation.ReLU'>, 'epochs': 100, 'batch_size': 32, 'flip_prob': 0.0}. Best is trial 102 with value: 2.7074620693814193.
[I 2025-08-05 06:11:10,214] Trial 204 finished with value: 2.7683812420388327 and parameters: {'patch_size': 6, 'emb_dim': 256, 'depth': 2, 'n_heads': 2, 'mlp_dim': 128, 'dropout_rate': 0, 'lr': 0.002184299753538797, 'weight_decay': 0.0005434680928787283, 'optimizer': 'sgd', 'activation': <class 'torch.nn.modules.activation.ReLU'>, 'epochs': 100, 'batch_size': 32, 'flip_prob': 0.0}. Best is trial 102 with value: 2.7074620693814193.
[I 2025-08-05 06:12:59,293] Trial 205 finished with value: 2.7508690015542063 and parameters: {'patch_size': 6, 'emb_dim': 256, 'depth': 2, 'n_heads': 2, 'mlp_dim': 128, 'dropout_rate': 0, 'lr': 0.0018552007017073055, 'weight_decay': 0.00044574893574434083, 'optimizer': 'sgd', 'activation': <class 'torch.nn.modules.activation.ReLU'>, 'epochs': 100, 'batch_size': 32, 'flip_prob': 0.0}. Best is trial 102 with value: 2.7074620693814193.
[I 2025-08-05 06:14:56,471] Trial 206 finished with value: 2.742821674611514 and parameters: {'patch_size': 6, 'emb_dim': 128, 'depth': 2, 'n_heads': 2, 'mlp_dim': 128, 'dropout_rate': 0, 'lr': 0.002536635566145674, 'weight_decay': 0.0003372968631364698, 'optimizer': 'sgd', 'activation': <class 'torch.nn.modules.activation.ReLU'>, 'epochs': 100, 'batch_size': 32, 'flip_prob': 0.0}. Best is trial 102 with value: 2.7074620693814193.
[I 2025-08-05 06:16:55,777] Trial 207 finished with value: 2.749710448084464 and parameters: {'patch_size': 6, 'emb_dim': 256, 'depth': 2, 'n_heads': 2, 'mlp_dim': 512, 'dropout_rate': 0, 'lr': 0.002108252082494992, 'weight_decay': 0.0009277153709982383, 'optimizer': 'sgd', 'activation': <class 'torch.nn.modules.activation.ReLU'>, 'epochs': 100, 'batch_size': 32, 'flip_prob': 0.0}. Best is trial 102 with value: 2.7074620693814193.
[I 2025-08-05 06:21:23,308] Trial 208 finished with value: 2.7674158129099626 and parameters: {'patch_size': 4, 'emb_dim': 256, 'depth': 6, 'n_heads': 2, 'mlp_dim': 128, 'dropout_rate': 0, 'lr': 0.004339674366291016, 'weight_decay': 0.0012735474070598351, 'optimizer': 'sgd', 'activation': <class 'torch.nn.modules.activation.ReLU'>, 'epochs': 100, 'batch_size': 32, 'flip_prob': 0.0}. Best is trial 102 with value: 2.7074620693814193.
[I 2025-08-05 06:23:30,686] Trial 209 finished with value: 2.747106571968272 and parameters: {'patch_size': 6, 'emb_dim': 256, 'depth': 2, 'n_heads': 4, 'mlp_dim': 128, 'dropout_rate': 0, 'lr': 0.002311913349532339, 'weight_decay': 0.000745966879344413, 'optimizer': 'sgd', 'activation': <class 'torch.nn.modules.activation.ReLU'>, 'epochs': 100, 'batch_size': 32, 'flip_prob': 0.0}. Best is trial 102 with value: 2.7074620693814193.
[I 2025-08-05 06:25:55,343] Trial 210 finished with value: 2.7922677289159794 and parameters: {'patch_size': 6, 'emb_dim': 256, 'depth': 2, 'n_heads': 2, 'mlp_dim': 128, 'dropout_rate': 0, 'lr': 0.0020240126727482455, 'weight_decay': 0.0004003565167322797, 'optimizer': 'rmsprop', 'activation': <class 'torch.nn.modules.activation.ReLU'>, 'epochs': 100, 'batch_size': 32, 'flip_prob': 0.0}. Best is trial 102 with value: 2.7074620693814193.
[I 2025-08-05 06:28:55,364] Trial 211 finished with value: 2.7465516332550415 and parameters: {'patch_size': 6, 'emb_dim': 256, 'depth': 2, 'n_heads': 2, 'mlp_dim': 128, 'dropout_rate': 0, 'lr': 0.002815460518452553, 'weight_decay': 0.00059720738790497, 'optimizer': 'sgd', 'activation': <class 'torch.nn.modules.activation.ReLU'>, 'epochs': 100, 'batch_size': 32, 'flip_prob': 0.0}. Best is trial 102 with value: 2.7074620693814193.
[I 2025-08-05 06:31:02,750] Trial 212 finished with value: 2.737180207290465 and parameters: {'patch_size': 6, 'emb_dim': 256, 'depth': 2, 'n_heads': 2, 'mlp_dim': 128, 'dropout_rate': 0, 'lr': 0.0031318803246167403, 'weight_decay': 0.0006289155527914898, 'optimizer': 'sgd', 'activation': <class 'torch.nn.modules.activation.ReLU'>, 'epochs': 100, 'batch_size': 32, 'flip_prob': 0.0}. Best is trial 102 with value: 2.7074620693814193.
[I 2025-08-05 06:33:53,611] Trial 213 finished with value: 2.7448036209377937 and parameters: {'patch_size': 6, 'emb_dim': 256, 'depth': 2, 'n_heads': 2, 'mlp_dim': 128, 'dropout_rate': 0, 'lr': 0.002505135324584746, 'weight_decay': 0.0010639081490256344, 'optimizer': 'sgd', 'activation': <class 'torch.nn.modules.activation.ReLU'>, 'epochs': 100, 'batch_size': 32, 'flip_prob': 0.0}. Best is trial 102 with value: 2.7074620693814193.
[I 2025-08-05 06:36:36,453] Trial 214 finished with value: 2.761081250297721 and parameters: {'patch_size': 6, 'emb_dim': 64, 'depth': 2, 'n_heads': 2, 'mlp_dim': 128, 'dropout_rate': 0, 'lr': 0.002241709138125722, 'weight_decay': 0.0005034194751501377, 'optimizer': 'sgd', 'activation': <class 'torch.nn.modules.activation.ReLU'>, 'epochs': 100, 'batch_size': 32, 'flip_prob': 0.0}. Best is trial 102 with value: 2.7074620693814193.
[I 2025-08-05 06:39:18,686] Trial 215 finished with value: 2.728369301277133 and parameters: {'patch_size': 6, 'emb_dim': 256, 'depth': 2, 'n_heads': 2, 'mlp_dim': 128, 'dropout_rate': 0, 'lr': 0.0028266323269833466, 'weight_decay': 0.0008660854875544931, 'optimizer': 'sgd', 'activation': <class 'torch.nn.modules.activation.ReLU'>, 'epochs': 100, 'batch_size': 32, 'flip_prob': 0.0}. Best is trial 102 with value: 2.7074620693814193.
[I 2025-08-05 06:42:01,002] Trial 216 finished with value: 2.744792639533343 and parameters: {'patch_size': 6, 'emb_dim': 256, 'depth': 2, 'n_heads': 2, 'mlp_dim': 128, 'dropout_rate': 0, 'lr': 0.001749704052405827, 'weight_decay': 0.00012595256787205478, 'optimizer': 'sgd', 'activation': <class 'torch.nn.modules.activation.ReLU'>, 'epochs': 100, 'batch_size': 32, 'flip_prob': 0.0}. Best is trial 102 with value: 2.7074620693814193.
[I 2025-08-05 06:45:09,413] Trial 217 finished with value: 2.7501076535522864 and parameters: {'patch_size': 6, 'emb_dim': 256, 'depth': 2, 'n_heads': 2, 'mlp_dim': 128, 'dropout_rate': 0, 'lr': 0.0015118689487304002, 'weight_decay': 0.0008676758816626857, 'optimizer': 'sgd', 'activation': <class 'torch.nn.modules.activation.ReLU'>, 'epochs': 100, 'batch_size': 32, 'flip_prob': 0.0}. Best is trial 102 with value: 2.7074620693814193.
[I 2025-08-05 06:46:58,135] Trial 218 finished with value: 2.7212444638458178 and parameters: {'patch_size': 6, 'emb_dim': 256, 'depth': 2, 'n_heads': 2, 'mlp_dim': 128, 'dropout_rate': 0, 'lr': 0.0025876621499781637, 'weight_decay': 0.0013745525743137964, 'optimizer': 'sgd', 'activation': <class 'torch.nn.modules.activation.ReLU'>, 'epochs': 100, 'batch_size': 64, 'flip_prob': 0.0}. Best is trial 102 with value: 2.7074620693814193.
[I 2025-08-05 06:49:45,782] Trial 219 finished with value: 2.752581538567353 and parameters: {'patch_size': 6, 'emb_dim': 128, 'depth': 2, 'n_heads': 2, 'mlp_dim': 128, 'dropout_rate': 0, 'lr': 0.0029809054194564724, 'weight_decay': 0.0021604085777688336, 'optimizer': 'sgd', 'activation': <class 'torch.nn.modules.activation.ReLU'>, 'epochs': 100, 'batch_size': 32, 'flip_prob': 0.0}. Best is trial 102 with value: 2.7074620693814193.
[I 2025-08-05 06:51:31,740] Trial 220 finished with value: 2.8017600298215455 and parameters: {'patch_size': 6, 'emb_dim': 256, 'depth': 2, 'n_heads': 2, 'mlp_dim': 128, 'dropout_rate': 0, 'lr': 0.002579374230836634, 'weight_decay': 0.0016399147593395527, 'optimizer': 'sgd', 'activation': <class 'torch.nn.modules.activation.ReLU'>, 'epochs': 100, 'batch_size': 64, 'flip_prob': 0.25}. Best is trial 102 with value: 2.7074620693814193.
[I 2025-08-05 06:53:11,896] Trial 221 finished with value: 2.751566878676558 and parameters: {'patch_size': 6, 'emb_dim': 256, 'depth': 2, 'n_heads': 2, 'mlp_dim': 128, 'dropout_rate': 0, 'lr': 0.0023690321254853045, 'weight_decay': 0.0012709024847181684, 'optimizer': 'sgd', 'activation': <class 'torch.nn.modules.activation.ReLU'>, 'epochs': 100, 'batch_size': 64, 'flip_prob': 0.0}. Best is trial 102 with value: 2.7074620693814193.
[I 2025-08-05 06:55:39,411] Trial 222 finished with value: 2.7623001316631948 and parameters: {'patch_size': 6, 'emb_dim': 256, 'depth': 2, 'n_heads': 2, 'mlp_dim': 128, 'dropout_rate': 0, 'lr': 0.002096225310702932, 'weight_decay': 0.0010663286831781938, 'optimizer': 'sgd', 'activation': <class 'torch.nn.modules.activation.ReLU'>, 'epochs': 100, 'batch_size': 64, 'flip_prob': 0.0}. Best is trial 102 with value: 2.7074620693814193.
[I 2025-08-05 06:57:34,434] Trial 223 finished with value: 2.7546932267625026 and parameters: {'patch_size': 6, 'emb_dim': 256, 'depth': 2, 'n_heads': 2, 'mlp_dim': 128, 'dropout_rate': 0, 'lr': 0.002629142772630554, 'weight_decay': 0.0014987870903593644, 'optimizer': 'sgd', 'activation': <class 'torch.nn.modules.activation.ReLU'>, 'epochs': 100, 'batch_size': 64, 'flip_prob': 0.0}. Best is trial 102 with value: 2.7074620693814193.
[I 2025-08-05 06:59:14,598] Trial 224 finished with value: 2.73128186819493 and parameters: {'patch_size': 6, 'emb_dim': 256, 'depth': 2, 'n_heads': 2, 'mlp_dim': 128, 'dropout_rate': 0, 'lr': 0.0034097365952407456, 'weight_decay': 0.0008862686654661406, 'optimizer': 'sgd', 'activation': <class 'torch.nn.modules.activation.ReLU'>, 'epochs': 100, 'batch_size': 64, 'flip_prob': 0.0}. Best is trial 102 with value: 2.7074620693814193.
[I 2025-08-05 07:00:32,392] Trial 225 finished with value: 2.7423305889378122 and parameters: {'patch_size': 6, 'emb_dim': 256, 'depth': 2, 'n_heads': 2, 'mlp_dim': 128, 'dropout_rate': 0, 'lr': 0.003851751239970368, 'weight_decay': 0.000804123967288129, 'optimizer': 'sgd', 'activation': <class 'torch.nn.modules.activation.ReLU'>, 'epochs': 100, 'batch_size': 64, 'flip_prob': 0.0}. Best is trial 102 with value: 2.7074620693814193.
[I 2025-08-05 07:01:35,308] Trial 226 finished with value: 2.776209222508282 and parameters: {'patch_size': 6, 'emb_dim': 256, 'depth': 2, 'n_heads': 2, 'mlp_dim': 128, 'dropout_rate': 0, 'lr': 0.00342096383984045, 'weight_decay': 0.000718161859867191, 'optimizer': 'sgd', 'activation': <class 'torch.nn.modules.activation.ReLU'>, 'epochs': 100, 'batch_size': 64, 'flip_prob': 0.0}. Best is trial 102 with value: 2.7074620693814193.
[I 2025-08-05 07:02:35,636] Trial 227 finished with value: 2.7503964313695746 and parameters: {'patch_size': 6, 'emb_dim': 256, 'depth': 2, 'n_heads': 2, 'mlp_dim': 128, 'dropout_rate': 0, 'lr': 0.003115287014372986, 'weight_decay': 0.0009153090312595055, 'optimizer': 'sgd', 'activation': <class 'torch.nn.modules.activation.ReLU'>, 'epochs': 100, 'batch_size': 64, 'flip_prob': 0.0}. Best is trial 102 with value: 2.7074620693814193.
[I 2025-08-05 07:03:52,975] Trial 228 finished with value: 2.755027137360613 and parameters: {'patch_size': 4, 'emb_dim': 256, 'depth': 2, 'n_heads': 2, 'mlp_dim': 128, 'dropout_rate': 0, 'lr': 0.0035512452558371, 'weight_decay': 0.0004568801396715005, 'optimizer': 'sgd', 'activation': <class 'torch.nn.modules.activation.ReLU'>, 'epochs': 100, 'batch_size': 64, 'flip_prob': 0.0}. Best is trial 102 with value: 2.7074620693814193.
[I 2025-08-05 07:06:03,291] Trial 229 finished with value: 2.7513116177373687 and parameters: {'patch_size': 6, 'emb_dim': 256, 'depth': 2, 'n_heads': 2, 'mlp_dim': 128, 'dropout_rate': 0, 'lr': 0.0019190064061664993, 'weight_decay': 0.0003507482663504479, 'optimizer': 'sgd', 'activation': <class 'torch.nn.modules.activation.ReLU'>, 'epochs': 100, 'batch_size': 64, 'flip_prob': 0.0}. Best is trial 102 with value: 2.7074620693814193.
[I 2025-08-05 07:06:49,149] Trial 230 finished with value: 2.8131744408348647 and parameters: {'patch_size': 6, 'emb_dim': 256, 'depth': 2, 'n_heads': 2, 'mlp_dim': 128, 'dropout_rate': 0, 'lr': 0.0027991942254037747, 'weight_decay': 0.0018426403733120989, 'optimizer': 'sgd', 'activation': <class 'torch.nn.modules.activation.GELU'>, 'epochs': 100, 'batch_size': 128, 'flip_prob': 0.0}. Best is trial 102 with value: 2.7074620693814193.
[I 2025-08-05 07:10:05,310] Trial 231 finished with value: 2.7328138500416093 and parameters: {'patch_size': 6, 'emb_dim': 256, 'depth': 2, 'n_heads': 4, 'mlp_dim': 128, 'dropout_rate': 0, 'lr': 0.002245864281360223, 'weight_decay': 0.0011050254672538612, 'optimizer': 'sgd', 'activation': <class 'torch.nn.modules.activation.ReLU'>, 'epochs': 100, 'batch_size': 32, 'flip_prob': 0.0}. Best is trial 102 with value: 2.7074620693814193.
[I 2025-08-05 07:12:51,141] Trial 232 finished with value: 2.7403597522846033 and parameters: {'patch_size': 6, 'emb_dim': 256, 'depth': 2, 'n_heads': 2, 'mlp_dim': 128, 'dropout_rate': 0, 'lr': 0.002188813469307595, 'weight_decay': 0.0010914137271170056, 'optimizer': 'sgd', 'activation': <class 'torch.nn.modules.activation.ReLU'>, 'epochs': 100, 'batch_size': 32, 'flip_prob': 0.0}. Best is trial 102 with value: 2.7074620693814193.
[I 2025-08-05 07:14:40,239] Trial 233 finished with value: 2.7739518747111136 and parameters: {'patch_size': 6, 'emb_dim': 256, 'depth': 2, 'n_heads': 2, 'mlp_dim': 128, 'dropout_rate': 0, 'lr': 0.0024355088198872612, 'weight_decay': 0.0013729454626504258, 'optimizer': 'sgd', 'activation': <class 'torch.nn.modules.activation.ReLU'>, 'epochs': 100, 'batch_size': 32, 'flip_prob': 0.0}. Best is trial 102 with value: 2.7074620693814193.
[I 2025-08-05 07:17:47,311] Trial 234 finished with value: 2.742841854544112 and parameters: {'patch_size': 6, 'emb_dim': 256, 'depth': 2, 'n_heads': 2, 'mlp_dim': 128, 'dropout_rate': 0, 'lr': 0.001821227879464869, 'weight_decay': 0.0008952103369313204, 'optimizer': 'sgd', 'activation': <class 'torch.nn.modules.activation.ReLU'>, 'epochs': 100, 'batch_size': 32, 'flip_prob': 0.0}. Best is trial 102 with value: 2.7074620693814193.
[I 2025-08-05 07:20:11,247] Trial 235 finished with value: 2.731348323074267 and parameters: {'patch_size': 6, 'emb_dim': 256, 'depth': 2, 'n_heads': 2, 'mlp_dim': 128, 'dropout_rate': 0, 'lr': 0.0020068725541020353, 'weight_decay': 0.0011924306060921595, 'optimizer': 'sgd', 'activation': <class 'torch.nn.modules.activation.ReLU'>, 'epochs': 100, 'batch_size': 32, 'flip_prob': 0.0}. Best is trial 102 with value: 2.7074620693814193.
[I 2025-08-05 07:20:40,185] Trial 236 finished with value: 2.9073067141672095 and parameters: {'patch_size': 6, 'emb_dim': 256, 'depth': 2, 'n_heads': 2, 'mlp_dim': 128, 'dropout_rate': 0, 'lr': 0.0019863090695814867, 'weight_decay': 0.0012433265510325433, 'optimizer': 'adamw', 'activation': <class 'torch.nn.modules.activation.ReLU'>, 'epochs': 100, 'batch_size': 64, 'flip_prob': 0.0}. Best is trial 102 with value: 2.7074620693814193.
[I 2025-08-05 07:25:01,540] Trial 237 finished with value: 2.729473727804904 and parameters: {'patch_size': 6, 'emb_dim': 256, 'depth': 2, 'n_heads': 4, 'mlp_dim': 128, 'dropout_rate': 0, 'lr': 0.002702779570454352, 'weight_decay': 0.0011232667518221078, 'optimizer': 'sgd', 'activation': <class 'torch.nn.modules.activation.ReLU'>, 'epochs': 100, 'batch_size': 32, 'flip_prob': 0.0}. Best is trial 102 with value: 2.7074620693814193.
[I 2025-08-05 07:27:25,165] Trial 238 finished with value: 2.7751565473646247 and parameters: {'patch_size': 6, 'emb_dim': 128, 'depth': 2, 'n_heads': 4, 'mlp_dim': 128, 'dropout_rate': 0, 'lr': 0.0029522914280904465, 'weight_decay': 0.0011960809447853537, 'optimizer': 'sgd', 'activation': <class 'torch.nn.modules.activation.ReLU'>, 'epochs': 100, 'batch_size': 32, 'flip_prob': 0.5}. Best is trial 102 with value: 2.7074620693814193.
[I 2025-08-05 07:30:23,685] Trial 239 finished with value: 2.7458659192189954 and parameters: {'patch_size': 6, 'emb_dim': 256, 'depth': 2, 'n_heads': 4, 'mlp_dim': 128, 'dropout_rate': 0, 'lr': 0.002655448843035516, 'weight_decay': 0.0014396993843332723, 'optimizer': 'sgd', 'activation': <class 'torch.nn.modules.activation.ReLU'>, 'epochs': 100, 'batch_size': 32, 'flip_prob': 0.0}. Best is trial 102 with value: 2.7074620693814193.
[I 2025-08-05 07:32:43,148] Trial 240 finished with value: 2.7475451651758394 and parameters: {'patch_size': 6, 'emb_dim': 256, 'depth': 2, 'n_heads': 4, 'mlp_dim': 128, 'dropout_rate': 0, 'lr': 0.00340389977828172, 'weight_decay': 0.0009724861403100485, 'optimizer': 'sgd', 'activation': <class 'torch.nn.modules.activation.ReLU'>, 'epochs': 100, 'batch_size': 32, 'flip_prob': 0.0}. Best is trial 102 with value: 2.7074620693814193.
[I 2025-08-05 07:34:32,302] Trial 241 finished with value: 2.764555501822827 and parameters: {'patch_size': 6, 'emb_dim': 256, 'depth': 2, 'n_heads': 4, 'mlp_dim': 128, 'dropout_rate': 0, 'lr': 0.0023286269435250488, 'weight_decay': 0.0011328176858273484, 'optimizer': 'sgd', 'activation': <class 'torch.nn.modules.activation.ReLU'>, 'epochs': 100, 'batch_size': 32, 'flip_prob': 0.0}. Best is trial 102 with value: 2.7074620693814193.
[I 2025-08-05 07:36:30,065] Trial 242 finished with value: 2.7678443242039696 and parameters: {'patch_size': 6, 'emb_dim': 256, 'depth': 2, 'n_heads': 4, 'mlp_dim': 128, 'dropout_rate': 0, 'lr': 0.002694073587631167, 'weight_decay': 0.0008096773531445293, 'optimizer': 'sgd', 'activation': <class 'torch.nn.modules.activation.ReLU'>, 'epochs': 100, 'batch_size': 32, 'flip_prob': 0.0}. Best is trial 102 with value: 2.7074620693814193.
[I 2025-08-05 07:39:58,832] Trial 243 finished with value: 2.72888969857385 and parameters: {'patch_size': 6, 'emb_dim': 256, 'depth': 2, 'n_heads': 2, 'mlp_dim': 128, 'dropout_rate': 0, 'lr': 0.0020939711446905894, 'weight_decay': 0.001543755432830301, 'optimizer': 'sgd', 'activation': <class 'torch.nn.modules.activation.ReLU'>, 'epochs': 100, 'batch_size': 32, 'flip_prob': 0.0}. Best is trial 102 with value: 2.7074620693814193.
[I 2025-08-05 07:42:52,809] Trial 244 finished with value: 2.7202039547794836 and parameters: {'patch_size': 6, 'emb_dim': 256, 'depth': 2, 'n_heads': 2, 'mlp_dim': 128, 'dropout_rate': 0, 'lr': 0.003199796403887739, 'weight_decay': 0.0015015369172378965, 'optimizer': 'sgd', 'activation': <class 'torch.nn.modules.activation.ReLU'>, 'epochs': 100, 'batch_size': 32, 'flip_prob': 0.0}. Best is trial 102 with value: 2.7074620693814193.
[I 2025-08-05 07:46:51,645] Trial 245 finished with value: 2.720538550780679 and parameters: {'patch_size': 6, 'emb_dim': 256, 'depth': 2, 'n_heads': 2, 'mlp_dim': 128, 'dropout_rate': 0, 'lr': 0.0033016748418353255, 'weight_decay': 0.0018591335198161862, 'optimizer': 'sgd', 'activation': <class 'torch.nn.modules.activation.ReLU'>, 'epochs': 100, 'batch_size': 32, 'flip_prob': 0.0}. Best is trial 102 with value: 2.7074620693814193.
[I 2025-08-05 07:49:28,480] Trial 246 finished with value: 2.7408189411761534 and parameters: {'patch_size': 6, 'emb_dim': 256, 'depth': 2, 'n_heads': 2, 'mlp_dim': 512, 'dropout_rate': 0, 'lr': 0.004217692177096475, 'weight_decay': 0.002017549504155552, 'optimizer': 'sgd', 'activation': <class 'torch.nn.modules.activation.ReLU'>, 'epochs': 100, 'batch_size': 32, 'flip_prob': 0.0}. Best is trial 102 with value: 2.7074620693814193.
[I 2025-08-05 07:52:30,910] Trial 247 finished with value: 2.765644224475175 and parameters: {'patch_size': 6, 'emb_dim': 256, 'depth': 2, 'n_heads': 2, 'mlp_dim': 128, 'dropout_rate': 0, 'lr': 0.0032695104531618876, 'weight_decay': 0.002715385985054942, 'optimizer': 'sgd', 'activation': <class 'torch.nn.modules.activation.ReLU'>, 'epochs': 100, 'batch_size': 32, 'flip_prob': 0.0}. Best is trial 102 with value: 2.7074620693814193.
