[I 2025-08-04 16:19:55,747] Trial 152 finished with value: 2.7552903741921675 and parameters: {'channels_list': [32, 64], 'kernel_size': 3, 'padding': 1, 'pool_kernel': 2, 'dropout_rate': 0, 'fc_hidden_dim': 256, 'lr': 0.003484458019075, 'weight_decay': 0.008284037630583042, 'optimizer': 'sgd', 'activation': <class 'torch.nn.modules.activation.ReLU'>, 'batchnorm': True, 'epochs': 35, 'batch_size': 32, 'flip_prob': 0.0}. Best is trial 47 with value: 2.711872135169256.
[I 2025-08-04 16:20:54,754] Trial 153 finished with value: 2.7343457274327663 and parameters: {'channels_list': [32, 64], 'kernel_size': 3, 'padding': 1, 'pool_kernel': 2, 'dropout_rate': 0, 'fc_hidden_dim': 256, 'lr': 0.0007540079719520738, 'weight_decay': 0.005916589291881909, 'optimizer': 'sgd', 'activation': <class 'torch.nn.modules.activation.ReLU'>, 'batchnorm': True, 'epochs': 35, 'batch_size': 32, 'flip_prob': 0.0}. Best is trial 47 with value: 2.711872135169256.
[I 2025-08-04 16:21:41,596] Trial 154 finished with value: 2.753119629686215 and parameters: {'channels_list': [32, 64], 'kernel_size': 3, 'padding': 1, 'pool_kernel': 2, 'dropout_rate': 0, 'fc_hidden_dim': 256, 'lr': 0.0028901142008912004, 'weight_decay': 0.005640141534725226, 'optimizer': 'sgd', 'activation': <class 'torch.nn.modules.activation.ReLU'>, 'batchnorm': True, 'epochs': 35, 'batch_size': 32, 'flip_prob': 0.0}. Best is trial 47 with value: 2.711872135169256.
[I 2025-08-04 16:22:34,114] Trial 155 finished with value: 2.759612035291186 and parameters: {'channels_list': [32, 64], 'kernel_size': 3, 'padding': 1, 'pool_kernel': 2, 'dropout_rate': 0, 'fc_hidden_dim': 256, 'lr': 0.003921751762142941, 'weight_decay': 0.007080683844003565, 'optimizer': 'sgd', 'activation': <class 'torch.nn.modules.activation.ReLU'>, 'batchnorm': True, 'epochs': 35, 'batch_size': 32, 'flip_prob': 0.0}. Best is trial 47 with value: 2.711872135169256.
[I 2025-08-04 16:22:57,756] Trial 156 finished with value: 2.962936887695073 and parameters: {'channels_list': [32, 64], 'kernel_size': 3, 'padding': 1, 'pool_kernel': 2, 'dropout_rate': 0, 'fc_hidden_dim': 256, 'lr': 0.005472095310059705, 'weight_decay': 0.009737161252693935, 'optimizer': 'adam', 'activation': <class 'torch.nn.modules.activation.ReLU'>, 'batchnorm': True, 'epochs': 35, 'batch_size': 32, 'flip_prob': 0.0}. Best is trial 47 with value: 2.711872135169256.
[I 2025-08-04 16:23:37,860] Trial 157 finished with value: 2.7702277193311042 and parameters: {'channels_list': [32, 64], 'kernel_size': 5, 'padding': 1, 'pool_kernel': 2, 'dropout_rate': 0, 'fc_hidden_dim': 128, 'lr': 0.007635197450605623, 'weight_decay': 1.618558655344115e-06, 'optimizer': 'sgd', 'activation': <class 'torch.nn.modules.activation.ReLU'>, 'batchnorm': True, 'epochs': 35, 'batch_size': 32, 'flip_prob': 0.0}. Best is trial 47 with value: 2.711872135169256.
[I 2025-08-04 16:24:01,553] Trial 158 finished with value: 2.776712209669327 and parameters: {'channels_list': [32, 64], 'kernel_size': 3, 'padding': 1, 'pool_kernel': 2, 'dropout_rate': 0, 'fc_hidden_dim': 256, 'lr': 0.001248402168419588, 'weight_decay': 0.004246491373511631, 'optimizer': 'sgd', 'activation': <class 'torch.nn.modules.activation.ReLU'>, 'batchnorm': True, 'epochs': 35, 'batch_size': 64, 'flip_prob': 0.0}. Best is trial 47 with value: 2.711872135169256.
[I 2025-08-04 16:24:15,419] Trial 159 finished with value: 2.9610637770630914 and parameters: {'channels_list': [32, 64], 'kernel_size': 3, 'padding': 0, 'pool_kernel': 2, 'dropout_rate': 0, 'fc_hidden_dim': 256, 'lr': 0.0004046194681335266, 'weight_decay': 0.005341351025924857, 'optimizer': 'rmsprop', 'activation': <class 'torch.nn.modules.activation.ReLU'>, 'batchnorm': True, 'epochs': 35, 'batch_size': 128, 'flip_prob': 0.0}. Best is trial 47 with value: 2.711872135169256.
[I 2025-08-04 16:24:52,722] Trial 160 finished with value: 2.7800360371896815 and parameters: {'channels_list': [32, 64], 'kernel_size': 3, 'padding': 1, 'pool_kernel': 2, 'dropout_rate': 0, 'fc_hidden_dim': 256, 'lr': 0.0009590809930659597, 'weight_decay': 0.006208302247307512, 'optimizer': 'sgd', 'activation': <class 'torch.nn.modules.activation.ReLU'>, 'batchnorm': True, 'epochs': 35, 'batch_size': 32, 'flip_prob': 0.0}. Best is trial 47 with value: 2.711872135169256.
[I 2025-08-04 16:25:48,052] Trial 161 finished with value: 2.7812614301145437 and parameters: {'channels_list': [32, 64, 128], 'kernel_size': 3, 'padding': 1, 'pool_kernel': 2, 'dropout_rate': 0, 'fc_hidden_dim': 256, 'lr': 0.0007669982663969886, 'weight_decay': 0.008223880721855899, 'optimizer': 'sgd', 'activation': <class 'torch.nn.modules.activation.ReLU'>, 'batchnorm': True, 'epochs': 35, 'batch_size': 32, 'flip_prob': 0.0}. Best is trial 47 with value: 2.711872135169256.
[I 2025-08-04 16:27:23,384] Trial 162 finished with value: 2.761033531725047 and parameters: {'channels_list': [16, 32, 64], 'kernel_size': 3, 'padding': 1, 'pool_kernel': 2, 'dropout_rate': 0, 'fc_hidden_dim': 256, 'lr': 0.0007207498464507738, 'weight_decay': 0.007061034326851019, 'optimizer': 'sgd', 'activation': <class 'torch.nn.modules.activation.ReLU'>, 'batchnorm': True, 'epochs': 35, 'batch_size': 32, 'flip_prob': 0.0}. Best is trial 47 with value: 2.711872135169256.
[I 2025-08-04 16:28:42,073] Trial 163 finished with value: 2.7336300675630283 and parameters: {'channels_list': [32, 64], 'kernel_size': 3, 'padding': 1, 'pool_kernel': 2, 'dropout_rate': 0, 'fc_hidden_dim': 256, 'lr': 0.0008282572164476495, 'weight_decay': 0.009854115168043633, 'optimizer': 'sgd', 'activation': <class 'torch.nn.modules.activation.ReLU'>, 'batchnorm': True, 'epochs': 35, 'batch_size': 32, 'flip_prob': 0.0}. Best is trial 47 with value: 2.711872135169256.
[I 2025-08-04 16:29:33,804] Trial 164 finished with value: 2.7690323941814023 and parameters: {'channels_list': [32, 64], 'kernel_size': 3, 'padding': 1, 'pool_kernel': 2, 'dropout_rate': 0, 'fc_hidden_dim': 256, 'lr': 0.0011042269456256273, 'weight_decay': 0.009386971049995434, 'optimizer': 'sgd', 'activation': <class 'torch.nn.modules.activation.ReLU'>, 'batchnorm': True, 'epochs': 35, 'batch_size': 32, 'flip_prob': 0.0}. Best is trial 47 with value: 2.711872135169256.
[I 2025-08-04 16:30:15,823] Trial 165 finished with value: 2.7644432613731724 and parameters: {'channels_list': [32, 64], 'kernel_size': 3, 'padding': 1, 'pool_kernel': 2, 'dropout_rate': 0, 'fc_hidden_dim': 256, 'lr': 0.002606953600096048, 'weight_decay': 1.2232805161997112e-06, 'optimizer': 'sgd', 'activation': <class 'torch.nn.modules.activation.ReLU'>, 'batchnorm': True, 'epochs': 35, 'batch_size': 32, 'flip_prob': 0.0}. Best is trial 47 with value: 2.711872135169256.
[I 2025-08-04 16:30:45,258] Trial 166 finished with value: 2.7905111292734364 and parameters: {'channels_list': [32, 64], 'kernel_size': 3, 'padding': 1, 'pool_kernel': 3, 'dropout_rate': 0, 'fc_hidden_dim': 256, 'lr': 0.0009008880895025737, 'weight_decay': 0.0048102930751503835, 'optimizer': 'sgd', 'activation': <class 'torch.nn.modules.activation.ReLU'>, 'batchnorm': True, 'epochs': 35, 'batch_size': 32, 'flip_prob': 0.0}. Best is trial 47 with value: 2.711872135169256.
[I 2025-08-04 16:31:30,931] Trial 167 finished with value: 2.9230893127593256 and parameters: {'channels_list': [32, 64], 'kernel_size': 5, 'padding': 1, 'pool_kernel': 2, 'dropout_rate': 0, 'fc_hidden_dim': 128, 'lr': 0.009299592705079714, 'weight_decay': 0.009968024332196316, 'optimizer': 'adam', 'activation': <class 'torch.nn.modules.activation.ReLU'>, 'batchnorm': True, 'epochs': 35, 'batch_size': 32, 'flip_prob': 0.0}. Best is trial 47 with value: 2.711872135169256.
[I 2025-08-04 16:31:57,429] Trial 168 finished with value: 2.8214917326721265 and parameters: {'channels_list': [32, 64], 'kernel_size': 3, 'padding': 1, 'pool_kernel': 2, 'dropout_rate': 0, 'fc_hidden_dim': 256, 'lr': 0.00449825401486139, 'weight_decay': 0.006149231943476583, 'optimizer': 'sgd', 'activation': <class 'torch.nn.modules.activation.ReLU'>, 'batchnorm': True, 'epochs': 35, 'batch_size': 64, 'flip_prob': 0.0}. Best is trial 47 with value: 2.711872135169256.
[I 2025-08-04 16:32:15,786] Trial 169 finished with value: 2.9487254608094475 and parameters: {'channels_list': [16, 32, 64, 128], 'kernel_size': 3, 'padding': 1, 'pool_kernel': 2, 'dropout_rate': 0, 'fc_hidden_dim': 256, 'lr': 0.0006489361904528332, 'weight_decay': 0.007718772265124528, 'optimizer': 'sgd', 'activation': <class 'torch.nn.modules.activation.ReLU'>, 'batchnorm': True, 'epochs': 35, 'batch_size': 128, 'flip_prob': 0.0}. Best is trial 47 with value: 2.711872135169256.
[I 2025-08-04 16:32:38,135] Trial 170 finished with value: 2.8273264658896857 and parameters: {'channels_list': [32, 64], 'kernel_size': 3, 'padding': 1, 'pool_kernel': 2, 'dropout_rate': 0, 'fc_hidden_dim': 256, 'lr': 0.0008152225028215984, 'weight_decay': 0.008027904298521085, 'optimizer': 'sgd', 'activation': <class 'torch.nn.modules.activation.ReLU'>, 'batchnorm': True, 'epochs': 35, 'batch_size': 32, 'flip_prob': 0.0}. Best is trial 47 with value: 2.711872135169256.
[I 2025-08-04 16:33:27,361] Trial 171 finished with value: 2.7252701608061933 and parameters: {'channels_list': [16, 32, 64], 'kernel_size': 3, 'padding': 1, 'pool_kernel': 2, 'dropout_rate': 0, 'fc_hidden_dim': 256, 'lr': 0.0008269221873880574, 'weight_decay': 2.6358182666135227e-06, 'optimizer': 'sgd', 'activation': <class 'torch.nn.modules.activation.ReLU'>, 'batchnorm': True, 'epochs': 35, 'batch_size': 32, 'flip_prob': 0.0}. Best is trial 47 with value: 2.711872135169256.
[I 2025-08-04 16:33:57,856] Trial 172 finished with value: 2.8181627652613477 and parameters: {'channels_list': [32, 64, 128], 'kernel_size': 3, 'padding': 1, 'pool_kernel': 2, 'dropout_rate': 0, 'fc_hidden_dim': 256, 'lr': 0.000895904483481467, 'weight_decay': 2.009405683248188e-06, 'optimizer': 'sgd', 'activation': <class 'torch.nn.modules.activation.ReLU'>, 'batchnorm': True, 'epochs': 35, 'batch_size': 32, 'flip_prob': 0.0}. Best is trial 47 with value: 2.711872135169256.
[I 2025-08-04 16:34:52,677] Trial 173 finished with value: 2.7473838280998755 and parameters: {'channels_list': [16, 32, 64], 'kernel_size': 3, 'padding': 1, 'pool_kernel': 2, 'dropout_rate': 0, 'fc_hidden_dim': 256, 'lr': 0.0010174864625145188, 'weight_decay': 2.4978225042860332e-06, 'optimizer': 'sgd', 'activation': <class 'torch.nn.modules.activation.ReLU'>, 'batchnorm': True, 'epochs': 35, 'batch_size': 32, 'flip_prob': 0.0}. Best is trial 47 with value: 2.711872135169256.
[I 2025-08-04 16:35:27,500] Trial 174 finished with value: 2.769137034341423 and parameters: {'channels_list': [32, 64], 'kernel_size': 3, 'padding': 1, 'pool_kernel': 2, 'dropout_rate': 0, 'fc_hidden_dim': 256, 'lr': 0.0005988753372410446, 'weight_decay': 2.562950860498055e-06, 'optimizer': 'sgd', 'activation': <class 'torch.nn.modules.activation.ReLU'>, 'batchnorm': True, 'epochs': 35, 'batch_size': 32, 'flip_prob': 0.0}. Best is trial 47 with value: 2.711872135169256.
[I 2025-08-04 16:36:30,732] Trial 175 finished with value: 2.7461347323994008 and parameters: {'channels_list': [16, 32, 64], 'kernel_size': 3, 'padding': 1, 'pool_kernel': 2, 'dropout_rate': 0, 'fc_hidden_dim': 256, 'lr': 0.0007106760679474991, 'weight_decay': 0.0065322691892698605, 'optimizer': 'sgd', 'activation': <class 'torch.nn.modules.activation.ReLU'>, 'batchnorm': True, 'epochs': 35, 'batch_size': 32, 'flip_prob': 0.0}. Best is trial 47 with value: 2.711872135169256.
[I 2025-08-04 16:37:47,304] Trial 176 finished with value: 2.764988748127071 and parameters: {'channels_list': [32, 64], 'kernel_size': 3, 'padding': 1, 'pool_kernel': 2, 'dropout_rate': 0, 'fc_hidden_dim': 256, 'lr': 0.000822191589331405, 'weight_decay': 3.7142801236770882e-06, 'optimizer': 'sgd', 'activation': <class 'torch.nn.modules.activation.LeakyReLU'>, 'batchnorm': True, 'epochs': 35, 'batch_size': 32, 'flip_prob': 0.0}. Best is trial 47 with value: 2.711872135169256.
[I 2025-08-04 16:38:21,151] Trial 177 finished with value: 2.773098764661138 and parameters: {'channels_list': [16, 32, 64, 128], 'kernel_size': 3, 'padding': 1, 'pool_kernel': 2, 'dropout_rate': 0, 'fc_hidden_dim': 256, 'lr': 0.0021848253130955543, 'weight_decay': 0.008110304584853971, 'optimizer': 'sgd', 'activation': <class 'torch.nn.modules.activation.ReLU'>, 'batchnorm': True, 'epochs': 35, 'batch_size': 64, 'flip_prob': 0.0}. Best is trial 47 with value: 2.711872135169256.
[I 2025-08-04 16:38:39,761] Trial 178 finished with value: 2.872468446448571 and parameters: {'channels_list': [32, 64, 128], 'kernel_size': 5, 'padding': 1, 'pool_kernel': 2, 'dropout_rate': 0, 'fc_hidden_dim': 64, 'lr': 0.0009525414096217899, 'weight_decay': 0.004968086086195231, 'optimizer': 'rmsprop', 'activation': <class 'torch.nn.modules.activation.ReLU'>, 'batchnorm': True, 'epochs': 35, 'batch_size': 128, 'flip_prob': 0.0}. Best is trial 47 with value: 2.711872135169256.
[I 2025-08-04 16:40:07,240] Trial 179 finished with value: 2.7869451533755867 and parameters: {'channels_list': [32, 64], 'kernel_size': 3, 'padding': 1, 'pool_kernel': 2, 'dropout_rate': 0, 'fc_hidden_dim': 128, 'lr': 0.003240198601748369, 'weight_decay': 0.009886016641822978, 'optimizer': 'adam', 'activation': <class 'torch.nn.modules.activation.ReLU'>, 'batchnorm': True, 'epochs': 35, 'batch_size': 32, 'flip_prob': 0.0}. Best is trial 47 with value: 2.711872135169256.
[I 2025-08-04 16:41:23,136] Trial 180 finished with value: 2.740529734205423 and parameters: {'channels_list': [16, 32, 64], 'kernel_size': 3, 'padding': 1, 'pool_kernel': 2, 'dropout_rate': 0, 'fc_hidden_dim': 256, 'lr': 0.0018634055910745297, 'weight_decay': 0.005836541277506566, 'optimizer': 'sgd', 'activation': <class 'torch.nn.modules.activation.ReLU'>, 'batchnorm': True, 'epochs': 35, 'batch_size': 32, 'flip_prob': 0.0}. Best is trial 47 with value: 2.711872135169256.
[I 2025-08-04 16:42:37,086] Trial 181 finished with value: 2.7482008351347846 and parameters: {'channels_list': [16, 32, 64], 'kernel_size': 3, 'padding': 1, 'pool_kernel': 2, 'dropout_rate': 0, 'fc_hidden_dim': 256, 'lr': 0.00116268910277457, 'weight_decay': 0.005801479176789085, 'optimizer': 'sgd', 'activation': <class 'torch.nn.modules.activation.ReLU'>, 'batchnorm': True, 'epochs': 35, 'batch_size': 32, 'flip_prob': 0.0}. Best is trial 47 with value: 2.711872135169256.
[I 2025-08-04 16:43:15,710] Trial 182 finished with value: 2.7531004266658363 and parameters: {'channels_list': [16, 32, 64], 'kernel_size': 3, 'padding': 1, 'pool_kernel': 2, 'dropout_rate': 0, 'fc_hidden_dim': 256, 'lr': 0.002837049189633818, 'weight_decay': 0.003877084017055031, 'optimizer': 'sgd', 'activation': <class 'torch.nn.modules.activation.ReLU'>, 'batchnorm': True, 'epochs': 35, 'batch_size': 32, 'flip_prob': 0.0}. Best is trial 47 with value: 2.711872135169256.
[I 2025-08-04 16:44:18,721] Trial 183 finished with value: 2.7189980353319747 and parameters: {'channels_list': [16, 32, 64], 'kernel_size': 3, 'padding': 1, 'pool_kernel': 2, 'dropout_rate': 0, 'fc_hidden_dim': 256, 'lr': 0.0015505608275494865, 'weight_decay': 0.007612468885026313, 'optimizer': 'sgd', 'activation': <class 'torch.nn.modules.activation.ReLU'>, 'batchnorm': True, 'epochs': 35, 'batch_size': 32, 'flip_prob': 0.0}. Best is trial 47 with value: 2.711872135169256.
[I 2025-08-04 16:45:24,407] Trial 184 finished with value: 2.7173727858627377 and parameters: {'channels_list': [16, 32, 64], 'kernel_size': 3, 'padding': 1, 'pool_kernel': 2, 'dropout_rate': 0, 'fc_hidden_dim': 256, 'lr': 0.001625653748093558, 'weight_decay': 0.007192414190882692, 'optimizer': 'sgd', 'activation': <class 'torch.nn.modules.activation.ReLU'>, 'batchnorm': True, 'epochs': 35, 'batch_size': 32, 'flip_prob': 0.0}. Best is trial 47 with value: 2.711872135169256.
[I 2025-08-04 16:46:27,390] Trial 185 finished with value: 2.7303094921986357 and parameters: {'channels_list': [16, 32, 64], 'kernel_size': 3, 'padding': 1, 'pool_kernel': 2, 'dropout_rate': 0, 'fc_hidden_dim': 256, 'lr': 0.0017457622097467166, 'weight_decay': 0.007331178860213903, 'optimizer': 'sgd', 'activation': <class 'torch.nn.modules.activation.ReLU'>, 'batchnorm': True, 'epochs': 35, 'batch_size': 32, 'flip_prob': 0.0}. Best is trial 47 with value: 2.711872135169256.
[I 2025-08-04 16:47:29,859] Trial 186 finished with value: 2.7213505116245282 and parameters: {'channels_list': [16, 32, 64], 'kernel_size': 3, 'padding': 1, 'pool_kernel': 2, 'dropout_rate': 0, 'fc_hidden_dim': 256, 'lr': 0.0016201188276036462, 'weight_decay': 0.006494474328430617, 'optimizer': 'sgd', 'activation': <class 'torch.nn.modules.activation.ReLU'>, 'batchnorm': True, 'epochs': 35, 'batch_size': 32, 'flip_prob': 0.0}. Best is trial 47 with value: 2.711872135169256.
[I 2025-08-04 16:48:37,349] Trial 187 finished with value: 2.7078559371041733 and parameters: {'channels_list': [16, 32, 64], 'kernel_size': 3, 'padding': 1, 'pool_kernel': 2, 'dropout_rate': 0, 'fc_hidden_dim': 256, 'lr': 0.0017944599034879086, 'weight_decay': 0.006862427063251231, 'optimizer': 'sgd', 'activation': <class 'torch.nn.modules.activation.ReLU'>, 'batchnorm': True, 'epochs': 35, 'batch_size': 32, 'flip_prob': 0.0}. Best is trial 187 with value: 2.7078559371041733.
[I 2025-08-04 16:48:37,370] Trial 188 pruned. 
[I 2025-08-04 16:49:37,418] Trial 189 finished with value: 2.7424851972605264 and parameters: {'channels_list': [16, 32, 64], 'kernel_size': 3, 'padding': 1, 'pool_kernel': 2, 'dropout_rate': 0, 'fc_hidden_dim': 256, 'lr': 0.0017190701653896326, 'weight_decay': 0.005280317291089776, 'optimizer': 'sgd', 'activation': <class 'torch.nn.modules.activation.ReLU'>, 'batchnorm': True, 'epochs': 35, 'batch_size': 32, 'flip_prob': 0.0}. Best is trial 187 with value: 2.7078559371041733.
[I 2025-08-04 16:50:18,641] Trial 190 finished with value: 2.748460799045816 and parameters: {'channels_list': [16, 32, 64], 'kernel_size': 3, 'padding': 1, 'pool_kernel': 2, 'dropout_rate': 0, 'fc_hidden_dim': 256, 'lr': 0.0018897506433476485, 'weight_decay': 0.00705182012293228, 'optimizer': 'sgd', 'activation': <class 'torch.nn.modules.activation.ReLU'>, 'batchnorm': True, 'epochs': 35, 'batch_size': 32, 'flip_prob': 0.0}. Best is trial 187 with value: 2.7078559371041733.
[I 2025-08-04 16:50:48,759] Trial 191 finished with value: 2.7674730715619353 and parameters: {'channels_list': [16, 32, 64], 'kernel_size': 3, 'padding': 1, 'pool_kernel': 2, 'dropout_rate': 0, 'fc_hidden_dim': 256, 'lr': 0.0017606348804576342, 'weight_decay': 0.007872006129889824, 'optimizer': 'sgd', 'activation': <class 'torch.nn.modules.activation.ReLU'>, 'batchnorm': True, 'epochs': 35, 'batch_size': 32, 'flip_prob': 0.0}. Best is trial 187 with value: 2.7078559371041733.
[I 2025-08-04 16:51:32,318] Trial 192 finished with value: 2.7488991915101164 and parameters: {'channels_list': [16, 32, 64], 'kernel_size': 3, 'padding': 1, 'pool_kernel': 2, 'dropout_rate': 0, 'fc_hidden_dim': 256, 'lr': 0.001495858519209896, 'weight_decay': 0.006191078334756487, 'optimizer': 'sgd', 'activation': <class 'torch.nn.modules.activation.ReLU'>, 'batchnorm': True, 'epochs': 35, 'batch_size': 32, 'flip_prob': 0.0}. Best is trial 187 with value: 2.7078559371041733.
[I 2025-08-04 16:52:29,889] Trial 193 finished with value: 2.7259393088636408 and parameters: {'channels_list': [16, 32, 64], 'kernel_size': 3, 'padding': 1, 'pool_kernel': 2, 'dropout_rate': 0, 'fc_hidden_dim': 256, 'lr': 0.0021480591549258923, 'weight_decay': 0.008369214468494, 'optimizer': 'sgd', 'activation': <class 'torch.nn.modules.activation.ReLU'>, 'batchnorm': True, 'epochs': 35, 'batch_size': 32, 'flip_prob': 0.0}. Best is trial 187 with value: 2.7078559371041733.
[I 2025-08-04 16:53:22,085] Trial 194 finished with value: 2.7483223610821623 and parameters: {'channels_list': [16, 32, 64], 'kernel_size': 3, 'padding': 1, 'pool_kernel': 2, 'dropout_rate': 0, 'fc_hidden_dim': 256, 'lr': 0.00166859501686763, 'weight_decay': 0.004717484210310933, 'optimizer': 'sgd', 'activation': <class 'torch.nn.modules.activation.ReLU'>, 'batchnorm': True, 'epochs': 35, 'batch_size': 32, 'flip_prob': 0.0}. Best is trial 187 with value: 2.7078559371041733.
[I 2025-08-04 16:54:16,966] Trial 195 finished with value: 2.757621378317673 and parameters: {'channels_list': [16, 32, 64], 'kernel_size': 3, 'padding': 1, 'pool_kernel': 2, 'dropout_rate': 0, 'fc_hidden_dim': 256, 'lr': 0.0015806084328105628, 'weight_decay': 0.007260744536688851, 'optimizer': 'sgd', 'activation': <class 'torch.nn.modules.activation.ReLU'>, 'batchnorm': True, 'epochs': 35, 'batch_size': 32, 'flip_prob': 0.0}. Best is trial 187 with value: 2.7078559371041733.
[I 2025-08-04 16:55:13,893] Trial 196 finished with value: 2.727593626763191 and parameters: {'channels_list': [16, 32, 64], 'kernel_size': 3, 'padding': 1, 'pool_kernel': 2, 'dropout_rate': 0, 'fc_hidden_dim': 256, 'lr': 0.002085116249538265, 'weight_decay': 3.1644371311714342e-06, 'optimizer': 'sgd', 'activation': <class 'torch.nn.modules.activation.ReLU'>, 'batchnorm': True, 'epochs': 35, 'batch_size': 32, 'flip_prob': 0.0}. Best is trial 187 with value: 2.7078559371041733.
[I 2025-08-04 16:56:22,261] Trial 197 finished with value: 2.8128767924084452 and parameters: {'channels_list': [16, 32, 64], 'kernel_size': 3, 'padding': 0, 'pool_kernel': 2, 'dropout_rate': 0, 'fc_hidden_dim': 256, 'lr': 0.002048643113039389, 'weight_decay': 0.005970951890699517, 'optimizer': 'sgd', 'activation': <class 'torch.nn.modules.activation.ReLU'>, 'batchnorm': True, 'epochs': 35, 'batch_size': 32, 'flip_prob': 0.0}. Best is trial 187 with value: 2.7078559371041733.
