[I 2025-06-30 21:39:17,364] A new study created in memory with name: no-name-84d73ab3-f1e6-43e3-8b00-0140ade7635b
/uufs/chpc.utah.edu/common/home/u1325975/software/pkg/miniforge3/lib/python3.12/site-packages/optuna/distributions.py:518: UserWarning: Choices for a categorical distribution should be a tuple of None, bool, int, float and str for persistent storage but contains [16, 32, 64] which is of type list.
  warnings.warn(message)
/uufs/chpc.utah.edu/common/home/u1325975/software/pkg/miniforge3/lib/python3.12/site-packages/optuna/distributions.py:518: UserWarning: Choices for a categorical distribution should be a tuple of None, bool, int, float and str for persistent storage but contains [32, 64, 128] which is of type list.
  warnings.warn(message)
/uufs/chpc.utah.edu/common/home/u1325975/software/pkg/miniforge3/lib/python3.12/site-packages/optuna/distributions.py:518: UserWarning: Choices for a categorical distribution should be a tuple of None, bool, int, float and str for persistent storage but contains [16, 32, 64, 128] which is of type list.
  warnings.warn(message)
/uufs/chpc.utah.edu/common/home/u1325975/software/pkg/miniforge3/lib/python3.12/site-packages/optuna/distributions.py:518: UserWarning: Choices for a categorical distribution should be a tuple of None, bool, int, float and str for persistent storage but contains <class 'torch.nn.modules.activation.ReLU'> which is of type type.
  warnings.warn(message)
/uufs/chpc.utah.edu/common/home/u1325975/software/pkg/miniforge3/lib/python3.12/site-packages/optuna/distributions.py:518: UserWarning: Choices for a categorical distribution should be a tuple of None, bool, int, float and str for persistent storage but contains <class 'torch.nn.modules.activation.LeakyReLU'> which is of type type.
  warnings.warn(message)
[I 2025-06-30 21:39:17,414] Trial 0 pruned. 
[I 2025-06-30 21:39:17,421] Trial 1 pruned. 
[I 2025-06-30 21:39:17,425] Trial 2 pruned. 
[I 2025-06-30 21:39:17,433] Trial 3 pruned. 
[I 2025-06-30 21:39:17,437] Trial 4 pruned. 
[I 2025-06-30 21:39:17,445] Trial 5 pruned. 
[I 2025-06-30 21:39:17,451] Trial 6 pruned. 
[I 2025-06-30 21:39:17,455] Trial 7 pruned. 
/uufs/chpc.utah.edu/common/home/u1325975/software/pkg/miniforge3/lib/python3.12/site-packages/torch/cuda/__init__.py:789: UserWarning: Can't initialize NVML
  warnings.warn("Can't initialize NVML")
[I 2025-06-30 21:39:45,146] Trial 8 finished with value: inf and parameters: {'kernel_size': 3, 'channel_list': [16, 32, 64], 'padding': 1, 'pool_kernel': 2, 'dropout_rate': 0.5, 'fc_hidden_dim': 256, 'lr': 0.007123462125457461, 'weight_decay': 7.682387359737966e-05, 'optimizer': 'sgd', 'activation': <class 'torch.nn.modules.activation.LeakyReLU'>, 'batchnorm': True, 'epochs': 10, 'batch_size': 64, 'flip_prob': 0.5}. Best is trial 8 with value: inf.
[I 2025-06-30 21:40:30,532] Trial 9 finished with value: 31.372737087974286 and parameters: {'kernel_size': 3, 'channel_list': [32, 64, 128], 'padding': 1, 'pool_kernel': 2, 'dropout_rate': 0.1, 'fc_hidden_dim': 256, 'lr': 0.0009422142135229441, 'weight_decay': 0.001027203653765883, 'optimizer': 'adam', 'activation': <class 'torch.nn.modules.activation.LeakyReLU'>, 'batchnorm': True, 'epochs': 10, 'batch_size': 64, 'flip_prob': 1}. Best is trial 9 with value: 31.372737087974286.
[I 2025-06-30 21:40:30,547] Trial 10 pruned. 
[I 2025-06-30 21:40:52,496] Trial 11 finished with value: inf and parameters: {'kernel_size': 3, 'channel_list': [16, 32, 64], 'padding': 1, 'pool_kernel': 2, 'dropout_rate': 0.5, 'fc_hidden_dim': 256, 'lr': 0.004584905797870481, 'weight_decay': 0.00024227124709792744, 'optimizer': 'sgd', 'activation': <class 'torch.nn.modules.activation.LeakyReLU'>, 'batchnorm': True, 'epochs': 10, 'batch_size': 64, 'flip_prob': 0.5}. Best is trial 9 with value: 31.372737087974286.
[I 2025-06-30 21:41:56,687] Trial 12 finished with value: inf and parameters: {'kernel_size': 3, 'channel_list': [16, 32, 64], 'padding': 1, 'pool_kernel': 2, 'dropout_rate': 0.5, 'fc_hidden_dim': 256, 'lr': 0.0033303336394631894, 'weight_decay': 5.823261576622903e-05, 'optimizer': 'sgd', 'activation': <class 'torch.nn.modules.activation.LeakyReLU'>, 'batchnorm': True, 'epochs': 30, 'batch_size': 64, 'flip_prob': 0.5}. Best is trial 9 with value: 31.372737087974286.
[I 2025-06-30 21:42:36,229] Trial 13 finished with value: 16.141186355024665 and parameters: {'kernel_size': 3, 'channel_list': [32, 64, 128], 'padding': 1, 'pool_kernel': 2, 'dropout_rate': 0.1, 'fc_hidden_dim': 64, 'lr': 0.009210367095827076, 'weight_decay': 0.0006142474996778267, 'optimizer': 'adam', 'activation': <class 'torch.nn.modules.activation.LeakyReLU'>, 'batchnorm': True, 'epochs': 10, 'batch_size': 64, 'flip_prob': 0.0}. Best is trial 13 with value: 16.141186355024665.
[I 2025-06-30 21:43:07,133] Trial 14 finished with value: 16.7570311931973 and parameters: {'kernel_size': 3, 'channel_list': [32, 64, 128], 'padding': 1, 'pool_kernel': 2, 'dropout_rate': 0.1, 'fc_hidden_dim': 64, 'lr': 0.0005525665524795366, 'weight_decay': 0.000858311873964223, 'optimizer': 'adam', 'activation': <class 'torch.nn.modules.activation.LeakyReLU'>, 'batchnorm': True, 'epochs': 10, 'batch_size': 64, 'flip_prob': 0.0}. Best is trial 13 with value: 16.141186355024665.
[I 2025-06-30 21:43:42,176] Trial 15 finished with value: 16.958472600128182 and parameters: {'kernel_size': 3, 'channel_list': [32, 64, 128], 'padding': 1, 'pool_kernel': 2, 'dropout_rate': 0.1, 'fc_hidden_dim': 64, 'lr': 0.00041370395625489284, 'weight_decay': 0.0005177407666325297, 'optimizer': 'adam', 'activation': <class 'torch.nn.modules.activation.LeakyReLU'>, 'batchnorm': True, 'epochs': 10, 'batch_size': 128, 'flip_prob': 0.0}. Best is trial 13 with value: 16.141186355024665.
[I 2025-06-30 21:44:26,180] Trial 16 finished with value: 16.208158317209264 and parameters: {'kernel_size': 3, 'channel_list': [32, 64, 128], 'padding': 1, 'pool_kernel': 2, 'dropout_rate': 0.1, 'fc_hidden_dim': 64, 'lr': 0.00022405705422137807, 'weight_decay': 0.009906905571865299, 'optimizer': 'adam', 'activation': <class 'torch.nn.modules.activation.LeakyReLU'>, 'batchnorm': True, 'epochs': 15, 'batch_size': 64, 'flip_prob': 0.0}. Best is trial 13 with value: 16.141186355024665.
[I 2025-06-30 21:45:11,461] Trial 17 finished with value: 16.465896628580282 and parameters: {'kernel_size': 3, 'channel_list': [32, 64, 128], 'padding': 1, 'pool_kernel': 2, 'dropout_rate': 0.1, 'fc_hidden_dim': 64, 'lr': 0.00021443798400403293, 'weight_decay': 0.005257851017063937, 'optimizer': 'adam', 'activation': <class 'torch.nn.modules.activation.LeakyReLU'>, 'batchnorm': True, 'epochs': 15, 'batch_size': 64, 'flip_prob': 0.0}. Best is trial 13 with value: 16.141186355024665.
[I 2025-06-30 21:45:11,475] Trial 18 pruned. 
[I 2025-06-30 21:45:11,494] Trial 19 pruned. 
[I 2025-06-30 21:46:03,844] Trial 20 finished with value: 15.882606916000501 and parameters: {'kernel_size': 3, 'channel_list': [16, 32, 64, 128], 'padding': 1, 'pool_kernel': 2, 'dropout_rate': 0.1, 'fc_hidden_dim': 128, 'lr': 0.0053280106576825805, 'weight_decay': 1.8104913186831754e-05, 'optimizer': 'adam', 'activation': <class 'torch.nn.modules.activation.LeakyReLU'>, 'batchnorm': True, 'epochs': 20, 'batch_size': 64, 'flip_prob': 0.0}. Best is trial 20 with value: 15.882606916000501.
[I 2025-06-30 21:46:52,388] Trial 21 finished with value: 15.839313245513308 and parameters: {'kernel_size': 3, 'channel_list': [16, 32, 64, 128], 'padding': 1, 'pool_kernel': 2, 'dropout_rate': 0.1, 'fc_hidden_dim': 128, 'lr': 0.00481620775975695, 'weight_decay': 2.5434733039543763e-05, 'optimizer': 'adam', 'activation': <class 'torch.nn.modules.activation.LeakyReLU'>, 'batchnorm': True, 'epochs': 20, 'batch_size': 64, 'flip_prob': 0.0}. Best is trial 21 with value: 15.839313245513308.
[I 2025-06-30 21:47:40,658] Trial 22 finished with value: 15.86202503178158 and parameters: {'kernel_size': 3, 'channel_list': [16, 32, 64, 128], 'padding': 1, 'pool_kernel': 2, 'dropout_rate': 0.1, 'fc_hidden_dim': 128, 'lr': 0.005516441432113656, 'weight_decay': 1.9023426630804693e-05, 'optimizer': 'adam', 'activation': <class 'torch.nn.modules.activation.LeakyReLU'>, 'batchnorm': True, 'epochs': 20, 'batch_size': 64, 'flip_prob': 0.0}. Best is trial 21 with value: 15.839313245513308.
[I 2025-06-30 21:48:29,346] Trial 23 finished with value: 15.742945167277131 and parameters: {'kernel_size': 3, 'channel_list': [16, 32, 64, 128], 'padding': 1, 'pool_kernel': 2, 'dropout_rate': 0.1, 'fc_hidden_dim': 128, 'lr': 0.004671671661115141, 'weight_decay': 2.01565172329433e-05, 'optimizer': 'adam', 'activation': <class 'torch.nn.modules.activation.LeakyReLU'>, 'batchnorm': True, 'epochs': 20, 'batch_size': 64, 'flip_prob': 0.0}. Best is trial 23 with value: 15.742945167277131.
[I 2025-06-30 21:49:17,462] Trial 24 finished with value: 15.66940120467566 and parameters: {'kernel_size': 3, 'channel_list': [16, 32, 64, 128], 'padding': 1, 'pool_kernel': 2, 'dropout_rate': 0.1, 'fc_hidden_dim': 128, 'lr': 0.0031285684047235164, 'weight_decay': 1.7723854179023184e-05, 'optimizer': 'adam', 'activation': <class 'torch.nn.modules.activation.LeakyReLU'>, 'batchnorm': True, 'epochs': 20, 'batch_size': 64, 'flip_prob': 0.0}. Best is trial 24 with value: 15.66940120467566.
[I 2025-06-30 21:50:05,925] Trial 25 finished with value: 15.926554922108247 and parameters: {'kernel_size': 3, 'channel_list': [16, 32, 64, 128], 'padding': 1, 'pool_kernel': 2, 'dropout_rate': 0, 'fc_hidden_dim': 128, 'lr': 0.0025983940880439766, 'weight_decay': 8.166912351296897e-06, 'optimizer': 'adam', 'activation': <class 'torch.nn.modules.activation.LeakyReLU'>, 'batchnorm': True, 'epochs': 20, 'batch_size': 64, 'flip_prob': 0.0}. Best is trial 24 with value: 15.66940120467566.
[I 2025-06-30 21:50:05,938] Trial 26 pruned. 
[I 2025-06-30 21:50:55,903] Trial 27 finished with value: 15.91440694851983 and parameters: {'kernel_size': 3, 'channel_list': [16, 32, 64, 128], 'padding': 1, 'pool_kernel': 2, 'dropout_rate': 0.1, 'fc_hidden_dim': 128, 'lr': 0.003371322131817923, 'weight_decay': 5.358592652355796e-06, 'optimizer': 'adam', 'activation': <class 'torch.nn.modules.activation.LeakyReLU'>, 'batchnorm': True, 'epochs': 20, 'batch_size': 64, 'flip_prob': 0.0}. Best is trial 24 with value: 15.66940120467566.
[I 2025-06-30 21:50:55,924] Trial 28 pruned. 
[I 2025-06-30 21:50:55,939] Trial 29 pruned. 
[I 2025-06-30 21:50:55,956] Trial 30 pruned. 
[I 2025-06-30 21:51:45,510] Trial 31 finished with value: 15.883506402037197 and parameters: {'kernel_size': 3, 'channel_list': [16, 32, 64, 128], 'padding': 1, 'pool_kernel': 2, 'dropout_rate': 0.1, 'fc_hidden_dim': 128, 'lr': 0.006748759159061536, 'weight_decay': 2.5054941973847124e-05, 'optimizer': 'adam', 'activation': <class 'torch.nn.modules.activation.LeakyReLU'>, 'batchnorm': True, 'epochs': 20, 'batch_size': 64, 'flip_prob': 0.0}. Best is trial 24 with value: 15.66940120467566.
[I 2025-06-30 21:52:35,879] Trial 32 finished with value: 15.654752956102314 and parameters: {'kernel_size': 3, 'channel_list': [16, 32, 64, 128], 'padding': 1, 'pool_kernel': 2, 'dropout_rate': 0.1, 'fc_hidden_dim': 128, 'lr': 0.005907067765724854, 'weight_decay': 0.00010287502515671449, 'optimizer': 'adam', 'activation': <class 'torch.nn.modules.activation.LeakyReLU'>, 'batchnorm': True, 'epochs': 20, 'batch_size': 64, 'flip_prob': 0.0}. Best is trial 32 with value: 15.654752956102314.
[I 2025-06-30 21:53:25,245] Trial 33 finished with value: 15.677129343312798 and parameters: {'kernel_size': 3, 'channel_list': [16, 32, 64, 128], 'padding': 1, 'pool_kernel': 2, 'dropout_rate': 0, 'fc_hidden_dim': 128, 'lr': 0.003110087536550699, 'weight_decay': 1.1195100638292768e-06, 'optimizer': 'adam', 'activation': <class 'torch.nn.modules.activation.LeakyReLU'>, 'batchnorm': True, 'epochs': 20, 'batch_size': 64, 'flip_prob': 0.0}. Best is trial 32 with value: 15.654752956102314.
[I 2025-06-30 21:53:57,892] Trial 34 finished with value: 17.06481447497315 and parameters: {'kernel_size': 3, 'channel_list': [16, 32, 64, 128], 'padding': 1, 'pool_kernel': 2, 'dropout_rate': 0, 'fc_hidden_dim': 128, 'lr': 0.002664327426741025, 'weight_decay': 1.188091341032498e-06, 'optimizer': 'adam', 'activation': <class 'torch.nn.modules.activation.ReLU'>, 'batchnorm': True, 'epochs': 12, 'batch_size': 64, 'flip_prob': 0.75}. Best is trial 32 with value: 15.654752956102314.
[I 2025-06-30 21:53:57,910] Trial 35 pruned. 
[I 2025-06-30 21:53:57,925] Trial 36 pruned. 
[I 2025-06-30 21:53:57,940] Trial 37 pruned. 
[I 2025-06-30 21:53:57,956] Trial 38 pruned. 
[I 2025-06-30 21:54:46,498] Trial 39 finished with value: 28.357206516072576 and parameters: {'kernel_size': 3, 'channel_list': [16, 32, 64, 128], 'padding': 1, 'pool_kernel': 2, 'dropout_rate': 0, 'fc_hidden_dim': 128, 'lr': 0.009585410376619584, 'weight_decay': 5.026748886879741e-06, 'optimizer': 'adam', 'activation': <class 'torch.nn.modules.activation.LeakyReLU'>, 'batchnorm': True, 'epochs': 12, 'batch_size': 32, 'flip_prob': 1}. Best is trial 32 with value: 15.654752956102314.
[I 2025-06-30 21:54:46,513] Trial 40 pruned. 
[I 2025-06-30 21:55:36,163] Trial 41 finished with value: 15.87199894654747 and parameters: {'kernel_size': 3, 'channel_list': [16, 32, 64, 128], 'padding': 1, 'pool_kernel': 2, 'dropout_rate': 0.1, 'fc_hidden_dim': 128, 'lr': 0.004481364696293065, 'weight_decay': 4.7238921139667876e-05, 'optimizer': 'adam', 'activation': <class 'torch.nn.modules.activation.LeakyReLU'>, 'batchnorm': True, 'epochs': 20, 'batch_size': 64, 'flip_prob': 0.0}. Best is trial 32 with value: 15.654752956102314.
[I 2025-06-30 21:56:26,077] Trial 42 finished with value: 15.655784064159162 and parameters: {'kernel_size': 3, 'channel_list': [16, 32, 64, 128], 'padding': 1, 'pool_kernel': 2, 'dropout_rate': 0.1, 'fc_hidden_dim': 128, 'lr': 0.007378402106304143, 'weight_decay': 9.375364425647329e-06, 'optimizer': 'adam', 'activation': <class 'torch.nn.modules.activation.LeakyReLU'>, 'batchnorm': True, 'epochs': 20, 'batch_size': 64, 'flip_prob': 0.0}. Best is trial 32 with value: 15.654752956102314.
[I 2025-06-30 21:57:15,822] Trial 43 finished with value: 15.824893282066961 and parameters: {'kernel_size': 3, 'channel_list': [16, 32, 64, 128], 'padding': 1, 'pool_kernel': 2, 'dropout_rate': 0.1, 'fc_hidden_dim': 128, 'lr': 0.007001848163565323, 'weight_decay': 9.625299309796501e-06, 'optimizer': 'adam', 'activation': <class 'torch.nn.modules.activation.LeakyReLU'>, 'batchnorm': True, 'epochs': 20, 'batch_size': 64, 'flip_prob': 0.0}. Best is trial 32 with value: 15.654752956102314.
[I 2025-06-30 21:58:21,700] Trial 44 finished with value: 16.403171570794417 and parameters: {'kernel_size': 3, 'channel_list': [16, 32, 64, 128], 'padding': 1, 'pool_kernel': 2, 'dropout_rate': 0.5, 'fc_hidden_dim': 128, 'lr': 0.008135338185118622, 'weight_decay': 8.926051912249413e-05, 'optimizer': 'adam', 'activation': <class 'torch.nn.modules.activation.LeakyReLU'>, 'batchnorm': True, 'epochs': 25, 'batch_size': 64, 'flip_prob': 0.5}. Best is trial 32 with value: 15.654752956102314.
[I 2025-06-30 21:59:35,684] Trial 45 finished with value: 15.668359029445043 and parameters: {'kernel_size': 3, 'channel_list': [16, 32, 64, 128], 'padding': 1, 'pool_kernel': 2, 'dropout_rate': 0.1, 'fc_hidden_dim': 128, 'lr': 0.005855367002439362, 'weight_decay': 2.1926692454117846e-06, 'optimizer': 'adam', 'activation': <class 'torch.nn.modules.activation.LeakyReLU'>, 'batchnorm': True, 'epochs': 30, 'batch_size': 64, 'flip_prob': 0.0}. Best is trial 32 with value: 15.654752956102314.
[I 2025-06-30 22:00:24,368] Trial 46 finished with value: 33.4036983297946 and parameters: {'kernel_size': 5, 'channel_list': [16, 32, 64], 'padding': 1, 'pool_kernel': 2, 'dropout_rate': 0.1, 'fc_hidden_dim': 128, 'lr': 0.005823929537639526, 'weight_decay': 1.7278120675821084e-06, 'optimizer': 'sgd', 'activation': <class 'torch.nn.modules.activation.LeakyReLU'>, 'batchnorm': True, 'epochs': 30, 'batch_size': 128, 'flip_prob': 1}. Best is trial 32 with value: 15.654752956102314.
[I 2025-06-30 22:01:38,344] Trial 47 finished with value: 15.68743175694895 and parameters: {'kernel_size': 3, 'channel_list': [16, 32, 64, 128], 'padding': 1, 'pool_kernel': 2, 'dropout_rate': 0.5, 'fc_hidden_dim': 128, 'lr': 0.009958840912458963, 'weight_decay': 1.981526252361394e-06, 'optimizer': 'adam', 'activation': <class 'torch.nn.modules.activation.LeakyReLU'>, 'batchnorm': True, 'epochs': 30, 'batch_size': 64, 'flip_prob': 0.0}. Best is trial 32 with value: 15.654752956102314.
[I 2025-06-30 22:02:52,867] Trial 48 finished with value: 16.10636279784842 and parameters: {'kernel_size': 3, 'channel_list': [16, 32, 64, 128], 'padding': 1, 'pool_kernel': 2, 'dropout_rate': 0.1, 'fc_hidden_dim': 256, 'lr': 0.0021843773378177325, 'weight_decay': 6.417241253956019e-06, 'optimizer': 'adam', 'activation': <class 'torch.nn.modules.activation.LeakyReLU'>, 'batchnorm': True, 'epochs': 30, 'batch_size': 64, 'flip_prob': 0.0}. Best is trial 32 with value: 15.654752956102314.
[I 2025-06-30 22:02:52,884] Trial 49 pruned. 
[I 2025-06-30 22:02:52,901] Trial 50 pruned. 
[I 2025-06-30 22:04:06,811] Trial 51 finished with value: 16.05662354864923 and parameters: {'kernel_size': 3, 'channel_list': [16, 32, 64, 128], 'padding': 1, 'pool_kernel': 2, 'dropout_rate': 0.5, 'fc_hidden_dim': 128, 'lr': 0.0096180544851113, 'weight_decay': 1.8424378882613585e-06, 'optimizer': 'adam', 'activation': <class 'torch.nn.modules.activation.LeakyReLU'>, 'batchnorm': True, 'epochs': 30, 'batch_size': 64, 'flip_prob': 0.0}. Best is trial 32 with value: 15.654752956102314.
[I 2025-06-30 22:05:19,704] Trial 52 finished with value: 15.826334195419166 and parameters: {'kernel_size': 3, 'channel_list': [16, 32, 64, 128], 'padding': 1, 'pool_kernel': 2, 'dropout_rate': 0.5, 'fc_hidden_dim': 128, 'lr': 0.00823171763619001, 'weight_decay': 1.5395011099051681e-06, 'optimizer': 'adam', 'activation': <class 'torch.nn.modules.activation.LeakyReLU'>, 'batchnorm': True, 'epochs': 30, 'batch_size': 64, 'flip_prob': 0.0}. Best is trial 32 with value: 15.654752956102314.
[I 2025-06-30 22:06:33,598] Trial 53 finished with value: 15.814152935198921 and parameters: {'kernel_size': 3, 'channel_list': [16, 32, 64, 128], 'padding': 1, 'pool_kernel': 2, 'dropout_rate': 0.5, 'fc_hidden_dim': 128, 'lr': 0.006113228717313875, 'weight_decay': 2.7134382268816555e-06, 'optimizer': 'adam', 'activation': <class 'torch.nn.modules.activation.LeakyReLU'>, 'batchnorm': True, 'epochs': 30, 'batch_size': 64, 'flip_prob': 0.0}. Best is trial 32 with value: 15.654752956102314.
[I 2025-06-30 22:07:48,105] Trial 54 finished with value: 15.911642989289257 and parameters: {'kernel_size': 3, 'channel_list': [16, 32, 64, 128], 'padding': 1, 'pool_kernel': 2, 'dropout_rate': 0.5, 'fc_hidden_dim': 256, 'lr': 0.0007411369727263334, 'weight_decay': 2.219583431553758e-06, 'optimizer': 'adam', 'activation': <class 'torch.nn.modules.activation.LeakyReLU'>, 'batchnorm': True, 'epochs': 30, 'batch_size': 64, 'flip_prob': 0.0}. Best is trial 32 with value: 15.654752956102314.
[I 2025-06-30 22:08:00,901] Trial 55 finished with value: 16.205300293080985 and parameters: {'kernel_size': 3, 'channel_list': [16, 32, 64, 128], 'padding': 1, 'pool_kernel': 2, 'dropout_rate': 0.5, 'fc_hidden_dim': 128, 'lr': 0.003928083768448613, 'weight_decay': 3.6937518068655215e-06, 'optimizer': 'adam', 'activation': <class 'torch.nn.modules.activation.LeakyReLU'>, 'batchnorm': True, 'epochs': 5, 'batch_size': 64, 'flip_prob': 0.25}. Best is trial 32 with value: 15.654752956102314.
[I 2025-06-30 22:08:52,865] Trial 56 finished with value: 26.106234765902343 and parameters: {'kernel_size': 3, 'channel_list': [16, 32, 64, 128], 'padding': 1, 'pool_kernel': 2, 'dropout_rate': 0.5, 'fc_hidden_dim': 128, 'lr': 0.005430688453597763, 'weight_decay': 1.0324942771612263e-06, 'optimizer': 'adam', 'activation': <class 'torch.nn.modules.activation.LeakyReLU'>, 'batchnorm': True, 'epochs': 25, 'batch_size': 128, 'flip_prob': 1}. Best is trial 32 with value: 15.654752956102314.
[I 2025-06-30 22:09:29,207] Trial 57 finished with value: 16.26081393379992 and parameters: {'kernel_size': 3, 'channel_list': [16, 32, 64, 128], 'padding': 1, 'pool_kernel': 2, 'dropout_rate': 0.1, 'fc_hidden_dim': 128, 'lr': 0.00809261983373328, 'weight_decay': 7.556925395207455e-06, 'optimizer': 'adam', 'activation': <class 'torch.nn.modules.activation.LeakyReLU'>, 'batchnorm': True, 'epochs': 15, 'batch_size': 64, 'flip_prob': 0.0}. Best is trial 32 with value: 15.654752956102314.
[I 2025-06-30 22:10:42,476] Trial 58 finished with value: 15.590755557733331 and parameters: {'kernel_size': 3, 'channel_list': [16, 32, 64, 128], 'padding': 1, 'pool_kernel': 2, 'dropout_rate': 0.1, 'fc_hidden_dim': 128, 'lr': 0.002810468817064702, 'weight_decay': 4.420395889886523e-06, 'optimizer': 'adam', 'activation': <class 'torch.nn.modules.activation.ReLU'>, 'batchnorm': True, 'epochs': 30, 'batch_size': 64, 'flip_prob': 0.0}. Best is trial 58 with value: 15.590755557733331.
[I 2025-06-30 22:10:42,491] Trial 59 pruned. 
[I 2025-06-30 22:10:42,509] Trial 60 pruned. 
[I 2025-06-30 22:11:56,396] Trial 61 finished with value: 16.04979001513179 and parameters: {'kernel_size': 3, 'channel_list': [16, 32, 64, 128], 'padding': 1, 'pool_kernel': 2, 'dropout_rate': 0.1, 'fc_hidden_dim': 128, 'lr': 0.0017374247119404304, 'weight_decay': 2.5271329550231843e-06, 'optimizer': 'adam', 'activation': <class 'torch.nn.modules.activation.ReLU'>, 'batchnorm': True, 'epochs': 30, 'batch_size': 64, 'flip_prob': 0.0}. Best is trial 58 with value: 15.590755557733331.
