[I 2025-06-30 23:32:29,389] Trial 165 finished with value: 15.614431129946901 and parameters: {'kernel_size': 3, 'channel_list': [16, 32, 64, 128], 'padding': 1, 'pool_kernel': 2, 'dropout_rate': 0, 'fc_hidden_dim': 128, 'lr': 0.006832045123936597, 'weight_decay': 5.7074320390543275e-06, 'optimizer': 'adam', 'activation': <class 'torch.nn.modules.activation.LeakyReLU'>, 'batchnorm': True, 'epochs': 20, 'batch_size': 64, 'flip_prob': 0.0}. Best is trial 121 with value: 15.493945159799877.
[I 2025-06-30 23:33:34,709] Trial 166 finished with value: 16.04052443502775 and parameters: {'kernel_size': 3, 'channel_list': [16, 32, 64, 128], 'padding': 1, 'pool_kernel': 2, 'dropout_rate': 0, 'fc_hidden_dim': 128, 'lr': 0.0067887622482726215, 'weight_decay': 1.0819688050935008e-05, 'optimizer': 'adam', 'activation': <class 'torch.nn.modules.activation.ReLU'>, 'batchnorm': True, 'epochs': 25, 'batch_size': 64, 'flip_prob': 0.5}. Best is trial 121 with value: 15.493945159799877.
[I 2025-06-30 23:33:34,731] Trial 167 pruned. 
[I 2025-06-30 23:34:47,340] Trial 168 finished with value: 15.765403104085632 and parameters: {'kernel_size': 3, 'channel_list': [16, 32, 64, 128], 'padding': 1, 'pool_kernel': 2, 'dropout_rate': 0, 'fc_hidden_dim': 128, 'lr': 0.0063459961443008426, 'weight_decay': 8.126806858997216e-06, 'optimizer': 'adam', 'activation': <class 'torch.nn.modules.activation.LeakyReLU'>, 'batchnorm': True, 'epochs': 30, 'batch_size': 64, 'flip_prob': 0.0}. Best is trial 121 with value: 15.493945159799877.
[I 2025-06-30 23:34:47,361] Trial 169 pruned. 
[I 2025-06-30 23:35:05,839] Trial 170 finished with value: 16.889068800859803 and parameters: {'kernel_size': 3, 'channel_list': [32, 64, 128], 'padding': 1, 'pool_kernel': 2, 'dropout_rate': 0, 'fc_hidden_dim': 128, 'lr': 0.005767199641274209, 'weight_decay': 1.1448135609270522e-06, 'optimizer': 'adam', 'activation': <class 'torch.nn.modules.activation.LeakyReLU'>, 'batchnorm': True, 'epochs': 5, 'batch_size': 64, 'flip_prob': 0.25}. Best is trial 121 with value: 15.493945159799877.
[I 2025-06-30 23:35:57,289] Trial 171 finished with value: 15.684527811173249 and parameters: {'kernel_size': 3, 'channel_list': [16, 32, 64, 128], 'padding': 1, 'pool_kernel': 2, 'dropout_rate': 0.1, 'fc_hidden_dim': 128, 'lr': 0.00520557060345254, 'weight_decay': 3.466406931515792e-06, 'optimizer': 'adam', 'activation': <class 'torch.nn.modules.activation.LeakyReLU'>, 'batchnorm': True, 'epochs': 20, 'batch_size': 64, 'flip_prob': 0.0}. Best is trial 121 with value: 15.493945159799877.
[I 2025-06-30 23:36:46,895] Trial 172 finished with value: 15.834683502760928 and parameters: {'kernel_size': 3, 'channel_list': [16, 32, 64, 128], 'padding': 1, 'pool_kernel': 2, 'dropout_rate': 0.1, 'fc_hidden_dim': 128, 'lr': 0.005130724514873795, 'weight_decay': 4.677277245587625e-06, 'optimizer': 'adam', 'activation': <class 'torch.nn.modules.activation.LeakyReLU'>, 'batchnorm': True, 'epochs': 20, 'batch_size': 64, 'flip_prob': 0.0}. Best is trial 121 with value: 15.493945159799877.
[I 2025-06-30 23:37:36,306] Trial 173 finished with value: 15.65969365030459 and parameters: {'kernel_size': 3, 'channel_list': [16, 32, 64, 128], 'padding': 1, 'pool_kernel': 2, 'dropout_rate': 0.1, 'fc_hidden_dim': 128, 'lr': 0.005503579768273554, 'weight_decay': 3.304149368673658e-06, 'optimizer': 'adam', 'activation': <class 'torch.nn.modules.activation.LeakyReLU'>, 'batchnorm': True, 'epochs': 20, 'batch_size': 64, 'flip_prob': 0.0}. Best is trial 121 with value: 15.493945159799877.
[I 2025-06-30 23:38:24,912] Trial 174 finished with value: 15.579525433166543 and parameters: {'kernel_size': 3, 'channel_list': [16, 32, 64, 128], 'padding': 1, 'pool_kernel': 2, 'dropout_rate': 0.1, 'fc_hidden_dim': 128, 'lr': 0.005740805727171165, 'weight_decay': 3.2028132322667415e-06, 'optimizer': 'adam', 'activation': <class 'torch.nn.modules.activation.LeakyReLU'>, 'batchnorm': True, 'epochs': 20, 'batch_size': 64, 'flip_prob': 0.0}. Best is trial 121 with value: 15.493945159799877.
[I 2025-06-30 23:39:14,381] Trial 175 finished with value: 15.892866453574195 and parameters: {'kernel_size': 3, 'channel_list': [16, 32, 64, 128], 'padding': 1, 'pool_kernel': 2, 'dropout_rate': 0.1, 'fc_hidden_dim': 128, 'lr': 0.00624546959812597, 'weight_decay': 5.093258136684158e-06, 'optimizer': 'adam', 'activation': <class 'torch.nn.modules.activation.LeakyReLU'>, 'batchnorm': True, 'epochs': 20, 'batch_size': 64, 'flip_prob': 0.0}. Best is trial 121 with value: 15.493945159799877.
[I 2025-06-30 23:40:03,909] Trial 176 finished with value: 15.801873715261339 and parameters: {'kernel_size': 3, 'channel_list': [16, 32, 64, 128], 'padding': 1, 'pool_kernel': 2, 'dropout_rate': 0.1, 'fc_hidden_dim': 128, 'lr': 0.005830286613020634, 'weight_decay': 3.0354026870776254e-06, 'optimizer': 'adam', 'activation': <class 'torch.nn.modules.activation.LeakyReLU'>, 'batchnorm': True, 'epochs': 20, 'batch_size': 64, 'flip_prob': 0.0}. Best is trial 121 with value: 15.493945159799877.
[I 2025-06-30 23:40:53,479] Trial 177 finished with value: 15.84706053245921 and parameters: {'kernel_size': 3, 'channel_list': [16, 32, 64, 128], 'padding': 1, 'pool_kernel': 2, 'dropout_rate': 0.1, 'fc_hidden_dim': 128, 'lr': 0.006749005062635982, 'weight_decay': 6.8532011630068355e-06, 'optimizer': 'adam', 'activation': <class 'torch.nn.modules.activation.LeakyReLU'>, 'batchnorm': True, 'epochs': 20, 'batch_size': 64, 'flip_prob': 0.0}. Best is trial 121 with value: 15.493945159799877.
[I 2025-06-30 23:41:28,944] Trial 178 finished with value: 15.83119044813622 and parameters: {'kernel_size': 3, 'channel_list': [16, 32, 64, 128], 'padding': 1, 'pool_kernel': 2, 'dropout_rate': 0.1, 'fc_hidden_dim': 256, 'lr': 0.005602799279317205, 'weight_decay': 2.3193403701636634e-06, 'optimizer': 'adam', 'activation': <class 'torch.nn.modules.activation.LeakyReLU'>, 'batchnorm': True, 'epochs': 20, 'batch_size': 128, 'flip_prob': 0.0}. Best is trial 121 with value: 15.493945159799877.
[I 2025-06-30 23:41:28,972] Trial 179 pruned. 
[I 2025-06-30 23:42:43,580] Trial 180 finished with value: 15.903155454976686 and parameters: {'kernel_size': 3, 'channel_list': [16, 32, 64, 128], 'padding': 1, 'pool_kernel': 2, 'dropout_rate': 0, 'fc_hidden_dim': 128, 'lr': 0.0046754924435574155, 'weight_decay': 4.3723764594385565e-06, 'optimizer': 'adam', 'activation': <class 'torch.nn.modules.activation.LeakyReLU'>, 'batchnorm': True, 'epochs': 20, 'batch_size': 32, 'flip_prob': 0.0}. Best is trial 121 with value: 15.493945159799877.
[I 2025-06-30 23:43:33,624] Trial 181 finished with value: 15.750390826584116 and parameters: {'kernel_size': 3, 'channel_list': [16, 32, 64, 128], 'padding': 1, 'pool_kernel': 2, 'dropout_rate': 0.1, 'fc_hidden_dim': 128, 'lr': 0.005077529500535926, 'weight_decay': 3.622580022559013e-06, 'optimizer': 'adam', 'activation': <class 'torch.nn.modules.activation.LeakyReLU'>, 'batchnorm': True, 'epochs': 20, 'batch_size': 64, 'flip_prob': 0.0}. Best is trial 121 with value: 15.493945159799877.
[I 2025-06-30 23:44:23,291] Trial 182 finished with value: 15.910736919501593 and parameters: {'kernel_size': 3, 'channel_list': [16, 32, 64, 128], 'padding': 1, 'pool_kernel': 2, 'dropout_rate': 0.1, 'fc_hidden_dim': 128, 'lr': 0.005506675784029941, 'weight_decay': 2.75615389828636e-06, 'optimizer': 'adam', 'activation': <class 'torch.nn.modules.activation.LeakyReLU'>, 'batchnorm': True, 'epochs': 20, 'batch_size': 64, 'flip_prob': 0.0}. Best is trial 121 with value: 15.493945159799877.
[I 2025-06-30 23:45:13,664] Trial 183 finished with value: 15.860399134293925 and parameters: {'kernel_size': 3, 'channel_list': [16, 32, 64, 128], 'padding': 1, 'pool_kernel': 2, 'dropout_rate': 0.1, 'fc_hidden_dim': 128, 'lr': 0.0035707362268046286, 'weight_decay': 3.3632292727152974e-06, 'optimizer': 'adam', 'activation': <class 'torch.nn.modules.activation.LeakyReLU'>, 'batchnorm': True, 'epochs': 20, 'batch_size': 64, 'flip_prob': 0.0}. Best is trial 121 with value: 15.493945159799877.
[I 2025-06-30 23:46:06,458] Trial 184 finished with value: 15.717924085930695 and parameters: {'kernel_size': 3, 'channel_list': [16, 32, 64, 128], 'padding': 1, 'pool_kernel': 2, 'dropout_rate': 0.1, 'fc_hidden_dim': 128, 'lr': 0.002945236667492545, 'weight_decay': 5.567421222296216e-06, 'optimizer': 'adam', 'activation': <class 'torch.nn.modules.activation.LeakyReLU'>, 'batchnorm': True, 'epochs': 20, 'batch_size': 64, 'flip_prob': 0.0}. Best is trial 121 with value: 15.493945159799877.
[I 2025-06-30 23:46:56,165] Trial 185 finished with value: 15.8410757023667 and parameters: {'kernel_size': 3, 'channel_list': [16, 32, 64, 128], 'padding': 1, 'pool_kernel': 2, 'dropout_rate': 0.1, 'fc_hidden_dim': 128, 'lr': 0.004239539230890141, 'weight_decay': 1.998747551383245e-06, 'optimizer': 'adam', 'activation': <class 'torch.nn.modules.activation.LeakyReLU'>, 'batchnorm': True, 'epochs': 20, 'batch_size': 64, 'flip_prob': 0.0}. Best is trial 121 with value: 15.493945159799877.
[I 2025-06-30 23:47:47,130] Trial 186 finished with value: inf and parameters: {'kernel_size': 3, 'channel_list': [16, 32, 64, 128], 'padding': 1, 'pool_kernel': 2, 'dropout_rate': 0.1, 'fc_hidden_dim': 128, 'lr': 0.00648326520080004, 'weight_decay': 9.79245436180578e-05, 'optimizer': 'sgd', 'activation': <class 'torch.nn.modules.activation.LeakyReLU'>, 'batchnorm': True, 'epochs': 20, 'batch_size': 64, 'flip_prob': 0.75}. Best is trial 121 with value: 15.493945159799877.
[I 2025-06-30 23:48:37,657] Trial 187 finished with value: 15.946818934113576 and parameters: {'kernel_size': 3, 'channel_list': [16, 32, 64, 128], 'padding': 1, 'pool_kernel': 2, 'dropout_rate': 0.1, 'fc_hidden_dim': 128, 'lr': 0.005317684264967588, 'weight_decay': 3.077411383952233e-06, 'optimizer': 'adam', 'activation': <class 'torch.nn.modules.activation.LeakyReLU'>, 'batchnorm': True, 'epochs': 20, 'batch_size': 64, 'flip_prob': 0.0}. Best is trial 121 with value: 15.493945159799877.
[I 2025-06-30 23:49:33,758] Trial 188 finished with value: 29.296701776081147 and parameters: {'kernel_size': 3, 'channel_list': [16, 32, 64, 128], 'padding': 1, 'pool_kernel': 2, 'dropout_rate': 0.1, 'fc_hidden_dim': 128, 'lr': 0.006049346311333632, 'weight_decay': 4.370214291972081e-06, 'optimizer': 'adam', 'activation': <class 'torch.nn.modules.activation.ReLU'>, 'batchnorm': True, 'epochs': 20, 'batch_size': 64, 'flip_prob': 1}. Best is trial 121 with value: 15.493945159799877.
[I 2025-06-30 23:50:24,081] Trial 189 finished with value: 15.800602836833354 and parameters: {'kernel_size': 3, 'channel_list': [16, 32, 64, 128], 'padding': 1, 'pool_kernel': 2, 'dropout_rate': 0.1, 'fc_hidden_dim': 128, 'lr': 0.007210801318897212, 'weight_decay': 3.600182172624614e-06, 'optimizer': 'adam', 'activation': <class 'torch.nn.modules.activation.LeakyReLU'>, 'batchnorm': True, 'epochs': 20, 'batch_size': 64, 'flip_prob': 0.0}. Best is trial 121 with value: 15.493945159799877.
[I 2025-06-30 23:51:13,182] Trial 190 finished with value: 17.017331415471318 and parameters: {'kernel_size': 3, 'channel_list': [16, 32, 64, 128], 'padding': 1, 'pool_kernel': 2, 'dropout_rate': 0.1, 'fc_hidden_dim': 128, 'lr': 0.0001391154318035354, 'weight_decay': 2.443846457870221e-06, 'optimizer': 'adam', 'activation': <class 'torch.nn.modules.activation.LeakyReLU'>, 'batchnorm': True, 'epochs': 20, 'batch_size': 64, 'flip_prob': 0.0}. Best is trial 121 with value: 15.493945159799877.
[I 2025-06-30 23:52:26,740] Trial 191 finished with value: 15.838657609229385 and parameters: {'kernel_size': 3, 'channel_list': [16, 32, 64, 128], 'padding': 1, 'pool_kernel': 2, 'dropout_rate': 0.1, 'fc_hidden_dim': 128, 'lr': 0.008022335452455025, 'weight_decay': 1.9113482463122813e-06, 'optimizer': 'adam', 'activation': <class 'torch.nn.modules.activation.LeakyReLU'>, 'batchnorm': True, 'epochs': 30, 'batch_size': 64, 'flip_prob': 0.0}. Best is trial 121 with value: 15.493945159799877.
[I 2025-06-30 23:53:42,078] Trial 192 finished with value: 15.90037943343393 and parameters: {'kernel_size': 3, 'channel_list': [16, 32, 64, 128], 'padding': 1, 'pool_kernel': 2, 'dropout_rate': 0, 'fc_hidden_dim': 128, 'lr': 0.0027488096548140047, 'weight_decay': 5.941769071159258e-06, 'optimizer': 'adam', 'activation': <class 'torch.nn.modules.activation.LeakyReLU'>, 'batchnorm': True, 'epochs': 30, 'batch_size': 64, 'flip_prob': 0.0}. Best is trial 121 with value: 15.493945159799877.
[I 2025-06-30 23:54:19,368] Trial 193 finished with value: 15.90977240247873 and parameters: {'kernel_size': 3, 'channel_list': [16, 32, 64, 128], 'padding': 1, 'pool_kernel': 2, 'dropout_rate': 0.1, 'fc_hidden_dim': 128, 'lr': 0.008843406503606335, 'weight_decay': 7.244689379943715e-05, 'optimizer': 'adam', 'activation': <class 'torch.nn.modules.activation.LeakyReLU'>, 'batchnorm': True, 'epochs': 15, 'batch_size': 64, 'flip_prob': 0.0}. Best is trial 121 with value: 15.493945159799877.
[I 2025-06-30 23:55:32,918] Trial 194 finished with value: 15.78413961197902 and parameters: {'kernel_size': 3, 'channel_list': [16, 32, 64, 128], 'padding': 1, 'pool_kernel': 2, 'dropout_rate': 0.5, 'fc_hidden_dim': 128, 'lr': 0.0032009056672580136, 'weight_decay': 2.845529279478515e-06, 'optimizer': 'adam', 'activation': <class 'torch.nn.modules.activation.LeakyReLU'>, 'batchnorm': True, 'epochs': 30, 'batch_size': 64, 'flip_prob': 0.0}. Best is trial 121 with value: 15.493945159799877.
[I 2025-06-30 23:56:14,369] Trial 195 finished with value: 16.765713103731773 and parameters: {'kernel_size': 3, 'channel_list': [16, 32, 64, 128], 'padding': 1, 'pool_kernel': 2, 'dropout_rate': 0.1, 'fc_hidden_dim': 128, 'lr': 0.00988342156751557, 'weight_decay': 2.2757291700530503e-06, 'optimizer': 'adam', 'activation': <class 'torch.nn.modules.activation.LeakyReLU'>, 'batchnorm': False, 'epochs': 20, 'batch_size': 64, 'flip_prob': 0.0}. Best is trial 121 with value: 15.493945159799877.
[I 2025-06-30 23:56:14,394] Trial 196 pruned. 
[I 2025-06-30 23:57:27,723] Trial 197 finished with value: 15.956457777793362 and parameters: {'kernel_size': 3, 'channel_list': [16, 32, 64, 128], 'padding': 1, 'pool_kernel': 2, 'dropout_rate': 0.1, 'fc_hidden_dim': 128, 'lr': 0.004712402824037461, 'weight_decay': 0.0005133083526976695, 'optimizer': 'adam', 'activation': <class 'torch.nn.modules.activation.LeakyReLU'>, 'batchnorm': True, 'epochs': 30, 'batch_size': 64, 'flip_prob': 0.0}. Best is trial 121 with value: 15.493945159799877.
[I 2025-06-30 23:58:17,011] Trial 198 finished with value: 16.092166625350547 and parameters: {'kernel_size': 3, 'channel_list': [16, 32, 64, 128], 'padding': 1, 'pool_kernel': 2, 'dropout_rate': 0.1, 'fc_hidden_dim': 128, 'lr': 0.006832169245949836, 'weight_decay': 1.8049800709339027e-06, 'optimizer': 'adam', 'activation': <class 'torch.nn.modules.activation.LeakyReLU'>, 'batchnorm': True, 'epochs': 20, 'batch_size': 64, 'flip_prob': 0.0}. Best is trial 121 with value: 15.493945159799877.
[I 2025-06-30 23:58:41,902] Trial 199 finished with value: 16.349973635565966 and parameters: {'kernel_size': 3, 'channel_list': [16, 32, 64], 'padding': 1, 'pool_kernel': 2, 'dropout_rate': 0, 'fc_hidden_dim': 64, 'lr': 0.005849144511305896, 'weight_decay': 4.718801761651692e-06, 'optimizer': 'adam', 'activation': <class 'torch.nn.modules.activation.LeakyReLU'>, 'batchnorm': True, 'epochs': 12, 'batch_size': 64, 'flip_prob': 0.0}. Best is trial 121 with value: 15.493945159799877.
[I 2025-06-30 23:58:41,928] Trial 200 pruned. 
[I 2025-06-30 23:59:31,069] Trial 201 finished with value: 15.737083189079831 and parameters: {'kernel_size': 3, 'channel_list': [16, 32, 64, 128], 'padding': 1, 'pool_kernel': 2, 'dropout_rate': 0.1, 'fc_hidden_dim': 64, 'lr': 0.004124241938386172, 'weight_decay': 3.436863570554831e-06, 'optimizer': 'adam', 'activation': <class 'torch.nn.modules.activation.LeakyReLU'>, 'batchnorm': True, 'epochs': 20, 'batch_size': 64, 'flip_prob': 0.0}. Best is trial 121 with value: 15.493945159799877.
[I 2025-07-01 00:00:20,356] Trial 202 finished with value: 15.777422375911277 and parameters: {'kernel_size': 3, 'channel_list': [16, 32, 64, 128], 'padding': 1, 'pool_kernel': 2, 'dropout_rate': 0.1, 'fc_hidden_dim': 64, 'lr': 0.003275020479531784, 'weight_decay': 2.7376386432888153e-06, 'optimizer': 'adam', 'activation': <class 'torch.nn.modules.activation.LeakyReLU'>, 'batchnorm': True, 'epochs': 20, 'batch_size': 64, 'flip_prob': 0.0}. Best is trial 121 with value: 15.493945159799877.
[I 2025-07-01 00:01:09,112] Trial 203 finished with value: 15.952530471512445 and parameters: {'kernel_size': 3, 'channel_list': [16, 32, 64, 128], 'padding': 1, 'pool_kernel': 2, 'dropout_rate': 0.1, 'fc_hidden_dim': 64, 'lr': 0.0036731251555704547, 'weight_decay': 4.437536027722884e-06, 'optimizer': 'adam', 'activation': <class 'torch.nn.modules.activation.LeakyReLU'>, 'batchnorm': True, 'epochs': 20, 'batch_size': 64, 'flip_prob': 0.0}. Best is trial 121 with value: 15.493945159799877.
[I 2025-07-01 00:01:57,852] Trial 204 finished with value: 15.990082050546707 and parameters: {'kernel_size': 3, 'channel_list': [16, 32, 64, 128], 'padding': 1, 'pool_kernel': 2, 'dropout_rate': 0.1, 'fc_hidden_dim': 64, 'lr': 0.00516326598832576, 'weight_decay': 3.925477053555793e-06, 'optimizer': 'adam', 'activation': <class 'torch.nn.modules.activation.LeakyReLU'>, 'batchnorm': True, 'epochs': 20, 'batch_size': 64, 'flip_prob': 0.0}. Best is trial 121 with value: 15.493945159799877.
[I 2025-07-01 00:02:46,527] Trial 205 finished with value: 15.924412378184583 and parameters: {'kernel_size': 3, 'channel_list': [16, 32, 64, 128], 'padding': 1, 'pool_kernel': 2, 'dropout_rate': 0.1, 'fc_hidden_dim': 64, 'lr': 0.0029671015337453593, 'weight_decay': 5.386300050808205e-06, 'optimizer': 'adam', 'activation': <class 'torch.nn.modules.activation.LeakyReLU'>, 'batchnorm': True, 'epochs': 20, 'batch_size': 64, 'flip_prob': 0.0}. Best is trial 121 with value: 15.493945159799877.
[I 2025-07-01 00:04:04,714] Trial 206 finished with value: 16.07472060216958 and parameters: {'kernel_size': 3, 'channel_list': [32, 64, 128], 'padding': 1, 'pool_kernel': 2, 'dropout_rate': 0.1, 'fc_hidden_dim': 256, 'lr': 0.0025227995221093814, 'weight_decay': 2.142579968890267e-06, 'optimizer': 'adam', 'activation': <class 'torch.nn.modules.activation.LeakyReLU'>, 'batchnorm': True, 'epochs': 20, 'batch_size': 64, 'flip_prob': 0.0}. Best is trial 121 with value: 15.493945159799877.
[I 2025-07-01 00:05:09,683] Trial 207 finished with value: 16.08233686224547 and parameters: {'kernel_size': 3, 'channel_list': [16, 32, 64, 128], 'padding': 1, 'pool_kernel': 2, 'dropout_rate': 0.1, 'fc_hidden_dim': 128, 'lr': 0.0044218382437379005, 'weight_decay': 3.168281345062365e-06, 'optimizer': 'adam', 'activation': <class 'torch.nn.modules.activation.LeakyReLU'>, 'batchnorm': True, 'epochs': 25, 'batch_size': 64, 'flip_prob': 0.5}. Best is trial 121 with value: 15.493945159799877.
[I 2025-07-01 00:05:44,775] Trial 208 finished with value: 15.899689036827922 and parameters: {'kernel_size': 3, 'channel_list': [16, 32, 64, 128], 'padding': 1, 'pool_kernel': 2, 'dropout_rate': 0, 'fc_hidden_dim': 64, 'lr': 0.005553296137342598, 'weight_decay': 6.539725821857223e-06, 'optimizer': 'adam', 'activation': <class 'torch.nn.modules.activation.LeakyReLU'>, 'batchnorm': True, 'epochs': 20, 'batch_size': 128, 'flip_prob': 0.0}. Best is trial 121 with value: 15.493945159799877.
[I 2025-07-01 00:05:44,805] Trial 209 pruned. 
[I 2025-07-01 00:06:58,290] Trial 210 finished with value: 15.794232280864634 and parameters: {'kernel_size': 3, 'channel_list': [16, 32, 64, 128], 'padding': 1, 'pool_kernel': 2, 'dropout_rate': 0.1, 'fc_hidden_dim': 128, 'lr': 0.0033329005644216372, 'weight_decay': 1.623441016845339e-06, 'optimizer': 'adam', 'activation': <class 'torch.nn.modules.activation.LeakyReLU'>, 'batchnorm': True, 'epochs': 30, 'batch_size': 64, 'flip_prob': 0.0}. Best is trial 121 with value: 15.493945159799877.
[I 2025-07-01 00:07:46,662] Trial 211 finished with value: 15.74460107978554 and parameters: {'kernel_size': 3, 'channel_list': [16, 32, 64, 128], 'padding': 1, 'pool_kernel': 2, 'dropout_rate': 0.1, 'fc_hidden_dim': 64, 'lr': 0.0036369224847289704, 'weight_decay': 8.996609800512343e-06, 'optimizer': 'adam', 'activation': <class 'torch.nn.modules.activation.LeakyReLU'>, 'batchnorm': True, 'epochs': 20, 'batch_size': 64, 'flip_prob': 0.0}. Best is trial 121 with value: 15.493945159799877.
[I 2025-07-01 00:08:35,704] Trial 212 finished with value: 15.649222710975131 and parameters: {'kernel_size': 3, 'channel_list': [16, 32, 64, 128], 'padding': 1, 'pool_kernel': 2, 'dropout_rate': 0.1, 'fc_hidden_dim': 64, 'lr': 0.003411726150746611, 'weight_decay': 7.856176444099791e-06, 'optimizer': 'adam', 'activation': <class 'torch.nn.modules.activation.LeakyReLU'>, 'batchnorm': True, 'epochs': 20, 'batch_size': 64, 'flip_prob': 0.0}. Best is trial 121 with value: 15.493945159799877.
[I 2025-07-01 00:09:24,480] Trial 213 finished with value: 15.792329637939613 and parameters: {'kernel_size': 3, 'channel_list': [16, 32, 64, 128], 'padding': 1, 'pool_kernel': 2, 'dropout_rate': 0.1, 'fc_hidden_dim': 64, 'lr': 0.002756603176510027, 'weight_decay': 7.436251619749299e-06, 'optimizer': 'adam', 'activation': <class 'torch.nn.modules.activation.LeakyReLU'>, 'batchnorm': True, 'epochs': 20, 'batch_size': 64, 'flip_prob': 0.0}. Best is trial 121 with value: 15.493945159799877.
[I 2025-07-01 00:10:12,572] Trial 214 finished with value: 15.74736728275395 and parameters: {'kernel_size': 3, 'channel_list': [16, 32, 64, 128], 'padding': 1, 'pool_kernel': 2, 'dropout_rate': 0.1, 'fc_hidden_dim': 64, 'lr': 0.0030702928416968325, 'weight_decay': 5.087508089904975e-06, 'optimizer': 'adam', 'activation': <class 'torch.nn.modules.activation.LeakyReLU'>, 'batchnorm': True, 'epochs': 20, 'batch_size': 64, 'flip_prob': 0.0}. Best is trial 121 with value: 15.493945159799877.
