[I 2025-08-04 20:10:38,966] Trial 440 finished with value: 2.739758975485697 and parameters: {'channels_list': [16, 32, 64], 'kernel_size': 3, 'padding': 1, 'pool_kernel': 2, 'dropout_rate': 0, 'fc_hidden_dim': 256, 'lr': 0.001412870599445431, 'weight_decay': 1.0371860232127844e-06, 'optimizer': 'rmsprop', 'activation': <class 'torch.nn.modules.activation.LeakyReLU'>, 'batchnorm': True, 'epochs': 35, 'batch_size': 64, 'flip_prob': 0.0}. Best is trial 269 with value: 2.690232738856096.
[I 2025-08-04 20:11:36,558] Trial 441 finished with value: 2.7120489131412113 and parameters: {'channels_list': [16, 32, 64], 'kernel_size': 3, 'padding': 1, 'pool_kernel': 2, 'dropout_rate': 0, 'fc_hidden_dim': 256, 'lr': 0.001117633339504207, 'weight_decay': 3.5638208579744142e-06, 'optimizer': 'rmsprop', 'activation': <class 'torch.nn.modules.activation.LeakyReLU'>, 'batchnorm': True, 'epochs': 35, 'batch_size': 32, 'flip_prob': 0.0}. Best is trial 269 with value: 2.690232738856096.
[I 2025-08-04 20:12:24,178] Trial 442 finished with value: 2.7060504435342527 and parameters: {'channels_list': [16, 32, 64], 'kernel_size': 3, 'padding': 1, 'pool_kernel': 2, 'dropout_rate': 0, 'fc_hidden_dim': 256, 'lr': 0.000983576501489208, 'weight_decay': 2.2835706946469526e-06, 'optimizer': 'rmsprop', 'activation': <class 'torch.nn.modules.activation.LeakyReLU'>, 'batchnorm': True, 'epochs': 35, 'batch_size': 32, 'flip_prob': 0.0}. Best is trial 269 with value: 2.690232738856096.
[I 2025-08-04 20:12:34,797] Trial 443 finished with value: 2.962783835621593 and parameters: {'channels_list': [16, 32, 64], 'kernel_size': 3, 'padding': 1, 'pool_kernel': 2, 'dropout_rate': 0, 'fc_hidden_dim': 256, 'lr': 0.0009690155100177864, 'weight_decay': 1.8506728326013437e-06, 'optimizer': 'rmsprop', 'activation': <class 'torch.nn.modules.activation.LeakyReLU'>, 'batchnorm': True, 'epochs': 35, 'batch_size': 128, 'flip_prob': 0.0}. Best is trial 269 with value: 2.690232738856096.
[I 2025-08-04 20:13:30,168] Trial 444 finished with value: 2.719256938812385 and parameters: {'channels_list': [16, 32, 64], 'kernel_size': 3, 'padding': 1, 'pool_kernel': 2, 'dropout_rate': 0, 'fc_hidden_dim': 256, 'lr': 0.001304794158605712, 'weight_decay': 1.3336132840076863e-06, 'optimizer': 'rmsprop', 'activation': <class 'torch.nn.modules.activation.LeakyReLU'>, 'batchnorm': True, 'epochs': 35, 'batch_size': 32, 'flip_prob': 0.0}. Best is trial 269 with value: 2.690232738856096.
[I 2025-08-04 20:14:30,224] Trial 445 finished with value: 2.78272468874049 and parameters: {'channels_list': [16, 32, 64], 'kernel_size': 3, 'padding': 0, 'pool_kernel': 2, 'dropout_rate': 0, 'fc_hidden_dim': 256, 'lr': 0.0010208789136933356, 'weight_decay': 2.3267366523966105e-06, 'optimizer': 'rmsprop', 'activation': <class 'torch.nn.modules.activation.LeakyReLU'>, 'batchnorm': True, 'epochs': 35, 'batch_size': 32, 'flip_prob': 0.0}. Best is trial 269 with value: 2.690232738856096.
[I 2025-08-04 20:15:13,137] Trial 446 finished with value: 2.732587780221955 and parameters: {'channels_list': [16, 32, 64], 'kernel_size': 3, 'padding': 1, 'pool_kernel': 2, 'dropout_rate': 0, 'fc_hidden_dim': 256, 'lr': 0.0015668887860007495, 'weight_decay': 1.6131707289479251e-06, 'optimizer': 'rmsprop', 'activation': <class 'torch.nn.modules.activation.LeakyReLU'>, 'batchnorm': True, 'epochs': 35, 'batch_size': 32, 'flip_prob': 0.0}. Best is trial 269 with value: 2.690232738856096.
[I 2025-08-04 20:15:13,166] Trial 447 pruned. 
[I 2025-08-04 20:15:53,221] Trial 448 finished with value: 2.762334296671703 and parameters: {'channels_list': [16, 32, 64], 'kernel_size': 3, 'padding': 1, 'pool_kernel': 2, 'dropout_rate': 0, 'fc_hidden_dim': 64, 'lr': 0.0014307526620943797, 'weight_decay': 1.0100005266628613e-05, 'optimizer': 'rmsprop', 'activation': <class 'torch.nn.modules.activation.LeakyReLU'>, 'batchnorm': True, 'epochs': 35, 'batch_size': 32, 'flip_prob': 0.0}. Best is trial 269 with value: 2.690232738856096.
[I 2025-08-04 20:16:40,816] Trial 449 finished with value: 2.720412302132251 and parameters: {'channels_list': [32, 64, 128], 'kernel_size': 3, 'padding': 1, 'pool_kernel': 2, 'dropout_rate': 0, 'fc_hidden_dim': 256, 'lr': 0.0009545075682906498, 'weight_decay': 2.3800809007220452e-06, 'optimizer': 'rmsprop', 'activation': <class 'torch.nn.modules.activation.LeakyReLU'>, 'batchnorm': True, 'epochs': 35, 'batch_size': 32, 'flip_prob': 0.0}. Best is trial 269 with value: 2.690232738856096.
[I 2025-08-04 20:17:50,820] Trial 450 finished with value: 2.730297947907764 and parameters: {'channels_list': [16, 32, 64], 'kernel_size': 3, 'padding': 1, 'pool_kernel': 2, 'dropout_rate': 0, 'fc_hidden_dim': 256, 'lr': 0.0012861614877552581, 'weight_decay': 0.00010791650111790572, 'optimizer': 'adam', 'activation': <class 'torch.nn.modules.activation.LeakyReLU'>, 'batchnorm': True, 'epochs': 35, 'batch_size': 32, 'flip_prob': 0.0}. Best is trial 269 with value: 2.690232738856096.
[I 2025-08-04 20:18:58,699] Trial 451 finished with value: 2.741706292217977 and parameters: {'channels_list': [16, 32, 64], 'kernel_size': 5, 'padding': 1, 'pool_kernel': 2, 'dropout_rate': 0, 'fc_hidden_dim': 128, 'lr': 0.0010546909744190936, 'weight_decay': 1.5788977034812431e-06, 'optimizer': 'rmsprop', 'activation': <class 'torch.nn.modules.activation.LeakyReLU'>, 'batchnorm': True, 'epochs': 35, 'batch_size': 32, 'flip_prob': 0.0}. Best is trial 269 with value: 2.690232738856096.
[I 2025-08-04 20:19:26,650] Trial 452 finished with value: 2.7863019036153833 and parameters: {'channels_list': [16, 32, 64], 'kernel_size': 3, 'padding': 1, 'pool_kernel': 2, 'dropout_rate': 0, 'fc_hidden_dim': 256, 'lr': 0.001193490970641141, 'weight_decay': 4.724002345904109e-05, 'optimizer': 'rmsprop', 'activation': <class 'torch.nn.modules.activation.LeakyReLU'>, 'batchnorm': True, 'epochs': 35, 'batch_size': 32, 'flip_prob': 0.0}. Best is trial 269 with value: 2.690232738856096.
[I 2025-08-04 20:19:39,726] Trial 453 finished with value: 3.146793670504746 and parameters: {'channels_list': [16, 32, 64], 'kernel_size': 3, 'padding': 1, 'pool_kernel': 2, 'dropout_rate': 0, 'fc_hidden_dim': 256, 'lr': 0.0013856833408263975, 'weight_decay': 2.7916516778689146e-06, 'optimizer': 'rmsprop', 'activation': <class 'torch.nn.modules.activation.LeakyReLU'>, 'batchnorm': True, 'epochs': 35, 'batch_size': 64, 'flip_prob': 0.0}. Best is trial 269 with value: 2.690232738856096.
[I 2025-08-04 20:19:39,756] Trial 454 pruned. 
[I 2025-08-04 20:20:30,120] Trial 455 finished with value: 2.7111821393771107 and parameters: {'channels_list': [16, 32, 64], 'kernel_size': 3, 'padding': 1, 'pool_kernel': 2, 'dropout_rate': 0, 'fc_hidden_dim': 256, 'lr': 0.0012755907425790274, 'weight_decay': 8.675392994216204e-06, 'optimizer': 'rmsprop', 'activation': <class 'torch.nn.modules.activation.LeakyReLU'>, 'batchnorm': True, 'epochs': 35, 'batch_size': 32, 'flip_prob': 0.0}. Best is trial 269 with value: 2.690232738856096.
[I 2025-08-04 20:21:37,624] Trial 456 finished with value: 2.727854020805497 and parameters: {'channels_list': [16, 32, 64, 128], 'kernel_size': 3, 'padding': 1, 'pool_kernel': 2, 'dropout_rate': 0, 'fc_hidden_dim': 256, 'lr': 0.0010934890864514543, 'weight_decay': 8.157187685512332e-05, 'optimizer': 'rmsprop', 'activation': <class 'torch.nn.modules.activation.LeakyReLU'>, 'batchnorm': True, 'epochs': 35, 'batch_size': 32, 'flip_prob': 0.0}. Best is trial 269 with value: 2.690232738856096.
[I 2025-08-04 20:22:40,256] Trial 457 finished with value: 2.7157884940019708 and parameters: {'channels_list': [16, 32, 64], 'kernel_size': 3, 'padding': 1, 'pool_kernel': 2, 'dropout_rate': 0, 'fc_hidden_dim': 256, 'lr': 0.0009738655276594019, 'weight_decay': 1.8906710975666593e-05, 'optimizer': 'rmsprop', 'activation': <class 'torch.nn.modules.activation.LeakyReLU'>, 'batchnorm': True, 'epochs': 35, 'batch_size': 32, 'flip_prob': 0.0}. Best is trial 269 with value: 2.690232738856096.
[I 2025-08-04 20:23:13,048] Trial 458 finished with value: 2.742738556085363 and parameters: {'channels_list': [16, 32, 64], 'kernel_size': 3, 'padding': 1, 'pool_kernel': 2, 'dropout_rate': 0, 'fc_hidden_dim': 256, 'lr': 0.0011786125693188944, 'weight_decay': 1.3305367341039734e-06, 'optimizer': 'rmsprop', 'activation': <class 'torch.nn.modules.activation.LeakyReLU'>, 'batchnorm': True, 'epochs': 35, 'batch_size': 32, 'flip_prob': 0.0}. Best is trial 269 with value: 2.690232738856096.
[I 2025-08-04 20:23:55,704] Trial 459 finished with value: 2.7186895198499914 and parameters: {'channels_list': [16, 32, 64], 'kernel_size': 3, 'padding': 1, 'pool_kernel': 2, 'dropout_rate': 0, 'fc_hidden_dim': 256, 'lr': 0.0014107997240137636, 'weight_decay': 1.909662476901281e-06, 'optimizer': 'rmsprop', 'activation': <class 'torch.nn.modules.activation.LeakyReLU'>, 'batchnorm': True, 'epochs': 35, 'batch_size': 32, 'flip_prob': 0.0}. Best is trial 269 with value: 2.690232738856096.
[I 2025-08-04 20:24:30,366] Trial 460 finished with value: 2.7174790908114037 and parameters: {'channels_list': [16, 32, 64], 'kernel_size': 3, 'padding': 1, 'pool_kernel': 2, 'dropout_rate': 0, 'fc_hidden_dim': 256, 'lr': 0.0012915254540425162, 'weight_decay': 3.546107309154262e-06, 'optimizer': 'rmsprop', 'activation': <class 'torch.nn.modules.activation.LeakyReLU'>, 'batchnorm': True, 'epochs': 35, 'batch_size': 64, 'flip_prob': 0.0}. Best is trial 269 with value: 2.690232738856096.
[I 2025-08-04 20:25:42,809] Trial 461 finished with value: 2.705667248565987 and parameters: {'channels_list': [16, 32, 64], 'kernel_size': 3, 'padding': 1, 'pool_kernel': 2, 'dropout_rate': 0, 'fc_hidden_dim': 256, 'lr': 0.0015299582853455988, 'weight_decay': 6.028562536095599e-06, 'optimizer': 'rmsprop', 'activation': <class 'torch.nn.modules.activation.LeakyReLU'>, 'batchnorm': True, 'epochs': 35, 'batch_size': 32, 'flip_prob': 0.0}. Best is trial 269 with value: 2.690232738856096.
[I 2025-08-04 20:26:45,305] Trial 462 finished with value: 2.727181895880705 and parameters: {'channels_list': [16, 32, 64], 'kernel_size': 3, 'padding': 1, 'pool_kernel': 2, 'dropout_rate': 0, 'fc_hidden_dim': 256, 'lr': 0.001549751677704188, 'weight_decay': 5.730782422847462e-06, 'optimizer': 'rmsprop', 'activation': <class 'torch.nn.modules.activation.LeakyReLU'>, 'batchnorm': True, 'epochs': 35, 'batch_size': 32, 'flip_prob': 0.0}. Best is trial 269 with value: 2.690232738856096.
[I 2025-08-04 20:27:35,408] Trial 463 finished with value: 2.7139280878879193 and parameters: {'channels_list': [16, 32, 64], 'kernel_size': 3, 'padding': 1, 'pool_kernel': 2, 'dropout_rate': 0, 'fc_hidden_dim': 256, 'lr': 0.0010522427416788213, 'weight_decay': 7.607086070208549e-06, 'optimizer': 'rmsprop', 'activation': <class 'torch.nn.modules.activation.LeakyReLU'>, 'batchnorm': True, 'epochs': 35, 'batch_size': 32, 'flip_prob': 0.0}. Best is trial 269 with value: 2.690232738856096.
[I 2025-08-04 20:28:42,931] Trial 464 finished with value: 2.74960351830081 and parameters: {'channels_list': [16, 32, 64], 'kernel_size': 3, 'padding': 1, 'pool_kernel': 2, 'dropout_rate': 0, 'fc_hidden_dim': 256, 'lr': 0.001187317123864236, 'weight_decay': 6.182319309918901e-06, 'optimizer': 'rmsprop', 'activation': <class 'torch.nn.modules.activation.LeakyReLU'>, 'batchnorm': True, 'epochs': 35, 'batch_size': 32, 'flip_prob': 0.0}. Best is trial 269 with value: 2.690232738856096.
[I 2025-08-04 20:29:08,906] Trial 465 finished with value: 2.799392460741381 and parameters: {'channels_list': [16, 32, 64], 'kernel_size': 3, 'padding': 0, 'pool_kernel': 2, 'dropout_rate': 0, 'fc_hidden_dim': 256, 'lr': 0.0013547723098306004, 'weight_decay': 8.081367292844398e-06, 'optimizer': 'rmsprop', 'activation': <class 'torch.nn.modules.activation.LeakyReLU'>, 'batchnorm': True, 'epochs': 35, 'batch_size': 128, 'flip_prob': 0.0}. Best is trial 269 with value: 2.690232738856096.
[I 2025-08-04 20:29:08,937] Trial 466 pruned. 
[I 2025-08-04 20:30:09,340] Trial 467 finished with value: 2.713273728339606 and parameters: {'channels_list': [16, 32, 64], 'kernel_size': 3, 'padding': 1, 'pool_kernel': 2, 'dropout_rate': 0, 'fc_hidden_dim': 256, 'lr': 0.0011145679763044905, 'weight_decay': 0.0007916100937338811, 'optimizer': 'rmsprop', 'activation': <class 'torch.nn.modules.activation.LeakyReLU'>, 'batchnorm': True, 'epochs': 35, 'batch_size': 32, 'flip_prob': 0.0}. Best is trial 269 with value: 2.690232738856096.
[I 2025-08-04 20:30:39,673] Trial 468 finished with value: 2.7624262131022603 and parameters: {'channels_list': [16, 32, 64], 'kernel_size': 3, 'padding': 1, 'pool_kernel': 2, 'dropout_rate': 0, 'fc_hidden_dim': 256, 'lr': 0.0016182075080619486, 'weight_decay': 4.867599713544528e-06, 'optimizer': 'rmsprop', 'activation': <class 'torch.nn.modules.activation.LeakyReLU'>, 'batchnorm': True, 'epochs': 35, 'batch_size': 64, 'flip_prob': 0.0}. Best is trial 269 with value: 2.690232738856096.
[I 2025-08-04 20:31:47,438] Trial 469 finished with value: 2.7024115901229178 and parameters: {'channels_list': [16, 32, 64], 'kernel_size': 3, 'padding': 1, 'pool_kernel': 2, 'dropout_rate': 0, 'fc_hidden_dim': 256, 'lr': 0.0012555447853682448, 'weight_decay': 1.0014639493868044e-06, 'optimizer': 'rmsprop', 'activation': <class 'torch.nn.modules.activation.LeakyReLU'>, 'batchnorm': True, 'epochs': 35, 'batch_size': 32, 'flip_prob': 0.0}. Best is trial 269 with value: 2.690232738856096.
[I 2025-08-04 20:32:37,354] Trial 470 finished with value: 2.7277212955695727 and parameters: {'channels_list': [16, 32, 64], 'kernel_size': 3, 'padding': 1, 'pool_kernel': 2, 'dropout_rate': 0, 'fc_hidden_dim': 64, 'lr': 0.001445510154899993, 'weight_decay': 1.006584630533881e-06, 'optimizer': 'rmsprop', 'activation': <class 'torch.nn.modules.activation.LeakyReLU'>, 'batchnorm': True, 'epochs': 35, 'batch_size': 32, 'flip_prob': 0.0}. Best is trial 269 with value: 2.690232738856096.
[I 2025-08-04 20:33:18,522] Trial 471 finished with value: 2.772287210192985 and parameters: {'channels_list': [32, 64, 128], 'kernel_size': 3, 'padding': 1, 'pool_kernel': 2, 'dropout_rate': 0, 'fc_hidden_dim': 256, 'lr': 0.0012908253467995429, 'weight_decay': 1.2468514996881967e-06, 'optimizer': 'adam', 'activation': <class 'torch.nn.modules.activation.LeakyReLU'>, 'batchnorm': True, 'epochs': 35, 'batch_size': 32, 'flip_prob': 0.0}. Best is trial 269 with value: 2.690232738856096.
[I 2025-08-04 20:34:09,155] Trial 472 finished with value: 2.742110572246648 and parameters: {'channels_list': [16, 32, 64], 'kernel_size': 5, 'padding': 1, 'pool_kernel': 2, 'dropout_rate': 0, 'fc_hidden_dim': 256, 'lr': 0.0015497300810393352, 'weight_decay': 1.04599558476877e-06, 'optimizer': 'rmsprop', 'activation': <class 'torch.nn.modules.activation.LeakyReLU'>, 'batchnorm': True, 'epochs': 35, 'batch_size': 32, 'flip_prob': 0.0}. Best is trial 269 with value: 2.690232738856096.
[I 2025-08-04 20:34:59,221] Trial 473 finished with value: 2.7360519440815447 and parameters: {'channels_list': [16, 32, 64], 'kernel_size': 3, 'padding': 1, 'pool_kernel': 2, 'dropout_rate': 0, 'fc_hidden_dim': 128, 'lr': 0.0017113765824609958, 'weight_decay': 1.2679133163420474e-06, 'optimizer': 'rmsprop', 'activation': <class 'torch.nn.modules.activation.LeakyReLU'>, 'batchnorm': True, 'epochs': 35, 'batch_size': 32, 'flip_prob': 0.0}. Best is trial 269 with value: 2.690232738856096.
[I 2025-08-04 20:34:59,252] Trial 474 pruned. 
[I 2025-08-04 20:36:04,437] Trial 475 finished with value: 2.7001132377813177 and parameters: {'channels_list': [16, 32, 64], 'kernel_size': 3, 'padding': 1, 'pool_kernel': 2, 'dropout_rate': 0, 'fc_hidden_dim': 256, 'lr': 0.0012480098670790158, 'weight_decay': 1.613579373272224e-06, 'optimizer': 'rmsprop', 'activation': <class 'torch.nn.modules.activation.LeakyReLU'>, 'batchnorm': True, 'epochs': 35, 'batch_size': 32, 'flip_prob': 0.0}. Best is trial 269 with value: 2.690232738856096.
[I 2025-08-04 20:36:47,240] Trial 476 finished with value: 2.7356573590898687 and parameters: {'channels_list': [16, 32, 64], 'kernel_size': 3, 'padding': 1, 'pool_kernel': 2, 'dropout_rate': 0, 'fc_hidden_dim': 256, 'lr': 0.0010430292943636509, 'weight_decay': 0.0005434990864091181, 'optimizer': 'rmsprop', 'activation': <class 'torch.nn.modules.activation.LeakyReLU'>, 'batchnorm': True, 'epochs': 35, 'batch_size': 32, 'flip_prob': 0.0}. Best is trial 269 with value: 2.690232738856096.
[I 2025-08-04 20:37:25,103] Trial 477 finished with value: 2.7576634279925227 and parameters: {'channels_list': [16, 32, 64], 'kernel_size': 3, 'padding': 1, 'pool_kernel': 2, 'dropout_rate': 0, 'fc_hidden_dim': 256, 'lr': 0.0012117712806439223, 'weight_decay': 1.6713708637847731e-06, 'optimizer': 'rmsprop', 'activation': <class 'torch.nn.modules.activation.LeakyReLU'>, 'batchnorm': True, 'epochs': 35, 'batch_size': 32, 'flip_prob': 0.0}. Best is trial 269 with value: 2.690232738856096.
[I 2025-08-04 20:38:15,373] Trial 478 finished with value: 2.723638867066479 and parameters: {'channels_list': [16, 32, 64], 'kernel_size': 3, 'padding': 1, 'pool_kernel': 2, 'dropout_rate': 0, 'fc_hidden_dim': 256, 'lr': 0.001400898740021449, 'weight_decay': 1.3873977503258493e-06, 'optimizer': 'rmsprop', 'activation': <class 'torch.nn.modules.activation.LeakyReLU'>, 'batchnorm': True, 'epochs': 35, 'batch_size': 32, 'flip_prob': 0.0}. Best is trial 269 with value: 2.690232738856096.
[I 2025-08-04 20:39:23,077] Trial 479 finished with value: 2.7055010774311024 and parameters: {'channels_list': [16, 32, 64], 'kernel_size': 3, 'padding': 1, 'pool_kernel': 2, 'dropout_rate': 0, 'fc_hidden_dim': 256, 'lr': 0.0011311329118784913, 'weight_decay': 1.4301590324227015e-06, 'optimizer': 'rmsprop', 'activation': <class 'torch.nn.modules.activation.LeakyReLU'>, 'batchnorm': True, 'epochs': 35, 'batch_size': 32, 'flip_prob': 0.0}. Best is trial 269 with value: 2.690232738856096.
[I 2025-08-04 20:40:33,589] Trial 480 finished with value: 2.7227780837345468 and parameters: {'channels_list': [16, 32, 64, 128], 'kernel_size': 3, 'padding': 1, 'pool_kernel': 2, 'dropout_rate': 0, 'fc_hidden_dim': 256, 'lr': 0.001045238634133057, 'weight_decay': 1.4735530500647554e-06, 'optimizer': 'rmsprop', 'activation': <class 'torch.nn.modules.activation.LeakyReLU'>, 'batchnorm': True, 'epochs': 35, 'batch_size': 32, 'flip_prob': 0.0}. Best is trial 269 with value: 2.690232738856096.
[I 2025-08-04 20:41:24,018] Trial 481 finished with value: 2.7428031930014654 and parameters: {'channels_list': [16, 32, 64], 'kernel_size': 3, 'padding': 1, 'pool_kernel': 2, 'dropout_rate': 0, 'fc_hidden_dim': 256, 'lr': 0.0009497467268914869, 'weight_decay': 1.045971821279512e-06, 'optimizer': 'rmsprop', 'activation': <class 'torch.nn.modules.activation.LeakyReLU'>, 'batchnorm': True, 'epochs': 35, 'batch_size': 32, 'flip_prob': 0.0}. Best is trial 269 with value: 2.690232738856096.
[I 2025-08-04 20:41:54,157] Trial 482 finished with value: 2.8291580900783564 and parameters: {'channels_list': [16, 32, 64], 'kernel_size': 3, 'padding': 1, 'pool_kernel': 2, 'dropout_rate': 0, 'fc_hidden_dim': 256, 'lr': 0.0011372162395645636, 'weight_decay': 1.801996137377033e-06, 'optimizer': 'rmsprop', 'activation': <class 'torch.nn.modules.activation.LeakyReLU'>, 'batchnorm': True, 'epochs': 35, 'batch_size': 64, 'flip_prob': 0.0}. Best is trial 269 with value: 2.690232738856096.
[I 2025-08-04 20:42:49,385] Trial 483 finished with value: 2.7048110965940433 and parameters: {'channels_list': [16, 32, 64], 'kernel_size': 3, 'padding': 1, 'pool_kernel': 2, 'dropout_rate': 0, 'fc_hidden_dim': 256, 'lr': 0.0009071193423852255, 'weight_decay': 1.338471684258877e-06, 'optimizer': 'rmsprop', 'activation': <class 'torch.nn.modules.activation.LeakyReLU'>, 'batchnorm': True, 'epochs': 35, 'batch_size': 32, 'flip_prob': 0.0}. Best is trial 269 with value: 2.690232738856096.
[I 2025-08-04 20:43:46,771] Trial 484 finished with value: 2.7972683313528504 and parameters: {'channels_list': [16, 32, 64], 'kernel_size': 3, 'padding': 0, 'pool_kernel': 2, 'dropout_rate': 0, 'fc_hidden_dim': 256, 'lr': 0.0008859719162407645, 'weight_decay': 1.2283905587362137e-06, 'optimizer': 'rmsprop', 'activation': <class 'torch.nn.modules.activation.LeakyReLU'>, 'batchnorm': True, 'epochs': 35, 'batch_size': 32, 'flip_prob': 0.0}. Best is trial 269 with value: 2.690232738856096.
[I 2025-08-04 20:44:41,827] Trial 485 finished with value: 2.692519248610383 and parameters: {'channels_list': [16, 32, 64], 'kernel_size': 3, 'padding': 1, 'pool_kernel': 2, 'dropout_rate': 0, 'fc_hidden_dim': 256, 'lr': 0.0009919766146380693, 'weight_decay': 1.019019243533953e-06, 'optimizer': 'rmsprop', 'activation': <class 'torch.nn.modules.activation.LeakyReLU'>, 'batchnorm': True, 'epochs': 35, 'batch_size': 32, 'flip_prob': 0.0}. Best is trial 269 with value: 2.690232738856096.
[I 2025-08-04 20:44:41,859] Trial 486 pruned. 
[I 2025-08-04 20:45:09,690] Trial 487 finished with value: 2.7836436358522016 and parameters: {'channels_list': [16, 32, 64], 'kernel_size': 3, 'padding': 1, 'pool_kernel': 2, 'dropout_rate': 0, 'fc_hidden_dim': 256, 'lr': 0.0009108207301408675, 'weight_decay': 1.2248040275494012e-06, 'optimizer': 'rmsprop', 'activation': <class 'torch.nn.modules.activation.LeakyReLU'>, 'batchnorm': True, 'epochs': 35, 'batch_size': 32, 'flip_prob': 0.0}. Best is trial 269 with value: 2.690232738856096.
[I 2025-08-04 20:46:07,199] Trial 488 finished with value: 2.711657942563691 and parameters: {'channels_list': [16, 32, 64], 'kernel_size': 3, 'padding': 1, 'pool_kernel': 2, 'dropout_rate': 0, 'fc_hidden_dim': 256, 'lr': 0.0009722903418877207, 'weight_decay': 1.445024868354397e-06, 'optimizer': 'rmsprop', 'activation': <class 'torch.nn.modules.activation.LeakyReLU'>, 'batchnorm': True, 'epochs': 35, 'batch_size': 32, 'flip_prob': 0.0}. Best is trial 269 with value: 2.690232738856096.
