[I 2025-08-05 11:46:03,832] Trial 181 finished with value: 2.7085634958039435 and parameters: {'channels_list': [32, 64], 'kernel_size': 3, 'padding': 1, 'pool_kernel': 2, 'dropout_rate': 0, 'fc_hidden_dim': 64, 'lr': 0.0012253249672822151, 'weight_decay': 0.006387000959196321, 'optimizer': 'sgd', 'activation': <class 'torch.nn.modules.activation.ReLU'>, 'batchnorm': True, 'epochs': 50, 'batch_size': 32, 'flip_prob': 0.0, 'lstm_hidden_dim': 128, 'lstm_layers': 1}. Best is trial 74 with value: 2.6790329756581452.
[I 2025-08-05 11:46:45,803] Trial 182 finished with value: 2.7789665371143633 and parameters: {'channels_list': [32, 64], 'kernel_size': 3, 'padding': 1, 'pool_kernel': 2, 'dropout_rate': 0, 'fc_hidden_dim': 64, 'lr': 0.0010573427916426834, 'weight_decay': 0.00488029647885826, 'optimizer': 'sgd', 'activation': <class 'torch.nn.modules.activation.ReLU'>, 'batchnorm': True, 'epochs': 50, 'batch_size': 32, 'flip_prob': 0.0, 'lstm_hidden_dim': 128, 'lstm_layers': 1}. Best is trial 74 with value: 2.6790329756581452.
[I 2025-08-05 11:47:24,443] Trial 183 finished with value: 2.777611393635178 and parameters: {'channels_list': [32, 64], 'kernel_size': 3, 'padding': 1, 'pool_kernel': 2, 'dropout_rate': 0, 'fc_hidden_dim': 64, 'lr': 0.0013272671413674718, 'weight_decay': 0.008516302330022846, 'optimizer': 'sgd', 'activation': <class 'torch.nn.modules.activation.ReLU'>, 'batchnorm': True, 'epochs': 50, 'batch_size': 32, 'flip_prob': 0.0, 'lstm_hidden_dim': 128, 'lstm_layers': 1}. Best is trial 74 with value: 2.6790329756581452.
[I 2025-08-05 11:48:02,858] Trial 184 finished with value: 2.7321680192636784 and parameters: {'channels_list': [32, 64], 'kernel_size': 3, 'padding': 1, 'pool_kernel': 2, 'dropout_rate': 0, 'fc_hidden_dim': 64, 'lr': 0.0007966054423014576, 'weight_decay': 0.007249041032290669, 'optimizer': 'sgd', 'activation': <class 'torch.nn.modules.activation.ReLU'>, 'batchnorm': True, 'epochs': 50, 'batch_size': 32, 'flip_prob': 0.0, 'lstm_hidden_dim': 128, 'lstm_layers': 1}. Best is trial 74 with value: 2.6790329756581452.
[I 2025-08-05 11:48:50,614] Trial 185 finished with value: 2.7638480743826945 and parameters: {'channels_list': [32, 64], 'kernel_size': 3, 'padding': 1, 'pool_kernel': 2, 'dropout_rate': 0, 'fc_hidden_dim': 128, 'lr': 0.0010977223000605625, 'weight_decay': 0.00998305022918107, 'optimizer': 'sgd', 'activation': <class 'torch.nn.modules.activation.ReLU'>, 'batchnorm': True, 'epochs': 50, 'batch_size': 32, 'flip_prob': 0.0, 'lstm_hidden_dim': 128, 'lstm_layers': 1}. Best is trial 74 with value: 2.6790329756581452.
[I 2025-08-05 11:49:45,189] Trial 186 finished with value: 2.7597846245736926 and parameters: {'channels_list': [32, 64], 'kernel_size': 5, 'padding': 0, 'pool_kernel': 2, 'dropout_rate': 0, 'fc_hidden_dim': 64, 'lr': 0.000706546598268229, 'weight_decay': 0.0005016065980834333, 'optimizer': 'sgd', 'activation': <class 'torch.nn.modules.activation.ReLU'>, 'batchnorm': True, 'epochs': 50, 'batch_size': 32, 'flip_prob': 0.0, 'lstm_hidden_dim': 128, 'lstm_layers': 1}. Best is trial 74 with value: 2.6790329756581452.
